Time,F-Scale,Location,County,State,Lat,Lon,Comments
Time,Speed,Location,County,State,Lat,Lon,Comments
1225,UNK,3 E DOUDS/LEANDO,VAN BUREN,IA,40.83,-92.03,TREE LIMBS DOWN ON OAK GROVE AVENUE. TIME ESTIMATED OFF RADAR. (DVN)
1308,UNK,2 WNW BURLINGTON,DES MOINES,IA,40.82,-91.16,8 INCH TREE LIMB DOWN ON TOP OF HOUSE NEAR THE 200TH BLOCK OF BROADWAY STREET...TIME ESTIMATED FROM RADAR. (DVN)
1355,UNK,CLINTWOOD,DICKENSON,VA,37.15,-82.46,ONE TREE BLOWN DOWN ON ROSE RIDGE (RLX)
1355,UNK,MOUTHCARD,PIKE,KY,37.38,-82.25,TWO TREES BLOWN DOWN IN MOUTHCARD (JKL)
1412,UNK,GRUNDY,BUCHANAN,VA,37.28,-82.1,NUMEROUS TREES AND POWERLINES BLOWN DOWN IN GRUNDY (RLX)
1440,UNK,HUNGRY MOTHER STATE PAR,SMYTH,VA,36.88,-81.53,SEVERAL LARGE TREES DOWN BLOCKING THE ROAD. (RNK)
1442,UNK,HONAKER,RUSSELL,VA,37.02,-81.98,NUMEROUS TREES DOWN. (MRX)
1455,UNK,3 NNE BROADFORD,TAZEWELL,VA,36.96,-81.65,LARGE LIMB FELL ON A CAR ON FREESTONE VALLEY ROAD AND SMASHED THE WINDSHIELD. PEOPLE INSIDE THE CAR WERE UNINJURED. (RNK)
1455,UNK,3 NE CLIFFIELD,TAZEWELL,VA,37.13,-81.62,6 INCH DIAMETER TREE DOWN ALONG WITH SEVERAL OTHERS. DIME SIZE HAIL. (RNK)
1514,UNK,MARION,SMYTH,VA,36.83,-81.5,LARGE TREES DOWN ACROSS ROAD (RNK)
1514,68,MARION WYTHEVILLE,SMYTH,VA,36.9,-81.35,(RNK)
1515,UNK,5 ENE RURAL RETREAT,WYTHE,VA,36.91,-81.18,ROOF BLOWN OFF HOUSE ON OLD STAGE ROAD (RNK)
1515,UNK,CERES,BLAND,VA,37.02,-81.35,SEVERAL TREES AND LARGE LIMBS DOWN IN THE CERES AREA. (RNK)
1520,60,FRIES,CARROLL,VA,36.72,-80.97,(RNK)
1528,UNK,FRIES,CARROLL,VA,36.72,-80.97,TREES DOWN BLOCKING FRIES ROAD. (RNK)
1530,UNK,WNW MOUTH OF WILSON,GRAYSON,VA,36.58,-81.34,TREES DOWN NEAR ROUTE 16 AND ROUTE 58 (RNK)
1530,UNK,2 SSW RURAL RETREAT,WYTHE,VA,36.87,-81.28,*** 1 INJ *** ONE PERSON INJURED BY FALLING TREE AT RURAL RETREAT LAKE. (RNK)
1546,UNK,HILLSVILLE,CARROLL,VA,36.77,-80.73,TREES AND POWER LINES DOWN ALONG US 58E IN HILLSVILLE. (RNK)
1607,UNK,5 N OSKALOOSA,MAHASKA,IA,41.37,-92.64,POWER LINES DOWNED BY WINDS...ELEVATED FUEL TANK BLOWN OVER...AND A BARN DOOR BLOWN 20 FEET. DIME SIZE HAIL ALSO REPORTED. (DMX)
1612,60,2 S STEWARD,LEE,IL,41.82,-89.02,(LOT)
1615,UNK,1 E WESTFIELD,STOKES,NC,36.48,-80.43,TREES DOWN. (RNK)
1630,UNK,TOWNSEND,BLOUNT,TN,35.68,-83.75,FEW TREES DOWN. (MRX)
1643,UNK,NW WALNUT COVE,STOKES,NC,36.3,-80.14,ONE TREE DOWN IN WALNUT COVE (RNK)
1645,UNK,5 N DANBURY,STOKES,NC,36.48,-80.2,TREES DOWN. (RNK)
1703,UNK,GENEVA,KANE,IL,41.88,-88.31,RT 38 AND RT 31. 4 FOOT DIAMETER TREE DOWN (LOT)
1703,59,WEST CHICAGO,DUPAGE,IL,41.89,-88.22,(LOT)
1718,UNK,CAROL STREAM,DUPAGE,IL,41.92,-88.13,SHINGLES OFF ROOFS. ROOF OFF WALGREENS. LIGHT POLE DOWN. ESTIMATED 80 MPH WINDS (LOT)
1718,70,ST. CHARLES,KANE,IL,41.92,-88.3,ALSO PEA SIZE HAIL (LOT)
1720,UNK,3 NNE MAYFIELD,PITTSYLVANIA,VA,36.56,-79.55,TREE BLOWN DOWN ON BUFORD ROAD. (RNK)
1726,90,WINFIELD,DUPAGE,IL,41.87,-88.15,TREES DOWN AND ROOF DAMAGE (LOT)
1728,UNK,NE GRETNA,PITTSYLVANIA,VA,36.95,-79.36,TREE BLOWN DOWN ONTO CABLE LINE. (RNK)
1734,UNK,6 E HURT,CAMPBELL,VA,37.08,-79.18,4 INCH TREE LIMBS DOWN ON MOONS ROAD (RNK)
1735,UNK,VILLA PARK,DUPAGE,IL,41.89,-87.98,2-4 INCH TREE LIMBS DOWN. 8-10 INCH TREES DOWN. 1 HOUSE DAMAGED BY TREE (LOT)
1741,77,5 ENE ELMHURST,COOK,IL,41.92,-87.85,TIME ESTIMATED. (LOT)
1747,60,CHICAGO,COOK,IL,41.88,-87.63,(LOT)
1750,UNK,OAK BROOK,DUPAGE,IL,41.84,-87.95,8 INCH TREE LIMB DOWN (LOT)
1750,UNK,NORTHLAKE,COOK,IL,41.91,-87.9,FLIPPED SHED IN HOME DEPOT PARKING LOT (LOT)
1756,UNK,DELPHI,CARROLL,IN,40.58,-86.67,TREES DOWNED IN DELPHI. (IND)
1758,UNK,3 NE CONCORD,PERSON,NC,36.51,-79.02,4 TREES DOWN ALONG EDWIN ROBERTSON ROAD... TIME ESTIMATED BY RADAR (RAH)
1802,80,GRIFFITH,LAKE,IN,41.52,-87.42,CLINE AVE AND RIDGE RD (LOT)
1805,UNK,WINNETKA,COOK,IL,42.11,-87.74,WINDOWS BLOWN OUT OF BUILDING IN DOWNTOWN WINNETKA (LOT)
1815,61,3 SSW LOGANSPORT,CASS,IN,40.71,-86.38,(IWX)
1820,UNK,BOONE GROVE,PORTER,IN,41.35,-87.13,PORTER COUNTY SHERIFF REPORTS TREES AND POWERLINES DOWN ACROSS THE COUNTY...INCLUDING IN BOONE GROVE. TIME FOR BOONE GROVE ESTIMATED FROM RADAR. (LOT)
1828,UNK,2 S MEXICO,MIAMI,IN,40.79,-86.12,REPORTS OF TREES DOWN SOUTH OF MEXICO. TIME ESTIMATED FROM RADAR. (IWX)
1833,70,LAKES OF THE FOUR SEASO,PORTER,IN,41.41,-87.22,PEA SIZE HAIL (LOT)
1845,71,2 WNW POTTAWATTOMIE PAR,LMZ046,IN,41.74,-86.91,(IWX)
1846,UNK,LA PORTE,LA PORTE,IN,41.61,-86.72,MANY REPORTS OF TREES AND POWER LINES DOWN ACROSS THE COUNTY. ESPECIALLY IN THE CENTRAL AND SOUTHERN PORTIONS OF THE COUNTY. (IWX)
1855,UNK,1 WNW WAKE FOREST,WAKE,NC,35.98,-78.54,TREE DOWN ON HIGHWAY 98... TIME ESTIMATED BY RADAR (RAH)
1855,UNK,2 N DOCKERY,MECKLENBURG,VA,36.71,-78.18,TREES DOWN ACROSS ROAD (AKQ)
1857,UNK,KNOX,STARKE,IN,41.3,-86.63,REPORTS OF TREES AND POWER LINES DOWN IN THE KNOX AREA. TIME ESTIMATED FROM RADAR. (IWX)
1900,70,WINAMAC,PULASKI,IN,41.05,-86.61,SEVERAL 2 TO 4 INCH BRANCHES DOWN. PEA SIZED HAIL LASTED FOR APPROXIMATELY 1 MINUTE. (IWX)
1900,UNK,WATERTOWN,LITCHFIELD,CT,41.61,-73.12,TREES AND WIRES DOWN (ALY)
1910,UNK,3 E ROLESVILLE,WAKE,NC,35.92,-78.4,TREE UPROOTED AND BLOWN OVER ONTO A FENCE ON PULLEY TOWN RD. TREE WAS HEALTHY AND APPROX 6 INCHES IN DIAMETER. (RAH)
1923,UNK,6 NNW NEW HOPE,NASH,NC,35.87,-78,TREE DOWN ON A CAR... TIME ESTIMATED BY RADAR (RAH)
1924,60,1 W ROCHESTER,FULTON,IN,41.06,-86.24,(IWX)
1924,UNK,ROCKVILLE,TOLLAND,CT,41.87,-72.47,TREES DOWN (BOX)
1926,60,URBANA,WABASH,IN,40.9,-85.79,(IWX)
1930,UNK,3 WSW NEW HOPE,WILSON,NC,35.78,-78,TREE IN SOUTHBOUND LANE OF INTERSTATE 95 NEAR MILE MARKER 123. (RAH)
1934,60,GLOCESTER,PROVIDENCE,RI,41.92,-71.67,(BOX)
1934,UNK,GLOCESTER,PROVIDENCE,RI,41.92,-71.67,TREE DOWN ON WIRES ON DURFEE HILL ROAD (BOX)
1943,UNK,3 ENE KENLY,WILSON,NC,35.61,-78.08,HEALTHY TREE APPROX 40 FT TALL UPROOTED AND BLOWN OVER NEAR HWY 581 AND NEWSOME MILL RD. NICKEL SIZE HAIL WAS ALSO REPORTED. (RAH)
1945,UNK,2 WNW WILSON,WILSON,NC,35.74,-77.95,TREES DOWN COUNTYWIDE. (RAH)
1947,UNK,6 SE WADE,CUMBERLAND,NC,35.1,-78.67,TREE DOWN (RAH)
1947,UNK,3 S WINONA LAKE,KOSCIUSKO,IN,41.19,-85.83,4 FOOT TREE UPROOTED. 4 INCH LIMB ON POWER LINES. ABOUT A QUARTER MILE NORTH OF CR300 ON SOUTH COUNTRY CLUB ROAD. (IWX)
1950,UNK,2 SE GILEAD,MIAMI,IN,40.95,-85.99,REPORTS OF TREES DOWN SOUTHEAST OF GILEAD. TIME ESTIMATED FROM RADAR. (IWX)
1950,UNK,SCITUATE,PROVIDENCE,RI,41.8,-71.62,TREE DOWN ON WIRES ON ROCKLAND ROAD (BOX)
1952,UNK,PLYMOUTH,PLYMOUTH,MA,41.96,-70.68,WIRES DOWN ON COURT STREET (BOX)
1955,UNK,3 E CLYDE,DARLINGTON,SC,34.37,-80.13,SC HIGHWAY PATROL REPORTED TREE IN ROAD AT SC 151 AND NEW MARKET ROAD (ILM)
1955,UNK,SOCIETY HILL,DARLINGTON,SC,34.51,-79.86,SC HIGHWAY PARTOL REPORTED TREE IN ROAD ON US 15. (ILM)
1955,UNK,3 ENE BUNN,FRANKLIN,NC,35.97,-78.2,TREES AND BRANCHES DOWN... PEA SIZE HAIL (RAH)
1956,UNK,DARLINGTON,DARLINGTON,SC,34.3,-79.87,LARGE BRANCHES BROKEN (ILM)
1957,UNK,4 NE HOPE MILLS,CUMBERLAND,NC,35.01,-78.9,*** 1 INJ *** TREE FELL ON A VEHICLE WITH PERSON INSIDE (RAH)
2000,UNK,1 W FREMONT,WAYNE,NC,35.54,-78,TREES DOWN NEAR FREMONT. (RAH)
2005,65,FARMVILLE,PITT,NC,35.59,-77.59,SPOTTER ESTIMATED 60-65 MPH WINDS (MHX)
2010,UNK,2 W PERRYVILLE,PERRY,MO,37.73,-89.91,SHED DAMAGED NEAR PERRY COUNTY COMMUNITY LAKE NEAR COUNTY ROAD 701. TIME APPROXIMATE. (PAH)
2010,UNK,FOSTER,PROVIDENCE,RI,41.85,-71.77,TREES DOWN (BOX)
2013,UNK,MARION,MARION,SC,34.18,-79.4,MULTIPLE TREES DOWN (ILM)
2013,70,PORTLAND,JAY,IN,40.43,-84.98,(IWX)
2014,UNK,1 S MOUNT OLIVE,WAYNE,NC,35.19,-78.07,TREES DOWN ON SOUTH CHURCH STREET. (RAH)
2014,UNK,3 NNW PINETOPS,EDGECOMBE,NC,35.84,-77.66,TREE DOWN AND BLOCKING THE ROAD ALONG RT 43 NEAR SOUTHWEST EDGECOMBE HIGH SCHOOL IN PINETOPS. (RAH)
2015,UNK,LASKER,NORTHAMPTON,NC,36.35,-77.31,SEVERAL TREES SNAPPED ALONG WITH QUARTER SIZE HAIL. (AKQ)
2015,UNK,SMITHFIELD,PROVIDENCE,RI,41.88,-71.55,WIRES DOWN (BOX)
2020,UNK,4 NNW DOVESVILLE,DARLINGTON,SC,34.45,-79.93,SC HIGHWAY PATROL REPORTED TREE IN ROAD AT HARTSVILLE HIGHWAY AND QUIETBROOK RD. (ILM)
2023,UNK,6 ENE OATS,DARLINGTON,SC,34.28,-79.98,TREE IN ROAD AT INDIAN BRANCH ROAD AND S CENTER ROAD (ILM)
2023,UNK,2 NE GRIMESLAND,PITT,NC,35.58,-77.17,MULTIPLE TREES DOWN ALL ALONG SOUTH GRIMESLAND RD. TIME ESTIMATED BY RADAR. (MHX)
2025,UNK,GREENVILLE,PITT,NC,35.6,-77.37,NUMEROUS TREES DOWN IN AN APARTMENT COMPLEX OFF 10TH STREET (MHX)
2030,75,GREENVILLE,PITT,NC,35.6,-77.37,MEASURED BY HIGHWAY PATROL ANEMOMETER (MHX)
2030,59,5 NE FORT WAYNE,ALLEN,IN,41.13,-85.07,ALONG GUST FRONT. SMALL TREE LIMBS DOWN (IWX)
2030,UNK,VOLUNTOWN,NEW LONDON,CT,41.59,-71.85,NUMEROUS TREES DOWN. (OKX)
2030,UNK,HOWE,LAGRANGE,IN,41.72,-85.42,POWERLINE DOWN (IWX)
2032,UNK,5 NNW TURKEY,SAMPSON,NC,35.05,-78.23,NUMEROUS TREES DOWN BETWEEN HOBBTON AND TURKEY. (RAH)
2033,UNK,1 NW CALICO,PITT,NC,35.43,-77.26,*** 1 FATAL *** SHED FELL ON A MAN WHILE HE WAS TRYING TO PUT HIS GOLF CART IN STORAGE (MHX)
2033,UNK,2 S WILLIAMSTON,MARTIN,NC,35.82,-77.06,ROOF OFF BARN AND NUMEROUS TREES DOWN (MHX)
2033,UNK,AULANDER,BERTIE,NC,36.23,-77.11,TREE DOWN ON HWY 11 (AKQ)
2035,UNK,4 SE QUINBY,FLORENCE,SC,34.2,-79.67,OVER 30 TREES DOWN... SOME ACROSS POWERLINES ALONG HIGHWAY 76 NEAR FRANCES MARION UNIVERSITY. ALSO ROOF BLOWN OFF A POORLY CONSTRUCTED BUILDING. (ILM)
2037,UNK,WASHINGTON,BEAUFORT,NC,35.56,-77.05,NUMEROUS TREES DOWN (MHX)
2038,60,BATESBURG,SALUDA,SC,33.91,-81.55,WIND RESULTED IN TREES DOWN AND POWER OUTAGES IN BATESBURG. (CAE)
2039,UNK,3 E CLYDE,DARLINGTON,SC,34.37,-80.13,SC HIGHWAY PATROL REPORTED TREE IN ROAD AT SC 151 AND NEW MARKET ROAD (ILM)
2040,UNK,3 SSE BROWNS CROSSING,BALDWIN,GA,33.01,-83.35,ONE TREE DOWN. LOTS OF LIMBS DOWN. PEA SIZE HAIL ALSO REPORTED. (FFC)
2040,UNK,2 SW CRAWFORDVILLE,TALIAFERRO,GA,33.53,-82.92,TWO TREES DOWN ON I-20 BLOCKING LANE AT MILE MARKER 147. (FFC)
2040,UNK,WARSAW,DUPLIN,NC,35,-78.09,911 CALL CENTER REPORTS NUMEROUS POWER LINES DOWN (MHX)
2040,UNK,5 NNE STEDMAN,CUMBERLAND,NC,35.08,-78.67,TREE BLOCKING ROAD AT HAYFIELD RD AND MAXWELL RD. (RAH)
2040,UNK,GILEAD,BEAUFORT,NC,35.45,-76.99,*** 2 FATAL *** TREE FELL ON A COUPLE IN A GOLF CART (MHX)
2045,UNK,JACKSON,NORTHAMPTON,NC,36.39,-77.42,LARGE DIAMETER TREE DOWN NEAR JACKSON BAPTIST CHURCH AT 252 NORTH CHURCH STREET (AKQ)
2046,UNK,2 W LEXINGTON,LEXINGTON,SC,33.99,-81.26,TREE DOWN IN ROADWAY ON OLD CHAPIN RD AT GOVERNORS GRANT. (CAE)
2046,UNK,2 WSW EAST GILEAD,BRANCH,MI,41.77,-85.12,TREE BLOCKING ADAMS RD. (IWX)
2047,69,FLORENCE,FLORENCE,SC,34.19,-79.72,(ILM)
2048,UNK,JOHNSONVILLE,FLORENCE,SC,33.82,-79.45,LARGE BRANCHES BROKEN (ILM)
2050,UNK,4 WNW DUBLIN,BLADEN,NC,34.68,-78.78,TREE DOWN AT MARSH RD AND HIGHWAY 131 (ILM)
2050,UNK,9 NE WHITE LAKE,BLADEN,NC,34.74,-78.41,TREE DOWN AT TOMAHAWK TRUCKING ON HWY 210 (ILM)
2050,UNK,1 SE BATH,BEAUFORT,NC,35.47,-76.81,TREE DOWN. TIME ESTIMATED BY RADAR (MHX)
2050,UNK,STEELEVILLE,RANDOLPH,IL,38.01,-89.66,TREE LIMBS BLOWN DOWN IN AROUND TOWN. (LSX)
2050,UNK,SMITHFIELD,PROVIDENCE,RI,41.88,-71.55,WIRES DOWN (BOX)
2053,UNK,3 NW WENONA,WASHINGTON,NC,35.76,-76.67,TREES DOWN NEAR HIGHWAY 99 NORTHWEST OF WENONA. (MHX)
2053,UNK,1 S ANGOLA,STEUBEN,IN,41.62,-85,SMALL TREE LIMBS DOWN. PEA SIZED HAIL REPORTED. (IWX)
2055,UNK,4 S MARION,MARION,SC,34.12,-79.4,TREE DOWN ACROSS POWER LINES. (ILM)
2056,UNK,2 N FOREST,CRAVEN,NC,35.19,-77.05,MULTIPLE TREES DOWN. TIME ESTIMATED BY RADAR. (MHX)
2057,UNK,ST. MARYS,AUGLAIZE,OH,40.54,-84.39,MULTIPLE LARGE LIMBS WERE REPORTED DOWN IN THE AREA. (ILN)
2058,UNK,2 WNW NICHOLS,MARION,SC,34.24,-79.19,TREE DOWN ACROSS WEST SELLERS ROAD NEAR THE INTERSECTION WITH US 501. (ILM)
2100,UNK,4 NNW DOVESVILLE,DARLINGTON,SC,34.45,-79.93,SC HIGHWAY PATROL REPORTED TREE IN ROAD AT HARTSVILLE HIGHWAY AND QUIETBROOK RD. (ILM)
2100,UNK,PANTEGO,BEAUFORT,NC,35.59,-76.66,NUMEROUS TREES DOWN. TIME ESTIMATED BY RADAR. (MHX)
2100,UNK,NARRAGANSETT,WASHINGTON,RI,41.43,-71.47,4 TO 8 INCH DIAMETER TREE LIMBS DOWN (BOX)
2102,70,1 W COLUMBIA,STEUBEN,IN,41.63,-84.81,A LOT OF TREE DAMAGE. SEVERAL LARGE TREES SPLIT. (IWX)
2103,UNK,TIMMONSVILLE,FLORENCE,SC,34.13,-79.94,LARGE TREE BRACHES BROKEN (ILM)
2103,UNK,CROSS HILL,LAURENS,SC,34.3,-81.98,TWO TREES REPORTED DOWN IN THE CROSS HILL AREA. WINDS WERE ASSOICATED WITH A OUTFLOW BOUNDARY. TIME ESTIMATED BY RADAR. (GSP)
2105,UNK,2 S REFORM,CHOCTAW,MS,33.4,-89.15,SEVERAL LARGE LIMBS DOWN ALONG HIGHWAY 15 SOUTH OF REFORM. TRAFFIC WAS HAVING TO WEAVE AROUND THE LIMBS TO PASS. HAIL WAS ALSO FALLING AT THE TIME...SIZE UNKNOWN. (JAN)
2105,UNK,5 SSE ELIZABETHTOWN,BLADEN,NC,34.56,-78.58,4.5 FOOT DIAMETER TREE DOWN ALONG COLEY RD. (ILM)
2105,UNK,SIDNEY,SHELBY,OH,40.29,-84.16,TREES DOWN AND POWER OUTAGES ON WEST END OF SIDNEY. (ILN)
2107,65,NEW BERN,CRAVEN,NC,35.12,-77.08,(MHX)
2109,UNK,EDON,WILLIAMS,OH,41.56,-84.77,REPORTS OF MULTIPLE TREES DOWN IN THE WESTERN PORTION OF WILLIAMS COUNTY. (IWX)
2110,59,1 ESE COLUMBIA,WILLIAMS,OH,41.63,-84.77,WIND MEASURED BY OHDOT SENSOR AT INTERSECTION OF US20 AND ROUTE 49. (IWX)
2110,UNK,2 W CAMBRIA,HILLSDALE,MI,41.82,-84.7,REPORT OF TREES AND POWER LINES DOWN IN THE CAMBRIA AND READING AREAS. TIME ESTIMATED FROM RADAR. (IWX)
2112,UNK,PIQUA,MIAMI,OH,40.15,-84.25,LARGE BRANCHES BROKEN. (ILN)
2115,UNK,2 WNW NICHOLS,MARION,SC,34.24,-79.19,TREE ACROSS ROADWAY. VICINITY OLD MULLINS ROAD CROSSING OLD NICHOLS HIGHWAY. (ILM)
2115,UNK,NEW BERN,CRAVEN,NC,35.12,-77.08,SEVERAL TREES DOWN IN THE AREA (MHX)
2115,UNK,2 NW KILKENNY,TYRRELL,NC,35.67,-76.26,TRRES DOWN ALONG HIGHWAY 94 NORTHWEST OF KILKENNY. (MHX)
2118,84,CHERRY POINT,CRAVEN,NC,34.92,-76.88,(MHX)
2118,72,BUNYAN,BEAUFORT,NC,35.54,-76.98,BUNYAN RAWS REPORTED A 72 MPH PEAK WIND GUST. (MHX)
2118,UNK,WEST MILTON,MIAMI,OH,39.95,-84.33,NUMEROUS LARGE BRANCHES DOWN. TIME ESTIMATED FROM RADAR. (ILN)
2120,UNK,JOHNSONVILLE,FLORENCE,SC,33.82,-79.44,METAL ROOF BLOWN OFF A BUILDING ON EAST BROADWAY STREET. (ILM)
2120,UNK,GRESHAM,MARION,SC,33.93,-79.42,TREE DOWN ON GRESHAM RD...LARGE LIMBS DOWN ALONG HWY 908 AT GRESHAM RD...TREE DOWN ON DILL RD...TREE DOWN ON VEHICLE ALONG GRESHAM RD...AND TREE DOWN ON VEHICLE ON OAKR (ILM)
2120,UNK,2 WNW KELLY,BLADEN,NC,34.48,-78.35,TREES DOWN ON ELWELL FERRY RD. (ILM)
2120,UNK,1 N IVANHOE,SAMPSON,NC,34.61,-78.25,SEVERAL TREES DOWN NEAR IVANHOE AND HARRELLS. (RAH)
2123,UNK,CONWAY,HORRY,SC,33.84,-79.06,LARGE BRANCHES BROKEN (ILM)
2123,UNK,CUTLER,PERRY,IL,38.03,-89.57,DOWNED POWER POLES IN CITY LIMITS WITH POWER OUTAGES AND 1 INCH HAIL (PAH)
2125,UNK,IRMO,RICHLAND,SC,34.09,-81.19,TREES AND POWERLINES DOWN IN IRMO ON LAKE MURRAY BLVD (CAE)
2127,UNK,5 NNW NEW CARLISLE,MIAMI,OH,40.01,-84.06,A 15 INCH DIAMETER TREE SNAPPED AT BASE IN ALCONY. ALSO PEA SIZE HAIL. TIME ESTIMATED FROM RADAR. (ILN)
2128,UNK,NEW CARLISLE,CLARK,OH,39.94,-84.03,LARGE BRANCHES BROKEN. (ILN)
2130,60,11 NNW EVANS,MCCORMICK,SC,33.66,-82.2,NATIONAL WEATHER SERVICE OBSERVATIONAL TOWER ATOP THE LAKE THURMOND DAM RECORDED A WIND GUST OF 60 MPH. (CAE)
2130,UNK,LEXINGTON,LEXINGTON,SC,33.99,-81.23,TREE IN ROADWAY...PILGRIM CHURCH RD AND OFF N LAKE. (CAE)
2130,UNK,COLUMBIA,RICHLAND,SC,34.04,-80.89,TREES DOWN IN ROADWAY ON BLUFF RD AND PINEVIEW...MONTGOMERY RDS. TREES DOWN ON AMICKS FERRY RD. TREES DOWN ON 155 NEWBERRY DR AN LYNCH RD. TREE IN ROADWAY ON I-20 EAST (CAE)
2130,62,NEW RIVER,ONSLOW,NC,34.76,-77.41,(MHX)
2130,UNK,5 NW HAVELOCK,CRAVEN,NC,34.94,-76.99,NUMEROUS TREES DOWN ALONG HWY 70 IN BETWEEN HAVELOCK AND NEW BERN (MHX)
2130,UNK,6 NW TUNNEL HILL,JOHNSON,IL,37.58,-88.92,*** 4 INJ *** A TREE FELL ON A DECK IN THE ROBINWOOD SUBDIVISION NEAR LAKE OF EGYPT...INJURING FOUR PEOPLE. (PAH)
2131,UNK,VANDALIA,MONTGOMERY,OH,39.88,-84.19,BRANCHES AND LIMBS DOWN. (ILN)
2131,UNK,ARCHBOLD,FULTON,OH,41.52,-84.31,ROOF TORN OFF NEWER BARN. (IWX)
2132,UNK,E VARDAMAN,CALHOUN,MS,33.88,-89.18,COVERED PORCH BLOWN OFF A TRAILER. (MEG)
2133,UNK,E HOUSTON,CHICKASAW,MS,33.9,-89,4 LIGHT POLES DOWN ALONG WITH SEVERAL TREES BLOWN DOWN ON HIGHWAY 8 EAST OF HOUSTON (MEG)
2135,UNK,ELBERTON,ELBERT,GA,34.11,-82.86,WIDESPREAD TREE DAMAGE OVER THE SOUTHERN PORTIONS OF THE COUNTY. WINDOWS WERE BLOWN OUT OF A BUILDING IN ELBERTON. TIME DETERMINED FROM RADAR. (GSP)
2135,UNK,ABBEVILLE,ABBEVILLE,SC,34.18,-82.38,WIDESPREAD TREE DAMAGE FROM CALHOUN FALLS TO ABBEVILLE. DAMAGING WINDS WERE ASSOICATED WITH OUTFLOW BOUNDARY. TIME DETERMINED FROM RADAR. (GSP)
2135,59,KFFO WRIGHT-PATT AFB,GREENE,OH,39.83,-84.05,(ILN)
2136,UNK,WILLIS,WASHTENAW,MI,42.16,-83.56,SEVERAL TREES AND LARGE LIMBS DOWN AT WILLIS AND MCKEAN (DTX)
2138,UNK,2 WNW NICHOLS,MARION,SC,34.24,-79.19,TREES DOWN NORTHERN GEORGETOWN COUNTY BORDER NEAR WHERE HIWAYS 512 AND 513 INTERSECT. (ILM)
2140,UNK,EASTOVER,RICHLAND,SC,33.88,-80.7,40 FOOT AMATEUR RADIO ANTENNA BLOW OVER. ANTENNA WAS ANCHORED IN CONCRETE. (CAE)
2140,60,1 NE TROY,MIAMI,OH,40.05,-84.21,HALF INCH HAIL FELL AS WELL. (ILN)
2141,UNK,5 S PHOENIX,PUTNAM,GA,33.35,-83.28,PUTNAM COUNTY 911 RELAYED REPORTS OF SEVERAL DOWNED TREES IN EASTERN PORTIONS OF THE COUNTY WITH THE STORM LATE IN THE 1700 HOUR. RADAR ESTIMATED TIME AROUND 1741 EDT. (FFC)
2142,UNK,2 SSE WILLIS,WAYNE,MI,42.13,-83.54,SEVERAL LARGE LIMBS DOWN (DTX)
2143,UNK,4 ESE BELVEDERE,AIKEN,SC,33.51,-81.87,TREES DOWN ACROSS ROAD AT INTERSECTION OF SUDLOW LAKE RD AND OSCAGO LAKE RD. (CAE)
2143,60,1 E LINCOLNTON,LINCOLN,NC,35.48,-81.23,LIMB 12 TO 18 INCHES IN DIAMETER DOWN ACROSS LINES. TIME DETERMINED BY RADAR. (GSP)
2145,UNK,3 NNW BYRON,CRAWFORD,GA,32.7,-83.77,CRAWFORD COUNTY 911 RELAYED REPORTS OF SEVERAL DOWNED TREES AND LINES ON THE EASTERN SIDE OF THE COUNTY. RADAR ESTIMATED TIME BETWEEN 1745 EDT AND 1750 EDT. (FFC)
2145,67,OCRACOKE,HYDE,NC,35.1,-75.98,MEASURED BY WEATHERFLOW STATION AT OCRACOKE (MHX)
2145,UNK,3 SSW SPRINGFIELD,CLARK,OH,39.89,-83.81,4 TREES DOWN NEAR INTERSTATE 70 AND ROUTE 72. (ILN)
2146,68,1 NE SALVO,MAINLAND DARE,NC,35.54,-75.47,WEATHERFLOW SENSOR AT REAL SLICK REPORTED A 68 MPH THUNDERSTORM WIND GUST. (MHX)
2147,UNK,EMERALD ISLE,CARTERET,NC,34.67,-77.03,SEVERAL TREES DOWN ALONG EMERALD ISLE (MHX)
2147,UNK,2 ESE TEXAS,HENRY,OH,41.42,-83.91,POWER LINES DOWN CLOSING A 3MILE STRETCH OF STATE ROAD 65 FROM THE WOOD COUNTY LINE TO INTERSECTION WITH STATE ROAD 110. NUMEROUS TREES ALSO DOWN IN THIS AREA. (IWX)
2147,UNK,4 N LIBERTY CENTER,FULTON,OH,41.5,-84.02,8 INCH TREE LIMB ACROSS ROAD AT CO RD B AND 8 (IWX)
2148,UNK,4 WNW ADRIAN,LENAWEE,MI,41.91,-84.12,ONE TREE DOWN (DTX)
2150,UNK,8 ESE HEMINGWAY,GEORGETOWN,SC,33.72,-79.31,TREE DOWN IN ROAD AT OLD PEE DEE ROAD AND WILLIAMS HILL ROAD. (ILM)
2150,UNK,NEWPORT,CARTERET,NC,34.79,-76.86,TREES DOWN JUST WEST OF NWS OFFICE (MHX)
2150,UNK,CEDARVILLE,GREENE,OH,39.74,-83.81,LARGE LIMBS WERE REPORTED DOWN THROUGHOUT THE TOWN. (ILN)
2150,UNK,6 SE MECHANICSBURG,MADISON,OH,40.01,-83.48,LARGE BRANCHES BROKEN. TIME ESTIMATED FROM RADAR. (ILN)
2151,UNK,3 ENE IVA,ANDERSON,SC,34.32,-82.61,TREES REPORTED DOWN NEAR THE INTERSECTION OF HWY. 184 AND FLAT ROCK ROAD. DAMAGING WIND WERE ASSOICATED WITH A OUTFLOW BOUNDARY. TIME DETERMINED BY RADAR. (GSP)
2151,UNK,MILL SPRING,POLK,NC,35.3,-82.16,TREES DOWN IN MILL SPRING AND SUNNYVIEW AREAS. (GSP)
2152,UNK,LINCOLNTON,LINCOLN,GA,33.79,-82.48,SHERIFF REPORTED TREES DOWN IN THE AREA. (CAE)
2152,UNK,WEST FRANKFORT,FRANKLIN,IL,37.9,-88.93,NWS EMPLOYEE WAS TRAVELING SOUTH ON I-57 AND REPORTED A TREE WAS BLOCKING ONE OF THE LANES AT MILE MARKER 65. AT LEAST 2 TREES WERE DOWN AND 4 TO 5 TREE TOPS WERE SNAPP (PAH)
2154,UNK,PLAINVIEW,NASSAU,NY,40.78,-73.47,LARGE TREE LIMBS DOWN ALONG THE LONG ISLAND EXPRESSWAY NEAR PLAINVIEW. (OKX)
2155,UNK,4 NE LAWLEY,BIBB,AL,32.9,-86.91,SEVERAL LARGE LIMBS ABOUT 6 INCHES IN DIAMETER WERE BLOWN OUT OF TREE TOPS NEAR THE INTERSECTION OF HWY 139 AND CR 36. ONE TREE WAS ALSO DOWN ALONG HWY 139 NEAR RANDOLP (BMX)
2155,UNK,1 NNE LELAND,BRUNSWICK,NC,34.26,-78.04,SEVERAL TREES AND POWER LINES DOWN (ILM)
2156,61,BEAUFORT,CARTERET,NC,34.72,-76.65,MEASURED ON HOME WEATHER STATION (MHX)
2156,UNK,MOUNT CARMEL,WABASH,IL,38.42,-87.77,SEVERAL TREES DOWN IN THE CITY LIMITS (PAH)
2156,58,SPRINGFIELD,CLARK,OH,39.93,-83.8,(ILN)
2200,UNK,ANNISTON,CALHOUN,AL,33.66,-85.81,TREES AND POWERLINES DOWN ALONG LEIGHTON AVE IN DOWNTOWN. TIME ESTIMATED FROM RADAR. (BMX)
2200,UNK,8 NE MANNING,CLARENDON,SC,33.78,-80.12,SHERIFF REPORTED MANY TREES DOWN IN THE NORTHERN PORTIONS OF THE COUNTY. (CAE)
2200,UNK,4 SW FLORENCE,FLORENCE,SC,34.15,-79.83,TREE DOWN ON SAVANNAH GROVE ROAD NEAR THE ELEMENTARY SCHOOL. (ILM)
2203,UNK,CROSS HILL,LAURENS,SC,34.3,-81.98,TWO TREES REPORTED DOWN IN THE CROSS HILL AREA. WINDS WERE ASSOICATED WITH A OUTFLOW BOUNDARY. TIME ESTIMATED BY RADAR. (GSP)
2205,UNK,5 NW WAYSIDE,JONES,GA,33.11,-83.67,6 TO 8 TREES DOWN ACROSS NORTHWEST JONES COUNTY. (FFC)
2205,UNK,BERNER,MONROE,GA,33.15,-83.83,20 TO 30 TREES DOWN ACROSS NORTH AND CENTRAL MONROE COUNTY. (FFC)
2208,70,2 W WILMINGTON,NEW HANOVER,NC,34.21,-77.95,ESTIMATED 60 TO 70 MPH WIND GUST IN THE GREENFIELD LAKE AREA. (ILM)
2208,UNK,WEST SAYVILLE,SUFFOLK,NY,40.73,-73.11,LARGE TREE DOWN IN WEST SAYVILLE...BRINGING DOWN POWER LINES. THIS PULLED LINES FROM A HOUSE...CAUSING MINOR DAMAGE. (OKX)
2210,UNK,STURGIS,UNION,KY,37.55,-87.99,REPORTS OF NUMEROUS TREES DOWN...POWER OUTAGES...AND A PARTIAL STRUCTURE COLLAPSE IN DOWNTOWN STURGIS. (PAH)
2211,58,14 WNW SAINT STEPHEN,BERKELEY,SC,33.48,-80.15,A 58 MPH WIND GUST WAS MEASURED AT THE SANTEE DAM. (CHS)
2211,UNK,BENTON,FRANKLIN,IL,38.01,-88.92,WIND TOOK DOWN THREE SECTIONS OF VINYL FENCING. IT TORE THE FACING OFF THE FRONT OF HOUSE. (PAH)
2213,UNK,AIKEN,AIKEN,SC,33.54,-81.73,TREES DOWN ON WATERLOO ROAD AT US-1 IN AIKEN. (CAE)
2213,UNK,BLOOMINGBURG,FAYETTE,OH,39.61,-83.4,MULTIPLE TREES DOWN IN THE AREA OF BLOOMINGBURG. (ILN)
2213,UNK,MADISON LAKE,MADISON,OH,39.87,-83.38,MULTIPLE TREES AND POWER LINES REPORTED DOWN THROUGHOUT SOUTHERN MADISON COUNTY. (ILN)
2214,UNK,PIEDMONT,CALHOUN,AL,33.93,-85.62,APPROXIMATELY A DOZEN LARGE TREES DOWN ALONG HWY 278 IN THE PIEDMONT AREA. (BMX)
2215,UNK,LOCUST GROVE,HENRY,GA,33.34,-84.1,HENRY COUNTY 911 RELAYED REPORTS OF SEVERAL DOWNED TREES IN THE LOCUST GROVE AREA. RADAR ESTIMATED TIME OF 1815 EDT TO 1837 EDT. (FFC)
2215,UNK,3 SE QUINBY,FLORENCE,SC,34.2,-79.69,TREE DOWN ON TREMONT ROAD. (ILM)
2215,UNK,1 W BOWLING GREEN,WOOD,OH,41.38,-83.67,LARGE LIMBS AND ONE LARGE TREE REPORTED DOWN IN WINTERGARDEN PARK. (CLE)
2216,UNK,6 SE AYNOR,HORRY,SC,33.93,-79.13,TREE IN ROAD AT SMITH ROAD AND HORRY ROAD. (ILM)
2218,UNK,3 ESE GODFREY,PUTNAM,GA,33.44,-83.46,PUTNAM COUNTY 911 RELAYED REPORTS OF SEVERAL DOWNED TREES IN THE NORTHERN PORTION OF THE COUNTY. RADAR ESTIMATED TIME 1818 EDT TO 1841 EDT. (FFC)
2220,UNK,GREELEYVILLE,WILLIAMSBURG,SC,33.58,-79.99,TREE DOWN ON SOCIETY STREET EXTENSION. (ILM)
2220,UNK,SUPPLY,BRUNSWICK,NC,34.01,-78.27,TREES DOWN VICINITY SOUTHPORT-SUPPLY ROAD. (ILM)
2226,UNK,8 E CALHOUN CITY,CALHOUN,MS,33.86,-89.18,TREE DOWN EAST OF CALHOUN CITY BLOCKING HIGHWAY 8 (MEG)
2226,UNK,8 W CALHOUN CITY,CALHOUN,MS,33.86,-89.45,TREE DOWN EAST OF CALHOUN CITY BLOCKING HIGHWAY 8 (MEG)
2230,UNK,8 S MANNING,CLARENDON,SC,33.58,-80.22,DISPATCH REPORTED TREES DOWN IN THE JORDAN AREA. (CAE)
2230,UNK,JASPER,DUBOIS,IN,38.39,-86.94,TREES AND POWER LINES DOWN IN THE CITY (LMK)
2230,UNK,MARBLEHEAD,OTTAWA,OH,41.53,-82.72,SIDING BLOW OFF A HOUSE. (CLE)
2231,UNK,OBETZ,FRANKLIN,OH,39.88,-82.94,SEVERAL BRANCHES DOWN. (ILN)
2233,UNK,OCEAN ISLE BEACH,BRUNSWICK,NC,33.89,-78.42,LARGE BRANCHES DOWN VICINITY EAST 2ND STREET. (ILM)
2233,UNK,7 W DOUBLE SPRINGS,WINSTON,AL,34.15,-87.53,TREES DOWN ON HWY 278 BETWEEN DOUBLE SPRINGS AND NATURAL BRIDGE (BMX)
2235,58,KLCK RICKENBACKER APT,FRANKLIN,OH,39.81,-82.93,(ILN)
2237,UNK,RAYVILLE,RICHLAND,LA,32.47,-91.76,TREES DOWN ACROSS THE CITY. ONE BLOCKING A DRIVEWAY TO A HOUSE AND ANOTHER BLOCKING FRAGALA STREET. (JAN)
2237,UNK,3 SW SAINT STEPHEN,BERKELEY,SC,33.38,-79.95,LAW ENFORCEMENT WITNESSED A ROOF BLOWN OFF A TRAILER. (CHS)
2238,UNK,BELLEVIEW,JEFFERSON,IN,38.85,-85.37,TREES DOWN ACROSS NORTHERN JEFFERSON COUNTY. (LMK)
2241,UNK,GREEN SPRINGS,SANDUSKY,OH,41.26,-83.05,A FEW LARGE LIMBS WERE REPORTED DOWN,ALONG WITH A UTILITY POLE. (CLE)
2242,UNK,SUPPLY,BRUNSWICK,NC,34.02,-78.27,TREES DOWN VICINITY STONE CHIMNEY ROAD. (ILM)
2243,UNK,MILTON,TRIMBLE,KY,38.71,-85.37,DOWNED TREES BLOCKING HWY 421 IN THE MILTON AREA. (LMK)
2245,UNK,1 S OAK RIDGE,ANDERSON,TN,35.95,-84.3,FEW TREES DOWN IN THE SOUTH END OF THE COUNTY. (MRX)
2245,75,5 S IRELAND,DUBOIS,IN,38.34,-87,(LMK)
2246,UNK,5 W PIEDMONT,CALHOUN,AL,33.93,-85.7,TREES AND POWERLINES DOWN AT 1148 OLD PIEDMONT GADSDEN HWY OR COUNTY ROAD 66 (BMX)
2250,UNK,LAWRENCEVILLE,LAWRENCE,IL,38.73,-87.69,NUMEROUS 8-10 INCH TREES AND LARGE BRANCHES DOWN. (ILX)
2254,UNK,LOCUST,CARROLL,KY,38.7,-85.26,MULTIPLE TREES DOWN IN THE AREA. ONE TREE FELL ON A CAR. (ILN)
2255,UNK,LAURENS,LAURENS,SC,34.5,-82.03,REPORTS OF AT LEAST 5 TREES DOWN AROUND CITY OF LAURENS BEGINNING AROUND 7 PM. TIME ESTIMATED FROM RADAR. (GSP)
2255,UNK,4 SSE FAIRVIEW,UNION,NC,35.09,-80.51,TREE DOWN ACROSS A ROAD WITH SEVERAL LIMBS DOWN IN THE AREA. TIME DETERMINED FROM RADAR DATA. (GSP)
2255,UNK,VINCENNES,KNOX,IN,38.68,-87.51,NUMEROUS TREES DOWN. ESTIMATED WINDS 65-70 MPH. (IND)
2256,UNK,1 E FREMONT,SANDUSKY,OH,41.35,-83.09,A FEW TREES WERE REPORTED DOWN. (CLE)
2300,UNK,2 SW LADSON,DORCHESTER,SC,32.96,-80.13,LAW ENFORCEMENT REPORTED ONE TREE DOWN ON POWERLINE AND ON FIRE ALONG RONALD DRIVE. (CHS)
2300,UNK,WAYNESBORO,BURKE,GA,33.09,-82.01,WAYNESBORO FIRE DEPT REPORTED A TREE ACROSS THE ROAD AT MARTIN LUTHER KING JR DRIVE AND WEST 8TH STREET. (CAE)
2300,UNK,3 NNE DORCHESTER,DORCHESTER,SC,33.19,-80.38,ONE TREE DOWN ALONG INTERSTATE 26 BETWEEN MILE MARKERS 184 AND 183. (CHS)
2300,UNK,2 NE LAURELVILLE,HOCKING,OH,39.49,-82.71,MULTIPLE TREES AND POWERS LINES DOWN IN LAUREVILLE AND OTHER LOCATIONS ACROSS SOUTHWESTERN HOCKING COUNTY. (ILN)
2300,UNK,3 W AMANDA,FAIRFIELD,OH,39.65,-82.8,TREE DOWN OVER US 22 BETWEEN STOUTSVILLE AND AMANDA. (ILN)
2303,UNK,HAWESVILLE,PERRY,KY,37.9,-86.76,LARGE TREE DOWN IN HAWESVILLE (LMK)
2304,UNK,BLACKSBURG,CHEROKEE,SC,35.12,-81.52,LIMBS AND POWERLINES DOWN IN THE CHEROKEE FALLS AREA. SOME SINGLE DAMAGE WAS OBSERVED IN THE AREA. TIME DETERMINED FROM RADAR DATA. (GSP)
