Time,F-Scale,Location,County,State,Lat,Lon,Comments
2305,UNK,SAINT GEORGE,DORCHESTER,SC,33.19,-80.58,LAW ENFORCEMENT REPORTED ONE TREE DOWN ON RAYSOR STREET. (CHS)
2305,UNK,3 W SHELBY,CLEVELAND,NC,35.29,-81.6,MULTIPLE TREES AND POWER LINES DOWN ON BEAVER DAM CHURCH ROAD AND HWY 74 WEST OF SHELBY. (GSP)
2305,UNK,1 SSE WITHAMSVILLE,CLERMONT,OH,39.05,-84.26,TREES AND POWER LINES DOWN ON GASKINS RD NEAR AMELIA. TIME ESTIMATED FROM RADAR. (ILN)
2306,UNK,AUSTIN,SCOTT,IN,38.74,-85.81,TREES DOWN IN THE AUSTIN AREA (LMK)
2307,UNK,4 N IRELAND,DUBOIS,IN,38.47,-87,NUMEROUS TREES DOWN (LMK)
2308,UNK,3 ESE PAULINE,SPARTANBURG,SC,34.81,-81.83,TREES AND POWER LINES DOWN IN THE GLENN SPRINGS AREA. PEA SIZE HAIL WAS ALSO OBSERVED. TIME DETERMINED FROM RADAR DATA. (GSP)
2309,UNK,1 SW MONCKS CORNER,BERKELEY,SC,33.19,-80.02,FIRE DEPARTMENT PERSONNEL REPORTED A 4 FEET DIAMETER OAK TREE DOWN ALONG WILDWOOD LANE. THE OAK TREE WAS 50 FEET TALL. (CHS)
2309,UNK,HANOVER,JEFFERSON,IN,38.72,-85.47,ROOF BLOWN OFF OF A HOUSE (LMK)
2310,UNK,3 E CHILLICOTHE,ROSS,OH,39.34,-82.93,NUMEROUS TREES REPORTED DOWN ACROSS THE COUNTY INCLUDING ON BLACKSMITH HILL ROAD...MASSIEVILLE ROAD...3 LOCKS ROAD...AND CHARLESTON PIKE. TIME ESTIMATED FROM RADAR. (ILN)
2310,UNK,NORWALK,HURON,OH,41.24,-82.61,ESTIMATED 18 INCH DIAMETER LIMB DOWN ON A TRUCK AND BOAT CAUSING DAMAGE TO EACH. (CLE)
2311,61,MANSFIELD,RICHLAND,OH,40.76,-82.53,WIND GUST OBSERVED BY CONTROLLER ASOS BACKUP SYSTEM SAWS. (CLE)
2312,UNK,BERLIN HEIGHTS,ERIE,OH,41.32,-82.49,A WIND GUST OF 70 MPH WAS ESTIMATED. MANY TREES REPORTED DOWN. (CLE)
2313,71,E PORT CLINTON,OTTAWA,OH,41.51,-82.94,(CLE)
2315,UNK,1 W LEXINGTON,LEXINGTON,SC,33.99,-81.25,LARGE LIMB DOWN ALONG PARK ROAD NEAR ELLIS AVENUE. (CAE)
2315,UNK,WILLARD,HURON,OH,41.05,-82.72,SEVERAL TREES REPORTED DOWN. (CLE)
2315,60,8 SSE SUNDANCE,CROOK,WY,44.3,-104.32,(UNR)
2316,UNK,4 W COPE,ORANGEBURG,SC,33.39,-81.07,DISPATCH REPORTS TREES DOWN IN WESTERN ORANGEBURG COUNTY (CAE)
2317,UNK,HOCKING HILLS STATE PAR,HOCKING,OH,39.42,-82.55,SEVERAL TREES AND LIMBS DOWN THROUGHOUT THE PARK. TIME ESTIMATED FROM RADAR. (ILN)
2320,UNK,4 SSE BALL FLAT,CALHOUN,AL,33.96,-85.71,TREES DOWN COMPLETELY BLOCKING PIEDMONT-GADSDEN HWY BETWEEN ROY WEBB AND BENEFIELD RD. CORRECTED FOR TIME. TIME ESTIMATED FROM RADAR. (BMX)
2320,UNK,1 E CEDAR BLUFF,CHEROKEE,AL,34.22,-85.57,TREE DOWN ACROSS COUNTY ROAD 131 JUST OFF HWY 9. (BMX)
2320,65,MOUNT ORAB,BROWN,OH,39.03,-83.92,(ILN)
2320,UNK,SANDUSKY,ERIE,OH,41.46,-82.71,TREES WERE REPORTED DOWN. NO ESTIMATION GIVEN AS TO HOW MANY. (CLE)
2321,UNK,PAOLI,ORANGE,IN,38.55,-86.47,A TRAINED SPOTTER REPORTED A MEASURED WIND GUST OF 72 MPH THROUGH E-MAIL. (LMK)
2325,UNK,BAMBERG,BAMBERG,SC,33.3,-81.03,SHERIFF REPORTS TREES AND POWERLINES DOWN ACROSS NORTHERN PORTIONS OF THE COUNTY. (CAE)
2325,UNK,PEACHLAND,ANSON,NC,34.99,-80.27,TREE DOWN ON UPPER WHITE STORE RD IN PEACHLAND. TIME ESTIMATED. (RAH)
2325,UNK,2 E WILLIAMSBURG,BROWN,OH,39.05,-84.01,MULTIPLE TREES DOWN IN THE AREA. HALF INCH HAIL ALSO OCCURRED. TIME ESTIMATED BY RADAR. (ILN)
2325,62,WAKEMAN,HURON,OH,41.26,-82.4,(CLE)
2327,UNK,1 NW OXFORD,CALHOUN,AL,33.61,-85.84,TREES AND POWERLINES DOWN AT 712 MARTIN LUTHER KING DRIVE (BMX)
2330,UNK,4 SSE MONROE,UNION,NC,34.93,-80.51,TREES DOWN ON MACEDONIA CHURCH ROAD AND PAGELAND HWY. (GSP)
2330,UNK,1 SW HICKORY GROVE,YORK,SC,34.97,-81.43,NUMEROUS TREES DOWN IN WEST AND SOUTHWEST PART OF COUNTY. FIRST REPORT RECEIVED ON IRENE BRIDGE HWY AND SINGING WOOD LANE NEAR HICKORY GROVE. (GSP)
2330,UNK,SALEM,WASHINGTON,IN,38.6,-86.1,TREES AND POWER LINES DOWN ACROSS THE CITY (LMK)
2330,70,SW OBERLIN,LORAIN,OH,41.29,-82.22,(CLE)
2331,58,JUNCTION CITY,PERRY,OH,39.72,-82.3,(RLX)
2335,UNK,HAMPTON,HAMPTON,SC,32.88,-81.13,TREES AND POWERLINES DOWN COUNTYWIDE. MOST OF THE DAMAGE OCCURRED BETWEEN 735 AND 800 PM. MORE THAN 100O CUSTOMERS WERE STILL WITHOUT POWER AT 1030 AM MONDAY. (CHS)
2335,70,BLACK CREEK,ETOWAH,AL,34.17,-85.9,WIND GUST OF 70 MPH REPORTED IN THE BLACK CREEK AREA ALONG WITH NICKEL SIZE HAIL. POWER OUTAGES ALSO REPORTED. (BMX)
2335,UNK,5 S WHITE STORE,ANSON,NC,34.83,-80.25,TREE DOWN ON LITTLE HUNTLEY RD AND LONG PINE CHURCH RD. TIME ESTIMATED. (RAH)
2337,UNK,WALTERBORO,COLLETON,SC,32.91,-80.67,EMERGENCY MANAGER RELAYED REPORTS OF 33 TREES AND 17 POWER LINES DOWN IN AND AROUND WALTERBORO. TIME ESTIMATED FROM RADAR. (CHS)
2339,UNK,CARROLLTON,CARROLL,KY,38.68,-85.16,TREE LIMBS DOWN IN CITY. SEVERAL OTHER TREES DOWN ACROSS THE COUNTY. TIME ESTIMATED FROM RADAR. (ILN)
2340,UNK,4 SW TABOR ROAD,ETOWAH,AL,34.15,-85.92,TREES AND POWERLINES DOWN ALONG TABOR ROAD NEAR TABOR BAPTIST CHURCH. (BMX)
2340,UNK,5 ENE ROGERSVILLE,LIMESTONE,AL,34.86,-87.21,*** 1 INJ *** A LARGE TREE FELL ON A CAMPER TRAILER INJURING ONE PERSON INSIDE. OCCURRED ON SNAKE ROAD NEAR THE FORKS OF THE RIVER IN LIMESTONE COUNTY. A SET OF PORCH P (HUN)
2340,UNK,CLOVERPORT,BRECKINRIDGE,KY,37.83,-86.63,TREE DOWN ON A POWER LINE (LMK)
2341,UNK,MARTIN,ALLENDALE,SC,33.07,-81.48,AN EMERGENCY MANAGER REPORTED A POWER LINE DOWN IN MARTIN SOUTH CAROLINA. (CHS)
2345,70,5 N LODI,MEDINA,OH,41.11,-82.01,WIND GUST ESTIMATED BETWEEN 60 AND 80 MPH. (CLE)
2350,UNK,GREEN POND,COLLETON,SC,32.73,-80.61,TREE DOWN ON RITTER ROAD BLOCKING 1 LANE. TIME ESTIMATED FROM RADAR. (CHS)
2350,UNK,4 SW SHARON,YORK,SC,34.91,-81.39,NUMEROUS TREES DOWN ACROSS AREA FROM SHARON TO BULLOCK CREEK. TIME ESTIMATED FROM RADAR (GSP)
2350,UNK,LIBERTY ROAD,MORGAN,KY,37.91,-83.29,TREE ACROSS LIBERTY ROAD IN WEST LIBERTY. (JKL)
2350,UNK,WELLINGTON,MENIFEE,KY,37.92,-83.5,TREES DOWN AROUND THE BIG WOODS AND WELLINGTON AREA (JKL)
2353,UNK,PHILO,MUSKINGUM,OH,39.86,-81.91,POWER LINES DOWN (PBZ)
2354,UNK,PAGELAND,CHESTERFIELD,SC,34.77,-80.39,SKYWARN SPOTTER REPORTS TREES DOWN IN PAGELAND. (CAE)
2355,UNK,4 SSE BALL FLAT,CALHOUN,AL,33.96,-85.71,TREES DOWN COMPLETELY BLOCKING PIEDMONT-GADSDEN HWY BETWEEN ROY WEBB AND BENEFIELD RD. TIME ESTIMATED. (BMX)
2356,UNK,2 NW PEEBLES,ADAMS,OH,38.97,-83.43,TREES DOWN ON MARBLE FURNACE RD...LOUISVILLE RD...AND OLD SR 32. TIME ESTIMATED FROM RADAR. (ILN)
2357,UNK,SYCAMORE,ALLENDALE,SC,33.04,-81.22,AN EMERGENCY MANAGER REPORTED ONE TREE DOWN IN SYCAMORE SOUTH CAROLINA. (CHS)
2357,UNK,3 WNW CHESTER,CHESTER,SC,34.72,-81.26,NUMEROUS TREES DOWN OVER WESTERN PART OF COUNTY...FIRST REPORT ON HIGHWAY 9 WEST OF CHESTER (GSP)
0000,UNK,JACKSON,JACKSON,OH,39.05,-82.63,MULTIPLE TREES DOWN ACROSS COUNTY. (RLX)
0002,UNK,5 WSW BLUE CREEK,ADAMS,OH,38.76,-83.42,TREES DOWN ON TULIP ROAD AND WHITE OAK RD. TIME ESTIMATED FROM RADAR. (ILN)
0005,UNK,1 E OFFUTT,JOHNSON,KY,37.85,-82.71,TREE DOWN ON BEE BRANCH IN THE BOONS CAMP AREA. (JKL)
0006,UNK,2 SSW SLACKLAND,ETOWAH,AL,34.1,-85.84,TREES DOWN ALONG CROFT FERRY ROAD. TIME ESTIMATED. (BMX)
0006,UNK,6 ESE MEDINA,MEDINA,OH,41.1,-81.76,NUMEROUS TREE DOWN ALONG ROUTE 94 (CLE)
0015,UNK,2 NNE VARNVILLE,HAMPTON,SC,32.88,-81.06,ONE TREE DOWN ON BROOKWOOD DRIVE. (CHS)
0015,UNK,1 NW BREVARD,TRANSYLVANIA,NC,35.25,-82.74,TREES DOWN AROUND BREVARD. FIRST REPORT ON RESERVOIR ROAD. TIME ESTIMATED FROM RADAR. (GSP)
0019,UNK,1 NE BEAUFORT,BEAUFORT,SC,32.45,-80.67,TREE DOWN ON A HOUSE ON LAUDONNIERE STREET. TIME ESTIMATED BASED ON RADAR. (CHS)
0020,UNK,MARIETTA,WASHINGTON,OH,39.42,-81.45,TREES DOWN IN MARIETTA AREA AND MUCH OF WASHINGTON COUNTY. (RLX)
0020,60,6 SE DOWNTOWN SPEARFISH,LAWRENCE,SD,44.44,-103.77,0.25 INCH HAIL (UNR)
0023,UNK,BLYTHEWOOD,RICHLAND,SC,34.22,-80.98,TREES DOWN AT LONGTOWN ROAD AND FARROW ROAD. (CAE)
0024,UNK,WEST LIBERTY,MORGAN,KY,37.91,-83.27,SEVERAL TREES DOWN ALONG LIBERTY ROAD IN WEST LIBERTY NEAR THE DAVIS LANE INTERSECTION AND SOME STRUCTURAL DAMAGE TO A TRAILER.DAMAGE REPORTED JUST WEST OF THE MORGAN C (JKL)
0025,UNK,5 S SANDY HOOK,ELLIOTT,KY,38.02,-83.12,TREES DOWN ACROSS SOUTHERN END OF THE COUNTY. (JKL)
0025,UNK,1 NE ASHLAND,BOYD,KY,38.48,-82.63,NUMEROUS TREES DOWN IN RUSSELL AND SURROUNDING AREA. (RLX)
0025,UNK,ZANESVILLE,MUSKINGUM,OH,39.94,-82.01,POWER LINES DOWN (PBZ)
0026,UNK,PAGELAND,CHESTERFIELD,SC,34.77,-80.39,SKYWARN SPOTTER FOLLOW-UP TO PREVIOUS REPORT...CHURCH ON AIRPORT ROAD ACROSS FROM CENTRAL HS HAS A PARTIALLY DESTROYED ROOF...WINDS ESTIMATED AT 65+ MPH...MULTIPLE REPO (CAE)
0030,UNK,HAMPTON,HAMPTON,SC,32.88,-81.13,12 BY 20 FOOT SHED BLOWN DOWN. TIME ESTIMATED. PUBLIC REPORT RELAYED BY BROADCAST MEDIA. (CHS)
0030,UNK,8 N MOREHEAD,ROWAN,KY,38.31,-83.44,TREES DOWN TRHOUGHOUT THE AREA. KY 377 CLOSED NEAR TATER LICK RD. (JKL)
0030,UNK,9 WSW BROWNSTOWN,JACKSON,IN,38.83,-86.2,SEVERAL TREES DOWNED. (IND)
0030,UNK,MASSILLON,STARK,OH,40.79,-81.52,SEVERAL TREES AND POWER LINES REPORTED DOWN. (CLE)
0032,UNK,TILLMAN,JASPER,SC,32.47,-81.11,THE PUBLIC REPORTED ONE POWERLINE DOWN IN TILLMAN. (CHS)
0032,60,4 N DENTSVILLE,RICHLAND,SC,34.13,-80.96,WIND GUSTS BLEW DOWN TREE LIMBS. (CAE)
0036,UNK,SUPPLY,BRUNSWICK,NC,34.02,-78.27,TREES DOWN VICINITY STONE CHIMNEY ROAD. (ILM)
0036,UNK,CHAPIN,LEXINGTON,SC,34.17,-81.35,TREES DOWN ALONG I-26 NEAR MILE MARKERS 98 AND 99. (CAE)
0037,UNK,RIDGEWAY,FAIRFIELD,SC,34.31,-80.96,TREES IN ROADWAY AT WEST RUFF STREET AND SOUTH MEANS STREET. (CAE)
0040,64,1 ENE BEACH,GOLDEN VALLEY,ND,46.92,-103.98,PEAK GUST MEASURED AT 64 MPH. WINDS STARTED AT 740PM CDT... WITH PEAK GUST AT 745PM CDT. (BIS)
0045,70,CLYO,EFFINGHAM,GA,32.48,-81.27,THE PUBLIC ESTIMATED 70 MPH WINDS WHICH RESULTED IN SHED DAMAGE. (CHS)
0045,UNK,CLYO,EFFINGHAM,GA,32.48,-81.27,THE PUBLIC REPORTED DAMAGE TO A SHED FROM WIND APPROXIMATELY 70 MPH. (CHS)
0045,UNK,ADELE,MORGAN,KY,37.76,-83.3,TREE ACROSS ROAD ON HWY 134. (JKL)
0045,UNK,HAZEL GREEN,WOLFE,KY,37.8,-83.42,LARGE BRANCHES ARE DOWN IN SEVERAL LOCATIONS IN THE TOWN OF HAZEL GREEN. (JKL)
0045,UNK,LOUISVILLE,JEFFERSON,KY,38.22,-85.74,TREES DOWN ON EASTERN PARKWAY AT PRESTON (LMK)
0045,UNK,SHIP BOTTOM,OCEAN,NJ,39.65,-74.18,WIRES DOWN. (PHI)
0046,UNK,2 SSW TOOMBS CENTRAL,TOOMBS,GA,32.02,-82.36,TOOMBS COUNTY 911 RELAYED REPORTS OF SEVERAL DOWNED TREES IN THE SOUTHERN PART OF THE COUNTY. RADAR ESTIMATED TIME OF 2046 EDT TO 2100 EDT. (FFC)
0046,UNK,5 W UVALDA,MONTGOMERY,GA,32.03,-82.59,TOOMBS COUNTY 911 RELAYED REPORTS OF SEVERAL DOWNED TREES IN SOUTHERN PORTIONS OF MONTGOMERY COUNTY. RADAR ESTIMATED TIME OF 2046 EDT TO 2055 EDT. (FFC)
0047,UNK,4 WNW COLLINSVILLE,DEKALB,AL,34.29,-85.92,NUMEROUS TREES DOWN ALONG HWY 68 BETWEEN COLLINSVILLE AND CROSSVILLE (HUN)
0048,UNK,FALCON,MAGOFFIN,KY,37.79,-83,TREE DOWN ON ROUTE 1081 JUST OFF OF ROUTE 40. (JKL)
0048,UNK,BOLIVAR,TUSCARAWAS,OH,40.65,-81.45,TREES AND POWER LINES DOWN (PBZ)
0050,UNK,HARRISVILLE,RITCHIE,WV,39.21,-81.05,POWERPOLES DOWN... SOME SNAPPED... TREES DOWN (RLX)
0050,UNK,BEACH,GOLDEN VALLEY,ND,46.92,-104,POWER LINE KNOCKED DOWN BY STRONG WINDS. RELAYED BY LAW ENFORCEMENT (BIS)
0055,UNK,1 SSW NATURAL BRIDGE S.,POWELL,KY,37.76,-83.69,A LARGE WALNUT TREE WAS SPLIT IN HALF. ANOTHER LARGE TREE HAD THE TOP TAKEN OUT OF IT. (JKL)
0055,UNK,VAN LEAR,JOHNSON,KY,37.77,-82.76,DOWNED TREES IN THE SILK STOCKING AREA. (JKL)
0055,UNK,4 NW BOWERSTON,CARROLL,OH,40.47,-81.24,TREES DOWN (PBZ)
0055,UNK,5 NE MINERAL CITY,CARROLL,OH,40.65,-81.29,TREES DOWN ON ROUTE 524 (PBZ)
0056,UNK,4 N GUNTERSVILLE,MARSHALL,AL,34.42,-86.26,THE CLAYSVILLE SNACK BAR WAS DESTROYED. THE DEBRIS WAS IN FRONT OF THE CLAYSVILLE SCHOOL. (HUN)
0058,UNK,1 SSW GUYTON,EFFINGHAM,GA,32.32,-81.4,A TRAINED SPOTTER REPORTED MULTIPLE TREES DOWN ALONG LIVE OAK TRAIL. (CHS)
0059,UNK,DEERSVILLE,HARRISON,OH,40.31,-81.19,NUMEROUS TREES REPORTED DOWN...COUNTY ROAD 2 CLOSED IN BOTH DIRECTIONS (PBZ)
0102,60,2 WSW STILLWELL,EFFINGHAM,GA,32.37,-81.29,A SPOTTER ESTIMATED 60 MPH WIND GUSTS NEAR THE INTERSECTION OF STILLWELL ROAD AND CLYO ROAD. (CHS)
0102,UNK,SANDY HOOK,ELLIOTT,KY,38.09,-83.12,NUMEROUS REPORTS OF TREES DOWN ACROSS THE COUNTY WITH 600 PEOPLE WITHOUT POWER. (JKL)
0104,70,2 NNE POOLER,CHATHAM,GA,32.14,-81.24,THE PUBLIC ESTIMATED 70 MPH WINDS. THE WIND RESULTED IN SHUTTER AND SHINGLE DAMAGE TO A HOME. (CHS)
0104,UNK,2 NNE POOLER,CHATHAM,GA,32.14,-81.24,THE PUBLIC REPORTED A FEW SHUTTERS AND SHINGLES BLOWN OFF HOUSE. 7 TREES WHERE ALSO SNAPPED ABOUT 30 FEET FROM THE GROUND. WIND WAS ESIMATED TO BE 70 MPH. (CHS)
0105,UNK,5 W PRESTONSBURG,FLOYD,KY,37.67,-82.86,LARGE TREE DOWN (JKL)
0105,UNK,1 S GILMORE,WOLFE,KY,37.72,-83.37,A TREE FELL ONTO A TRUCK IN THE UPPER GILMORE COMMUNITY. (JKL)
0105,UNK,TAYLORSVILLE,SPENCER,KY,38.03,-85.34,TREES AND POWER LINES DOWN ACROSS THE CITY (LMK)
0106,UNK,HAZLEHURST,JEFF DAVIS,GA,31.87,-82.6,JEFF DAVIS COUNTY 911 DISPATCH REPORTS NUMEROUS TREES DOWN IN THE VICINITY OF HAZELHURST. TIME OF DAMAGE ESTIMATED FROM RADAR. (JAX)
0108,UNK,1 NE TYBEE ISLAND,CHATHAM,GA,32.02,-80.85,*** 2 INJ *** LAW ENFORCEMENT REPORTED ONE TREE DOWN ON TOP OF A VECHILE ALONG LAUREL AVE. TWO PEOPLE WERE INJURIED AND TRANSPORTED VIA EMS. EXTENT OF INJURIES ARE UNKN (CHS)
0108,UNK,LITTLE RIVER,TRANSYLVANIA,NC,35.24,-82.63,TREES DOWN AROUND LITTLE RIVER. (GSP)
0109,UNK,3 SW HATLEY,CRISP,GA,31.87,-83.64,CRISP COUNTY 911 RELAYED REPORTS OF SEVERAL DOWNED TREES AND LINES INCLUDING 2 TREES DOWNED ONTO A HOUSE. RADAR ESTIMATED TIME FROM 2109 EDT TO 2123 EDT. (FFC)
0109,UNK,1 NNE REIDSVILLE,TATTNALL,GA,32.1,-82.11,LAW ENFORCEMENT REPORTED ONE TREE DOWN ALONG HIGHWAY 23. (CHS)
0110,UNK,2 E VAN LEAR,JOHNSON,KY,37.77,-82.72,TREE DOWN ON STONE COAL RD. (JKL)
0111,UNK,4 E SHELBYVILLE,SHELBY,KY,38.22,-85.16,WINDS ESTIMATED OF AT LEAST 50 MPH DOWNED POWER LINES EAST OF SHELBYVILLE. THESE WINDS DEVELOPED ALONG A GUST FRONT THAT SURGED WELL AHEAD OF ITS PARENT THUNDERSTORM. (LMK)
0112,UNK,5 WNW FYFFE,DEKALB,AL,34.47,-85.99,ROOF OF A BARN LAYING ACROSS COUNTY ROAD 538 NEAR GROVE OAK. (HUN)
0113,UNK,5 W ST. MATTHEWS,CALHOUN,SC,33.66,-80.86,TREE IN ROADWAY AT MURPH MILL ROAD AND COLUMBIA ROAD. (CAE)
0115,UNK,1 ENE LANGSTON,JACKSON,AL,34.54,-86.07,NUMEROUS TREES DOWN IN THE AREA. AWNINGS WERE BLOWN OFF OF CAMPERS AT THE LITTLE MOUNTAIN RESORT. (HUN)
0115,UNK,3 SE WILLISBURG,WASHINGTON,KY,37.78,-85.09,TREES DOWNED NEAR HWY 152 AND HWY 43 (LMK)
0115,UNK,WELLINGTON,MENIFEE,KY,37.92,-83.5,TREES DOWN AROUND THE BIG WOODS AND WELLINGTON AREA (JKL)
0116,UNK,CADIZ,HARRISON,OH,40.27,-80.99,TREES DOWN ON ROUTE 250 (PBZ)
0117,UNK,8 NW BROOKDALE,ORANGEBURG,SC,33.6,-80.93,TREE IN ROADWAY AT PROVIDENCE ROAD AND KENNERLY ROAD. (CAE)
0120,UNK,4 SW BAXLEY,APPLING,GA,31.73,-82.41,APPLING COUNTY 911 DISPATCH REPORTS A POWER LINE DOWN NEAR THE COUNTY FARM PLANT OUTSIDE OF BAXLEY. TIME OF DAMAGE APPROXIMATED BY RADAR. (JAX)
0120,UNK,2 ENE MAULDIN,GREENVILLE,SC,34.8,-82.27,NUMEROUS REPORTS OF TREES DOWN BETWEEN FIVE FORKS...MAULDIN...AND SIMPSONVILLE. (GSP)
0125,70,1 SSW SAVANNAH,CHATHAM,GA,32.03,-81.09,TRAINED WEATHER SPOTTER ESTIMATED 60-70 MPH WINDS NEAR MEMORIAL HOSPITAL IN SAVANNAH. (CHS)
0125,UNK,1 SSW SAVANNAH,CHATHAM,GA,32.03,-81.09,A TRAINED WEATHER SPOTTER REPORTED TREES DOWN NEAR MEMORIAL HOSPITAL IN DOWNTOWN SAVANNAH. (CHS)
0125,UNK,SE COLLINSVILLE,DEKALB,AL,34.26,-85.86,TREES DOWN ON CR 12 IN COLLINSVILLE. (HUN)
0125,UNK,INEZ,MARTIN,KY,37.87,-82.54,MANY LARGE TREES DOWN. (JKL)
0126,UNK,MOUSIE,KNOTT,KY,37.42,-82.88,THUNDERSTORM WINDS KNOCKED DOWN A POWER POLE BEHIND THE POST OFFICE. (JKL)
0128,UNK,5 W ST. MATTHEWS,CALHOUN,SC,33.66,-80.86,TREE IN ROADWAY AT MURPH MILL ROAD AND COLUMBIA ROAD. TIME CORRECTED FOR RADAR ESTIMATE. (CAE)
0130,UNK,3 N FITZGERALD,BEN HILL,GA,31.76,-83.25,MANY TREES AND POWER LINES DOWN...MAINLY NORTH OF FITZGERLAD. (TAE)
0133,UNK,8 NW BROOKDALE,ORANGEBURG,SC,33.6,-80.93,TREE IN ROADWAY AT PROVIDENCE ROAD AND KENNERLY ROAD. TIME CORRECTED FOR RADAR ESTIMATE. (CAE)
0133,UNK,GLENSBORO,ANDERSON,KY,38,-85.07,TREES DOWN (LMK)
0135,UNK,2 NNE SCOTTSBORO,JACKSON,AL,34.67,-86.03,LIMBS DOWN IN THE AREA. POWER IS OUT IN SCOTTSBORO. (HUN)
0135,UNK,BRADFORDSVILLE,MARION,KY,37.5,-85.15,DOWNED TREE BLOCKING ROAD (LMK)
0135,UNK,5 SSW FRANKFORT,FRANKLIN,KY,38.12,-84.9,A 51 MPH WIND GUST MEASURED BY THE KENTUCKY MESONET. SEVERAL TREES DOWNED ACROSS SOUTHERN FRANKLIN COUNTY. (LMK)
0142,UNK,2 NE HIGHLANDS,MACON,NC,35.07,-83.17,LARGE TREE LIMBS BLOWN OFF ON HWY 64. (GSP)
0144,60,LEXINGTON,FAYETTE,KY,38.04,-84.46,(LMK)
0144,UNK,LEXINGTON,FAYETTE,KY,38.04,-84.46,TREES DOWN ACROSS THE CITY AS WELL AS NUMEROUS POWER OUTAGES (LMK)
0145,UNK,2 NW WATERLOO,IRWIN,GA,31.61,-83.5,ONE LARGE TREE DOWN. (TAE)
0145,UNK,5 NNW WEST GREEN,COFFEE,GA,31.67,-82.78,POWERLINES WERE DAMAGED ALONG FIRE LINE DRIVE FROM THUNDERSTORM WINDS. THE TIME OF THE EVENT WAS BASED ON RADAR IMAGERY. (JAX)
0145,UNK,ASHBURN,TURNER,GA,31.71,-83.65,TREES DOWN ACROSS THE COUNTY. (TAE)
0145,UNK,MIDWAY,LIBERTY,GA,31.81,-81.43,A COUNTY OFFICIAL REPORTED SEVERAL TREES DOWN NEAR MIDWAY GEORGIA. (CHS)
0148,UNK,PIKEVILLE,PIKE,KY,37.48,-82.51,TREE BLOWN DOWN IN PIKEVILLE. (JKL)
0148,UNK,VERSAILLES,WOODFORD,KY,38.05,-84.73,MULTIPLE TREES DOWN ACROSS THE COUNTY (LMK)
0148,UNK,4 SE SAND LICK,SCOTT,KY,38.21,-84.67,TRAINED SPOTTER MEASURED A 62 MPH WIND GUST AND NOTIFIED THROUGH E-MAIL (LMK)
0152,UNK,5 NNW PRIDGEN,COFFEE,GA,31.76,-82.97,COFFEE COUNTY EMERGENCY MANAGEMENT REPORTS TREES DOWN ON THE INTERSECTION OF US HIGHWAY 441 AND MCRAE HIGHWAY. (JAX)
0155,UNK,FRANKLIN,MACON,NC,35.18,-83.38,MANY TREES DOWN IN FRANKLIN AND SUSPECTED LARGE HAIL. SEVERAL REPORTS OF MULTIPLE TREES DOWN ACROSS THE COUNTY. (GSP)
0155,60,7 ESE LADNER,HARDING,SD,45.79,-103.6,(UNR)
0157,UNK,LUDOWICI,LONG,GA,31.71,-81.75,LAW ENFORCEMENT REPORTED ON TREE DOWN ON TOP OF A HOUSE ALONG COTTAGE STREET. PEOPLE ARE TRAPPED INSIDE. INJURIES UNKNOWN. (CHS)
0200,UNK,SMITHVILLE,LEE,GA,31.9,-84.26,MANY TREES AND POWERS LINES DOWN. (TAE)
0200,UNK,ANDERSON,ANDERSON,SC,34.52,-82.65,SEVERAL TREES BLOWN DOWN ACROSS CITY OF ANDERSON. FIRST REPORTS RECEIVED AROUND 10 PM. (GSP)
0200,UNK,SUMMERSVILLE,GREEN,KY,37.32,-85.62,TREES DOWN (LMK)
0200,UNK,LOGAN,LOGAN,WV,37.85,-81.99,EXTENSIVE BUT CONFINED PATH OF TREE DAMAGE UP A MOUNTAIN OFF COW CREEK RD. (RLX)
0200,UNK,NICHOLASVILLE,JESSAMINE,KY,37.88,-84.58,A BROAD GUST FRONT TRAVELED ACROSS ALL OF JESSAMINE COUNTY. NUMEROUS TREES WERE DOWNED IN AND AROUND NICHOLASVILLE AROUND 10 PM EDT (LMK)
0201,UNK,3 W FRANKFORT,FRANKLIN,KY,38.19,-84.92,TREE REPORTED ON A HOUSE AS WELL AS MULTIPLE TREES DOWN BLOCKING ROADS (LMK)
0202,UNK,HARDY,PIKE,KY,37.62,-82.24,TREES DOWN BLOCKING TRAFFIC ON HARDY MOUNTAIN. (JKL)
0203,UNK,1 NW CLAY CITY,POWELL,KY,37.87,-83.94,TREES DOWN ON WINCHESTER ROAD BETWEEN THE 8000 AND 9000 BLOCKS. (JKL)
0205,UNK,14 WNW GREENSBURG,HART,KY,37.33,-85.73,SEVERAL TREES WERE DOWNED BY THUNDERSTORM WINDS ACROSS NORTHERN HART COUNTY. ONE WAS DOWNED ON STATE HIGHWAY 566 JUST WEST OF EVE. ANOTHERN WAS DOWNED NEAR EVE. (LMK)
0205,UNK,4 NW ELKHORN CITY,PIKE,KY,37.34,-82.4,TREES DOWN BLOCKING TRAFFIC ON 2500 BLOCK OF MARROWBONE CREEK ROAD. (JKL)
0213,UNK,KERMIT,MINGO,WV,37.86,-82.34,TREES DOWN. EVENT OCCURRED BETWEEN 1010 PM (RLX)
0215,UNK,SYLVESTER,WORTH,GA,31.53,-83.84,NUMEROUS TREES AND POWER LINES DOWN ACROSS THE COUNTY. (TAE)
0215,UNK,3 N MARIETTA,GREENVILLE,SC,35.08,-82.5,TREE DOWN IN ROADWAY ON WONDERLAND RANGE ROAD NEAR HWY 11. TIME ESTIMATED FROM RADAR. (GSP)
0216,UNK,1 E DILLARD,RABUN,GA,34.97,-83.37,MULTIPLE TREES DOWN. PART OF ROOF BLOWN OFF AND ELECTRICAL LINES PULLED LOOSE. (GSP)
0216,60,5 SW LUDLOW,HARDING,SD,45.78,-103.46,(UNR)
0225,UNK,4 WNW WAYCROSS,WARE,GA,31.23,-82.41,TREES AND POWER LINES WERE BLOWN DOWN ON THE WEST SIDE OF WAYCROSS. TIME OF DAMAGE WAS BASED ON RADAR IMAGERY. (JAX)
0225,UNK,7 SE GREENSBURG,GREEN,KY,37.18,-85.41,TREES DOWN (LMK)
0229,UNK,3 SE WINDER,BARROW,GA,33.96,-83.68,BARROW COUNTY EMA REPORTED TREES DOWN ON A VEHICLE AND A HOUSE ON LAKEVIEW DRIVE SE. THEY ALSO REPORTED THAT A BOAT HAD BEEN REMOVED FROM THE LAKE BY THE WIND AND PLACE (FFC)
0230,UNK,BRUNSWICK,GLYNN,GA,31.14,-81.47,THE GLYNN COUNTY 911 DISPATCH REPORTS MULTIPLE TREES AND POWERLINES DOWN IN SEVERAL LOCATIONS THROUGHOUT THE COUNTY. TIME OF DAMAGE BASED ON RADAR DATA. (JAX)
0230,UNK,SSE PHILLIPSBURG,TIFT,GA,31.43,-83.52,SOME TREES DOWN NEAR THE INTERSECTION OF INTERSTRATE 75 AND UNION ROAD. (TAE)
0230,UNK,PINEVILLE,WYOMING,WV,37.58,-81.53,TREES DOWN ACROSS MUCH OF WYOMING COUNTY. POWER RESTORED SINCE EARLIER STORM WAS LOST. (RLX)
0235,UNK,BRADFORDSVILLE,MARION,KY,37.5,-85.15,DOWNED TREE BLOCKING ROAD (LMK)
0238,UNK,1 NW CLAY CITY,POWELL,KY,37.87,-83.94,TREES DOWN ON WINCHESTER ROAD BETWEEN THE 8000 AND 9000 BLOCKS. (JKL)
0240,UNK,NEW ELM,COLQUITT,GA,31.29,-83.82,TREES DOWN ON POWERLINES IN NEW ELM. (TAE)
0240,UNK,ALBANY,DOUGHERTY,GA,31.58,-84.18,TREES AND POWER LINES DOWN ACROSS THE COUNTY. (TAE)
0245,UNK,NAHUNTA,BRANTLEY,GA,31.21,-81.98,THE CALL CENTER REPORTED TREES AND POWERLINES DOWN. THE TIME GIVEN WAS BASED ON RADAR. (JAX)
0245,UNK,2 NE ROCK HILL,YORK,SC,34.96,-81,TREES DOWN BETWEEN ROCK HILL AND FORT MILL (GSP)
0250,UNK,5 ESE CLARKESVILLE,HABERSHAM,GA,34.6,-83.44,GAS STATION CLERK REPORTED MULTIPLE LIMBS DOWN IN THE AREA SURROUNDING THE GAS STATION. (GSP)
0250,UNK,FURNACE,ESTILL,KY,37.76,-83.83,TREES DOWN ON HIGHWAY 213 NEAR THE ESTILL AND POWELL COUNTY LINE (JKL)
0255,UNK,MOULTRIE,COLQUITT,GA,31.18,-83.79,TREES AND AND POWER LINES DOWN COUNTY WIDE. FIRES ALSO REPORTED...POSSIBLY FROM LIGHTNING. (TAE)
0255,UNK,2 E STANTON,POWELL,KY,37.85,-83.82,TREE DOWN ON CAMPTON RD. (JKL)
0258,UNK,BACONTON,MITCHELL,GA,31.38,-84.16,ONE TREE DOWN. (TAE)
0300,UNK,6 SW GATLINBURG,SEVIER,TN,35.66,-83.57,FEW TREES DOWN ON LITTLE RIVER ROAD. (MRX)
0300,UNK,RUSSELL SPRINGS,RUSSELL,KY,37.05,-85.08,THUNDERSTORM WINDS BROUGHT DOWN THREE TREES ACROSS THE COUNTY. ONE FELL ACROSS A POWER LINE IN RUSSELL SPRINGS ON COUNTY HIGHWAY 910. ANOTHER TREE FELL 3 MILES WEST OF (LMK)
0300,UNK,RICHLANDS,TAZEWELL,VA,37.1,-81.8,THE TAZEWELL COUNTY SHERIFFS OFFICE HAS REPORTED MULTIPLE TREES BLOWN DOWN IN THE COMMUNITY OF RICHLANDS. (RNK)
0300,UNK,ANNVILLE,JACKSON,KY,37.32,-83.96,ONE TREE BLOWN DOWN. (JKL)
0305,UNK,JONESVILLE,LEE,VA,36.69,-83.12,SEVERAL TREES DOWN (MRX)
0305,UNK,TAZEWELL,TAZEWELL,VA,37.12,-81.52,THE TAZEWELL COUNTY SHERIFFS OFFICE HAS REPORTED MULTIPLE TREES BLOWN DOWN IN THE COMMUNITY OF TAZEWELL. (RNK)
0310,UNK,ST. MARYS,CAMDEN,GA,30.71,-81.54,CAMDEN COUNTY 911 DISPATCH REPORTS AT LEAST 8-10 TREES DOWN THROUGHOUT THE COUNTY...ALONG WITH 4-5 BLOWN TRANSFORMERS. POWER IS CURRENTLY OUT IN DOWNTOWN ST. MARYS.TIME (JAX)
0310,UNK,5 NE HAHIRA,COOK,GA,31.04,-83.32,TREE DOWN ACROSS SHADY GROVE ROAD. (TAE)
0310,UNK,WELCH,MCDOWELL,WV,37.43,-81.58,TREES DOWN... POWER POLES DOWN... ENTRAPMENT IN A HOUSE... UNDERPASSES FLOODED DUE TO POOR DRAINAGE. (RLX)
0310,UNK,PINEVILLE,WYOMING,WV,37.58,-81.53,POWER POLES AND TREES DOWN THROUGHOUT THE COUNTY. POWER RESTORED FROM PREVIOUS STORMS LOST. (RLX)
0310,UNK,3 SE STANAFORD,RALEIGH,WV,37.79,-81.11,TREES DOWN THROUGHOUT COUNTY... HOUSE HIT BY LIGHTNING IN BECKLEY AREA. (RLX)
0311,UNK,3 SSE EASLEY,PICKENS,SC,34.79,-82.57,PUBLIC REPORTED TREE LIMBS DOWN ALONG SHERIFF MILL RD. (GSP)
0312,UNK,BARNEY,BROOKS,GA,31.01,-83.52,SEVERAL TREES AND POWER LINES DOWN...MAINLY ON THE NORTHEAST SIDE OF THE COUNTY NEAR HWY 133. (TAE)
0315,UNK,HAHIRA,LOWNDES,GA,30.99,-83.37,SEVERAL TREES AND POWER LINES DOWN. (TAE)
0315,UNK,NEWTON,BAKER,GA,31.32,-84.34,ONE TREE DOWN OF ABOUT 4-5 INCH DIAMETER. (TAE)
0315,UNK,NEWTON,DALE,AL,31.33,-85.6,ONE TREE DOWN OF ABOUT 4-5 INCH DIAMETER. (TAE)
0315,UNK,DAYTON,RHEA,TN,35.49,-85.01,MUTIPLE TREES AND POWERLINES DOWN. (MRX)
0315,65,SWEETWATER,MONROE,TN,35.6,-84.47,(MRX)
0318,UNK,SHOOTING CREEK,CLAY,NC,35.03,-83.65,TREES DOWN (MRX)
0323,UNK,10 ESE GREENVILLE,GREENVILLE,SC,34.8,-82.19,TREE IN ROADWAY. (GSP)
0327,UNK,4 S COOLIDGE,THOMAS,GA,30.95,-83.88,TREE DOWN NEAR THE INTERSECTION OF MERRIVILLE ROAD AND DILLON ROAD. (TAE)
0330,UNK,1 ESE BURKES GARDEN,TAZEWELL,VA,37.09,-81.34,SEVERAL LARGE TREES DOWN IN THE BURKES GARDEN AREA...INCLUDING ONE ON A HOUSE AND ONE ON A CAR. (RNK)
0330,UNK,5 SSW MATOAKA,MERCER,WV,37.34,-81.27,SEVERAL REPORTS OF TREES AND POWER LINES DOWN IN THE MONTCALM AND BLUEWELL AREAS. (RNK)
0331,UNK,3 SE STANAFORD,RALEIGH,WV,37.79,-81.11,TREES DOWN THROUGHOUT COUNTY... HOUSE HIT BY LIGHTNING IN BECKLEY AREA. (RLX)
0331,59,2 SE STANAFORD,RALEIGH,WV,37.79,-81.12,WIND GUST 59 MPH (RLX)
0332,UNK,4 SW CHARLESTON,BRADLEY,TN,35.25,-84.81,COUPLE OF TREES DOWN. (MRX)
0335,UNK,MORRISTOWN,HAMBLEN,TN,36.21,-83.3,MUTIPLE TREES AND POWERLINES DOWN (MRX)
0335,UNK,NICKELSVILLE,SCOTT,VA,36.75,-82.42,TREES DOWN (MRX)
0336,UNK,ETOWAH,MCMINN,TN,35.33,-84.53,COUPLE TREES DOWN (MRX)
0337,UNK,VADA,DECATUR,GA,31.08,-84.41,TREE DOWN ON COUNTY LINE ROAD IN DECATUR COUNTY. (TAE)
0340,UNK,QUITMAN,BROOKS,GA,30.79,-83.56,TREES AND POWER LINES DOWN. (TAE)
0342,UNK,2 S TALLAHASSEE COML AI,LEON,FL,30.52,-84.37,ONE TREE DOWNED ON A POWER LINE NEAR CAPITAL CITY NW AND VILLAGE WAY. TREE CAUGHT FIRE. (TAE)
0342,UNK,2 WNW HONEA PATH,ANDERSON,SC,34.46,-82.43,SEVERAL TREES DOWN ON AUSTIN ROAD. (GSP)
0342,UNK,2 WSW COLEMAN STORE,WYTHE,VA,36.87,-81.02,TREES DOWN ON HUDDLE ROAD (RNK)
0342,UNK,2 NNE SALTVILLE,SMYTH,VA,36.89,-81.75,TREES DOWN NEAR SALTVILLE ON HWY 107 AND ON EAST MAIN STREET (RNK)
0343,UNK,4 E FOUNTAIN INN,LAURENS,SC,34.69,-82.13,TREE IN ROADWAY ON DURBIN CHURCH ROAD. (GSP)
0345,UNK,THOMASVILLE,THOMAS,GA,30.84,-83.98,ONE TREE DOWN. (TAE)
0350,UNK,4 E CAIRO,GRADY,GA,30.87,-84.15,LARGE TREE DOWN WITH PORTIONS OF THE TREE DAMAGING A MOBILE HOME NEAR THE INTERSECTION OF SINGLETARY RD. AND HWY 84. (TAE)
0350,UNK,BULLS GAP,HAWKINS,TN,36.26,-83.08,SEVERAL TREES AND POWER LINES DOWN AROUND THE BULLS GAP AREA. (MRX)
0350,UNK,FLATRIDGE,GRAYSON,VA,36.73,-81.32,POWERLINES WERE BLOWN DOWN IN THE COMMUNITY FLATRIDGE. (RNK)
0354,UNK,MOUNT VERNON,MONROE,TN,35.41,-84.36,TREES DOWN COUNTY WIDE (MRX)
0355,UNK,N GRAYSON HIGHLANDS STA,GRAYSON,VA,36.62,-81.5,A TREE WAS BLOWN DOWN AT A CAMPGROUND IN THE GRAYSON HIGHLANDS STATE PARK. (RNK)
0355,UNK,5 E NARROWS,GILES,VA,37.33,-80.74,WIRES DOWN ON MAPLE AVENUE (RNK)
0400,UNK,1 SE EVERETT,THOMAS,GA,30.69,-83.79,TREE DOWN ALONG MADRE POND ROAD. (TAE)
0403,UNK,2 NNE SPEEDWELL,WYTHE,VA,36.84,-81.16,TREE BLOCKING GRAYSON TURNPIKE (RNK)
