Time,F-Scale,Location,County,State,Lat,Lon,Comments
Time,Speed,Location,County,State,Lat,Lon,Comments
1808,UNK,LENOIR,CALDWELL,NC,35.91,-81.53,TREES AND UTILITY LINES DOWN BLOCKING AT LEAST ONE ROAD. (GSP)
1812,60,6 W BASINGER,OKEECHOBEE,FL,27.4,-81.11,SFWMD S65CW WIND 107/21 GUSTS 52 KTS. (MLB)
1830,60,3 SSW PORT SAINT LUCIE,ST. LUCIE,FL,27.24,-80.37,SPOTTER REPORTED STAEDY WINDS 40KTS WITH GUSTS TO 52 KTS. BEEN BLOWING FOR 10 TO 20 MINUTES. (MLB)
1915,UNK,5 N NORTH WILKESBORO,WILKES,NC,36.24,-81.13,SEVERAL TREES DOWN ON MOUNTAIN VIEW ROAD. (RNK)
1930,68,2 S CAPE CANAVERAL,BREVARD,FL,28.36,-80.61,A SPOTTER MEASURED A 68 MPH THUNDERSTORM WIND GUST ON HIS DAVIS PRO WEATHER STATION. (MLB)
1950,59,3 W CAPE CANAVERAL,AMZ552,FL,28.4,-80.65,MESONET SITE MEASURED 51 KT/59 MPH WIND GUST DURING THUNDERSTORM. (MLB)
2001,62,5 NE HAVELOCK,CRAVEN,NC,34.94,-76.87,62 MPH WINDS AT CHERRY BRANCH FERRY. (MHX)
2007,77,SAINT PETERSBURG,PINELLAS,FL,27.77,-82.63,ASOS AS SAINT PETERSBURG ALBERT WHITTED AIRPORT MEASURED A 67 KNOT THUNDERSTORM WIND GUST. (TBW)
2025,UNK,4 NNW FRIES,CARROLL,VA,36.78,-80.99,TREE DOWN ON IVANHOE ROAD (RNK)
2030,UNK,2 WNW SPRING VALLEY,GRAYSON,VA,36.75,-81.1,TWO TREES DOWN ON SPRING VALLEY ROAD (RNK)
2140,UNK,5 NNW SPRING HILL,HERNANDO,FL,28.51,-82.58,SPOTTER REPORTS 6-8 INCH TREE LIMBS DOWN. (TBW)
2154,UNK,2 WNW BETHEL,WAKULLA,FL,30.26,-84.35,DAMAGE TO A BILLBOARD AND TREES BLOWN DOWN ON LONNIE RAKER ROAD NEAR HIGHWAY 267...A FEW MILES WEST-NORTHWEST OF WAKULLA SPRINGS STATE PARK. (TAE)
2155,60,ZEELAND,MCINTOSH,ND,45.97,-99.83,A FEW TREE BRANCHES WERE DOWN. (BIS)
2252,60,7 NE ASHLEY,MCINTOSH,ND,46.11,-99.27,TREE BRANCHES REPORTED DOWN. (BIS)
2315,60,17 ENE ASHLEY,MCINTOSH,ND,46.09,-99.03,HEAVY RAIN AND NO HAIL. (BIS)
2320,60,11 W MERRICOURT,DICKEY,ND,46.22,-98.99,HEAVY RAIN AND NO HAIL. (BIS)
2322,UNK,1 N LLOYD,JEFFERSON,FL,30.49,-84.02,FEW TREES DOWN ALONG I-10. ONE LANE OF WESTBOUND I-10 WAS CLOSED TEMPORARILY. (TAE)
2345,70,BAIRD,CALLAHAN,TX,32.4,-99.4,CONVENIENCE STORE MANAGER REPORTED WINDS IN EXCESS OF 70 MPH. HE ALSO REPORTED SOME OF THE GAS PUMP SIGNS BLOWN OFF. (SJT)
2350,67,1 SE BUMBLE BEE,YAVAPAI,AZ,34.19,-112.14,AT SUNSET POINT (FGZ)
2350,UNK,4 N BUMBLE BEE,YAVAPAI,AZ,34.26,-112.15,TRUCK BLOWN OVER ON I-17 (FGZ)
2356,60,ELLENDALE,DICKEY,ND,46,-98.53,VERY HEAVY RAINFALL AND NUMEROUS SMALL TREE LIMBS DOWN. (BIS)
0000,60,1 N FULLERTON,DICKEY,ND,46.18,-98.43,HEAVY RAINFALL AND HAIL AS WELL. (BIS)
0022,UNK,MOULTRIE,COLQUITT,GA,31.18,-83.79,THREE TREES BLOWN DOWN ON THE SOUTH SIDE OF MOULTRIE. (TAE)
0030,UNK,2 ESE MARKHAM,ST. LOUIS,MN,47.29,-92.19,A QUARTER MILE LONG SWATH OF TREES UP TO 2.5 FT IN DIAMETER DOWN. (DLH)
0030,61,32 WSW BYNUM,LEWIS AND CLARK,MT,47.79,-112.94,(TFX)
0045,UNK,2 WNW CORMORANT,BECKER,MN,46.74,-96.1,SEVERAL LARGE TREES WERE EITHER SNAPPED OR UPROOTED ALONG THE NORTH SHORE OF LAKE IDA. TREES VARIED FROM 1 TO 2.5 FOOT IN DIAMETER. (FGF)
0125,UNK,CONDON,MISSOULA,MT,47.53,-113.71,A FEW TREES AND POWER LINES DOWN IN THE CONDON AREA (MSO)
0130,UNK,7 ESE STEVENSVILLE,RAVALLI,MT,46.47,-113.96,NUMEROUS TREES (POPLAR,WILLOWS,COTTONWOODS) SNAPPED 4 TO 8 FEET ABOVE THE GROUND. ESTIMATED WIND SPEED 60 MPH. (MSO)
0224,65,2 SSE GEYSER,JUDITH BASIN,MT,47.25,-110.48,GEYSER DOT (TFX)
0945,UNK,4 NE ELMA,ERIE,NY,42.89,-78.58,LARGE TREE DOWN (BUF)
Time,Size,Location,County,State,Lat,Lon,Comments
1745,100,SSW OAK ISLAND,LAKE OF THE WOODS,MN,49.31,-94.85,LARGE HAIL TO AT LEAST QUARTER SIZE WAS OBSERVED OVER OPENED WATER ON THE LAKE OF THE WOODS... JUST WEST OF GARDEN ISLAND. (FGF)
1850,100,1 SSE PHILLIPS CROSSROA,JONES,NC,35.06,-77.44,MOTORIST OBSERVED QUARTER SIZE HAIL ALONG HWY-58 OUTSIDE OF PHILLIPS CROSSROADS (MHX)
1905,100,8 N PITT,LAKE OF THE WOODS,MN,48.83,-94.74,THE HAIL FELL AT THE SPORTSMANS LODGE. (FGF)
1920,175,BAUDETTE,LAKE OF THE WOODS,MN,48.71,-94.59,HAIL FELL AT THE LAKE OF THE WOODS CAMPGROUND. (FGF)
2005,100,2 NNW HAVELOCK,CRAVEN,NC,34.91,-76.94,QUARTER-SIZE HAIL AT NWS EMPLOYEE HOUSE. (MHX)
2008,125,BEULAVILLE,DUPLIN,NC,34.92,-77.77,(MHX)
2020,125,NEWPORT,CARTERET,NC,34.79,-76.86,ESTIMATED HALF DOLLAR HAIL ON CHATHAM STREET IN NEWPORT. (MHX)
2100,100,NEWPORT,CARTERET,NC,34.79,-76.86,QUARTER SIZE HAIL IN NEWPORT. (MHX)
2145,100,2 N ASHLEY HEIGHTS,MOORE,NC,35.13,-79.38,NICKEL TO QUARTER SIZE HAIL WAS REPORTED NEAR THE INTERSECTION OF EAST INDIANA AVE AND BRIDGEWATER DRIVE. (RAH)
2147,175,10 NE HERREID,CAMPBELL,SD,45.94,-99.93,GOLFBALL HAIL. (ABR)
2155,100,ZEELAND,MCINTOSH,ND,45.97,-99.83,(BIS)
2230,125,KENEL,CORSON,SD,45.86,-100.46,RELAYED THROUGH KFYR TV METEOROLOGIST...TIME ESTIMATED FROM RADAR (ABR)
2255,175,2 SE ENDERLIN,RANSOM,ND,46.6,-97.57,(FGF)
2305,175,10 N SIDE LAKE,ST. LOUIS,MN,47.81,-93.02,MOSTLY NICKEL SIZE HAIL...A FEW LARGE TREES DOWN. (DLH)
2310,100,4 E SHELDON,RANSOM,ND,46.59,-97.41,(FGF)
2315,175,1 SSE VERONA,LAMOURE,ND,46.35,-98.07,30 TO 40 MPH WINDS. 0.90 INCHES OF RAINFALL. (BIS)
2325,200,2 S LEONARD,RICHLAND,ND,46.62,-97.25,PHOTOS POSTED TO FACEBOOK. TIME ESTIMATED BASED ON RADAR. (FGF)
2334,125,4 N LITTLE EAGLE,CORSON,SD,45.74,-100.8,HAIL QUARTER TO HALF DOLLAR SIZE.. (ABR)
2335,100,7 SW ENGLEVALE,RANSOM,ND,46.32,-98.02,(FGF)
2342,150,6 W KINDRED,CASS,ND,46.65,-97.15,(FGF)
2358,100,1 W CHRISTINE,RICHLAND,ND,46.58,-96.83,(FGF)
0000,100,1 N FULLERTON,DICKEY,ND,46.18,-98.43,VERY HEAVY RAINFALL AND HIGH WIND. (BIS)
0002,100,17 S FARGO,CASS,ND,46.63,-96.82,REPORTED VIA FACEBOOK (FGF)
0035,100,4 SE ROLLAG,CLAY,MN,46.7,-96.18,(FGF)
0046,100,7 N FIRESTEEL,CORSON,SD,45.52,-101.3,QUARTER HAIL. (ABR)
0104,100,1 SW DETROIT LAKES,BECKER,MN,46.8,-95.86,REPORTED VIA ESPOTTER. (FGF)
0125,100,2 S OSAGE,BECKER,MN,46.89,-95.26,(FGF)
