Time,F_Scale,Location,County,State,Lat,Lon,Comments
1441,UNK,BRIDGE CITY,ORANGE,TX,30.03,-93.85,NWS STORM SURVEY CONFIRMED AN EF-0 TORNADO IN BRIDGE CITY TX. THE PATH WAS 3 MILES LONG 100 YARDS WIDE AND THE ESTIMATED WIND SPEED WAS 75 MPH. MINOR DAMAGE TO HOMES WI (LCH)
1445,UNK,6 SSE DE QUINCY,CALCASIEU,LA,30.37,-93.4,NWS SURVEY CONFIRMS AN EF0 TORNADO SOUTH OF DEQUINCY. THE PATH IS CURRENTLY ESTIMATED AT NEAR 6 MILES LONG STARTING JUST WEST OF WANDA ROAD AND ENDING JUST NORTH OF HOL (LCH)
1502,UNK,6 S RAGLEY,BEAUREGARD,LA,30.43,-93.23,NWS SURVEY CONFIRMS A EF1 TORNADO TRACK FROM CAMP EDGEWOOD ROAD BETWEEN GILLIS AND RAGLEY TO TEXAS EASTERN ROAD ROUGHLY 6 MILES WEST SOUTHWEST OF REEVES. STORM SURVEY C (LCH)
1530,UNK,5 WNW LAKE CHARLES REGI,CALCASIEU,LA,30.16,-93.3,A NWS STORM SURVEY CONFIRMED AN EF-0 TORNADO TOUCHED DOWN OF HWY 384 NEAR OGEA RD TO THE SOUTH WEST OF LAKE CHARLES LA. MINOR DAMAGE TO ONE HOME WITH 2 SHEDS COLLAPSED (LCH)
1641,UNK,5 NE JENNINGS,ACADIA,LA,30.28,-92.6,VIDEO OF A TORNADO RECORDED NEAR EVANGELINE. (LCH)
2311,UNK,2 WSW OXLY,RIPLEY,MO,36.58,-90.72,EF1 TORNADO. MANY TREES SNAPPED/UPROOTED. 2.5 WSW OF OXLY TO 2.5 E OF OXLY. MAX WIND 95 MPH. WIDTH 150 YARDS. LENGTH WAS 5 MILES LONG. AN ATTACHED CARPORT TORN FROM HOM (PAH)
2330,UNK,2 S HARVIELL,BUTLER,MO,36.64,-90.47,EF1 TORNADO. BRIEF TOUCHDOWN 2.5 MILES SOUTH OF TOWN. PK WND 95 MPH AND MAX WIDTH 50 YARDS. LARGE WOOD FRAMED MECHANICS SHED DESTROYED. SEVERAL TREES SNAPPED AND ONE LA (PAH)
2348,UNK,3 S BATESVILLE,BUTLER,MO,36.66,-90.25,EF1 TORNADO 1.5 NW OF BROSELY TO 5.5 NE OF BROSELEY. 5.5 MILES LONG. MAX WIDTH 75 YARDS WITH MAX WIND 100 MPH. ONE MOBILE HOME OVERTURNED. SHINGLE DAMAGE TO ONE HOME. A (PAH)
2354,UNK,LEOPOLD,BOLLINGER,MO,37.26,-89.93,EF1 TORNADO. PEAK WIND 95 MPH. 200 YARDS WIDE AND 1.5 MILES LONG. BEGAN 1 W OF TOWN TO 0.5 E OF LEOPOLD. NO INJURIES OR DEATHS. DOZENS OF TREES SNAPPED AND UPROOTED WIT (PAH)
0005,UNK,DUTCHTOWN,CAPE GIRARDEAU,MO,37.25,-89.66,NWS SURVEY CONFIRMS EF1 TORNADO ACROSS SOUTHERN CAPE GIRARDEAU COUNTY FROM 3 NW DUTCHTOWN TO 2.5 NE DUTCHTOWN. 150 YARDS WIDE. 4.25 MILES TRACK LENGTH. NUMEROUS TREES U (PAH)
0011,UNK,2 WSW OXLY,RIPLEY,MO,36.58,-90.72,EF1 TORNADO. MANY TREES SNAPPED/UPROOTED. 2.5 WSW OF OXLY TO 2.5 E OF OXLY. MAX WIND 95 MPH. WIDTH 150 YARDS. LENGTH WAS 5 MILES LONG. AN ATTACHED CARPORT TORN FROM HOM (PAH)
0020,UNK,EAST CAPE GIRARDEAU,ALEXANDER,IL,37.3,-89.5,NWS STORM DAMAGE SURVEY CONFIRMS EF0 TORNADO EAST CAPE GIRARDEAU IL. 80 MPH PEAK WIND. (PAH)
0024,UNK,4 SW BAKER,STODDARD,MO,36.73,-89.81,PRELIMINARY REPORT. EF2 TORNADO WITH MAX WIND 115 MPH. BEGAN 4SW BAKER TO 2SW BAKER. WIDTH 100 YDS. 3 SHEDS AND 4 GRAIN BINS LEVELED AND DEBRIS CARRIED 100S OF YARDS. S (PAH)
0030,UNK,2 S HARVIELL,BUTLER,MO,36.64,-90.47,EF1 TORNADO. BRIEF TOUCHDOWN 2.5 MILES SOUTH OF TOWN. PK WND 95 MPH AND MAX WIDTH 50 YARDS. LARGE WOOD FRAMED MECHANICS SHED DESTROYED. SEVERAL TREES SNAPPED AND ONE LA (PAH)
0040,UNK,CARAWAY,CRAIGHEAD,AR,35.76,-90.33,SUBSTANTIAL STRUCTURAL DAMAGE REPORTED AS TORNADO TOUCHED DOWN JUST SOUTHWEST OF BUSINESS DISTRICT. MANY TREES AND POWER LINES SNAPPED.THE TORNADO LIFTED AT THE FAR NOR (MEG)
0048,UNK,3 S BATESVILLE,BUTLER,MO,36.66,-90.25,EF1 TORNADO 1.5 NW OF BROSELY TO 5.5 NE OF BROSELEY. 5.5 MILES LONG. MAX WIDTH 75 YARDS WITH MAX WIND 100 MPH. ONE MOBILE HOME OVERTURNED. SHINGLE DAMAGE TO ONE HOME. A (PAH)
0050,UNK,1 S CREAL SPRINGS,WILLIAMSON,IL,37.6,-88.84,...UNCONFIRMED...REPORTED BY OFF DUTY 911 OPERATOR. REPORTED WINDS AND RAINS INCREASED AND HEARD THE SOUND OF A FREIGHT TRAIN. (PAH)
0054,UNK,LEOPOLD,BOLLINGER,MO,37.26,-89.93,EF1 TORNADO. PEAK WIND 95 MPH. 200 YARDS WIDE AND 1.5 MILES LONG. BEGAN 1 W OF TOWN TO 0.5 E OF LEOPOLD. NO INJURIES OR DEATHS. DOZENS OF TREES SNAPPED AND UPROOTED WIT (PAH)
0102,UNK,5 NW BERNIE,STODDARD,MO,36.72,-90.03,EF1 TORNADO. WINDS 105 MPH. 5 NW OF BERNIE TO 5.5 SE OF ESSEX. NUMEROUS LARGE BRANCHES DOWN. SEVERAL TREES SNAPPED OR UPROOTED. SEVERAL OUTBUILDINGS DAMAGED OR DESTROYE (PAH)
0105,UNK,WYATT,MISSISSIPPI,MO,36.91,-89.22,EF1 TORNADO BEGAN IN WYATT MO TRAVELED NE 6 MILES TO WICKLIFFE KY. PK WND 100 MPH. MAX WIDTH 200 YDS. HOMES IN WYATT HAD ROOF DAMAGE AND 1 BLDG HEAVILY DAMAGED. ROOF OF (PAH)
0105,UNK,DUTCHTOWN,CAPE GIRARDEAU,MO,37.25,-89.66,NWS SURVEY CONFIRMS EF1 TORNADO ACROSS SOUTHERN CAPE GIRARDEAU COUNTY FROM 3 NW DUTCHTOWN TO 2.5 NE DUTCHTOWN. 150 YARDS WIDE. 4.25 MILES TRACK LENGTH. NUMEROUS TREES U (PAH)
0105,UNK,CARRIER MILLS,SALINE,IL,37.69,-88.63,...UNCONFIRMED...TORNADO REPORTED AT CARRIER MILLS HEADING EAST. LATE REPORT. (PAH)
0120,UNK,EAST CAPE GIRARDEAU,ALEXANDER,IL,37.3,-89.5,NWS STORM DAMAGE SURVEY CONFIRMS EF0 TORNADO EAST CAPE GIRARDEAU IL. 80 MPH PEAK WIND. (PAH)
0124,UNK,4 SW BAKER,STODDARD,MO,36.73,-89.81,PRELIMINARY REPORT. EF2 TORNADO WITH MAX WIND 115 MPH. BEGAN 4SW BAKER TO 2SW BAKER. WIDTH 100 YDS. 3 SHEDS AND 4 GRAIN BINS LEVELED AND DEBRIS CARRIED 100S OF YARDS. S (PAH)
0125,UNK,CUNNINGHAM,CARLISLE,KY,36.92,-88.91,EF1 TORNADO BEGAN JUST SOUTH OF TOWN TO 6 MILES NE. PEAK WIND 105 MPH. 200 YARDS WIDE AND 6 MILES LONG. LARGE TREES SNAPPED AND UPROOTED. GLASS DOOR DESTROYED. NEARBY H (PAH)
0130,UNK,2 SW GAGE,BALLARD,KY,36.97,-88.92,LARGE SECTIONS OF TREES SNAPPED. MOBILE HOME MOVED OFF FOUNDATION. PATH LENGTH 1/3RD OF A MILE. WIDTH APPROXIMATELY 70 YARDS. NEAR JUNCTION OF FRAIZER AND MARTIN ROADS. (PAH)
0139,UNK,2 E MELBER,MCCRACKEN,KY,36.95,-88.69,EF1 TORNADO BEGAN 1.2E OF MELBER TO JUST S OF ST. JOHNS. PK WND 100 MPH. WIDTH 200-250 YARDS. LENGTH 2.5 MILES. TREES SNAPPED OR UPROOTED. HOME HAD GARAGE AND ROOF DAMA (PAH)
0140,UNK,5 SSW SIKESTON,NEW MADRID,MO,36.81,-89.62,EF1 TORNADO WITH 100 MPH PEAK WINDS AND 50 YD PATH WIDTH. THE 3 MILE PATH LENGTH STARTED 5 MI SSW OF SIKESTON ALONG HWY FF TO 3.8 MI S OF SIKESTON ALONG HWY 61. ON HWY (PAH)
0150,UNK,REIDLAND,MCCRACKEN,KY,37.01,-88.53,EF1 TORNADO. WINDS 90 MPH. TORNADO STARTED NEAR FANTASY LANE AND ENDED NEAR THE INTERSECTION OF MYRA DR AND EPPERSON RD. PATH WIDTH 40 YARDS. NUMEROUS LARGE TREE BRANCH (PAH)
0150,UNK,1 S CREAL SPRINGS,WILLIAMSON,IL,37.6,-88.84,...UNCONFIRMED...REPORTED BY OFF DUTY 911 OPERATOR. REPORTED WINDS AND RAINS INCREASED AND HEARD THE SOUND OF A FREIGHT TRAIN. (PAH)
0203,UNK,CALVERT CITY,MARSHALL,KY,37.03,-88.35,NWS DAMAGE SURVEY CONFIRMS EF0 TORNADO SOUTH SIDE OF CALVERT CITY KY FROM LAUREL LANE NORTHEAST ACROSS HWY 62 ALONG OAK PARK BLVD ENDING NEAR OAK PARK AND 15TH AVE SE.P (PAH)
0205,UNK,WYATT,MISSISSIPPI,MO,36.91,-89.22,EF1 TORNADO BEGAN IN WYATT MO TRAVELED NE 6 MILES TO WICKLIFFE KY. PK WND 100 MPH. MAX WIDTH 200 YDS. HOMES IN WYATT HAD ROOF DAMAGE AND 1 BLDG HEAVILY DAMAGED. ROOF OF (PAH)
0205,UNK,CARRIER MILLS,SALINE,IL,37.69,-88.63,...UNCONFIRMED...TORNADO REPORTED AT CARRIER MILLS HEADING EAST. LATE REPORT. (PAH)
0225,UNK,CUNNINGHAM,CARLISLE,KY,36.92,-88.91,EF1 TORNADO BEGAN JUST SOUTH OF TOWN TO 3.6 MILES NE. PEAK WIND 105 MPH. 200 YARDS WIDE AND 9 MILES LONG. LARGE TREES SNAPPED AND UPROOTED. GLASS DOOR DESTROYED. NEARBY (PAH)
0230,UNK,2 SW GAGE,BALLARD,KY,36.97,-88.92,LARGE SECTIONS OF TREES SNAPPED. MOBILE HOME MOVED OFF FOUNDATION. PATH LENGTH 1/3RD OF A MILE. WIDTH APPROXIMATELY 70 YARDS. NEAR JUNCTION OF FRAIZER AND MARTIN ROADS. (PAH)
0239,UNK,2 E MELBER,MCCRACKEN,KY,36.95,-88.69,EF1 TORNADO BEGAN 1.2E OF MELBER TO JUST S OF ST. JOHNS. PK WND 100 MPH. WIDTH 200-250 YARDS. LENGTH 2.5 MILES. TREES SNAPPED OR UPROOTED. HOME HAD GARAGE AND ROOF DAMA (PAH)
0248,UNK,1 SE REIDLAND,MCCRACKEN,KY,37,-88.51,EF-0 TORNADO. PEAK WINDS 75 MPH. TORNADO BEGAN JUST SOUTH OF THE INTERSECTION OF HWY 131 AND POWERS RD... ENDED AT TILL LANE. UPROOTED LARGE TREE NEAR CREEK BED. VERY L (PAH)
0303,UNK,CALVERT CITY,MARSHALL,KY,37.03,-88.35,NWS DAMAGE SURVEY CONFIRMS EF0 TORNADO SOUTH SIDE OF CALVERT CITY KY FROM LAUREL LANE NORTHEAST ACROSS HWY 62 ALONG OAK PARK BLVD ENDING NEAR OAK PARK AND 15TH AVE SE.P (PAH)
0330,UNK,4 NW HUBER HEIGHTS,MONTGOMERY,OH,39.89,-84.18,AN EF1 TORNADO AFFECTED BUSINESSES AND HOMES NEAR US ROUTE 40 IN VANDALIA. (ILN)
0338,UNK,5 NW ST. PARIS,MIAMI,OH,40.18,-84.03,(ILN)
0440,UNK,4 WNW GROVEPORT,FRANKLIN,OH,39.88,-82.94,AN EF0 TORNADO AFFECTED NUMEROUS MOBILE HOMES IN SOUTHERN COLUMBUS...JUST NORTH OF INTERSTATE 270. (ILN)
0507,UNK,2 WNW HEBRON,LICKING,OH,39.97,-82.53,AN EF1 TORNADO SNAPPED NUMEROUS PINE TREES NEAR OHIO ROUTE 37. (ILN)
Time,Speed,Location,County,State,Lat,Lon,Comments
1440,UNK,DE QUINCY,CALCASIEU,LA,30.45,-93.44,CALCASIEU PARISH SHERIFF REPORTS METAL PORCH WRAPPED AROUND POWER POLES AT 174 WANDA LN (LCH)
1445,UNK,BRIDGE CITY,ORANGE,TX,30.03,-93.85,PUBLIC REPORTS TREES DOWN...SIDING OFF OF HOMES AND CEILING DAMAGE ALONG S. PATILLO RD...POSSIBLE TORNADO. (LCH)
1550,UNK,WEST LIBERTY,LOGAN,OH,40.25,-83.76,A TREE WAS DOWNED ACROSS A STREET DUE TO THUNDERSTORM WINDS. (ILN)
1551,UNK,5 ENE GRAND LAKE,CALCASIEU,LA,30.07,-93.2,TIN TORE OFF A MOBILE HOME AND TWO SHEDS DAMAGED. (LCH)
1655,UNK,6 SW WISNER,FRANKLIN,LA,31.92,-91.72,ALONG JOHNSON ROAD...PART OF THE ROOF WAS BLOWN OFF A HOME...A CAMPER TRAILER WAS OVERTURNED...A FENCE WAS DOWNED...AND MULTIPLE TREES WERE DOWNED. NEARBY... WINDOWS WE (JAN)
1655,UNK,FRANKFORT,ROSS,OH,39.4,-83.18,A TREE FELL ON A HOUSE. (ILN)
1723,UNK,RAYNE,ACADIA,LA,30.24,-92.27,REPORT FROM KLFY OF DOG KENNELS BLOWN AWAY OFF OF HWY 35 (LCH)
1725,UNK,4 ESE WAVERLY,PIKE,OH,39.1,-82.92,A FEW TREES WERE DOWNED IN THE AREA DUE TO THUNDERSTORM WINDS. ONE OF THE TREES FELL ON MEADOW RUN ROAD. (ILN)
1742,UNK,SUNSET,ST. LANDRY,LA,30.41,-92.07,PUBLIC REPORTS A SHED DEMOLISHED...5-6 TREES SNAPPED AND TELEPHONE POLLS DOWN NEAR SUNSET. (LCH)
1802,61,TALLULAH,MADISON,LA,32.41,-91.19,VICKSBURG-TALLULAH REGIONAL AIRPORT ASOS RECORDED 61MPH WIND GUST. (JAN)
2152,UNK,1 SW HEBRON,JEFFERSON DAVIS,MS,31.71,-89.97,ALONG LAZY S ROAD...ONE HOME RECEIVED MINOR DAMAGE AND A ROOF WAS BLOWN OFF A BUSINESS...AND SEVERAL TREES WERE DOWNED. (JAN)
2238,UNK,4 W RALEIGH,SMITH,MS,32.02,-89.59,TREE AND POWER LINES DOWNED ON SMITH CR 540-2. POSSIBLE TORNADO. (JAN)
2328,60,1 SE BROWNSBURG,HENDRICKS,IN,39.83,-86.38,NUMEROUS TREE BRANCHES FLYING THROUGH THE AIR AND ACROSS ROADWAYS... NEAR ZERO VISIBILITY. NUMEROUS ROADWAYS ALSO COMPLETELY COVERED IN WATER... SOME IMPASSABLE. (IND)
2330,UNK,HARVIELL,BUTLER,MO,36.66,-90.47,TREES DOWN. LATE REPORT (PAH)
2333,UNK,5 W NAYLOR,RIPLEY,MO,36.57,-90.7,DOWNED TREES AND POWER LINES. DAMAGE TO SHED. INJURED OR DEAD CATTLE. (PAH)
2354,UNK,LEOPOLD,BOLLINGER,MO,37.26,-89.93,TREES REPORTED DOWN IN THE COMMUNITY. EM ALSO REPORTS WIDESPREAD TREES DOWN COUNTY WIDE WITH SOME BLOCKING ROADWAYS. (PAH)
0010,60,BERNIE,STODDARD,MO,36.67,-89.97,WINDS MEASURED 60 MPH WITH POSSIBLE HIGHER WINDS. POWER OUT COMMUNITY WIDE. (PAH)
0020,UNK,CAPE GIRARDEAU,CAPE GIRARDEAU,MO,37.31,-89.55,SEMI-TRACTOR ROLLED OVER DUE TO WIND NEAR MILE MARKER 96 ALONG INTERSTATE 55. (PAH)
0028,60,1 SE BROWNSBURG,HENDRICKS,IN,39.83,-86.38,NUMEROUS TREE BRANCHES FLYING THROUGH THE AIR AND ACROSS ROADWAYS... NEAR ZERO VISIBILITY. NUMEROUS ROADWAYS ALSO COMPLETELY COVERED IN WATER... SOME IMPASSABLE. (IND)
0030,UNK,HARVIELL,BUTLER,MO,36.66,-90.47,TREES DOWN. LATE REPORT. ADDITIONAL INFORMATION AT 0730 PM. ROOF BLOWN OFF HOME AND GRAIN BINS DAMAGED. (PAH)
0033,UNK,5 W NAYLOR,RIPLEY,MO,36.57,-90.7,UPDATED AT 0708 PM. DOWNED TREES AND POWER LINES. DAMAGE TO SHED. INJURED OR DEAD CATTLE. SEVERAL HARD WOODED TREES DOWN. BARN DESTROYED. OUTBUILDINGS DAMAGED. WINDS ES (PAH)
0044,UNK,MONETTE,CRAIGHEAD,AR,35.89,-90.34,POSSIBLE STRAIGHT LINE WINDS BLEW ROOF OFF OF CONVENIENCE STORE. (MEG)
0045,UNK,MILLIGAN RIDGE,MISSISSIPPI,AR,35.78,-90.26,MINOR DAMAGE ON HIGHWAY 158 IN MILLIGAN RIDGE. A FARM SHOP BUILDING AND SOME GRAIN BINS WERE DAMAGED. POWER LINES AND TRANSFORMERS FELL. (MEG)
0045,UNK,BEECH GROVE,MARION,IN,39.72,-86.09,20 INCH DIAMETER LIVING TREE DOWN... BROKE OFF AT BASE. (IND)
0047,UNK,FRANKLIN,JOHNSON,IN,39.49,-86.06,PATIO FURNITURE DAMAGED. LOCATION IS ESTIMATED. (IND)
0059,UNK,STONEFORT,SALINE,IL,37.62,-88.71,SIGNS BLOWN OFF OF SUPPORT POLES. (PAH)
0103,UNK,WYATT,MISSISSIPPI,MO,36.91,-89.22,1 SHED DESTROYED. SIGNIFICANT DAMAGE TO BRICK BUILDING WITH ROOF DAMAGE AS WELL. SEVERAL CHEMICAL CONTAINERS THROWN A LONG DISTANCE INTO A FIELD. LARGE TREE DOWN. REPOR (PAH)
0105,UNK,CARAWAY,CRAIGHEAD,AR,35.76,-90.33,SUBSTANTIAL STRUCTURAL DAMAGE REPORTED. DEBRIS OVER ROADS IMPARING LAW ENFORCEMENT AND RESCUE CREWS INTO CITY FOR ASSESMENT OF DAMAGES. (MEG)
0110,60,BERNIE,STODDARD,MO,36.67,-89.97,WINDS MEASURED 60 MPH WITH POSSIBLE HIGHER WINDS. POWER OUT COMMUNITY WIDE. (PAH)
0110,62,2 W HARRISBURG,SALINE,IL,37.74,-88.59,(PAH)
0115,UNK,S CAPE GIRARDEAU,CAPE GIRARDEAU,MO,37.31,-89.55,NWS STORM DAMAGE SURVEY INDICATES MICROBURST OVER SOUTH SIDE OF CAPE GIRARDEAU CITY. 95 MPH PEAK WINDS. (PAH)
0115,75,MUNCIE,DELAWARE,IN,40.2,-85.39,POWER POLES BLOWN PARTIALLY DOWN. POWER LINES DOWN. LOCATION IS ESTIMATED. (IND)
0126,UNK,MONKEYS EYEBROW,BALLARD,KY,37.19,-88.99,TREES DOWN. (PAH)
0128,UNK,CUNNINGHAM,CARLISLE,KY,36.92,-88.91,LATE REPORT. NUMEROUS TREES AND POWER LINES DOWN. MULTIPLE WINDOWS BLOWN OUT OF HOMES NEAR THE INTERSECTION OF HWY 62 AND CR 1015. DAMAGE FIELD PROCEDED EAST ALONG HWY (PAH)
0130,UNK,BLANDVILLE,BALLARD,KY,36.94,-88.96,WIDESPREAD TREES DOWN WITH POWER OUTAGES. (PAH)
0135,UNK,FOWLKES,DYER,TN,35.97,-89.39,TREES DOWN BLOCKING HWY 210 SOUTH NEAR FOWLKES. (MEG)
0137,UNK,INDIANAPOLIS,MARION,IN,39.78,-86.15,DAUGHTER OF NWS EMPLOYEE REPORTED POWER FLASHES ON IUPUI CAMPUS. (IND)
0140,UNK,3 E CARMEL,HAMILTON,IN,39.97,-86.05,POWER OUTAGE JUST EAST OF 116TH STREET AND HAZEL DELL. (IND)
0141,65,CASTLETON,MARION,IN,39.9,-86.05,HIGH WIND GUST... LARGE TREES BENDING HALFWAY OVER... ELECTRICAL TRANSFORMERS BLOWING IN THE AREA (IND)
0144,70,1 S SOUTHPORT,MARION,IN,39.65,-86.12,GUST REPORTED JUST NORTH OF COUNTY LINE ROAD ON US 31. (IND)
0147,UNK,FRANKLIN,JOHNSON,IN,39.49,-86.06,PATIO FURNITURE DAMAGED. LOCATION IS ESTIMATED. (IND)
0148,UNK,METROPOLIS,MASSAC,IL,37.15,-88.71,LARGE TREE FELL AGAINST HOUSE AT 18TH AND GIBBONS IN METROPOLIS.TREE SEVERELY DAMAGED TRUSSES SEPARATING FRONT WALL OF HOUSE FROM SIDE WALL. (PAH)
0150,UNK,REIDLAND,MCCRACKEN,KY,37.01,-88.53,PORCH BLOWN OFF BACK OF HOME ALONG FISHER ROAD. (PAH)
0154,62,1 NW SPEEDWAY,MARION,IN,39.8,-86.26,INDOT WEATHER STATION REPORT. (IND)
0159,UNK,STONEFORT,SALINE,IL,37.62,-88.71,UPDATE AT 0930 PM. 4 HOMES HAVE ROOF DAMAGE. SEVERAL TREES AND TREE LIMBS DOWN. SIGNS BLOWN OFF OF SUPPORT POLES. (PAH)
0159,UNK,MARIETTA,SHELBY,IN,39.44,-85.88,TREES DOWN AT SR 252 E OF I 65 IN SW SHELBY COUNTY (IND)
0200,60,NORTH VERNON,JENNINGS,IN,39.01,-85.63,HIGH WINDS. SMALL TREE LIMBS DOWN ON PERSONAL PROPERTY. (IND)
0202,UNK,CALVERT CITY,MARSHALL,KY,37.03,-88.35,2 BUILDINGS DAMAGED. ROOFS BLOWN OFF OF TWO BUSINESSES. MINOR ROOF DAMAGE REPORTED AT WESTLAKE. (PAH)
0203,UNK,WYATT,MISSISSIPPI,MO,36.91,-89.22,1 SHED DESTROYED. SIGNIFICANT DAMAGE TO BRICK BUILDING WITH ROOF DAMAGE AS WELL. SEVERAL CHEMICAL CONTAINERS THROWN A LONG DISTANCE INTO A FIELD. LARGE TREE DOWN. REPOR (PAH)
0203,UNK,S CAPE GIRARDEAU,CAPE GIRARDEAU,MO,37.31,-89.55,NWS STORM DAMAGE SURVEY INDICATES MICROBURST OVER SOUTH SIDE OF CAPE GIRARDEAU CITY. 95 MPH PEAK WINDS. (PAH)
0203,60,EDINBURGH,JOHNSON,IN,39.35,-85.97,POWER OUTAGES REPORTED. (IND)
0203,UNK,EDINBURGH,JOHNSON,IN,39.35,-85.97,POWER OUTAGES REPORTED. TREE DOWN ON HOUSE ON FRANKLIN STREET. ESTIMATED WINDS 60 MPH. (IND)
0204,UNK,ANDERSON,MADISON,IN,40.09,-85.69,NUMEROUS POWER LINES AND LIMBS DOWNED. ESTIMATED WIND GUSTS 60 MPH. (IND)
0205,65,GREENFIELD,HANCOCK,IN,39.79,-85.77,(IND)
0210,UNK,5 N GRAND RIVERS,LIVINGSTON,KY,37.08,-88.24,3SW OF IUKA KENTUCKY...1 TREE DOWN AND SEVERAL LARGE LIMBS DOWN (PAH)
0210,62,2 W HARRISBURG,SALINE,IL,37.74,-88.59,(PAH)
0210,UNK,NEWBURGH,WARRICK,IN,37.95,-87.4,TREES DOWN. POWER LINE DOWN ACROSS A HOME NEAR THE INTERSECTION OF SYCAMORE AND GREY. (PAH)
0212,UNK,HENDERSON,HENDERSON,KY,37.84,-87.58,WIDESPREAD POWER OUTAGES REPORTED. (PAH)
0216,UNK,3 SE DYCUSBURG,LYON,KY,37.13,-88.15,A FEW LIMBS DOWN (PAH)
0220,UNK,RUSHVILLE,RUSH,IN,39.61,-85.45,DAMAGED FARM EQUIPMENT WEST OF RUSHVILLE. TREES DOWN AROUND RUSH COUNTY. (IND)
0220,UNK,KENNARD,HENRY,IN,39.9,-85.52,MULTIPLE TREES DOWN...ONE MAY HAVE FALLEN ON HOUSE (IND)
0222,UNK,3 E CUNNINGHAM,CARLISLE,KY,36.92,-88.86,LATE REPORT. MOBILE HOME BLOWN OFF OF FOUNDATION. (PAH)
0223,75,MUNCIE,DELAWARE,IN,40.2,-85.39,POWER POLES BLOWN PARTIALLY DOWN. POWER LINES DOWN. LOCATION IS ESTIMATED. (IND)
0225,UNK,FISHERS,HAMILTON,IN,39.95,-86.02,TREES DOWN AT ELLER AND 106TH (IND)
0226,UNK,MONKEYS EYEBROW,BALLARD,KY,37.19,-88.99,TREES DOWN. (PAH)
0230,UNK,BLANDVILLE,BALLARD,KY,36.94,-88.96,MOBILE HOME BLOWN OFF OF FOUNDATION. (PAH)
0230,UNK,2 WSW CAMBRIDGE CITY,WAYNE,IN,39.8,-85.21,ONE TREE DOWN (ILN)
0235,UNK,5 S AURORA,CALLOWAY,KY,36.7,-88.14,A LARGE BOAT DOCK,2 FISHING BOATS,AND 2 PONTOON BOATS WERE LIFTED,AND FLIPPED UPSIDE DOWN INTO THE LAKE. DOCK WAS LOCATED AT WESTERN SHORES SOUTH LAKE PARK. PRELIMINAR (PAH)
0235,UNK,KNOTTSVILLE,DAVIESS,KY,37.77,-86.91,LARGE TREE REPORTED DOWN,BLOCKING HIGHWAY 144 NEAR KNOTTSVILLE IN EASTERN DAVIESS COUNTY. ROAD CREWS WORKING TO CLEAR ROADWAY. (PAH)
0235,68,ROCKPORT,SPENCER,IN,37.88,-87.05,(PAH)
0236,UNK,ROCKFORD,MERCER,OH,40.69,-84.65,TREE LIMBS WERE DOWNED IN THE NORTHERN PORTION OF MERCER COUNTY DUE TO THUNDERSTORM WINDS. (ILN)
0240,UNK,FRANKLIN,JOHNSON,IN,39.49,-86.06,TREES DOWN ON VEHICLES. (IND)
0241,UNK,MARIETTA,SHELBY,IN,39.44,-85.88,TREES DOWN AT SR 252 E OF I 65 IN SW SHELBY COUNTY (IND)
0242,UNK,10 SW WINCHESTER,RANDOLPH,IN,40.07,-85.11,RANDOLPH COUNTY SHERRIFF REPORTED MULTIPLE TREES DOWN,WITH ONE INTO A HOUSE NEAR HUNTSVILLE. POWER OUTAGES IN RURAL RANDOLPH COUNTY SOUTH OF PARKER. TIME ESTIMATED BY (IND)
0245,UNK,TRENTON,GIBSON,TN,35.97,-88.94,SEVERAL TREES AND LARGE LIMBS DOWN WITH POWER LINES DOWN NEAR HWY 45 IN TRENTON AND AROUND DYER AND RUTHERFORD IN NORTHERN GIBSON COUNTY. (MEG)
0246,58,KCEV CONNERSVILLE APT,FAYETTE,IN,39.7,-85.13,(ILN)
0248,UNK,METROPOLIS,MASSAC,IL,37.15,-88.71,LARGE TREE FELL AGAINST HOUSE AT 18TH AND GIBBONS IN METROPOLIS.TREE SEVERELY DAMAGED TRUSSES SEPARATING FRONT WALL OF HOUSE FROM SIDE WALL. (PAH)
0250,UNK,REIDLAND,MCCRACKEN,KY,37.01,-88.53,PORCH BLOWN OFF BACK OF HOME ALONG FISHER ROAD. (PAH)
0251,UNK,CADIZ,TRIGG,KY,36.87,-87.82,NUMEROUS TREES DOWN. (PAH)
0251,UNK,RICHMOND,WAYNE,IN,39.83,-84.89,LARGE TREE FELL ON TWO CARS PLUS SEVERAL REPORTS OF TREES DOWN AROUND WAYNE COUNTY. (ILN)
0253,UNK,5 WNW SAINT PETER,FRANKLIN,IN,39.35,-85.11,ONE TREE DOWN ALONG ST. MARYS RD. (ILN)
0300,UNK,2 S PARIS,HENRY,TN,36.27,-88.31,A FEW TREES WERE KNOCKED DOWN JUST SOUTH OF PARIS. (MEG)
0300,UNK,N HENDERSON,HENDERSON,KY,37.84,-87.58,TWO TREES BLOWN DOWN BLOCKING ROADS IN NORTHERN SECTIONS OF HENDERSON CITY. ALSO REPORTS OF AN ELECTRICAL TRANSFORMER FIRE,POWER OUTAGES AND POWER LINES DOWN NORTH PAR (PAH)
0300,UNK,JEFFERSONTOWN,JEFFERSON,KY,38.21,-85.57,TREES DOWN NEAR JTOWN HIGH SCHOOL. (LMK)
0300,60,NORTH VERNON,JENNINGS,IN,39.01,-85.63,HIGH WINDS. SMALL TREE LIMBS DOWN ON PERSONAL PROPERTY. (IND)
0302,UNK,CALVERT CITY,MARSHALL,KY,37.03,-88.35,UPDATE AT 1005 PM. INITIAL SURVEY INDICATES WIND SPEEDS 80 MPH. ROOF DAMAGE TO STRIP MALL ALONG OAK PARK BLVD. DOWNED POWER LINES. RUPTURED GAS LINES AND EMERGENCY RESP (PAH)
0304,UNK,3 W CLOVERPORT,HANCOCK,KY,37.83,-86.68,THE STATE POLICE HAD TO REMOVE A TREE FROM A ROADWAY NEAR THE HANCOCK AND BRECKINRIDGE COUNTY LINE. (LMK)
0304,UNK,1 W PENNTOWN,RIPLEY,IN,39.27,-85.12,ONE TREE FELL ACROSS SR-46 AND ONTO VEHICLE (ILN)
0305,UNK,ARCANUM,DARKE,OH,39.99,-84.55,SEVERAL TREES REPORTED DOWN IN THE AREA (ILN)
0308,62,MILAN,RIPLEY,IN,39.13,-85.13,HOME WEATHER STATION (ILN)
0310,UNK,5 N GRAND RIVERS,LIVINGSTON,KY,37.08,-88.24,3SW OF IUKA KENTUCKY...1 TREE DOWN AND SEVERAL LARGE LIMBS DOWN (PAH)
0310,UNK,NEWBURGH,WARRICK,IN,37.95,-87.4,TREES DOWN. POWER LINE DOWN ACROSS A HOME NEAR THE INTERSECTION OF SYCAMORE AND GREY. (PAH)
0312,UNK,5 NNW FORKS OF ELKHORN,FRANKLIN,KY,38.28,-84.84,TREE REPORTED DOWN ACROSS ROYAL PARKWAY NEAR FRANKFORT. NEARBY WEATHER STATION REPORTED WIND GUST OF 58 MPH. (LMK)
0314,UNK,1 S RUSSIA,SHELBY,OH,40.22,-84.41,MULTIPLE TREES WERE DOWNED DUE TO THUNDERSTORM WINDS. (ILN)
0315,UNK,2 N MILLERSVILLE,SUMNER,TN,36.41,-86.7,POWER LINES DOWN ON BETHEL ROAD BY MILLERSVILLE FIRE DEPT. (OHX)
0316,UNK,3 SE DYCUSBURG,LYON,KY,37.13,-88.15,A FEW LIMBS DOWN (PAH)
0320,UNK,4 S CAMDEN,BENTON,TN,36,-88.1,A TREE WAS DOWNED AT 2138 SHILOH CHURCH ROAD. (OHX)
0320,UNK,PIQUA,MIAMI,OH,40.15,-84.25,ONE TREE DOWN (ILN)
0325,UNK,3 WSW DOVER,STEWART,TN,36.47,-87.9,A DOWNED POWER LINE CAUSED A TREE TO CATCH ON FIRE IN LOCKWOOD HOLLOW. (OHX)
0326,UNK,5 WNW HUBER HEIGHTS,MONTGOMERY,OH,39.89,-84.18,FRICKERS RESTAURANT ON FOLEY DRIVE HAD ROOF RIPPED OFF AND WINDOWS BLOWN OUT. (ILN)
0328,UNK,3 WSW TIPP CITY,MIAMI,OH,39.94,-84.23,TREES WERE DOWNED WEST SOUTHWEST OF TIPP CITY DUE TO THUNDERSTORM WINDS. (ILN)
0330,UNK,ANCHORAGE,JEFFERSON,KY,38.27,-85.54,PICTURE SUBMITTED VIA FACEBOOK OF LARGE PART OF TREE SNAPPED OFF. (LMK)
0332,58,MAPLEWOOD,SHELBY,OH,40.38,-84.03,(ILN)
0333,UNK,5 S MIAMISBURG,WARREN,OH,39.56,-84.27,*** 1 INJ *** SEMI TRUCK OVERTURNED ON I-75. DRIVER TAKEN TO HOSPITAL WITH MINOR INJURIES. (ILN)
0334,UNK,2 WSW BARDSTOWN JUNCTIO,BULLITT,KY,37.93,-85.73,SEVERAL TREES AND POWER LINES DOWN ALONG WITH POWER POLES SNAPPED ON BEECH GROVE ROAD NEAR SHEPHERDSVILLE (LMK)
0335,UNK,5 S AURORA,CALLOWAY,KY,36.7,-88.14,A LARGE BOAT DOCK,2 FISHING BOATS,AND 2 PONTOON BOATS WERE LIFTED,AND FLIPPED UPSIDE DOWN INTO THE LAKE. DOCK WAS LOCATED AT WESTERN SHORES SOUTH LAKE PARK. PRELIMINAR (PAH)
0335,UNK,KNOTTSVILLE,DAVIESS,KY,37.77,-86.91,LARGE TREE REPORTED DOWN,BLOCKING HIGHWAY 144 NEAR KNOTTSVILLE IN EASTERN DAVIESS COUNTY. ROAD CREWS WORKING TO CLEAR ROADWAY. (PAH)
0335,68,ROCKPORT,SPENCER,IN,37.88,-87.05,(PAH)
0335,UNK,OAKWOOD,MONTGOMERY,OH,39.72,-84.17,MULTIPLE TREES DOWN (ILN)
0336,UNK,LOUISVILLE,JEFFERSON,KY,38.22,-85.74,VARIOUS SOCIAL MEDIA REPORTS OF LARGE TREE LIMBS AND TREES DOWN ACROSS THE COUNTY (LMK)
0336,UNK,5 NE CAMBRIDGE CITY,WAYNE,IN,39.87,-85.12,ONE TREE DOWN AND SEVERAL TREES PARTIALLY DOWN. (ILN)
0338,UNK,LEXINGTON,FAYETTE,KY,38.04,-84.46,SOME TREES REPORTED DOWN ACROSS THE CITY. (LMK)
0340,UNK,3 NNW DOWNTOWN CINCINNA,HAMILTON,OH,39.14,-84.53,ROOF REMOVED FROM BUILDING (ILN)
0340,UNK,ROSEWOOD,CHAMPAIGN,OH,40.22,-83.96,TREES AND POWER LINES WERE DOWN ACROSS THE NORTHWESTERN PORTIONS OF CHAMPAIGN COUNTY. SOME ROAD CLOSURES OCCURRED DUE TO TREE DEBRIS. PORCH DAMAGE OCCURRED TO A RESIDEN (ILN)
0346,UNK,1 NNW SPRINGFIELD,CLARK,OH,39.94,-83.81,TREES DOWN ON WITTENBERG UNIVERSITY CAMPUS (ILN)
0347,UNK,4 SE NASHVILLE,DAVIDSON,TN,36.13,-86.73,SEVERAL POWER LINES DOWN MAINLY ACROSS SOUTHEASTERN DAVIDSON COUNTY (OHX)
0350,UNK,WEST LIBERTY,LOGAN,OH,40.25,-83.76,A TREE WAS DOWNED ACROSS A STREET DUE TO THUNDERSTORM WINDS. CORRECTED EVENT TIME. (ILN)
0351,UNK,CADIZ,TRIGG,KY,36.87,-87.82,NUMEROUS TREES DOWN. (PAH)
0354,UNK,KENTON,HARDIN,OH,40.64,-83.61,ROOF DAMAGE (ILN)
0355,60,3 E LEBANON,WARREN,OH,39.43,-84.15,(ILN)
0356,UNK,1 NNW NOLENSVILLE,WILLIAMSON,TN,35.96,-86.65,TREES AND LIMBS DOWN AROUND NOLENSVILLE AND LENOX VILLAGE (OHX)
0358,UNK,5 SW LEBANON,WILSON,TN,36.16,-86.39,TREE DOWN IN ROAD AT 543 OAK GROVE ROAD IN LEBANON (OHX)
0401,60,4 W LEBANON,WILSON,TN,36.21,-86.39,(OHX)
0411,UNK,NICHOLASVILLE,JESSAMINE,KY,37.88,-84.58,TREES AND POWER LINES DOWN THROUGHOUT THE COUNTY (LMK)
0413,58,1 ESE BOWERSVILLE,GREENE,OH,39.57,-83.71,RECORDED ON ODOT SENSOR. (ILN)
0415,UNK,10 E SPRING HILL,WILLIAMSON,TN,35.74,-86.75,TREE DOWN AND BLOCKING ROADWAY AT CHOCTAW AND GILES HILL ROAD IN COLLEGE GROVE (OHX)
0415,UNK,LEXINGTON,FAYETTE,KY,38.04,-84.46,NUMEROUS POWER OUTAGES REPORTED ACROSS FAYETTE COUNTY. (LMK)
0415,UNK,WILMINGTON,CLINTON,OH,39.44,-83.83,LARGE TREE LIMB DOWN. THE BRANCH WENT THROUGH AUTOMOBILE WINDSHIELD. (ILN)
0415,UNK,2 SE TIFFIN,SENECA,OH,41.1,-83.15,NUMEROUS POLES AND POWER LINES DOWN NEAR US 224 JUST EAST OF STATE ROUTE 100. (CLE)
0419,60,3 SW MAGNETIC SPRINGS,UNION,OH,40.32,-83.3,(ILN)
0425,UNK,MARION,MARION,OH,40.58,-83.13,FOUR TREES AND SOME POWERLINES DOWN. (CLE)
0425,UNK,BUCYRUS,CRAWFORD,OH,40.8,-82.97,TREE AND LIMBS FELL ON HOUSE DOING SOME DAMAGE. (CLE)
0425,UNK,NEW WASHINGTON,CRAWFORD,OH,40.96,-82.85,TREE ON ROAD. (CLE)
0426,58,MARION,MARION,OH,40.58,-83.13,(CLE)
0430,UNK,CELINA,CLAY,TN,36.55,-85.5,TREE LIMBS WERE BLOWN DOWN ACROSS THE COUNTY. (OHX)
0430,UNK,1 ENE DOWNTOWN COLUMBUS,FRANKLIN,OH,39.96,-82.98,LARGE HEALTHY 3 FOOT DIAMETER TREE DOWN NEAR ROUTE 62 AND INTERSTATE 71. TIME IS ESTIMATED. (ILN)
0430,UNK,CRESTLINE,CRAWFORD,OH,40.79,-82.74,TREE ON ROAD. (CLE)
0433,UNK,LEXINGTON,FAYETTE,KY,38.04,-84.46,NUMEROUS POWER OUTAGES REPORTED ACROSS FAYETTE COUNTY. (LMK)
0435,UNK,GEORGETOWN,BROWN,OH,38.87,-83.9,A LARGE TREE FELL ON A HOUSE DUE TO THUNDERSTORM WINDS...CAUSING CONSIDERABLE DAMAGE TO THE HOUSE. (ILN)
0437,UNK,3 NNE BUFORD,HIGHLAND,OH,39.12,-83.82,A TREE WAS DOWNED ON CERTIER ROAD DUE TO THUNDERSTORM WINDS. (ILN)
0445,UNK,2 N MOUNT STERLING,MONTGOMERY,KY,38.09,-83.95,RT. 11 MAYSVILLE ROAD CLOSED DUE TO DOWNED TREES AND POWERLINES. (JKL)
0445,UNK,SHELBY,RICHLAND,OH,40.88,-82.66,MANY TREES AND POWER LINES DOWN OVER THE SOUTHERN HALF OF TOWN. SOME ROOF DAMAGE REPORTED. (CLE)
0447,UNK,1 W MARSHALL,HIGHLAND,OH,39.15,-83.51,A TREE WAS DOWNED ON MAIN ROAD DUE TO THUNDERSTORM WINDS. (ILN)
0450,UNK,WINCHESTER,CLARK,KY,38,-84.19,GARAGE DOOR DAMAGED...STORM DOORS BLOWN OFF...LARGE LIMBS DOWN...POWER OUTAGES (LMK)
0450,UNK,NORWALK,HURON,OH,41.24,-82.61,SEVERAL TREES REPORTED DOWN BLOCKING ROADWAYS. HALF OF CITY ESTIMATED WITHOUT POWER. (CLE)
0451,UNK,PICKERINGTON,FAIRFIELD,OH,39.89,-82.77,TREES DOWN ON SR-256 (ILN)
0452,UNK,MAYSVILLE,MASON,KY,38.64,-83.75,A FEW LARGE LIMBS WERE DOWNED DUE TO THUNDERSTORM WINDS. (ILN)
