Time,F_Scale,Location,County,State,Lat,Lon,Comments
0455,UNK,WAYNESBURG,LINCOLN,KY,37.33,-84.68,MANY TREES AND POWER LINES DOWN THROUGHOUT THE COUNTY. ONE MOBILE HOME HAD A TREE FALL THROUGH THE ROOF IN WAYNESBURG. (LMK)
0455,UNK,FRANKFORT,ROSS,OH,39.4,-83.18,A TREE FELL ON A HOUSE. CORRECTED EVENT TIME. (ILN)
0500,UNK,CENTERBURG,KNOX,OH,40.3,-82.7,ONE TREE DOWN IN MILFORD TOWNSHIP. (CLE)
0503,UNK,BAINBRIDGE,ROSS,OH,39.23,-83.27,FOUR TREES WERE DOWNED DUE TO THUNDERSTORM WINDS. THESE TREES WERE PRIMARILY SCATTERED ACROSS THE SOUTHWESTERN PORTIONS OF THE COUNTY. (ILN)
0505,UNK,3 SSW LIVINGSTON,OVERTON,TN,36.36,-85.35,A LARGE TREE FELL ON A TRUCK AT 4630 NEW HOPE ROAD. (OHX)
0505,UNK,6 WNW CELINA,CLAY,TN,36.59,-85.59,A LARGE TREE FELL ON A TRUCK AT 4630 NEW HOPE ROAD. (OHX)
0505,59,4 S OWINGSVILLE,BATH,KY,38.08,-83.76,59 MPH WIND GUST WAS MEASURED AT THE BATH COUNTY KY MESONET SITE. (JKL)
0505,58,KFGX FLEMING-MASON APT,MASON,KY,38.54,-83.74,(ILN)
0505,UNK,AMHERST,LORAIN,OH,41.4,-82.23,SOME TREES DOWN. (CLE)
0507,UNK,2 SW CLAY CITY,POWELL,KY,37.84,-83.95,MOBILE HOME AT 2187 SPOUT SPRINGS ROAD HAD ROOF PARTIALLY TORN OFF PORCH,ANTENNA SNAPPED OFF TOP OF TRAILER,AND PORTABLE BASKETBALL GOAL BLOWN OVER. (JKL)
0510,UNK,ASHLAND,ASHLAND,OH,40.87,-82.32,MANY TREES AND LARGE LIMBS DOWN ACROSS THE COUNTY. (CLE)
0515,UNK,NORWALK,HURON,OH,41.24,-82.61,SEVERAL TREES REPORTED DOWN BLOCKING ROADWAYS. HALF OF CITY ESTIMATED WITHOUT POWER. (CLE)
0516,UNK,4 S BREMEN,HOCKING,OH,39.64,-82.43,TREES WERE DOWNED ALONG HIGHWAY 664 DUE TO THUNDERSTORM WINDS. (ILN)
0517,UNK,4 SE LAURELVILLE,HOCKING,OH,39.44,-82.68,TWO TREES WERE DOWNED NEAR BIG PINE ROAD AND STATE ROUTE 56 DUE TO THUDNERSTORM WINDS. (ILN)
0520,UNK,SCIENCE HILL,PULASKI,KY,37.18,-84.64,TREE ACROSS ROAD AT JUNCTION OF HWY 70 AND HWY 635. (JKL)
0525,UNK,8 N MONTEREY,OVERTON,TN,36.25,-85.26,A FEW TREES WERE DOWNED IN HILHAM. (OHX)
0525,UNK,4 ESE STANTON,POWELL,KY,37.82,-83.79,POWER FLASHES AND POWER OUTAGES NEAR THE STANTON AREA. (JKL)
0525,UNK,4 ESE WAVERLY,PIKE,OH,39.1,-82.92,A FEW TREES WERE DOWNED IN THE AREA DUE TO THUNDERSTORM WINDS. ONE OF THE TREES FELL ON MEADOW RUN ROAD. TIME CORRECTED. (ILN)
0525,UNK,6 SW GLENMONT,HOLMES,OH,40.46,-82.17,A BIG TREE DOWN ACROSS US 62 IN RICHLAND TOWNSHIP. (CLE)
0525,UNK,CONGRESS,WAYNE,OH,40.93,-82.06,ONE TREE DOWN. (CLE)
0527,UNK,5 SW NEWARK,LICKING,OH,40,-82.47,6-INCH DIAMTER LIMBS BROKEN. 10X10 STEEL BUILDING LIFTED FROM PLATFORM AND DEMOLISHED. (ILN)
0528,UNK,LUCASVILLE,SCIOTO,OH,38.88,-83,TWO LARGE TREE LIMBS DOWN (ILN)
0530,UNK,WISEMANTOWN,ESTILL,KY,37.68,-84.01,TREE ACROSS ROAD. (JKL)
0530,UNK,RICHMOND,MADISON,KY,37.74,-84.29,WACO FIRE DEPT REPORTED TREES DOWN ON GOGGINS LANE... REDHOUSE RD BLOCKING THE ROADWAY... TATES CREEK RD... FOUR MILE RD AT RUNYON GROVE RD... AND SUMMIT STREET BLOCKIN (LMK)
0530,UNK,MARIBA,MENIFEE,KY,37.91,-83.58,TWO TREES ACROSS ROADWAY. (JKL)
0530,UNK,MOREHEAD,ROWAN,KY,38.19,-83.44,POWER OUT ACROSS MOREHEAD. WIND GUSTS ESTIMATED ABOVE 50MPH. (JKL)
0530,65,NEW LEXINGTON,PERRY,OH,39.71,-82.21,MEASURED AT NEW LEXINGTON SCHOOL (RLX)
0530,UNK,NEW LEXINGTON,PERRY,OH,39.71,-82.21,TREES DOWN ALONG ROUTE 165 (RLX)
0530,UNK,CAMBRIDGE,GUERNSEY,OH,40.02,-81.59,TREES DOWN NEAR CAMBRIDGE ALONG OLD 21 (PBZ)
0530,UNK,TUSCARAWAS,TUSCARAWAS,OH,40.4,-81.4,TREES DOWN (PBZ)
0530,UNK,RITTMAN,WAYNE,OH,40.97,-81.78,ONE TREE DOWN. (CLE)
0530,UNK,MEDINA,MEDINA,OH,41.14,-81.87,A FEW TREES DOWN ACROSS THE COUNTY. (CLE)
0538,UNK,2 W WARNOCK,GREENUP,KY,38.49,-83.01,EIGHT TREES DOWN ALONG RIDGE. (RLX)
0540,UNK,MOUNT VICTORY,PULASKI,KY,37.03,-84.39,TREE ACROSS ROAD ON HWY 192. (JKL)
0540,UNK,RED RIVER GORGE,WOLFE,KY,37.82,-83.62,THREE TREES ACROSS ROAD AT GLADIE. ONE TREE WAS COMPLETELY BLOCKING ROAD,THE OTHER TWO WERE ONLY BLOCKING ONE LANE. (JKL)
0540,UNK,5 E COSHOCTON,COSHOCTON,OH,40.26,-81.75,TREES EAST OF COSHOCTON (PBZ)
0540,UNK,CARROLLTON,CARROLL,OH,40.58,-81.09,REPORTS OF LARGE TREE BRANCHES DOWN (PBZ)
0543,UNK,GREENUP,GREENUP,KY,38.57,-82.83,TREES DOWN AROUND COUNTY. TIME ESTIMATED BY RADAR. (RLX)
0543,UNK,HAMDEN,VINTON,OH,39.16,-82.53,TREES AND POWER LINES DOWN. ALSO A FEW TREES DOWN IN THE MCARTHUR AREA. (RLX)
0545,UNK,LIVINGSTON,OVERTON,TN,36.39,-85.33,A FEW TREES WERE DOWNED IN LIVINGSTON. (OHX)
0548,58,COOKEVILLE,PUTNAM,TN,36.16,-85.51,(OHX)
0548,UNK,RENDVILLE,PERRY,OH,39.62,-82.09,TREES DOWN ON RT 70. TIME ESTIMATED BY RADAR (RLX)
0555,UNK,MCKEE,JACKSON,KY,37.43,-84,TREE ACROSS ROAD ON HWY 290. (JKL)
0555,UNK,ROGERS,WOLFE,KY,37.74,-83.64,TREE DOWN ON KY 715. (JKL)
0600,UNK,4 E SANDY HOOK,ELLIOTT,KY,38.08,-83.05,MULTIPLE TREES DOWN ON HWY 706 BETWEEN MILE MARKERS 5 AND 10. (JKL)
0600,60,CANNONSBURG,BOYD,KY,38.39,-82.7,POWER OUT (RLX)
0600,UNK,MORELAND HILLS,CUYAHOGA,OH,41.44,-81.43,SOME TREES AND POWERLINES DOWN IN AND NEAR THE AREA. (CLE)
0604,UNK,5 E ZANESVILLE,MUSKINGUM,OH,39.95,-81.92,TREES DOWN NEAR ZANE GREY RD (PBZ)
0605,UNK,SCOVILLE,OWSLEY,KY,37.45,-83.72,THREE TREES ON HWY 11 SCATTERED BETWEEN SCOVILLE TO ALLEN CREEK. (JKL)
0605,UNK,PROCTOR,LEE,KY,37.57,-83.71,MULTIPLE TREES AND LARGE LIMBS ON ROAD. (JKL)
0610,UNK,8 ESE WHITLEY CITY,MCCREARY,KY,36.68,-84.34,TREE ACROSS ROAD ON HWY 92 AT TWO SEPERATE LOCATIONS,HOLLY HILL AND WOLF RIDGE. (JKL)
0610,UNK,3 E BUNCH,LAUREL,KY,37.1,-84.18,TREE ACROSS ROAD AT SINKING CREEK ON HWY 1535. (JKL)
0610,UNK,MCCONNELSVILLE,MORGAN,OH,39.65,-81.84,TREES DOWN ON RT 676 AND RT 78. TIME ESTIMATED BY RADAR. (RLX)
0610,UNK,PAINESVILLE,LAKE,OH,41.73,-81.25,A FEW TREES AND LARGE LIMBS DOWN ACROSS THE EASTERN HALF OF LAKE COUNTY. (CLE)
0612,UNK,2 WSW CHESAPEAKE,LAWRENCE,OH,38.42,-82.48,TREE DOWN INTO POWERLINE WHICH SNAPPED POWER POLE. (RLX)
0614,62,1 S CEREDO,WAYNE,WV,38.38,-82.55,(RLX)
0615,UNK,EGYPT,JACKSON,KY,37.31,-83.9,LARGE LIMBS AND DEBRIS HAD TO BE REMOVED FROM HWY 3630 IN THE COMMUNITES OF ANNVILLE,TYNER AND EGYPT. ALSO LARGE TREE WAS BLOCKING THE ROAD AT ANNVILLE. (JKL)
0615,70,ASHLAND,BOYD,KY,38.46,-82.64,(RLX)
0616,63,2 SSW HAZEL GREEN,WOLFE,KY,37.77,-83.43,(JKL)
0619,UNK,3 ENE SENECAVILLE,GUERNSEY,OH,39.94,-81.41,SEVERAL LARGE TREES DOWN (PBZ)
0620,UNK,1 SE ATHOL,BREATHITT,KY,37.54,-83.56,TREE DOWN AT RAILROAD UNDERPASS BLOCKING ROAD. (JKL)
0620,UNK,SALYERSVILLE,MAGOFFIN,KY,37.75,-83.06,SALYERSVILLE FIRE DEPARTMENT WORKING DOWNED POWER LINES DOWNTOWN (JKL)
0625,70,HUNTINGTON,CABELL,WV,38.41,-82.43,SPOTTER AT MARSHALL UNIV CAMPUS ESTIMATES 65-70MPH WIND GUSTS. ALSO REPORTS POWER LINES AND MANY LARGE BRANCHES DOWN. (RLX)
0625,UNK,HUNTINGTON,CABELL,WV,38.41,-82.43,PUBLIC REPORTS LARGE TREE DOWN IN THE ROAD AT MCCOY... NEAR CROSS STREET MORROW ST...NEAR HUNTINGTON ART MUSEUM. EVENT TIME IS A RADAR ESTIMATE. (RLX)
0630,UNK,ISLAND CITY,OWSLEY,KY,37.37,-83.77,TREE ACROSS ROAD ON KY 1503. (JKL)
0630,UNK,LEROSE,OWSLEY,KY,37.48,-83.62,TREE ACROSS ROAD ON HWY 30. (JKL)
0630,UNK,HELECHAWA,WOLFE,KY,37.77,-83.34,CLUSTER OF TREES DOWN 1 MILE INTO WOLFE COUNTY ALONG THE WOLFE/MORGAN COUNTY LINE. THIS CLUSTER OF TREES HAS FALLEN ONTO A POWER POLE,CAUSING A TRANSFORMER TO BLOW,AN (JKL)
0630,UNK,LAVALETTE,WAYNE,WV,38.32,-82.45,TREES DOWN ON POWERLINES ALONG RT 152 FROM WAYNE-CABELL COUNTY LINE TO THE TOWN OF WAYNE. OTHER TREES REPORTED DOWN THROUGHOUT COUNTY. (RLX)
0630,UNK,LITTLE HOCKING,WASHINGTON,OH,39.26,-81.7,TREES DOWN. (RLX)
0635,UNK,CALDWELL,NOBLE,OH,39.75,-81.51,TREES DOWN NEAR LINCOLN HIGHWAY NEAR RENROCK (PBZ)
0638,61,1 E BALDWIN,ALLEGHENY,PA,40.36,-79.94,(PBZ)
0640,UNK,CADIZ,HARRISON,OH,40.27,-80.99,NUMEROUS TREES REPORTED DOWN IN CADIZ (PBZ)
0643,61,3 SSE WILLIAMSTOWN,WOOD,WV,39.36,-81.43,(RLX)
0645,UNK,BEAR BRANCH,LESLIE,KY,37.16,-83.55,TREE ACROSS ROAD ON NORTH 66. (JKL)
0645,UNK,1 W BEAR BRANCH,CLAY,KY,37.16,-83.57,TREE ACROSS ROAD ON NORTH 66. (JKL)
0650,65,SW ELEANOR,PUTNAM,WV,38.54,-81.93,(RLX)
0655,UNK,ST. CLAIRSVILLE,BELMONT,OH,40.08,-80.9,TREES DOWN (PBZ)
0655,UNK,GLASGOW,COLUMBIANA,OH,40.66,-80.69,TREES DOWN ACROSS THE SOUTHERN HALF OF COLUMBIANA COUNTY (PBZ)
0658,UNK,MOUNDSVILLE,MARSHALL,WV,39.92,-80.74,TREES DOWN (PBZ)
0700,UNK,HADDIX,BREATHITT,KY,37.49,-83.35,ENTIRE ROAD,KY 1110,WAS BLOCKED BY MULTIPLE TREES AND LARGE LIMBS. (JKL)
0700,UNK,PARKVIEW,OHIO,WV,40.05,-80.66,4 FOOT DIAMETER TREE FELL ON PARKED CAR (PBZ)
0700,UNK,OHIOVILLE,BEAVER,PA,40.68,-80.48,MULTIPLE REPORTS OF TREES DOWN (PBZ)
0705,UNK,PLEASANT HILL,JEFFERSON,OH,40.42,-80.66,TREES DOWN (PBZ)
0710,UNK,CANONSBURG,WASHINGTON,PA,40.26,-80.19,TREES DOWN AND CONSTRUCTION SIGNS BLOWN OVER (PBZ)
0718,UNK,CHARLESTON,KANAWHA,WV,38.35,-81.63,TREES AND POWERLINES DOWN AROUND CITY. WINDS ESTIMATED 50-55 MPH. (RLX)
0718,UNK,DENVER HEIGHTS,MARSHALL,WV,39.73,-80.54,LARGE BRANCHES DOWN (PBZ)
0728,UNK,IRVINE,ESTILL,KY,37.7,-83.97,REPORTS OF TREES DOWN COUNTY WIDE IN ESTILL COUNTY,AS WELL AS SEVERAL HUNDRED PEOPLE WITHOUT POWER. NO EXACT TIMES ON WHEN ALL OCCURANCES OF DAMAGE OCCURRED. (JKL)
0729,UNK,DORMONT,ALLEGHENY,PA,40.39,-80.03,TREES AND POWER LINES DOWN (PBZ)
0735,UNK,MOUSIE,KNOTT,KY,37.42,-82.88,TWO TREES DOWN ON KY 550. (JKL)
0735,UNK,WAYNESBURG,GREENE,PA,39.9,-80.19,TREES DOWN COUNTYWIDE (PBZ)
0738,61,1 E BALDWIN,ALLEGHENY,PA,40.36,-79.94,(PBZ)
0740,UNK,REGENCY PARK,ALLEGHENY,PA,40.48,-79.77,LARGE TRAMPOLINE STUCK ON ROOF OF HOUSE (PBZ)
0745,UNK,COLFAX,MARION,WV,39.43,-80.13,MULTIPLE TREES DOWN (PBZ)
0746,67,MUNICIPALITY OF MONROEV,ALLEGHENY,PA,40.43,-79.75,AWS SITE AT GATEWAY HIGH SCHOOL (PBZ)
0747,UNK,STOCKDALE,WASHINGTON,PA,40.08,-79.85,NUMEROUS TREES AND POWERLINES DOWN (PBZ)
0750,UNK,ARNETTSVILLE,MONONGALIA,WV,39.58,-80.09,TREES DOWN IN ROAD AT ARNETTSVILLE CEMETERY (PBZ)
0750,UNK,MASONTOWN,FAYETTE,PA,39.85,-79.91,LARGE TREES DOWN (PBZ)
0754,70,3 SSW LOST CREEK,HARRISON,WV,39.12,-80.37,(RLX)
0754,66,1 E BRIDGEPORT,HARRISON,WV,39.29,-80.23,(RLX)
0800,UNK,3 SE FAIRMONT,FAYETTE,PA,39.91,-79.41,FAST FOOD RESTAURANT SIGNS BLOWN DOWN (PBZ)
0805,62,1 ENE CONNELLSVILLE,FAYETTE,PA,40.02,-79.57,AWS SITE AT CONNELLSVILLE CAREER TECH (PBZ)
0810,UNK,LATROBE,WESTMORELAND,PA,40.31,-79.38,TREES DOWN COUNTYWIDE (PBZ)
0815,UNK,NESTORVILLE,BARBOUR,WV,39.18,-79.92,TREES AND POWERLINES DOWN. OTHER TREES DOWN IN PHILLIPPI AND BELINGTON. (RLX)
0826,67,4 W THOMAS,TUCKER,WV,39.15,-79.57,GUST TO 67 MPH REPORTED BY OBSERVATION SITE ALONG SR 219 4 MILES E. OF THOMAS IN TUCKER COUNTY. (PBZ)
0840,UNK,DUBOIS,CLEARFIELD,PA,41.12,-78.76,TREES AND WIRES DOWN (CTP)
0845,UNK,JOHNSTOWN,CAMBRIA,PA,40.33,-78.92,15 TREES DOWN (CTP)
0850,UNK,SOMERSET,SOMERSET,PA,40.01,-79.08,8 TREES DOWN ON HUSBAND ROAD. NUMEROUS ADDITIONAL TREES AND WIRES DOWN ACROSS COUNTY. (CTP)
0850,UNK,IRVONA,CLEARFIELD,PA,40.77,-78.55,TREES AND WIRES DOWN (CTP)
0900,UNK,1 ENE MIDLAND,ALLEGANY,MD,39.6,-78.93,TREE DOWN NEAR MD RT 36 AND FLINT RD. NORTHBOUND MD RT 36 WAS BLOCKED (LWX)
0905,UNK,BEDFORD,BEDFORD,PA,40.01,-78.5,TREES AND WIRES DOWN. TWO BLOCKED ROADWAYS AND PINE TREES BLOW INTO THE SIDE OF A HOUSE. (CTP)
0905,UNK,3 N PHILIPSBURG,CLEARFIELD,PA,40.94,-78.21,TREES DOWN (CTP)
0910,UNK,ALTOONA,BLAIR,PA,40.51,-78.4,TREES AND WIRE DOWN IN ALTOONA AND NEWRY (CTP)
0915,UNK,HUNTINGDON,HUNTINGDON,PA,40.5,-78.01,TREES DOWN AROUND HUNTINGDON (CTP)
0930,UNK,2 SE ROMNEY,HAMPSHIRE,WV,39.32,-78.73,POWERLINES DOWN THAT STARTED A BRUSH FIRE ON GRASSY LICK ROAD (LWX)
0930,UNK,MOUNT UNION,HUNTINGDON,PA,40.38,-77.88,TREES AND WIRES DOWN AROUND MOUNT UNION (CTP)
0930,UNK,WHIPPLE DAM STATE PARK,HUNTINGDON,PA,40.69,-77.84,TREES AND WIRES DOWN (CTP)
0930,UNK,SPRING MILLS,CENTRE,PA,40.85,-77.57,TREES DOWN (CTP)
0933,UNK,KEATING,CLINTON,PA,41.26,-77.92,TREES DOWN (CTP)
0943,UNK,HAMDEN,VINTON,OH,39.16,-82.53,TREES AND POWER LINES DOWN. ALSO A FEW TREES DOWN IN THE MCARTHUR AREA. (RLX)
0945,UNK,2 NW SMITH CROSSROADS,MORGAN,WV,39.59,-78.25,TREE DOWN ON 700 BLOCK OF VALLEY ROAD (LWX)
0945,UNK,2 S NEEDMORE,FULTON,PA,39.83,-78.15,TREES AND WIRES DOWN IN THOMPSON TOWNSHIP... SPORADIC DAMAGE ELSEWHERE AROUND COUNTY. (CTP)
0955,UNK,LOGANTON,CLINTON,PA,41.03,-77.3,4 TREES DOWN (CTP)
1000,UNK,MIFFLIN,JUNIATA,PA,40.57,-77.4,SEVERAL TREES DOWN AROUND MIFFLIN AND MIFFLINTOWN (CTP)
1000,UNK,WELLSBORO,TIOGA,PA,41.75,-77.3,TREES DOWN AROUND WELLSBORO (CTP)
1045,UNK,SHAMOKIN,NORTHUMBERLAND,PA,40.79,-76.55,NUMEROUS REPORTS OF TREES AND WIRES DOWN AROUND SHAMOKIN (CTP)
1045,UNK,CATAWISSA,COLUMBIA,PA,40.95,-76.46,TREES DOWN IN CATAWISSA AND BENTON (CTP)
1100,UNK,3 E GETTYSBURG,ADAMS,PA,39.83,-77.18,TREES DOWN (CTP)
1130,UNK,POTTSVILLE,SCHUYLKILL,PA,40.68,-76.21,TREES AND WIRES DOWN AROUND POTTSVILLE AND FRACKVILLE (CTP)
1145,UNK,ELDERSBURG,CARROLL,MD,39.41,-76.95,TREE DOWN AT LIBERTY HIGH SCHOOL BARTHOLOW ROAD (LWX)
1145,UNK,JIM THORPE,CARBON,PA,40.87,-75.74,NUMEROUS REPORTS OF TREES AND POWER LINES ACROSS THE COUNTY. (PHI)
Time,Size,Location,County,State,Lat,Lon,Comments
