Time,F_Scale,Location,County,State,Lat,Lon,Comments
1917,UNK,1 WSW PARAMUS,BERGEN,NJ,40.94,-74.09,DOZENS OF TREES UPROOTED AND SNAPPED FROM ALPINE RD THROUGH GEORGE WASHINGTON MEMORIAL CEMETERY TO THE PARAMUS GOLF AND RIDGEWOOD COUNTRY CLUBS. DAMAGE CONSISTENT WITH (OKX)
Time,Speed,Location,County,State,Lat,Lon,Comments
1220,UNK,2 SSW WINCHESTER,CITY OF WINCHESTE,VA,39.15,-78.19,SEVERAL TREES DOWN ON VALLEY AVE NEAR TREETOPS LN (LWX)
1225,UNK,2 E WINCHESTER,FREDERICK,VA,39.17,-78.14,LARGE TREE DOWN ON SENSENY RD NEAR WINCHESTER COUNTRY CLUB (LWX)
1323,UNK,CALEDONIA PARK,FRANKLIN,PA,39.91,-77.48,LARGE TREES DOWN ACROSS RTE 30 (CTP)
1409,UNK,4 SSW NEWCOMB HALL,ALBEMARLE,VA,37.98,-78.55,TREE DOWN ON OLD LYNCHBURG ROAD JUST NORTH OF DUDLEY MOUNTAIN ROAD. (LWX)
1515,UNK,3 E BLOOMSBURG,COLUMBIA,PA,41,-76.4,TREES DOWN IN MAIN AND NORTH CENTRE TOWNSHIPS (CTP)
1523,UNK,BELMONT,SPOTSYLVANIA,VA,38.15,-77.86,TREE DOWN ON STUBBS BRIDGE ROAD NEAR BELMONT (LWX)
1542,UNK,2 NNE MASSAPONAX,SPOTSYLVANIA,VA,38.22,-77.49,HVAC UNIT DAMAGED ON FLAT THREE STORY MEDICAL CENTER ROOF DUE TO STRONG WIND. (LWX)
1550,UNK,UPPER BERN TWP,BERKS,PA,40.51,-76.1,SEVERAL TREES DOWN IN THE WESTERN PART OF THE COUINTY. (PHI)
1603,UNK,DIMOCK,SUSQUEHANNA,PA,41.75,-75.9,MULTIPLE TREES DOWN (BGM)
1615,UNK,READING,BERKS,PA,40.33,-75.93,TREES DOWN (PHI)
1616,UNK,3 SE NEW MILFORD,SUSQUEHANNA,PA,41.85,-75.69,WIRES REPORTED DOWN ON STUMP POND ROAD. (BGM)
1640,UNK,1 SSE AFTON,CHENANGO,NY,42.22,-75.52,TREE DOWN IN AFTON. (BGM)
1645,UNK,SIDNEY,DELAWARE,NY,42.31,-75.4,NUMEROUS TREES AND WIRED DOWN IN THE VILLAGE. (BGM)
1650,UNK,UNADILLA,OTSEGO,NY,42.33,-75.32,TREES DOWN ON STATE RT. 7 NEAR UNADILLA (BGM)
1705,UNK,GILBERTSVILLE,OTSEGO,NY,42.47,-75.32,TREE DOWN (BGM)
1708,UNK,EARL TWP,BERKS,PA,40.35,-75.71,TREES DOWN. (PHI)
1710,UNK,NORTHEAST HEIGHTS,CECIL,MD,39.57,-75.95,DAMAGE TO CROPS (PHI)
1710,UNK,LOWER NAZARETH TWP,NORTHAMPTON,PA,40.7,-75.33,WIRES DOWN (PHI)
1712,UNK,ONEONTA,OTSEGO,NY,42.45,-75.07,WIRE DOWN (BGM)
1730,UNK,EAST ALLEN TWP,NORTHAMPTON,PA,40.71,-75.42,TREE DOWN. (PHI)
1730,UNK,2 E MILFORD,OTSEGO,NY,42.59,-74.91,TREE DOWN (BGM)
1740,UNK,NORTH BRANCH,SULLIVAN,NY,41.8,-75,TREE DOWN (BGM)
1753,UNK,STRATFORD,FULTON,NY,43.18,-74.69,TREES AND WIRES DOWN ROUTE 29A TIME ESTIMATED BY RADAR (ALY)
1815,UNK,SOLEBURY TWP,BUCKS,PA,40.37,-75.01,TREES DOWN (PHI)
1815,UNK,GRAHAMSVILLE,SULLIVAN,NY,41.85,-74.57,TREE DOWN (BGM)
1815,UNK,5 SE JEFFERSON,SCHOHARIE,NY,42.43,-74.54,TREES AND WIRES DOWN. TIME ESTIMATED BY RADAR. (ALY)
1840,UNK,BERNARDS TWP,SOMERSET,NJ,40.68,-74.58,TREES AND WIRES DOWN (PHI)
1845,UNK,1 NNE JOHNSBURG,WARREN,NY,43.63,-73.96,TREES AND POWER LINES DOWN IN ROADWAY AT STATE ROIUTE 8 AND WASHER HILL ROAD (ALY)
1850,UNK,CHATHAM,MORRIS,NJ,40.74,-74.38,TREES DOWN IN CHATHAM BOROUGH. (PHI)
1850,UNK,BALLSTON LAKE,SARATOGA,NY,42.91,-73.87,TREES DOWN (ALY)
1852,UNK,STONE RIDGE,ULSTER,NY,41.85,-74.14,TREE AND WIRES DOWN (ALY)
1855,UNK,WOODSTOCK,ULSTER,NY,42.04,-74.11,TREE INTO HOUSE ON PINE GROVE STREET (ALY)
1901,UNK,2 SE LAWNDALE,CLEVELAND,NC,35.4,-81.54,LARGE TREE DOWN ON POWER LINE ALONG BALL PARK ROAD. (GSP)
1905,UNK,SARATOGA SPRINGS,SARATOGA,NY,43.07,-73.78,TREE DOWN ON UNION AVENUE (ALY)
1906,60,WESTFIELD,UNION,NJ,40.65,-74.34,5 FT LONG MEDIUM BRANCHES DOWN (OKX)
1907,UNK,TIVOLI,DUTCHESS,NY,42.06,-73.91,TREES DOWN (ALY)
1911,UNK,1 NNW WAYNE,PASSAIC,NJ,40.96,-74.25,TREE DOWN BLOCKING ONE LANE AT SQUAD PLACE (OKX)
1911,UNK,1 SE DARLINGTON,BERGEN,NJ,41.07,-74.17,LARGE COMMERCIAL SIGN BLOWN DOWN IN VICINITY OF MCARTHUR BLVD IN TOWN OF MAHWAH. (OKX)
1913,UNK,ELMWOOD PARK,BERGEN,NJ,40.91,-74.13,MULTIPLE TREES DOWN ON RIVER DR. (OKX)
1915,UNK,BETHLEHEM,LITCHFIELD,CT,41.64,-73.21,TREES AND WIRES DOWN. POLE SNAPPED. (ALY)
1915,UNK,GLENMONT,ALBANY,NY,42.6,-73.77,TREE ON HOUSE ON HARTMAN ROAD (ALY)
1915,UNK,1 ENE GLENS FALLS,WARREN,NY,43.31,-73.63,TREE AND LIMBS DOWN ON HOUSE ON KATHERINE STREET (ALY)
1915,UNK,WARRENSBURG,WARREN,NY,43.5,-73.78,TREES AND POWER LINES DOWN (ALY)
1920,60,1 SSW WARREN POINT,BERGEN,NJ,40.92,-74.11,TREES DOWN ALONG BERKSHIRE RD AND MIDLAND AVE MAKING THEM IMPASSABLE IN TOWNSHIP OF FAIRLAWN. (OKX)
1920,UNK,LIVINGSTON,COLUMBIA,NY,42.14,-73.76,SMALL TREES SHEARED OFF (ALY)
1920,60,HAMPTON MANOR,RENSSELAER,NY,42.62,-73.73,(ALY)
1925,UNK,EAST GREENBUSH,RENSSELAER,NY,42.59,-73.7,TREE DOWN ON PHILLIPS RD AND TREE DOWN ON POINT VIEW DRIVE (ALY)
1927,UNK,STUYVESANT,COLUMBIA,NY,42.39,-73.78,TREES AND WIRES DOWN ON SHARPTOWN RD. (ALY)
1928,UNK,FORT MONTGOMERY,ORANGE,NY,41.34,-73.99,ROAD CLOSURE N S AREA OF CORBIN HILL RD T HIGHLANDS DUE TO DOWNED TREE AND WIRES. (OKX)
1930,UNK,1 NW CRESSKILL,BERGEN,NJ,40.95,-73.97,TREE FELL ON TOP OF HOME ON JEFFERSON AVE. (OKX)
1930,UNK,COXSACKIE,GREENE,NY,42.36,-73.81,LARGE TREE LIMBS DOWN (ALY)
1941,UNK,CANAAN,COLUMBIA,NY,42.41,-73.45,TREES AND WIRES DOWN SEVERAL LOCATIONS. (ALY)
1944,UNK,PUTNAM VALLEY,PUTNAM,NY,41.34,-73.87,TREE DOWN BLOCKING PART OF OSCAWANA LAKE ROAD. (OKX)
1955,UNK,STOCKBRIDGE,BERKSHIRE,MA,42.29,-73.32,TREE ON CAR. PERSON IN CAR. (ALY)
2000,UNK,2 S CROSS RIVER,WESTCHESTER,NY,41.24,-73.62,TREE DOWN BLOCKING OLD POST ROAD SOUTH OF CROSS RIVER RESERVOIR IN KATONAH. (OKX)
2000,UNK,1 N STEARNSVILLE,BERKSHIRE,MA,42.46,-73.3,TREE AND LARGE LIMBS DOWN AT CHURCHILL STREET AND WEST STREET (ALY)
2010,UNK,CUMMINGTON,HAMPSHIRE,MA,42.47,-72.9,TREE DOWN ON WIRES ON WEST CUMMINGTON ROAD (BOX)
2026,UNK,EASTHAMPTON,HAMPSHIRE,MA,42.27,-72.68,TREE AND WIRES DOWN ON HOLYOKE ROAD (BOX)
2026,UNK,LEYDEN,FRANKLIN,MA,42.7,-72.62,TREE AND WIRES DOWN ON GREENFIELD ROAD (BOX)
2031,UNK,WARE,HAMPSHIRE,MA,42.25,-72.25,WIRES DOWN ON CAR ON CHURCH STREET (BOX)
2038,UNK,SIMSBURY,HARTFORD,CT,41.88,-72.81,POWERLINES DOWN ON WEST MOUNTAIN ROAD (BOX)
2045,UNK,1 SSW BRIDGEPORT,FAIRFIELD,CT,41.18,-73.21,A LARGE TREE WAS DOWN ON A PICKUP TRUCK ON SHERWOOD AVE NEAR THE JAMES J CURIALE SCHOOL (OKX)
2045,UNK,NEWFANE,WINDHAM,VT,42.99,-72.66,NUMEROUS TREES AND WIRES DOWN. (ALY)
2048,UNK,SHELBURNE,FRANKLIN,MA,42.58,-72.68,TREE AND WIRES DOWN ON ROUTE 2 AT THE BELCHERTOWN LINE (BOX)
2054,UNK,1 ENE ROSLYN HARBOR,NASSAU,NY,40.82,-73.63,1.5 TO 2 INCH DIAMETER TREE DOWN BLOCKING ROAD AT GLEN COVE RD AND SIMONSON RD. (OKX)
2055,UNK,SHELTON,FAIRFIELD,CT,41.32,-73.1,TREES DOWN. APPROXIMATELY 1500 PEOPLE WITHOUT POWER. (OKX)
2055,UNK,CLAREMONT,SULLIVAN,NH,43.38,-72.35,NUMEROUS TREES AND WIRES DOWN ACROSS CLAREMONT (GYX)
2100,UNK,BELCHERTOWN,HAMPSHIRE,MA,42.27,-72.4,TREE AND WIRES DOWN ON GOLF AND NORTH STREET (BOX)
2101,UNK,HINSDALE,CHESHIRE,NH,42.79,-72.49,TREE AND WIRES DOWN ON TOWER HILL ROAD (BOX)
2104,UNK,WALPOLE,CHESHIRE,NH,43.08,-72.43,TREE AND WIRES DOWN ON UPPER WALPOLE ROAD (BOX)
2105,UNK,KEENE,CHESHIRE,NH,42.95,-72.3,TREE AND WIRES DOWN ON PARK AVE AS WELLAS MARSHALL STREET AND GRIMES ROAD (BOX)
2120,UNK,CONWAY,FRANKLIN,MA,42.52,-72.68,TRANSFORMER AND WIRES DOWN ON ROARING BROOK ROAD (BOX)
2120,UNK,GRANTHAM,SULLIVAN,NH,43.49,-72.14,TREE DOWN (GYX)
2129,UNK,6 SSW SANTOS,MARION,FL,29.04,-82.15,EM REPORTED MULTIPLE TREES DOWN...POWERLINES DOWN...AND DAMAGE TO THE ROOF OF A BARN. (JAX)
2130,UNK,WINCHESTER,CHESHIRE,NH,42.78,-72.38,TREE AND WIRES DOWN ON HEADLOND ROAD AND KENNEDY BROOK ROAD (BOX)
2130,UNK,SULLIVAN,CHESHIRE,NH,43.02,-72.22,TREE AND WIRES DOWN ON OLD CONCORD ROAD (BOX)
2130,UNK,1 SSE HENNIKER,MERRIMACK,NH,43.17,-71.82,TWO 6 INCH DIAMETER TREE LIMBS DOWN. DELAYED REPORT...TIME ESTIMATED FROM RADAR. (GYX)
2140,UNK,ANTRIM,HILLSBOROUGH,NH,43.03,-71.95,TREE AND WIRES DOWN ON ROUTE 9. (BOX)
2145,UNK,LANCASTER,COOS,NH,44.49,-71.57,NUMEROUS TREES AND WIRES DOWN IN LANCASTER (GYX)
2147,UNK,HINSDALE,CHESHIRE,NH,42.79,-72.49,TREE AND WIRES DOWN ON ROUTE 119 EASTBOUND. (BOX)
2148,UNK,2 W DURHAM,MIDDLESEX,CT,41.47,-72.71,RT 68 AT PENT RD HAD WIRES FALL DOWN. (OKX)
2150,UNK,WHITEFIELD,LINCOLN,ME,44.17,-69.63,NUMEROUS TREES AND WIRES DOWN ACROSS WHITEFIELD...ASOS HAS ALSO LOST POWER (GYX)
2155,UNK,STODDARD,CHESHIRE,NH,43.08,-72.1,TREE AND WIRES DOWN ON TIGOLA TRAIL. (BOX)
2155,UNK,1 NE LITTLETON,GRAFTON,NH,44.32,-71.76,TREE LIMBS AND POWER LINES DOWN ON MANNS HILL IN LITTLETON. (GYX)
2200,UNK,ATHOL,WORCESTER,MA,42.59,-72.23,2 TREES DOWN AT THE INTERSECTION OF CHESTNUT AND HILL AVENUE. (BOX)
2200,UNK,HANCOCK,HILLSBOROUGH,NH,42.97,-71.98,TREE AND WIRES DOWN ON DUNCAN ROAD. (BOX)
2203,UNK,EAST HAMPTON,MIDDLESEX,CT,41.57,-72.5,BRANCHES AND WIRES WERE REPORTED DOWN IN EAST HAMPTON. (OKX)
2220,UNK,TUFTONBORO,CARROLL,NH,43.7,-71.22,TREES AND WIRES DOWN ON FEDERAL CORNER ROAD (GYX)
2300,UNK,CORNISH,YORK,ME,43.8,-70.8,TREE FELL ACROSS DRIVEWAY AND PULLED WIRES OFF THE HOUSE (GYX)
2300,UNK,ANDOVER,OXFORD,ME,44.64,-70.75,EAST ANDOVER ROAD BLOCKED BY DOWNED TREES (GYX)
2300,UNK,RANGELEY,FRANKLIN,ME,44.97,-70.64,NUMEROUS TREES AND POWER LINES DOWN (GYX)
2310,UNK,NEW DURHAM,STRAFFORD,NH,43.44,-71.17,3 TREES FELL ACROSS HAM ROAD (GYX)
2310,UNK,BRIDGTON,CUMBERLAND,ME,44.05,-70.71,TREES DOWN ON POWER LINES (GYX)
2315,UNK,HEBRON,OXFORD,ME,44.2,-70.41,TREE PARTIALLY BLOCKING RTE 119 ON THE HEBRON MINOT LINE (GYX)
2327,UNK,FARMINGTON,STRAFFORD,NH,43.39,-71.07,TREE ACROSS CHESTNUT HILL ROAD CAUSED A CAR ACCIDENT (GYX)
2330,UNK,ACTON,YORK,ME,43.53,-70.91,TREES DOWN ON POWER LINES. (GYX)
2330,UNK,PARIS,OXFORD,ME,44.26,-70.51,TREES ACROSS BUCKFIELD ROAD (GYX)
2345,UNK,LIMINGTON,YORK,ME,43.73,-70.71,TREES DOWN ON POWERLINES. (GYX)
2350,UNK,NEW PORTLAND,SOMERSET,ME,44.88,-70.1,TREES AND WIRES DOWN IN NEW PORTLAND (GYX)
2357,UNK,WATERBORO,YORK,ME,43.54,-70.72,TREES DOWN ON POWER LINES. (GYX)
0010,UNK,3 SSE POLAND,ANDROSCOGGIN,ME,44.02,-70.37,TREES ON WIRES ON MAINE ST NEAR RANGE POND AND ALSO AT TWO SEPARATE LOCATIONS ON RANGE HILL ROAD (GYX)
0017,UNK,SOUTH BERWICK,YORK,ME,43.23,-70.81,LARGE LIMBS DOWN ON WIRES ON OLD SOUTH RD. (GYX)
0019,UNK,EMBDEN,SOMERSET,ME,44.92,-69.87,TREES AND WIRES DOWN IN EMBDEN (GYX)
0049,UNK,FAIRFIELD,SOMERSET,ME,44.59,-69.6,TREES AND WIRES ACROSS OLD NORRIDGEWOCK ROAD (GYX)
0057,UNK,NEW PORTLAND,SOMERSET,ME,44.88,-70.1,TREES AND WIRES DOWN IN NEW PORTLAND (GYX)
0100,UNK,GREENVILLE,PISCATAQUIS,ME,45.46,-69.59,TREES DOWN IN TOWN. TIME IS ESTIMATED. (CAR)
0113,UNK,DOVER-FOXCROFT,PISCATAQUIS,ME,45.18,-69.23,TREE DOWN ON WIRES (CAR)
0130,UNK,NEWPORT,PENOBSCOT,ME,44.84,-69.27,TREES AND POWER LINES DOWN. (CAR)
0135,UNK,DEXTER,PENOBSCOT,ME,45.02,-69.29,TREE DOWN ON POWER LINES. (CAR)
0135,UNK,MONSON,PISCATAQUIS,ME,45.29,-69.5,TREE DOWN (CAR)
0145,UNK,CHARLESTON,PENOBSCOT,ME,45.08,-69.04,TREES DOWN WITH POWER OUTAGES. (CAR)
0205,UNK,12 NNE PATTEN,AROOSTOOK,ME,46.16,-68.35,TREE DOWN ACROSS ROUTE 11 IN MORO PLANTATION. (CAR)
Time,Size,Location,County,State,Lat,Lon,Comments
