Time,F_Scale,Location,County,State,Lat,Lon,Comments
Time,Speed,Location,County,State,Lat,Lon,Comments
2050,65,1 N DAVIE DOWNTOWN,BROWARD,FL,26.1,-80.23,SKYWARN SPOTTER REPORTED A FUNNEL CLOUD NEAR THE INTERSECTION OF SW 55TH AVENUE AND SW 19TH STREET. VISUAL CONTACT LOST BEFORE SEEING IF TOUCHDOWN OCCURRED. PENNY-SIZED (MFL)
2109,UNK,2 WNW DAVIE,BROWARD,FL,26.11,-80.33,DAVIE POLICE REPORTED VIA SOCIAL MEDIA THAT A DOWNED TREE WAS BLOCKING THE ROADWAY AT THE INTERSECTION OF SHENANDOAH PARKWAY AND APPALACHIAN TRAIL. (MFL)
2135,UNK,2 NE NORTH PERRY AIRPOR,BROWARD,FL,26.02,-80.21,MEMBER OF THE PUBLIC REPORTED PEA-SIZED HAIL AND SMALL TREE BRANCHES DOWN NEAR THE INTERSECTION OF JOHNSON STREET AND THE FLORIDA TURNPIKE IN HOLLYWOOD. (MFL)
Time,Size,Location,County,State,Lat,Lon,Comments
