Time,F_Scale,Location,County,State,Lat,Lon,Comments
Time,Speed,Location,County,State,Lat,Lon,Comments
1215,96,5 S PETROLIA,HUMBOLDT,CA,40.25,-124.28,LINE OF STRONG STORMS MOVED THROUGH THE AREA WITH RADAR INDCIATED WIND SPEEDS OF 70+ KNOTS AT 3500 FEET ABOVE GROUND LEVEL. ONCE THE LINE MADE LANDFALL THE COOSKIE OBSE (EKA)
1250,UNK,11 SSW SEBASTOPOL,MARIN,CA,38.25,-122.91,DILLON BEACH RD AT HWY 1 CLOSED DUE TO LARGE TREE COVERING ROAD (MTR)
1408,UNK,GOLD HILL,JACKSON,OR,42.43,-123.05,WIND PUSHED A TREE INTO A POWER LINE... CAUSING A POLE TO FALL ONTO THE ROOF OF A HOME... CAUSING A HOUSE FIRE ON HWY 234. (MFR)
1410,UNK,PETALUMA,SONOMA,CA,38.24,-122.63,DOWNED POWER LINES CLOSE TO CA-116 AFTER GILCHRIST RD IN PETALUMA. (MTR)
Time,Size,Location,County,State,Lat,Lon,Comments
