Time,F_Scale,Location,County,State,Lat,Lon,Comments
2345,UNK,SW CAPE CORAL,LEE,FL,26.58,-81.99,EMERGENCY MANAGER REPORTED MULTIPLE TREES AND POWER LINES DOWN AS WELL AS STRUCTURAL DAMAGE TO SEVERAL HOMES. LOCATED IN SW CAPE CORAL NEAR THE INTERSECTION OF CHIQUITA (TBW)
Time,Speed,Location,County,State,Lat,Lon,Comments
1845,UNK,3 NE BYHALIA,MARSHALL,MS,34.9,-89.65,POSSIBLE TORNADO.SIGNIFICANT DAMAGE TO MOBILE HOME IN DEER CREEK AREA. (MEG)
2350,UNK,3 W CAPE CORAL,LEE,FL,26.57,-82.04,SPOTTER REPORTS SNAPPED POWER POLES AND SMALL TREES DOWN. (TBW)
0035,68,3 NNW FORT MYERS BEACH,LEE,FL,26.49,-81.96,HOME WEATHER STATION MEASURED 68 MPH WIND GUST. (TBW)
Time,Size,Location,County,State,Lat,Lon,Comments
