Time,F_Scale,Location,County,State,Lat,Lon,Comments
2230,UNK,7 SSW LAKOTA,NELSON,ND,47.95,-98.4,A BRIEF TOUCHDOWN WITH DUST SWIRL WAS NOTED NORTHEAST OF STUMP LAKE. (FGF)
2238,UNK,7 S LAKOTA,NELSON,ND,47.94,-98.35,A TORNADO TRACKED TO THE EASTWARD OVER MAINLY OPENED FIELDS FROM NORTHEAST WAMDUSKA TOWNSHIP INTO NORTHEAST CENTRAL TOWNSHIP. MULTIPLE REPORTS AND PHOTOS SHOWED A PERSI (FGF)
0016,UNK,7 NE COOPERSTOWN,GRIGGS,ND,47.51,-98,THIS TORNADO TRACKED INTERMITTENTLY FOR ABOUT 2 MILES ACROSS A PORTION OF THE SHEYENNE RIVER VALLEY AND ALONG THE STEELE COUNTY LINE TO AROUND 7 WSW OF FINLEY BY 722 PM (FGF)
Time,Speed,Location,County,State,Lat,Lon,Comments
1515,UNK,1 SW YULEE,NASSAU,FL,30.62,-81.59,TREES AND POWER LINES WERE BLOWN DOWN ALONG MINER ROAD NEAR HICKORY VILLAGE. SOME HOMES HAD ROOF DAMAGE. THE TIME OF THE EVENT WAS BASED ON RADAR IMAGERY. (JAX)
1611,UNK,1 W ARCHER,ALACHUA,FL,29.53,-82.53,DOWNED POWER LINES AT 17500 SW ARCHER RD. (JAX)
1810,UNK,1 N OCEANWAY,DUVAL,FL,30.48,-81.63,BROADCAST MEDIA RELAYED PHOTOGRAPHS SHOWING SEVERAL TREES DOWN NEAR THE UF HEALTH CENTER. TIME ESTIMATED FROM RADAR DATA. (JAX)
1820,60,3 NNE OCEANWAY,DUVAL,FL,30.5,-81.62,OFF DUTY NWS EMPLOYEE ESTIMATED WIND GUSTS OF 60 MPH. (JAX)
1827,UNK,2 SSE EDGEMOOR,CHESTER,SC,34.78,-81,A FEW TREES DOWN WITH ONE FALLING ON A POWERLINE WITH TRANSFORMER FAILURE. THIS OCCURRED NEAR LANDO. (GSP)
1835,UNK,ELLERBE,RICHMOND,NC,35.07,-79.76,TREE DOWN IN ELLERBE. TIME ESTIMATED BY RADAR. (RAH)
1850,UNK,12 SSW HEATH SPRINGS,KERSHAW,SC,34.43,-80.78,LAKE WATEREE CAMPGROUND REPORTED TREES DOWN. (CAE)
1850,UNK,4 SSE UPTOWN CHARLOTTE,MECKLENBURG,NC,35.18,-80.8,FIRE DEPT/RESCUE REPORTED POWER LINES DOWN ON WOODLARK LN AND ANDOVER RD. (GSP)
1900,UNK,1 N OCALA,MARION,FL,29.2,-82.13,911 CALL CENTER REPORTED POWER LINES DOWN AT THE INTERSECTION OF NE 9TH STREET AND NE 8TH AVE. TIME ESTIMATED FROM RADAR DATA. (JAX)
1900,UNK,LANDIS,ROWAN,NC,35.55,-80.62,BROADCAST MEDIA REPORTED POWER LINES DOWN ON BEAVER CORRELL AND UPRIGHT STREETS IN LANDIS (GSP)
1910,UNK,4 S GRANTHAM,WAYNE,NC,35.24,-78.18,LARGE LIVE OAK TREE FELL ON A MOBILE HOME AT 512 CROWS FOOT ROAD AND GRANTHAM SCHOOL ROAD. (RAH)
1910,UNK,1 ESE SEVEN LAKES,MOORE,NC,35.26,-79.57,TREE DOWN ON CARTHAGE ROAD. (RAH)
1921,UNK,4 SW ST. AUGUSTINE BEAC,ST. JOHNS,FL,29.79,-81.31,DOWNED POWER LINE REPORTED AT CACIQUE DR. (JAX)
1940,UNK,MCBEE,CHESTERFIELD,SC,34.47,-80.26,TREES DOWN HIGHWAY 1 NEAR MCBEE. (CAE)
1945,UNK,RAMSEUR,RANDOLPH,NC,35.73,-79.65,TREE DOWN ON FOUSHEE RD AND UTILITY LINES ON TREE ON BROOKLYN AVE. (RAH)
1952,UNK,1 SSW TRAMWAY,LEE,NC,35.41,-79.24,NUMEROUS TREES DOWN. (RAH)
2010,UNK,3 ESE SANFORD,LEE,NC,35.46,-79.14,TWO STRUCTURES REPORTED DAMAGE WITH ROOF COLLAPSE. (RAH)
2012,UNK,2 SE GEORGETOWN,PUTNAM,FL,29.38,-81.62,BROADCAST MEDIA RELAYED PUBLIC REPORT OF TREE DAMAGE ON DRIFTWOOD LANE. (JAX)
2025,UNK,2 NNW HARDEEVILLE,JASPER,SC,32.32,-81.09,SOUTH CAROLINA HIGHWAY PATROL REPORTED A TREE DOWN ON HIGHWAY 321 NEAR THE INTERSECTION WITH HONEY HILL ROAD. (CHS)
2045,UNK,ANGIER,HARNETT,NC,35.51,-78.74,NUMEROUS TREES DOWN ACROSS NORTHERN PORTIONS OF THE COUNTY. (RAH)
2100,UNK,1 ESE CARTHAGE,MOORE,NC,35.34,-79.4,TREE DOWN IN ROAD ON NC 24-27. (RAH)
2103,UNK,1 W ANGIER,HARNETT,NC,35.51,-78.76,TREE DOWN BLOCKING RAWS CHURCH ROAD. (RAH)
2108,UNK,4 ENE ANGIER,JOHNSTON,NC,35.53,-78.67,TREE BLOWN DOWN BLOCKING ROADWAY. (RAH)
2110,UNK,COTTAGEVILLE,COLLETON,SC,32.94,-80.48,COLLETON COUNTY DISPATCH REPORTED A TREE DOWN ON PEIRCE ROAD NEAR COTTAGEVILLE HIGHWAY. (CHS)
2124,UNK,3 W SLANDS BRIDGE,DORCHESTER,SC,32.97,-80.3,SOUTH CAROLINA HIGHWAY PATROL REPORTED A TREE DOWN ON HIGHWAY 61 NEAR THE INTERSECTION WITH OLD BEECH HILL ROAD. (CHS)
2124,UNK,4 W STATESVILLE,IREDELL,NC,35.78,-80.96,2 OR 3 TREES DOWN NEAR LITTLE FARM ROAD. (GSP)
2140,UNK,6 WNW SILVER CITY,HOKE,NC,35.03,-79.32,REAR FLANK DOWNDRAFT WINDS UPLIFTED AND RIPPED A WAY A ROOF OFF A OUTDOOR BUILDING. THERE WAS ALSO SOME LESS EXTENSIVE ROOF DAMAGE TO THE PRIMARY HOME. (RAH)
2221,UNK,1 NNW RALEIGH,WAKE,NC,35.84,-78.67,DOWNED TREES FALLING ON POWER LINES/EQUIPMENT. (RAH)
2230,UNK,4 W HOBOKEN,BRANTLEY,GA,31.17,-82.2,TREE REPORTED DOWN AT SCHLATTERVILLE (JAX)
2230,UNK,5 S THERMAL CITY,RUTHERFORD,NC,35.45,-81.97,A FEW TREES DOWN. (GSP)
2250,UNK,6 ESE YOUNGSVILLE,FRANKLIN,NC,36,-78.37,TREES DOWN ON POWER LINE AND EQUIPMENT. (RAH)
2311,UNK,HUNTERSVILLE,MECKLENBURG,NC,35.42,-80.85,ONE TREE DOWN NEAR THE CENTER OF THE CITY. HIGH WIND AT RIVER RUN COUNTRY CLUB BLEW OVER A LARGE POTTED PLANT AND BROUGHT DOWN SMALL LIMBS. (GSP)
2315,UNK,4 ESE PINK HILL,LENOIR,NC,35.03,-77.68,LENOIR CO EM REPORTED DAMAGE TO 3-4 BUILDINGS ON SNAGS PATH RD AND TURNER FARM LN. (MHX)
2320,UNK,MAURY,GREENE,NC,35.48,-77.6,TREES DOWN IN THE MAURY COMMUNITY. (MHX)
2345,UNK,6 SE OTTER CREEK,LEVY,FL,29.26,-82.7,911 CALL OF A TREE DOWN ON POWER LINES NEAR SOUTHEAST 42 COURT AND COUNTY ROAD 326. TIME ESTIMATED BY RADAR. (TBW)
0009,60,2 SE PORT CHARLOTTE,CHARLOTTE,FL,26.96,-82.08,PEAK WIND GUST OF 52 KNOTS MEASURED AT WXFLOW SITE. (TBW)
0030,UNK,6 SW FINLEY,STEELE,ND,47.45,-97.93,SEVERAL LARGE 4 TO 8 INCH DIAMETER TREE BRANCHES SNAPPED IN A FARMSTEAD SHELTER BELT NEAR CR25 NORTH OF HIGHWAY 200... IN WEST CENTRAL GREENVIEW TOWNSHIP. (FGF)
0037,UNK,CONCORD,CABARRUS,NC,35.41,-80.59,SEVERAL TREES DOWN IN CONCORD AND A FEW POWERLINES. TIME DERIVED FROM RADAR DATA. (GSP)
0050,60,5 W HOPE,STEELE,ND,47.32,-97.83,STRONG WINDS GUSTS IN REAR FLANK SHELF CLOUD. SOME DIME TO NICKEL SIZED HAIL AS WELL. (FGF)
0055,UNK,3 W HOPE,STEELE,ND,47.32,-97.78,LARGE BRANCHES BROKEN DOWN AROUND THE TOWN OF HOPE. ONE POPLAR TREE SNAPPED AT THE GOLF COURSE. (FGF)
0115,UNK,8 NW PAGE,CASS,ND,47.24,-97.69,A FEW LARGE BRANCHES BROKEN DOWN IN SHELTER BELTS. CORN AND BEAN FIELDS FLATTENED IN SPOTS ACROSS NORTHWEST ROCHESTER AND NORTHEAST ELLSBURY TOWNSHIPS. TIME ESTIMATED B (FGF)
0315,UNK,1 SW YULEE,NASSAU,FL,30.62,-81.59,TREES AND POWER LINES WERE BLOWN DOWN ALONG MINER ROAD NEAR HICKORY VILLAGE. SOME HOMES HAD ROOF DAMAGE. THE TIME OF THE EVENT WAS BASED ON RADAR IMAGERY. (JAX)
0430,UNK,1 N AVON,MAINLAND DARE,NC,35.35,-75.5,MINOR DAMAGE TO A DECK... HOUSE STRUCK BY LIGHTNING IN AVON. (MHX)
0758,UNK,1 E JAMES ISLAND COUNTY,CHARLESTON,SC,32.73,-79.97,LARGE TREE DOWN AROUND 924 FOLLY ROAD... JAMES ISLAND. (CHS)
0759,62,1 SW FOLLY BEACH,AMZ350,SC,32.65,-79.94,(CHS)
0805,58,1 ESE ISLE OF PALMS,AMZ350,SC,32.78,-79.79,THE WEATHERFLOW SENSOR AT ISLE OF PALMS REPORTED A WIND GUST TO 50 KT. (CHS)
0806,70,4 ESE CHARLESTON,AMZ330,SC,32.75,-79.87,(CHS)
0813,UNK,3 SE CAINHOY,CHARLESTON,SC,32.9,-79.79,TWO LARGE TREES DOWN AROUND THE INTERSECTION OF STATE ROAD 41 AND THE ENTRANCE TO PARK WEST. (CHS)
0830,UNK,3 WSW GARRIS LANDING,CHARLESTON,SC,32.92,-79.71,TREES DOWN ALONG SEEWEE ROAD NEAR HIGHWAY 17. TIME ESTIMATED BASED ON RADAR. (CHS)
Time,Size,Location,County,State,Lat,Lon,Comments
1845,100,10 ENE RIDGEWAY,FAIRFIELD,SC,34.37,-80.8,QUARTER-SIZE HAIL NEAR INTERSECTION OF RIVER RD AND DOE RUN LANE. (CAE)
1850,100,12 SSW HEATH SPRINGS,KERSHAW,SC,34.43,-80.78,LAKE WATEREE CAMPGROUND REPORTED QUARTER SIZE HAIL. (CAE)
1850,100,6 NE HOBBTON,WAYNE,NC,35.24,-78.24,1 INCH HAIL REPORTED ON DOBBERSVILLE ROAD. (RAH)
1910,100,10 ENE RIDGEWAY,FAIRFIELD,SC,34.37,-80.8,QUARTER-SIZE HAIL NEAR INTERSECTION OF RIVER RD AND DOE RUN LANE. (CAE)
1940,100,MCBEE,CHESTERFIELD,SC,34.47,-80.26,PEA TO QUARTER SIZED HAIL AT QUAIL RIDGE FARMS. (CAE)
2020,100,SANFORD,LEE,NC,35.47,-79.18,(RAH)
2058,275,3 N ANGIER,WAKE,NC,35.56,-78.74,(RAH)
2105,275,2 NW ANGIER,HARNETT,NC,35.53,-78.77,(RAH)
2115,275,2 SE FUQUAY-VARINA,WAKE,NC,35.57,-78.77,IN ADDITION MULTIPLE TREES HAVE BEEN BLOWN DOWN. (RAH)
2130,100,3 SW CARPENTER,WAKE,NC,35.79,-78.92,(RAH)
2228,100,1 NW BOISE CITY,CIMARRON,OK,36.74,-102.52,SOME HAIL STONES WERE JUST A TAD LARGER THAN A QUARTER. (AMA)
2259,100,5 NNW MCVILLE,NELSON,ND,47.83,-98.22,HEAVY RAIN WITH A FEW DIME TO QUARTER SIZED HAIL. (FGF)
2311,175,3 SE DAVIDSON,MECKLENBURG,NC,35.46,-80.81,HAIL UP TO THE SIZE OF GOLF BALLS FELL AT THE RIVER RUN GOLF COURSE. (GSP)
2325,125,4 ESE MCVILLE,NELSON,ND,47.74,-98.1,A FEW HAIL UP TO HALF DOLLAR SIZED JUST NORTH OF HIGHWAY 15...IN NORTHWEST LEE TOWNSHIP. (FGF)
2356,150,4 W SHARON,GRIGGS,ND,47.6,-97.98,OCASSIONAL NICKEL TO PING PONG BALL SIZED HAIL IN VERY HEAVY RAIN ACROSS SOUTHEAST LENORA TOWNSHIP. (FGF)
0025,175,5 S SHARON,STEELE,ND,47.52,-97.9,VERY HEAVY RAIN WITH OCASSIONAL LARGE HAIL... A FEW UP TO GOLF BALL SIZED. (FGF)
0310,100,4 NW PIERCEVILLE,FINNEY,KS,37.92,-100.71,HAIL OF NICKEL UP TO QUARTER SIZE WAS REPORTED IN THE AIRPORT AREA. (DDC)
