Time,F_Scale,Location,County,State,Lat,Lon,Comments
1812,UNK,3 WSW LORMAN,JEFFERSON,MS,31.81,-91.1,THIS TORNADO OCCURRED WITHIN A BROADER CORRIDOR OF VERY STRONG WINDS. IT BEGAN ALONG THE NATCHEZ TRACE NEAR THE INTERSECTION OF JULIUS GIBBS RD AND RODNEY RD AND CONTIN (JAN)
1858,UNK,4 WNW DENTVILLE,COPIAH,MS,31.99,-90.61,THIS TORNADO BEGAN TO THE WEST OF HOODTOWN ROAD AND TRACKED NORTHEAST TO NEW ZION AND BEAR CREEK ROAD INTERSECTION. NUMEROUS TREES WERE SNAPPED AND UPROOTED ON BOTH SID (JAN)
1859,UNK,2 NW UTICA,HINDS,MS,32.12,-90.65,THIS TORNADO BEGAN NORTHWEST OF UTICA ALONG THORNTON RD... WHERE IT PRODUCED MINOR TREE DAMAGE. IT MOVED NORTHEAST... STRENGTHENING AFTER CROSSING MS 27 AND TOM COLLINS (JAN)
1906,UNK,4 WSW LEARNED,HINDS,MS,32.18,-90.6,THIS TORNADO BEGAN WEST OF LEARNED NEAR OLD ADAMS STATION RD... MOVING EAST NORTHEASTWARD ACROSS ADAMS STATION RD AND NEAR THE DOWNTOWN AREA OF LEARNED... SNAPPING AND (JAN)
1919,UNK,3 SW RAYMOND,HINDS,MS,32.23,-90.45,TRAINED SPOTTER REPORTED TORNADO IN SIGHT NEAR THE INTERSECTION OF HWY 18 AND DRY GROVE RD. (JAN)
1935,UNK,4 W RUTH,LINCOLN,MS,31.39,-90.38,THIS BRIEF TORNADO BEGAN JUST TO THE SOUTH OF FOX ROAD AND WEST OF ELM LANE. A FEW TREES WERE DAMAGED OFF ON THE EDGE OF A FIELD WITH MORE TREE DAMAGE NOTED AT THE INTE (JAN)
1935,UNK,2 NNW GEORGETOWN,COPIAH,MS,31.9,-90.18,THIS EF-1 TORNADO DEVELOPED JUST NORTH OF GEORGETOWN AND TRACKED NE ACROSS SIMPSON AND RANKIN COUNTIES FOR NEARLY 29 MILES. THE TORNADO HAD MAX WINDS OF 107 MPH AND WAS (JAN)
1941,UNK,2 ESE CLINTON,HINDS,MS,32.33,-90.31,A TORNADO BEGAN NEAR THE WALMART IN CLINTON... WHERE IT BLEW OVER TWO VEHICLES... DAMAGED A FENCE... AND CAUSED DAMAGE IN THE GARDEN CENTER. THE TORNADO CONTINUED EASTW (JAN)
1945,UNK,HARRISVILLE,SIMPSON,MS,31.97,-90.08,WIDESPREAD DAMAGE ALONG HIGHWAY 469 AND HIGHWAY 540 FROM HARRISVILLE UP TOWARDS BRAXTON. 28 STRUCTURES DAMAGED WITH A MAJORITY WITH MINOR DAMAGE. 1 STRUCTURE WAS DESTRO (JAN)
1951,UNK,1 SSE FLOWOOD,RANKIN,MS,32.3,-90.13,AN EF-1 TORNADO ABOUT 3 MILES LONG AND 50 YARDS WIDE BEGAN OF OFF NORTH BIERDEMAN RD... THEN TRACKED NORTHEAST ACROSS FLOWOOD DRIVE WHERE IT UPPROOTED AND SNAPPED A FEW (JAN)
1954,UNK,2 SE BRAXTON,SIMPSON,MS,32,-89.95,AN EF-1 TORNADO FORMED NEAR GUM SPRINGS ROAD AND OLD PINOLA-BRAXTON ROAD JUST NW OF DLO. THE TORNADO MOVED NORTHEAST ACROSS US 49 NORTH OF DLO... ST JOHNS RD AND CHARLI (JAN)
2001,UNK,5 SE CATO,SIMPSON,MS,32.04,-89.83,THIS TORNADO DEVELOPED ALONG BRANDON WILLIAMSBURG RD NEAR THE SIMPSON-RANKIN LINE AND MOVED MOSTLY NORTHWARD TO JUST NORTH OF PUCKETT AND UP HIGHWAY 43. AT THE EARLY ST (JAN)
2005,UNK,2 SE RIDGELAND,MADISON,MS,32.41,-90.11,TREES DOWN THROUGHOUT THE REZ AREA NEAR RIDGELAND... TDS OBSERVED ON RADAR. (JAN)
2006,UNK,4 SE RIDGELAND,HINDS,MS,32.39,-90.09,THIS BRIEF AND WEAK TORNADO DEVELOPED IN A HEAVILY WOODED AREA ALONG THE PEARL RIVER. NO ACCESS POINTS WERE AVAILABLE TO ASSESS THE DAMAGE... HOWEVER A TORNADO DEBRIS S (JAN)
2007,UNK,3 NNE FLOWOOD,RANKIN,MS,32.36,-90.06,A EF-1 TORNADO WITH A NEARLY 1 MILE TRACK... STARTED ALONG MCLAURIN DR AND CROSSED ORIOLE WAY AND SWAN DR WHERE SEVERAL LARGE TREE BRANCHES WERE SNAPPED. THE TORNADO TH (JAN)
2010,UNK,2 SE JOHNS,RANKIN,MS,32.12,-89.82,THE START POINT FOR THIS TORNADO IS NOT KNOW YET AND THIS PORTION WILL BE COMPLETED IN THE COMING DAYS. AS THIS TORNADO CROSSED HIGHWAY 18 A FEW DOWNED TREES WERE NOTED (JAN)
2015,UNK,3 WNW FANNIN,RANKIN,MS,32.43,-90,THIS BRIEF EF-0 TORNADO STARTED NORTH OF FANNIN LANDING CIRCLE IN A WOODED AREA AND ENDED ALONG THREE PRONG RD. MULTIPLE HARDWOOD TREES WERE SNAPPED AND UPROOTED ALONG (JAN)
2019,UNK,1 WSW POLKVILLE,SMITH,MS,32.19,-89.71,THIS TORNADO DEVELOPED IN THE CREEK BOTTOM JUST SOUTH OF LOFTON RD AND TRACKED NORTHEAST THROUGH THE NORTH SIDE OF POLKVILLE AND DOWNED HUNDREDS OF TREES AND MANY POWER (JAN)
2022,UNK,2 SW GOSHEN SPRINGS,RANKIN,MS,32.45,-89.94,THIS EF1 TORNADO DEVELOPED ALONG JOHN HILL RD... AND MOVED EAST ACROSS JESS DEAN DR... OLD HIGHWAY 471... MS HIGHWAY 25... AND STUMP RIDGE RD BEFORE LIFTING. ALONG ITS (JAN)
2024,UNK,4 ENE CROSS ROADS,SCOTT,MS,32.28,-89.7,THIS TORNADO BEGAN ON COOPERVILLE RD JUST WEST OF HIGHWAY 13 SOUTH AND TRACKED NE TO MAHAFFEY RD. THIS TORNADO QUICKLY INTENSIFIED TO AN EF1 AND REACHED ITS PEAK INTENS (JAN)
2024,UNK,1 NE PULASKI,SCOTT,MS,32.29,-89.59,THIS TORNADO BEGAN ALONG BLOSSOM HILL ROAD NORTH OF THE PULASKI COMMUNITY AND MOVED NORTH NORTHEAST... PARALLELING THE ROAD THROUGHOUT ITS DURATION. SEVERAL TREES WERE (JAN)
2031,UNK,1 NNE MORTON,SCOTT,MS,32.37,-89.65,HOMES DESTROYED IN NORTH PART OF MORTON... MS. (JAN)
2040,UNK,4 E RATLIFF FERRY,SCOTT,MS,32.59,-89.78,THIS EF1 TORNADO BEGAN AT THE COAL BLUFF PARK THEN PROGRESSED EASTWARD ACROSS A HUNTING CLUB... ACROSS UTAH RD... CRAWFORD CIR... MS HIGHWAY 25... AND LUDLOW RD. IT THE (JAN)
2045,UNK,4 SW MIDWAY,SCOTT,MS,32.5,-89.59,THIS EF1 TORNADO STARTED IN THE BIENVILLE NATIONAL FOREST IN NORTHERN SCOTT CO... MOVING ACROSS HATTIE LYLES RD... HILLSBORO-LUDLOW RD... CALHOUN LN... CASH RD... RHINE (JAN)
2045,UNK,2 W LUDLOW,SCOTT,MS,32.57,-89.74,AWNING AND ROOF DAMAGE AT COAL BLUFF GAS STATION OFF OF MS 25. (JAN)
2046,UNK,4 NNW LUDLOW,LEAKE,MS,32.62,-89.73,THIS EF1 TORNADO BEGAN IN A WOODED AREA NEAR THE SCOTT AND LEAKE COUNTY LINE AND MOVED EASTWARD ACROSS UTAH ROAD... MS HWY 25... MCDONALDS RD... NEW GROUND RD... LUDLOW (JAN)
2104,UNK,FREENY,LEAKE,MS,32.7,-89.48,THIS EF-1 TORNADO FORMED NEAR THE FREENY COMMUNITY TRACKING EAST AND SOUTHEAST FOR NEARLY 10 MILES. WIDESPREAD TREE DAMAGE OCCURRED ACROSS THE AREA. WIND SPEEDS NEAR 11 (JAN)
2119,UNK,1 ENE FREETRADE,LEAKE,MS,32.7,-89.4,THIS TORNADO BEGAN ALONG LAUREL HILL RD AND TRACKED ROUGHLY EAST ALONG AND MOSTLY TO THE SOUTH OF MADDEN RD. THE TORNADO CROSSED RISHER RD AND DISSIPATED JUST EAST OF T (JAN)
2123,UNK,3 NNE HOUSE,NESHOBA,MS,32.67,-88.98,THE TORNADO TOUCHED DOWN AT COUNTY ROAD 717 BREAKING SMALL TO LARGE SOFTWOOD AND HARDWOOD TREE LIMBS. AS IT MOVED NORTHEAST TO COUNTY ROAD 450 IT SNAPPED AND UPROOTED S (JAN)
2123,UNK,2 NNW LAUREL HILL,LEAKE,MS,32.76,-89.32,THIS BRIEF TORNADO BEGAN JUST WEST OF HIGHWAY 427 AND JUST NORTH OF SISTRUNK LANE. THE TORNADO CROSSED HIGHWAY 427 WHERE IT SNAPPED AND UPROOTED SEVERAL TREES. THE TORN (JAN)
2130,UNK,1 NW HOPE,NESHOBA,MS,32.76,-89.26,CORRECTS PREVIOUS TORNADO REPORT FROM 1 NW HOPE. THIS BRIEF TORNADO BEGAN JUST TO THE WEST OF CR 151 AND TRACKED JUST SOUTH OF EAST IN THE HOPE COMMUNITY AND DISSIPATED (JAN)
2134,UNK,4 N PEARL RIVER,NESHOBA,MS,32.84,-89.23,THIS TORNADO BEGAN OVER A MARSHY AREA JUST SOUTH OF HOOPER MILL CREEK RD WHERE SEVERAL LARGE TREE BRANCHES WERE SNAPPED. IT THEN MOVED NORTHEAST CROSSING COUNTY ROADS 1 (JAN)
2137,UNK,4 SSW DE KALB,KEMPER,MS,32.72,-88.68,THE TORNADO TOUCHED DOWN WEST OF HIGHWAY 39 ALONG CRAIG ROAD WHERE IT PEELED BACK THE ALUMINUM ROOFING ALONG THE SOUTHWARD FACING SIDE OF A ONE-STORY HOME. IT BLEW THE (JAN)
2140,UNK,1 N DEEMER,NESHOBA,MS,32.76,-89.12,THIS EF1 TORNADO STARTED NEAR HOSPITAL ROAD WEST AND TRACKED NORTHEAST THROUGH PORTIONS OF PHILADELPHIA. THE TORNADO ENDED JUST NORTH OF EAST MAIN STREET IN EAST PHILAD (JAN)
2150,UNK,3 ENE STALLO,WINSTON,MS,32.94,-89.05,THIS BRIEF TORNADO BEGAN JUST SOUTHEAST OF ARTHUR YARBOROUGH RD AND MOVED NORTHEAST CROSSING ARTHUR YARBOROUGH AND MOUNT PISGAH ROADS. THE STRONGEST WINDS OCCURRED ALON (JAN)
2157,UNK,4 W VERNON,WINSTON,MS,32.99,-88.99,THIS TORNADO BEGAN JUST SOUTHWEST OF ENON RD AND MOVED NORTHEAST ACROSS ROCKY HILL RD AND POTTER FULTON RD WHERE LARGE LIMBS WERE SNAPPED AND SEVERAL SOFTWOOD TREES UPR (JAN)
2204,UNK,4 SE VERNON,WINSTON,MS,32.95,-88.87,THIS TORNADO BEGAN JUST WEST OF HIGHWAY 397 WHERE IT SNAPPED AND UPROOTED SEVERAL HARDWOOD AND SOFTWOOD TREES. THE TORNADO CONTINUED TO THE EAST CROSSING SHUGUALAK ROAD (JAN)
2208,UNK,ELLISON RIDGE,WINSTON,MS,33.07,-88.88,THIS BRIEF TORNADO BEGAN OFF OF ELLISON RIDGE ROAD WHERE IT UPROOTED A COUPLE OF TREES. THE TORNADO CROSSED HEMPHILL ROAD CONTINUING TO UPROOT TREES... BEFORE ENDING AB (JAN)
2213,UNK,4 ESE ELLISON RIDGE,WINSTON,MS,33.05,-88.82,THIS TORNADO BEGAN NEAR THE WINSTON/NOXUBEE COUNTY LINE OFF OF HIGHWAY 490. NUMEROUS TREES WHERE SNAPPED AND UPROOTED AT THIS POINT. THE TORNADO CONTINUED TO MOVE EAST (JAN)
2229,UNK,6 E BROOKSVILLE,NOXUBEE,MS,33.23,-88.49,THIS TORNADO BEGAN ALONG BALDWYN RD... WHERE THE TIN ROOF OF A CHURCH WAS PARTIALLY REMOVED AND A LARGE TREE WAS UPROOTED. IT PARTIALLY FLIPPED AN IRRIGATION PIVOT IN A (JAN)
2238,UNK,BROOKSVILLE,NOXUBEE,MS,33.24,-88.58,CORRECTS PREVIOUS TORNADO REPORT FROM BROOKSVILLE. THIS TORNADO BEGAN ON THE NORTH SIDE OF THE TOWN OF BROOKSVILLE... PRODUCING CONSIDERABLE DAMAGE ALONG DEERBROOK ST. (JAN)
2242,UNK,4 W PLUM GROVE,LOWNDES,MS,33.32,-88.5,THIS TORNADO BEGAN ALONG TRINITY RD... WHERE A FEW TREES WERE UPROOTED. IT CONTINUED NORTH NORTHEASTWARD TO CARSON RD... WHERE A LARGE EMPTY GRAIN BIN WAS SLID OFF OF I (JAN)
0907,UNK,2 NNW BERKELEY LAKE,FULTON,GA,34.01,-84.2,A BRIEF EF-0 TORNADO WITH MAX WIND SPEEDS OF 75 MPH TOUCHED DOWN IN JOHNS CREEK SNAPPING BRANCHES OFF OF MULTIPLE TREES AND DOWNING SEVERAL POWERLINES ON OLD ALABAMA RO (FFC)
0946,UNK,4 S CLERMONT,HALL,GA,34.41,-83.77,A LARGE NUMBER OF TREES WERE SNAPPED OR UPROOTED NEAR THE INTERSECTION OF CLARKS BRIDGE RD AND GLADE FARM RD. THE STEEPLE WAS ALSO BLOWN OFF OF DEWBERRY BAPTIST CHURCH. (FFC)
0952,UNK,4 SSE CLERMONT,HALL,GA,34.42,-83.74,MANY TREES SNAPPED OR UPROOTED NEAR A HOME IN THE 400 BLOCK OF GLADE FARM RD. (FFC)
Time,Speed,Location,County,State,Lat,Lon,Comments
1407,UNK,9 S MONTGOMERY,NATCHITOCHES,LA,31.54,-92.92,TREES DOWN ON THE SOUTH END OF 495 IN CLOUTIERVILLE. (SHV)
1630,UNK,PINEVILLE,RAPIDES,LA,31.33,-92.42,BROADCAST MEDIA RELAYED VIDEO OF DAMAGE TO A RESIDENCE DUE TO A TREE FALLING INTO IT. (LCH)
1704,UNK,5 WSW JONESVILLE,CATAHOULA,LA,31.6,-91.9,A FEW TREES WERE DOWNED ALONG US 84 WEST OF JONESVILLE. (JAN)
1728,UNK,2 ENE STACY,CONCORDIA,LA,31.61,-91.67,TREE DOWN ON HWY 84. (JAN)
1745,UNK,FERRIDAY,CONCORDIA,LA,31.63,-91.56,CORRECTS PREVIOUS TSTM WND DMG REPORT FROM FERRIDAY. TREE DOWN ON FISHERMAN DRIVE. (JAN)
1750,UNK,1 SSE NATCHEZ,ADAMS,MS,31.53,-91.38,POWER LINES DOWN AT N. COMMERCE ST AND AT MANSFIELD RD. (JAN)
1750,60,1 S NATCHEZ,ADAMS,MS,31.54,-91.39,REPORT IN EXCESS OF 60 MPH ESTIMATED WIND GUSTS. (JAN)
1810,UNK,3 E CRANFIELD,FRANKLIN,MS,31.55,-91.15,TREES WERE DOWNED ALONG US 84 ALONG THE ADAMS/FRANKLIN CO LINE. (JAN)
1818,UNK,1 NNE LORMAN,JEFFERSON,MS,31.83,-91.04,TREES AND POWERLINES DOWN. POSSIBLE TORNADO DAMAGE. (JAN)
1818,UNK,1 ENE ALCORN STATE,CLAIBORNE,MS,31.88,-91.13,MULTIPLE TREES DOWN ACROSS THE AREA AND ALONG HWY 52. (JAN)
1830,UNK,PATTISON,CLAIBORNE,MS,31.89,-90.89,MULTIPLE TREES DOWN. (JAN)
1849,UNK,1 SSW LETOURNEAU,WARREN,MS,32.2,-90.95,MULTIPLE TREES DOWN ACROSS THE SOUTHERN END OF WARREN COUNTY. (JAN)
1854,UNK,GRETNA,JEFFERSON,LA,29.91,-90.05,*** 2 INJ *** NEWS FOOTAGE OF POWER POLE DOWNED UPON TWO OCCUPIED VEHIICLES ON GRETNA BLVD NEAR SAMS CLUB. MEDIA REPORTS 2 INJURIES TO OCCUPANTS OF THE VEHICLES. (LIX)
1856,UNK,4 W DENTVILLE,COPIAH,MS,31.97,-90.63,SEVERAL TREES DOWN ACROSS NORTHWEST COPIAH COUNTY WITH TREES ACROSS THE ROAD ON DENTVILLE RD... HOODTOWN RD... HOLLY GROVE LN... AND SHELBY RD. (JAN)
1859,UNK,5 NW SPILLMAN,WEST FELICIANA,LA,30.97,-91.35,SOCIAL MEDIA PHOTOS OF TREE DOWN ON ROSEMOUND LOOP NEAR U.S. HIGHWAY 61. (LIX)
1900,UNK,1 N ST. FRANCISVILLE,WEST FELICIANA,LA,30.8,-91.38,IMAGE OF TREE DOWN ON HOME IN THE DIPPLE DRIVE AREA OFF U.S. HIGHWAY 61. (LIX)
1900,60,1 WNW GILLSBERG,AMITE,MS,31.03,-90.68,A LARGE OAK TREE WAS BLOWN DOWN ON BEAN ROAD NEAR MS HIGHWAY 568. A TRUCK LATER RAN INTO THE DOWNED TREE FATALLY INJURING THE TRUCK DRIVER. TIME IS ESTIMATE OF WHEN TRE (LIX)
1910,UNK,LEARNED,HINDS,MS,32.2,-90.55,TREES DOWN ON HOUSES IN LEARNED. (JAN)
1914,UNK,2 W AUBURN,FRANKLIN,MS,31.36,-90.65,A FEW TREES AND MANY LARGE LIMBS DOWN... BROKEN OFF. (JAN)
1915,UNK,WESSON,COPIAH,MS,31.7,-90.4,TREES DOWN IN WESSON ON HWY 51. (JAN)
1916,UNK,1 WSW AUBURN,LINCOLN,MS,31.36,-90.62,SEVERAL TREES UPROOTED OR LARGE PORTIONS BROKEN OFF ALONG HIGHWAY 569... 98 AND THE NORTH END OF GREENSBURG RD. (JAN)
1925,UNK,5 WNW ENTERPRISE,LINCOLN,MS,31.5,-90.46,TREE DOWN NEAR THE INTERSECTION OF HWY 51 AND ARGYLE TRAIL. (JAN)
1925,UNK,6 NW TERRY,HINDS,MS,32.17,-90.37,TREES AND POWER LINES DOWN NEAR THE INTERSECTION OF KIMBELL RD AND MCWILLIAMS DR. (JAN)
1932,UNK,7 NNW HARMONY,LINCOLN,MS,31.61,-90.31,SPORADIC TREE DAMAGE ACROSS THE COUNTY. (JAN)
1937,UNK,2 ESE CLINTON,HINDS,MS,32.33,-90.3,TREES AND TREE LIMBS DOWN ON ROOF OF HOUSE. (JAN)
1938,UNK,4 E BERWICK,ST. MARY,LA,29.69,-91.17,MORGAN CITY POLICE REPORT RAILROAD AVE. BETWEEN PECOS ST. AND AYCOCK ST. IS CLOSED DUE TO SEVERAL UTILITY POLES DOWN. TIME ESTIMATED BY RADAR. (LCH)
1941,UNK,3 WNW PRIDE,EAST BATON ROUGE,LA,30.71,-91.02,TREE ON HOME IN THE PRIDE AREA NEAR FIRE HOUSE 13. (LIX)
1941,62,3 E PHILIP,HAAKON,SD,44.05,-101.6,DELAYED REPORT (UNR)
1946,UNK,3 NW TOPEKA,LAWRENCE,MS,31.44,-90.23,SEVERAL TREES DOWN ON CHINA GROVE RD. POSSIBLE TORNADO. (JAN)
1946,UNK,1 E PEARL,RANKIN,MS,32.27,-90.11,TREES DOWN ON E. LISA DR. IN PEARL. VIA SOCIAL MEDIA. (JAN)
1950,UNK,1 W BRAXTON,SIMPSON,MS,32.02,-89.99,CORRECTS PREVIOUS FLASH FLOOD REPORT FROM 3 SW BRAXTON. TREES REPORTED DOWN BLOCKING ROAD. (JAN)
1955,63,1 E HILL CITY,GRAHAM,KS,39.37,-99.83,MEASURED AT KHLC ASOS. (GLD)
1959,UNK,4 SSE LIVINGSTON,MADISON,MS,32.51,-90.18,CORRECTS PREVIOUS TIME OF TSTM WND DMG REPORT FROM 4 SSE LIVINGSTON. PICTURES OF TREES DOWN AT WHISPER LAKE COUNTRY CLUB IN ANNANDALE. (JAN)
2001,UNK,3 SW PUCKETT,RANKIN,MS,32.05,-89.81,TREES ON HOUSE ON COUNTY LINE RD NEAR PUCKETT. (JAN)
2002,UNK,2 SSE TOUGALOO,HINDS,MS,32.37,-90.14,LARGE TREE SNAPPED AND ANOTHER UPROOTED THAT FELL ACROSS A CHAIN LINK FENCE AND A LARGE LIMB ACROSS THE ROOF OF A HOUSE NEAR THE INTERSECTION OF REDDOCH DRIVE AND SUFFO (JAN)
2003,UNK,3 E MONTICELLO,LAWRENCE,MS,31.55,-90.06,TREE DOWN NEAR THE INTERSECTION OF ST. STEPHENS RD AND HWY 43. (JAN)
2005,UNK,3 N BRANDON,RANKIN,MS,32.32,-89.98,TREE DOWN ALONG HWY 471. (JAN)
2013,UNK,3 ENE WHITE OAK,SMITH,MS,32.09,-89.64,TREES DOWN ALONG COUNTY ROAD 133... COUNTY ROAD 503... COUNTY ROAD 514 AND COUNTY ROAD 541. (JAN)
2022,UNK,PULASKI,SCOTT,MS,32.27,-89.6,TREES DOWN ACROSS SOUTHWEST PORTIONS OF SCOTT COUNTY. (JAN)
2029,UNK,2 WSW BASSFIELD,JEFFERSON DAVIS,MS,31.48,-89.78,TREES DOWN ON BASS BURKETT RD. (JAN)
2029,UNK,4 ENE SARATOGA,SMITH,MS,31.83,-89.61,LARGE TREE DOWN ACROSS A DRIVEWAY. (JAN)
2035,UNK,7 E AMITE,TANGIPAHOA,LA,30.72,-90.39,TREES DOWN IN THE LORANGER AREA. POSSIBLE TORNADO. (LIX)
2043,UNK,7 WSW FRANKLINTON,WASHINGTON,LA,30.81,-90.25,FOOTAGE OF POWER POLES LEANING AND SEVERAL TREE BRANCHES DOWN IN THE AREA OF LA 10 AND 450. TIME ESTIMATED BY RADAR. (LIX)
2043,UNK,4 W LUDLOW,SCOTT,MS,32.58,-89.77,MAJOR DAMAGE ON DUMMY LINE RD AND COAL BLUFF AREA. (JAN)
2048,UNK,2 SE MIDWAY,SCOTT,MS,32.53,-89.51,SEVERAL TREES UPROOTED ACROSS NORTH CENTRAL SCOTT AND SOUTH CENTRAL LEAKE COUNTIES. (JAN)
2051,UNK,2 ESE COLLINS,COVINGTON,MS,31.63,-89.53,TREE ACROSS THE RAILROAD TRACK. (JAN)
2053,UNK,NEWTON,NEWTON,MS,32.32,-89.16,TREES DOWN ACROSS PORTIONS OF THE COUNTY. (JAN)
2059,UNK,4 SSE LIVINGSTON,MADISON,MS,32.51,-90.18,PICTURES OF TREES DOWN AT WHISPER LAKE COUNTRY CLUB IN ANNANDALE. (JAN)
2104,UNK,DIXON,NESHOBA,MS,32.66,-89.22,SEVERAL TREES DOWN AT DIXON ON CR 339 AND CR 129. (JAN)
2104,UNK,1 NNW CARTHAGE,LEAKE,MS,32.75,-89.54,MULTIPLE TREES AND POWER LINES DOWN ACROSS LEAKE COUNTY. (JAN)
2105,UNK,4 SW ROSE HILL,JASPER,MS,32.11,-89.05,TREES DOWN ALONG HWY 503. (JAN)
2114,UNK,3 SW DEEMER,NESHOBA,MS,32.72,-89.15,*** 1 FATAL *** ONE FATALITY OCCURRED AS A TREE FELL ON A CAR. THIS OCCURRED ON HIGHWAY 15S BETWEEN HIGHWAY 485 AND COUNTY ROAD 432. TIME ESTIMATED BASED ON RADAR. (JAN)
2121,UNK,4 WSW CLEVELAND,KEMPER,MS,32.74,-88.89,TREES ACROSS HOPEWELL RD. (JAN)
2123,UNK,4 SSE OLOH,LAMAR,MS,31.24,-89.55,TREE DOWN ON PURVIS OLOH RD. AND KNIGHT RD. (JAN)
2126,UNK,3 NNW EDINBURG,LEAKE,MS,32.84,-89.35,SEVERAL TREES UPROOTED ALONG MARS HILL RD. (JAN)
2130,UNK,3 SW DALEVILLE,LAUDERDALE,MS,32.54,-88.72,SEVERAL TREES AND A POWER LINE DOWN IN NORTHWEST LAUDERDALE COUNTY. (JAN)
2133,UNK,3 E NANIH WAIYA,KEMPER,MS,32.92,-88.9,NUMEROUS TREES DOWN ACROSS ROADS IN NORTHWEST KEMPER COUNTY. (JAN)
2135,UNK,1 N BOGALUSA,WASHINGTON,LA,30.8,-89.86,SEVERAL TREES BLOWN DOWN NEAR INTERSECTION OF HWY 21 AND SOUTH BANKSTON DRIVE. (LIX)
2136,UNK,GEIGER,SUMTER,AL,32.87,-88.3,TREES AND POWER LINES DOWN IN GEIGER... AL. (BMX)
2137,UNK,2 SW BURNSIDE,NESHOBA,MS,32.83,-89.12,DAMAGE IN SEVERAL AREAS... TREES DOWN ON HOUSES. LOTS OF DAMAGE PER EM. (JAN)
2143,UNK,3 W MACEDONIA,FORREST,MS,31.38,-89.22,TREE DOWN AT COUNTY LINE RD AND AT MORRISTON RD AND MOSES LANE IN PETAL... MS. (JAN)
2145,UNK,5 E PRIDE,EAST BATON ROUGE,LA,30.69,-90.9,TREE ACROSS JIM PRICE ROAD AT GREENWELL SPRINGS. (LIX)
2145,UNK,DE KALB,KEMPER,MS,32.77,-88.65,ROOF OFF OF A HOME... TREES AND POWER LINES DOWN... ALONG WITH SEVERAL OTHER HOMES DAMAGED SOUTH OF TOWN. (JAN)
2146,UNK,5 ESE MOSELLE,JONES,MS,31.48,-89.2,POWER LINE DOWN ON OVETT MOSELLE RD. (JAN)
2148,UNK,DIXIE,FORREST,MS,31.22,-89.3,PICTURE RELAYED VIA SOCIAL MEDIA OF A TREE DOWN IN THE DIXIE AREA. (JAN)
2148,UNK,5 NW NOXAPATER,WINSTON,MS,33.04,-89.12,TWO UTILITY POLES WERE BROKEN ALONG CAMPGROUND RD. (JAN)
2155,UNK,3 SE WAHALAK,KEMPER,MS,32.88,-88.49,TREES BLOCKING HWY 45. (JAN)
2158,UNK,4 SSW BETHEDEN,WINSTON,MS,33.17,-88.97,TREE ON LIBERTY CHURCH RD. (JAN)
2159,UNK,SHUQUALAK,NOXUBEE,MS,32.98,-88.57,PICTURE OF A TREE DOWN ACROSS POWER LINES ALONG RESIDENCE ST. (JAN)
2159,UNK,1 W MATHISTON,WEBSTER,MS,33.54,-89.15,TREE DOWN ON NATCHEZ TRACE NEAR MATHISTON... MS. (JAN)
2200,UNK,RUNNELSTOWN,PERRY,MS,31.38,-89.11,MULTIPLE TREES AND POWER LINES REPORTED DOWN IN RUNNELSTOWN. ALSO MULTIPLE TREES ON A HOME AND A BARN DAMAGED. TIME ESTIMATED BY RADAR. (MOB)
2200,UNK,5 NNW MANNASSA,CLARKE,MS,32.06,-88.62,TREE DOWN ALONG COUNTY ROAD 440. (JAN)
2215,UNK,RICHTON,PERRY,MS,31.35,-88.94,TREES DOWN AND ROOF DAMAGED IN THE TOWN OF RICHTON. REPORT VIA SOCIAL MEDIA AND TIME ESTIMATED BY RADAR. (MOB)
2218,UNK,2 NW HAVANA,HALE,AL,32.91,-87.64,A FEW TREES BLOWN DOWN NEAR HAVANA JUNCTION. (BMX)
2222,UNK,GEIGER,SUMTER,AL,32.87,-88.3,A FEW TREES AND POWER LINES DOWN NEAR GEIGER. (BMX)
2223,UNK,1 W CEDAR BLUFF,CLAY,MS,33.59,-88.85,TREE DOWN ON HWY 50 W NEAR CAMP SEMINOLE RD. (JAN)
2224,UNK,GREENSBORO,HALE,AL,32.71,-87.6,A FEW TREES AND POWER LINES BLOWN DOWN. (BMX)
2224,UNK,4 SW COCHRANE,PICKENS,AL,33.02,-88.29,A CARPORT WAS TORN OFF A HOME. (BMX)
2230,60,2 WNW CLAYTON VILLAGE,OKTIBBEHA,MS,33.49,-88.79,ESTIMATED WIND GUST 60 TO 65MPH ON THE NORTH SIDE OF STARKVILLE. (JAN)
2230,UNK,NICOMA PARK,OKLAHOMA,OK,35.49,-97.32,POWER POLE DOWN AT NE 23RD AND DRAPER. (OUN)
2232,UNK,1 NNE SAND HILL,GREENE,MS,31.35,-88.76,LARGE TREE DOWN BLOCKING HIGHWAY 42 IN SAND HILL. TIME ESTIMATED BY RADAR. (MOB)
2232,UNK,5 WSW BROOKSVILLE,NOXUBEE,MS,33.19,-88.66,ROOF DAMAGE TO A SHED ALONG MACON-LYNN CREEK RD. (JAN)
2236,UNK,ALICEVILLE,PICKENS,AL,33.13,-88.15,SEVERAL PIECES OF ROOFING REMOVED FROM BUILDINGS IN ALICEVILLE. (BMX)
2241,UNK,CRAWFORD,LOWNDES,MS,33.31,-88.62,ROOF BLOWN OFF A SHED. (JAN)
2247,74,3 SE HOBART,KIOWA,OK,35,-99.05,(OUN)
2255,UNK,2 NNE COLUMBUS,LOWNDES,MS,33.54,-88.39,DOWNED TREES ON MILITARY RD. (JAN)
2258,UNK,BENNDALE,GEORGE,MS,30.87,-88.81,POWER COMPANY REPORTS TREES DOWN ON POWER LINES NEAR BENNDALE... MS. TIME ESTIMATED BY RADAR. (MOB)
2306,UNK,3 W ROMULUS,TUSCALOOSA,AL,33.15,-87.8,TREES BLOWN DOWN. (BMX)
2312,UNK,2 NW HAVANA,HALE,AL,32.91,-87.64,CORRECTS PREVIOUS TSTM WND DMG REPORT FROM 2 NW HAVANA. A FEW TREES BLOWN DOWN NEAR HAVANA JUNCTION. (BMX)
2320,UNK,1 N UNIVERSITY OF ALABA,TUSCALOOSA,AL,33.22,-87.55,TREES BLOWN DOWN. (BMX)
2322,UNK,4 NW STAR,LAMAR,AL,33.71,-88.23,TREES BLOWN DOWN NEAR NEBO ROAD. (BMX)
2324,UNK,MILLPORT,LAMAR,AL,33.56,-88.08,TREES WERE BLOWN DOWN ON HIGHWAY 96 IN MILLPORT. (BMX)
2336,UNK,4 S NEWBERN,HALE,AL,32.54,-87.53,A FEW TREES BLOWN DOWN. (BMX)
2340,UNK,3 NNE BEVILL STATE COLL,FAYETTE,AL,33.77,-87.8,TREES DOWN ALONG HWY 171 NORTH OF HWY 102 IN FAYETTE... AL. (BMX)
2350,67,4 NNE SULPHUR,MURRAY,OK,34.56,-96.95,(OUN)
2354,UNK,4 SSE TOPTON,WASHINGTON,AL,31.23,-88.13,A FEW TREES UPROOTED AND LARGE OAK BRANCHES BLOWN DOWN ON RUFFIN ODOM ROAD. THERE WAS ALSO DAMAGE TO THE TIN ROOF OF AN OUTDOOR BUILDING. (MOB)
0000,UNK,2 SW UNIVERSITY OF SOUT,MOBILE,AL,30.68,-88.21,RADIO OPERATOR REPORTS TREES DOWN IN AND AROUND PROVIDENCE ESTATES DR. TIME ESTIMATED BY RADAR. (MOB)
0000,UNK,5 ESE COFFEEVILLE,CLARKE,AL,31.74,-88.01,EMERGENCY MANAGER REPORTS A TREE DOWN NEAR HIGHWAY 84 AND WINN RD. TIME ESTIMATED BY RADAR. (MOB)
0000,UNK,2 E MIDFIELD,JEFFERSON,AL,33.46,-86.87,TREE DOWN ALONG ISHKOODA RD IN BIRMINGHAM... AL. (BMX)
0000,UNK,2 SE OAK GROVE,JEFFERSON,AL,33.46,-87.14,TREE DOWN ALONG LOCK 17 RD NEAR CONCORD... AL. (BMX)
0003,64,1 ENE PINTO ISLAND,GMZ630,AL,30.68,-88.01,MESONET STATION FW3662 NEAR PINTO ISLAND RECORDED A WIND GUST OF 64 MPH. (MOB)
0005,UNK,WINFIELD,MARION,AL,33.93,-87.82,TREES DOWN IN WINFIELD ON HIGHWAY 253. SHINGLE DAMAGE TO A HOME WAS ALSO REPORTED. (BMX)
0011,UNK,1 W ALABASTER,SHELBY,AL,33.25,-86.84,TREE DOWN AND POWER OUT AT THE INTERSECTION OF THOMPSON RD AND 1ST AVE. IN ALABASTER... AL. (BMX)
0015,UNK,1 ESE MEDAL OF HONOR PA,MOBILE,AL,30.65,-88.16,REPORTS OF MULTIPLE TREES DOWN... SOME ON RESIDENCES NEAR COTTAGE HILL RD AND UNIVERSITY DR. REPORT VIA SOCIAL MEDIA AND TIME ESTIMATED BY RADAR. (MOB)
0015,UNK,2 SW BIRMINGPORT,JEFFERSON,AL,33.55,-87.13,TREE DOWN ON POWERLINES NEAR THE INTERSECTION OF BLACK CREEK CAMP RD AND ALLIANCE RD NEAR CONCORD... AL. (BMX)
0015,UNK,1 ESE PARRISH,WALKER,AL,33.73,-87.27,SEVERAL TREES DOWN ALONG HWY 269 IN PARISH... AL. (BMX)
0015,UNK,1 SSE TISHOMINGO,JOHNSTON,OK,34.23,-96.68,TREE DOWN ON VEHICLE AT BYRD AND 12TH STREET. REPORT VIA NWSCHAT. (OUN)
0016,UNK,1 E HOOVER,JEFFERSON,AL,33.4,-86.79,A LARGE TREE FELL ON A HOME ON RIDGECREST DRIVE... PRODUCING SIGNIFICANT ROOF AND STRUCTURE DAMAGE. NO INJURIES REPORTED. (BMX)
0019,UNK,ELDRIDGE,WALKER,AL,33.92,-87.62,TREES BLOWN DOWN. ONE TREE LANDED ON A HOME AND PEOPLE ARE TRAPPED. (BMX)
0022,61,3 SE FREDERICK,TILLMAN,OK,34.36,-98.97,(OUN)
0033,UNK,SEMINOLE,BALDWIN,AL,30.52,-87.47,REPORTS OF DOWNED POWER LINES NEAR SEMINOLE. TIME ESTIMATED BY RADAR. (MOB)
0035,UNK,2 SW CENTER POINT,JEFFERSON,AL,33.62,-86.7,TREE ON HOUSE AT GLENWOOD ST. IN BIRMINGHAM... AL. (BMX)
0036,58,24 S VENICE,PLAQUEMINES,LA,28.93,-89.41,THE CMAN STATION PSTL1 AT PILOTS STATION EAST REPORTED A 43 KNOT WIND WITH A GUST TO 50 KNOTS. (LIX)
0036,UNK,STOCKTON,BALDWIN,AL,30.99,-87.86,VIEWER REPORTS TREES DOWN IN STOCKTON... AL VIA BROADCAST MEDIA. TIME ESTIMATED BY RADAR. (MOB)
0036,UNK,2 E HOOVER,JEFFERSON,AL,33.4,-86.78,TREE ON HOUSE ALONG RIDGECREST DR. (BMX)
0040,UNK,2 SE ARKADELPHIA,BLOUNT,AL,33.85,-86.9,SEVERAL TREES DOWN ON ARKADELPHIA RD IN HAYDEN... AL. (BMX)
0044,UNK,1 SE WINSTON FREE STATE,WINSTON,AL,34.16,-87.41,TREES BLOWN DOWN IN A COUPLE LOCATIONS IN DOUBLE SPRINGS. (BMX)
0054,UNK,1 S WATTSVILLE,ST. CLAIR,AL,33.66,-86.28,TREE ON HOUSE ALONG HWY 231 NEAR COAL CITY... AL. (BMX)
0058,UNK,WATTSVILLE,ST. CLAIR,AL,33.68,-86.28,*** 1 FATAL *** ONE PERSON WAS KILLED AS A TREE LANDED ON A HOME ALONG US HIGHWAY 231. (BMX)
0059,UNK,3 SE DOUGLASVILLE,BALDWIN,AL,30.83,-87.74,TREES DOWN IN THE PINE GROVE COMMUNITY IN BALDWIN CO. AL. TIME ESTIMATED BY RADAR. (MOB)
0100,UNK,2 SSW MOULTON,LAWRENCE,AL,34.45,-87.29,TREES WERE REPORTED DOWN ON HIGHWAY 33 IN THE MOULTON COMMUNITY. (HUN)
0104,UNK,9 SW WEST POINT,CULLMAN,AL,34.13,-87.04,LARGE TREES WERE UPROOTED AND SOME SHINGLES WERE BLOWN OFF OF A HOME AT THIS LOCATION. SOME MINOR DAMAGE TO THE HOME WAS REPORTED. (HUN)
0105,UNK,2 W CLEVELAND,BLOUNT,AL,34,-86.6,TREE DOWN ALONG SWANN BRIDGE RD IN CLEVELAND... AL. (BMX)
0105,UNK,MILL CREEK,JOHNSTON,OK,34.4,-96.82,WIND DAMAGE TO A BUILDING IN THE TOWN OF MILL CREEK. (OUN)
0106,UNK,3 SE DREWRY,CONECUH,AL,31.45,-87.23,BERMUDA FIRE DISPATCHED TO A TREE DOWN BETWEEN COUNTY RD. 5 AND COUNTY RD. 7 ON CPNECUH CO. TIME ESTIMATED BY RADAR. (MOB)
0107,UNK,1 E HOLLY SPRINGS,BLOUNT,AL,33.83,-86.46,TREE DOWN ALONG COUNTY HWY 27 IN SPRINGVILLE... AL. (BMX)
0110,58,1 N RINGLING,JEFFERSON,OK,34.19,-97.59,MESONET AUTOMATED REPORTING (OUN)
0114,UNK,6 WSW FLINT CITY,MORGAN,AL,34.49,-87.08,TREES DOWN AT EDDIE ROAD AT KIRBY BRIDGE ROAD... AND JOHNSON ROAD AT BOYS RANCH ROAD. TIME ESTIMATED FROM RADAR. (HUN)
0120,UNK,3 ESE SOUTHSIDE,ETOWAH,AL,33.91,-85.98,TREE ACROSS ROADWAY BETWEEN PILGRIMS REST RD AND 4TH AVE SOUTH OF GADSDEN... AL. (BMX)
0124,UNK,3 ENE OHATCHEE,CALHOUN,AL,33.8,-85.96,TREES BLOWN DOWN. (BMX)
0125,UNK,1 ENE GALLANT,ETOWAH,AL,34,-86.23,TREE DOWN ON POWERLINES ALONG GALLANT RD. (BMX)
0125,UNK,3 NE PRICEVILLE,MORGAN,AL,34.55,-86.84,TREE DOWN NEAR RED BUD LN AND NE THOMPSON RD. TIME ESTIMATED BASED ON RADAR. (HUN)
0126,UNK,4 WNW EVA,MORGAN,AL,34.35,-86.83,TREE AND POWER LINE DOWN NEAR DUNLAP RD AT HWY 55 E. TIME ESTIMATED BASED ON RADAR. (HUN)
0130,61,FORT MORGAN,BALDWIN,AL,30.23,-88.03,MARINE THUNDERSTORM WIND GUST OF 61MPH MEASURED AT FMOA1 ON FORT MORGAN... AL. (MOB)
0131,UNK,2 N MOORESVILLE,LIMESTONE,AL,34.66,-86.88,MULTIPLE TREES DOWN IN BELLE MINA CLOSE TO THE RAILROAD TRACKS. TIME ESTIMATED BASED ON RADAR. (HUN)
0133,UNK,SEMINOLE,BALDWIN,AL,30.52,-87.47,CORRECTS PREVIOUS TSTM WND DMG REPORT FROM SEMINOLE. REPORTS OF DOWNED POWER LINES NEAR SEMINOLE. TIME ESTIMATED BY RADAR. (MOB)
0144,UNK,2 WSW MADISON,MADISON,AL,34.69,-86.78,WOODEN LIGHT POLE ON A PALMER PARK BASEBALL FIELD DOWNED. (HUN)
0145,UNK,TITUS,ELMORE,AL,32.71,-86.32,TREES DOWN AND POWER OUTAGES IN AREAS OF TITUS... AL. (BMX)
0154,UNK,1 NW TENNALA,CHEROKEE,AL,34.1,-85.68,TREES BLOWN DOWN. (BMX)
0157,UNK,6 SW MERIDIANVILLE,MADISON,AL,34.82,-86.65,A TREE WAS REPORTED DOWN JUST TO THE EAST OF THIS LOCATION. (HUN)
