Time,F_Scale,Location,County,State,Lat,Lon,Comments
2338,UNK,11 NNE COLUSA,COLUSA,CA,39.35,-122,ON FEBRUARY 2... 2019 THERE WAS A BRIEF TORNADO TOUCHDOWN AT THE SACRAMENTO RIVER NATIONAL WILDLIFE REFUGE NORTH OF COLUSA. A WEATHER SPOTTER TOOK A VIDEO OF THE TOUCHD (STO)
2355,UNK,8 S MARIPOSA,MARIPOSA,CA,37.37,-119.97,NATIONAL WEATHER SERVICE CONDUCTED STORM SURVEY AND FOUND THAT AN EF0 TORNADO HAD TOUCHED DOWN NEAR BEN HUR ROAD AND BEACH ROAD SOUTH OF THE CITY ABOUT 8 MILES SOUTH OF (HNX)
0150,UNK,3 NNW TUDOR,SUTTER,CA,39.05,-121.65,NATIONAL WEATHER SERVICE METEOROLOGISTS CONFIRMED AN EF0 TORNADO TOUCHED DOWN AT APPROXIMATELY 5:50 PM PST ON SATURDAY... FEBRUARY 2ND... JUST SOUTH OF YUBA CITY... CA. (STO)
Time,Speed,Location,County,State,Lat,Lon,Comments
2331,UNK,5 ESE MARIPOSA,MARIPOSA,CA,37.46,-119.88,PER MARIPOSA COUNTY SHERIFF... REPORTS OF TREES DOWN IN NEARBY ROADWAYS. (HNX)
0130,UNK,3 NNW TUDOR,SUTTER,CA,39.05,-121.65,TREE AND FENCE DAMAGE NEAR CARLSON ROAD AND HUTCHINSON ROAD IN YUBA CITY. (STO)
Time,Size,Location,County,State,Lat,Lon,Comments
0000,125,3 NNE COLUSA,COLUSA,CA,39.24,-121.99,HALF DOLLAR SIZED HAIL REPORTED NORTH OF COLUSA. (STO)
