Time,F_Scale,Location,County,State,Lat,Lon,Comments
0201,UNK,GREENVILLE,BUTLER,AL,31.83,-86.62,EMERGENCY MANAGER REPORTS MULTIPLE TREES DOWN IN AND AROUND GREENVILLE... AL. TIME ESTIMATED BY RADAR. (MOB)
0210,UNK,4 NNW LETOHATCHEE,LOWNDES,AL,32.18,-86.5,SHERIFF DISPATCH REPORTED TREES DOWN NEAR COUNTY RD 26 AND COUNTY RD 37. TIME ESTIMATED BY RADAR. (BMX)
0405,UNK,5 S RAINBOW LAKES ESTAT,Marion,FL,29.08,-82.44,TRAINED SPOTTERS REPORTING TREES DOWNED IN THE DUNNELLON AREA...WITH A TREE ON A ROOF IN THE VICINITY OF 94TH COURT. TIME OF DAMAGE BASED ON RADAR DATA. (JAX)
0421,UNK,1 E COPPERAS COVE,CORYELL,TX,31.13,-97.9,DELAYED REPORT: DAMAGE TO THE ROOFS OF HOUSES IN THE COPPERAS COVE AREA. TIME ESTIMATED VIA RADAR. (FWD)
0435,UNK,4 SE BULLET CREEK,MONROE,TN,35.24,-84.37,APPROXIMATELY 15-20 TREES... 18-24 INCHES IN DIAMETER... WERE EITHER UPROOTED OR SNAPPED OFF ABOUT 20 FEET OFF THE GROUND IN A LOCATION ON THE TOP OF A RIDGE. (MRX)
0522,UNK,1 NW DURBIN,St. Johns,FL,30.1,-81.47,BROADCAST MEDIA RELAYED A SHORT VIDEO ON SOCIAL MEDIA OF POWER LINES DOWN ON PHILLIPS HIGHWAY NEAR THE ST JOHNS COUNTY AND DUVAL COUNTY LINE. TIME ESTIMATED BY RADAR. (JAX)
0633,UNK,4 ENE BUNNELL,Flagler,FL,29.48,-81.19,EMERGENCY MANAGER RELAYED A REPORT OF A TREE DOWN ON HOSPITAL DRIVE. NO ROAD BLOCKAGE. TIME IS ESTIMATED BY RADAR. (JAX)
0904,UNK,1 NNE MECHANICSVILLE,GWINNETT,GA,33.93,-84.25,POWERLINES WERE DOWN AT THE INTERSECTION OF JONES MILL RD AND GOVERNORS LAKE PKWY (FFC)
0904,UNK,2 NNW BERKELEY LAKE,FULTON,GA,34.01,-84.2,A LARGE TREE AND SEVERAL UTILITY POLES WERE DOWNED ONTO OLD ALABAMA ROAD. (FFC)
0910,UNK,1 N POWER DAM ROAD,DALE,AL,31.28,-85.65,TREE BLOCKING COUNTY RD 121. (TAE)
0954,UNK,3 SSE MOSSY CREEK,HALL,GA,34.5,-83.67,A HOME AND SHED WERE DAMAGED IN THE 1100 BLOCK OF DYER FARM RD. TREES WERE ALSO DOWNED. (FFC)
0959,UNK,10 SW CLARKESVILLE,HABERSHAM,GA,34.51,-83.66,TREES... POWER LINES AND POWER POLES DOWNED IN A PATH. POSSIBLE TORNADO. (GSP)
1000,UNK,BRUCE,WALTON,FL,30.47,-85.96,SCATTERED TREES DOWN IN WALTON COUNTY. (TAE)
1020,UNK,PONCE DE LEON,HOLMES,FL,30.72,-85.94,TREES DOWN IN THE PONCE DE LEON AREA. (TAE)
1030,UNK,BONIFAY,HOLMES,FL,30.79,-85.68,TREES DOWN IN THE BONIFAY AREA. (TAE)
1030,UNK,2 ENE NEWTON,DALE,AL,31.34,-85.57,TREE DOWN ON COUNTY ROAD 14. (TAE)
1045,UNK,1 SSW MAGNET,ROCKDALE,GA,33.56,-84.02,A TREE WAS DOWNED ON CEDAR BROOK DRIVE SE. (FFC)
1100,UNK,2 E ALFORD,JACKSON,FL,30.7,-85.36,TREE DOWN ON GARDEN VIEW ROAD CLOSE TO MILL ROAD. (TAE)
1100,UNK,2 N BIG HAYNES CREEK PA,WALTON,GA,33.78,-83.94,A TREE WAS DOWNED ONTO SANDY CREEK RD. (FFC)
1126,UNK,2 E HOSCHTON,JACKSON,GA,34.1,-83.73,A TREE WAS DOWN ONTO HIGHWAY 332 AT INDIAN CREEK RD. (FFC)
1130,UNK,LUCY,HOUSTON,AL,31.02,-85.04,TREE DOWN IN THE LUCY AREA. (TAE)
1155,UNK,4 S APALACHEE REGIONAL,LEON,FL,30.37,-84.15,TREE DOWN ON TRAM ROAD NEAR ST JOE ROAD. (TAE)
1157,UNK,3 ESE COMMERCE,JACKSON,GA,34.19,-83.4,A TREE WAS DOWNED ONTO ILA RD. (FFC)
Time,Size,Location,County,State,Lat,Lon,Comments
1728,100,PLAQUEMINE,IBERVILLE,LA,30.28,-91.24,PUBLIC REPORT RELAYED VIA BROADCAST MEDIA. (LIX)
