Time,F_Scale,Location,County,State,Lat,Lon,Comments
2302,65,2 S OWENSVILLE,GIBSON,IN,38.24,-87.69,A TREE BLOCKING IN65 BETWEEN CYNTHIANA AND OWENSVILLE. ALSO...LARGE LIMBS DOWN IN OWENSVILLE. (PAH)
2310,UNK,5 SSW SIDNEY,SHELBY,OH,40.22,-84.19,TREE DOWN NEAR 2000 BLOCK OF RIVER RD. TIME ESTIMATED BY RADAR. (ILN)
2310,UNK,2 WSW LIMA,ALLEN,OH,40.73,-84.14,SEVERAL TREES AND TREE LIMBS DOWNED IN LIMA. ROOF DAMAGE ALSO REPORTED BUT DETAILS ON ROOF WERE UNAVAILABLE. (IWX)
2310,UNK,NAPOLEON,HENRY,OH,41.39,-84.13,LARGE TREE DOWNED ACROSS TWO YARDS-APPROXIMATELY 1 FT DIAMETER. (IWX)
2315,UNK,3 SW SULLIVAN,SULLIVAN,IN,39.07,-87.45,BARN DESTROYED. (IND)
2315,UNK,5 W DANVILLE,VERMILION,IL,40.14,-87.71,POWER POLES AND POWER LINES DOWN ON SOUTH HENNING ROAD JUST SOUTH OF US HWY 150 (ILX)
2315,UNK,5 W DANVILLE,TAZEWELL,IL,40.53,-89.27,POWER POLES AND POWER LINES DOWN ON SOUTH HENNING ROAD JUST SOUTH OF US HWY 150 (ILX)
2315,65,3 NE NEWARK,KENDALL,IL,41.57,-88.54,(LOT)
2318,UNK,ANDERSON,MADISON,IN,40.09,-85.69,MODERATELY LARGE TREE DOWN. TIME APPROXIMATE (IND)
2319,UNK,EATON,PREBLE,OH,39.75,-84.63,MULTIPLE TREES DOWN IN THE CITY OF EATON. TIME ESTIMATED FROM RADAR. (ILN)
2321,UNK,4 NE DUNDEE,MONROE,MI,42.01,-83.61,SEVERAL REPORTS OF POWER LINES AND TREES DOWN MONROE COUNTY...DUNDEE TO MAYBE. (DTX)
2324,60,2 N NEW PALESTINE,HANCOCK,IN,39.75,-85.89,WIND PUSHING TREES OVER...SMALL ONES ALMOST TO THE GROUND (IND)
2325,UNK,BRUCEVILLE,KNOX,IN,38.76,-87.41,TREE AND UTILITY LINES DOWN ON A HOUSE (IND)
2325,60,BICKNELL,KNOX,IN,38.78,-87.31,(IND)
2325,UNK,TERRE HAUTE,VIGO,IN,39.47,-87.38,LARGE TREE BLOWN DOWN ACROSS ROAD AT STATE ROAD 150 AND BOLTON (IND)
2325,UNK,1 N DANA,VERMILLION,IN,39.82,-87.49,ROOF OFF A BARN. (IND)
2325,58,OTTAWA,PUTNAM,OH,41.02,-84.04,SMALL BRANCHES 1-3" IN DIAMETER DOWNED. ALSO REPORTED DIME SIZED HAIL. . (IWX)
2325,UNK,MONROE,MONROE,MI,41.92,-83.39,SEVERAL REPORTS OF POWER LINES AND TREES DOWN MONROE COUNTY...DUNDEE TO MAYBE. (DTX)
2327,60,BRAIDWOOD,WILL,IL,41.27,-88.22,NEAR THE LIBRARY. ALSO PEA SIZE HAIL. (LOT)
2330,UNK,MONTICELLO,LAWRENCE,MS,31.55,-90.11,MULTIPLE TREES DOWN IN MONTICELLO AND THROUGHOUT THE SOUTHERN PART OF LAWRENCE COUNTY...REPORTED BY LAWRENCE COUNTY SO (JAN)
2330,UNK,3 SW MONTICELLO,EAST CARROLL,LA,32.57,-91.43,TREE DOWN ON A HOUSE NEAR INTERSECTION OF FOREST GROVE RD AND FROG RIDGE RD...REPORTED BY LAWRENCE COUNTY SO (JAN)
2330,UNK,WHITESTOWN,BOONE,IN,40,-86.35,LARGE TREE LIMBS DOWN... ROOF SHINGLES BLOWN OFF... KNOCKED OVER A FEW AIR CONDITIONING UNITS. (IND)
2330,UNK,KANKAKEE,KANKAKEE,IL,41.12,-87.86,ACROSS CENTRAL AND SOUTHERN KANKAKEE COUNTY. OVER 200 TREES AND POWERLINES DOWN. (LOT)
2331,UNK,MORRISTOWN,SHELBY,IN,39.67,-85.7,TREE LIMBS 6 TO 8 INCHES IN DIAMETER BLOWN DOWN. TIME ESTIMATED FROM RADAR. (IND)
2334,65,EVANSVILLE,VANDERBURGH,IN,37.98,-87.54,ON THE SOUTHEAST SIDE OF EVANSVILLE NEAR ANGEL MOUNDS (PAH)
2340,UNK,5 WSW DELAWARE,DELAWARE,OH,40.28,-83.17,8 TO 12 INCH DIAMETER TREE LIMB SNAPPED FROM BASE OF TREE. (ILN)
2340,UNK,5 ENE COLUMBIAVILLE,LAPEER,MI,43.19,-83.31,NUMEROUS WIRES AND TREES IN THE TWP. ONE TREE FELL THROUGH ROOF ON HOUSE. BARNES LAKE RD NEAR KINGS LANDING CAMP GROUND. (DTX)
2341,UNK,3 N DOWNTOWN DAYTON,MONTGOMERY,OH,39.81,-84.2,LARGE DIAMETER SPLIT AND FELL ON A CAR. TIME ESTIMATED FROM RADAR. (ILN)
2341,65,4 SW SHOREWOOD,KENDALL,IL,41.48,-88.26,(LOT)
2341,60,1 S OSWEGO,KENDALL,IL,41.68,-88.33,MATURE TREES WERE BENDING. (LOT)
2343,UNK,TERRE HAUTE,VIGO,IN,39.47,-87.38,TWELVE INCH DIAMETER TREE BLOWN DOWN INTO ROAD AT GARDENDALE AND PARK LANE IN WOODRIDGE SUBDIVISION. (IND)
2345,UNK,2 NE CUMBERLAND,HANCOCK,IN,39.8,-85.93,TOP OF A 40 FOOT TREE WAS SNAPPED OFF AT EAST 21ST STREET AND COUNTY ROAD 700 WEST. TIME ESTIMATED FROM RADAR AND TIME GIVEN BY SPOTTER. (IND)
2345,60,BOURBONNAIS,KANKAKEE,IL,41.16,-87.88,(LOT)
2350,UNK,5 SSW LAKE BUTLER,UNION,FL,29.95,-82.36,THE EMERGENCY MANAGER REPORTED TREES AND POWERLINES DOWN NEAR COUNTY ROAD 231 SOUTH OF LAKE BUTLER. THE TIME GIVEN WAS BASED ON RADAR. (JAX)
2352,UNK,2 SW STILESVILLE,PUTNAM,IN,39.62,-86.66,CONSTRUCTION TRAILER BLOWN OVER AND UTILITY LINES BLOWN DOWN NEAR US HIGHWAY 40 AND STATE ROAD 75. TIME ESTIMATED FROM RADAR. (IND)
2355,58,RADNOR,DELAWARE,OH,40.38,-83.15,TIME ESTIMATED FROM RADAR. (ILN)
2355,UNK,2 W MONROE,MONROE,MI,41.92,-83.42,8 INCH DIAMETER TREE BRANCH DOWN NEAR THE INTERSECTION OF US-24/M-50. (DTX)
2358,UNK,5 SW PLAINFIELD,KENDALL,IL,41.56,-88.27,TREE FELL ON ASHBROOK LANE COVERING MOST OF THE STREET. (LOT)
2359,UNK,2 SW ROSELAWN,NEWTON,IN,41.12,-87.34,LARGE TREE DOWNED ON STATE ROUTE 55. TIME ESTIMATED BY RADAR. (LOT)
0000,UNK,4 SSE ST. PARIS,CHAMPAIGN,OH,40.07,-83.94,TREE DOWN ALONG N. HAMPTON DIALTON RD. TIME ESTIMATED BY RADAR. (ILN)
0000,UNK,3 NW BRADNER,WOOD,OH,41.35,-83.47,LARGE TREE DOWN ACROSS ROUTE 6. ALSO SOME LARGE BRANCHES DOWN IN THE LUCKEY AREA AS WELL. TIME ESTIMATED VIA RADAR. (CLE)
0004,UNK,4 SE NEW CARLISLE,CLARK,OH,39.9,-83.98,TREE KNOCKED DOWN ALONG LOWER VALLEY PIKE. TIME ESTIMATED FROM RADAR. (ILN)
0010,UNK,1 WSW STILESVILLE,HENDRICKS,IN,39.63,-86.65,TREES DOWNED. (IND)
0010,UNK,5 SSW DUBLIN,FAYETTE,IN,39.74,-85.24,TREES DOWN ACROSS THE COUNTY. TIME ESTIMATED BY RADAR. (ILN)
0010,UNK,ARMADA,MACOMB,MI,42.84,-82.88,MACOMB COUNTY CENTRAL DISPATCH REPORTED A LARGE TREE DOWN IN THE VILLAGE OF ARMADA. (DTX)
0010,UNK,MORIAH,ESSEX,NY,44.05,-73.51,TREES AND POWER LINES DOWN (BTV)
0012,UNK,1 WNW CELESTINE,DUBOIS,IN,38.39,-86.8,LARGE TREE DOWN AT STATE ROAD 164 AND STEINBOTTOM ROAD. (LMK)
0012,UNK,1 NW PARAGON,MORGAN,IN,39.41,-86.58,NUMEROUS TREES TOPPED BY WIND. (IND)
0013,UNK,CAMBRIDGE CITY,WAYNE,IN,39.81,-85.17,TREE KNOCKED DOWN. TIME ESTIMATED FROM RADAR. (ILN)
0013,UNK,4 NNE OSTRANDER,DELAWARE,OH,40.32,-83.18,3 FOOT DIAMETER TREE KNOCKED DOWN. TIME ESTIMATED FROM RADAR. (ILN)
0014,UNK,1 E HAZEL CREST,COOK,IL,41.57,-87.67,LARGE TREE OVER ONE FOOT IN DIAMETER DOWNED. (LOT)
0015,UNK,N TIFFIN,SENECA,OH,41.12,-83.18,BARN DOWN ON COUNTY ROAD 48 NORTH OF TIFFIN. ALSO SOME TREES DOWN IN NORTHERN SENECA COUNTY BETWEEN BETTSVILLE AND OLD FORT. (CLE)
0017,UNK,1 N RUSSELLVILLE,FRANKLIN,AL,34.52,-87.73,SEVERAL TREES DOWN IN THE RUSSELLVILLE AREA (HUN)
0024,UNK,TURKEY,HALL,TX,34.39,-100.9,LAW ENFORCEMENT REPORTED PORTION OF ROOF BLOWN OFF HOUSE AND POWER LINES DOWN. (LUB)
0025,UNK,ASHLEY,DELAWARE,OH,40.41,-82.95,POWER POLE KNOCKED DOWN. TIME ESTIMATED FROM RADAR. (ILN)
0030,60,2 WSW TURKEY,HALL,TX,34.38,-100.93,REPORTED BY WEST TEXAS MESONET (LUB)
0032,UNK,MECHANICSBURG,CHAMPAIGN,OH,40.07,-83.56,TREE DOWN IN MECHANICSBURG. TIME ESTIMATED BY RADAR. (ILN)
0035,UNK,8 S NASHVILLE,BROWN,IN,39.09,-86.24,SEVERAL TREES DOWNED ACROSS SOUTHERN PART OF COUNTY. (IND)
0038,UNK,SULPHUR,CRAWFORD,IN,38.24,-86.47,TREES REPORTED DOWN. (LMK)
0040,UNK,2 NE LEXINGTON,RICHLAND,OH,40.7,-82.56,TREE FELL ON A CAR ON STATE ROUTE 42. (CLE)
0042,UNK,3 NE MARENGO,ORANGE,IN,38.4,-86.31,TREES REPORTED DOWN. (LMK)
0044,UNK,EATON,PREBLE,OH,39.75,-84.63,TREE KNOCKED DOWN OVER MAPLE STREET. TIME ESTIMATED FROM RADAR. (ILN)
0045,UNK,1 WNW LAKEPORT,ST. CLAIR,MI,43.12,-82.52,ST CLAIR COUNTY DISPATCH REPORTED NUMEROUS TREES BLOW DOWN IN BURTCHVILLE TOWNSHIP. (DTX)
0050,UNK,JONESVILLE,HILLSDALE,MI,41.98,-84.66,DELAYED REPORT. SEVERAL TREES BLOWN DOWN ACROSS THE NORTHERN PART OF THE COUNTY. TIME ESTIMATED FROM RADAR. (IWX)
0100,UNK,1 WNW OLIVESBURG,RICHLAND,OH,40.89,-82.44,*** 1 INJ *** TREE FELL ON A MAN ON ROUTE 603 IN BUTLER TOWNSHIP. TREES DOWN ACROSS RICHLAND COUNTY. (CLE)
0100,60,NEW LONDON,HURON,OH,41.08,-82.41,SPOTTER REPORTED A 60 MPH WIND GUST. (CLE)
0105,UNK,WAKEMAN,HURON,OH,41.26,-82.4,TREE DOWN NEAR INTERSECTION OF ROUTES 20 AND 303. POWER LINES DOWN EAST OF TOWN. (CLE)
0115,UNK,PERRYSVILLE,ASHLAND,OH,40.66,-82.31,SCATTERED TREES DOWN IN ASHLAND COUNTY (CLE)
0120,UNK,VERMILION,LORAIN,OH,41.41,-82.32,TREES DOWN ON EDGEWATER ROAD AND ANOTHER TREE DOWN AND BLOCKING ROUTE 6. (CLE)
0120,UNK,PLAINFIELD,WAUSHARA,WI,44.21,-89.48,TREE BRANCHES DOWN. PEA SIZED HAIL ALSO REPORTED. TIME ESTIMATED. (GRB)
0132,UNK,ATHENS,MCMINN,TN,35.45,-84.6,TWO TREES DOWN. (MRX)
0140,UNK,1 SW MEDINA,MEDINA,OH,41.13,-81.88,LARGE TREE DOWN AND SIDING RIPPED FROM THE SIDE OF THE HOUSE ON A HOUSE ON THE SOUTHWEST SIDE OF MEDINA...REPORT VIA SOCIAL MEDIA. TIME ESTIMATED VIA RADAR. (CLE)
0151,UNK,3 S SUNMAN,RIPLEY,IN,39.19,-85.09,TREE ACROSS SR 48. MULTIPLE POWER POLES DOWN ALONG SR 48. TIME ESTIMATED FROM RADAR. (ILN)
0200,UNK,3 NE MOORES HILL,DEARBORN,IN,39.14,-85.05,MULTIPLE TREES AND POWERLINES DOWN. TIME ESTIMATED BY RADAR. (ILN)
0200,UNK,5 W CHILI,COSHOCTON,OH,40.36,-81.87,TREES DOWN ACROSS PORTIONS OF NORTHWEST COSHOCTON COUNTY. (PBZ)
0205,UNK,CARLISLE,WARREN,OH,39.58,-84.32,SMALL PARTS OF SIDING REMOVED FROM STRUCTURE. TIME ESTIMATED BY RADAR. (ILN)
0208,UNK,5 S DILLSBORO,OHIO,IN,38.95,-85.05,TREE DOWN ON MILTON BEAR BRANCH RD. TIME ESTIMATED BY RADAR. (ILN)
0210,UNK,5 NNE MARYSVILLE,UNION,OH,40.31,-83.33,SEVERAL TREE LIMBS DOWN ALONG RTE 4 NEAR BLUES CREEK GOLF COURSE. TIME ESTIMATED BY RADAR. (ILN)
0215,UNK,4 ESE TUNAS,DALLAS,MO,37.83,-92.96,TREE DOWN ACROSS COUNTY YY (SGF)
0220,UNK,SOLON,CUYAHOGA,OH,41.39,-81.44,COUPLE TREES DOWN AROUND SOLON...REPORTS VIA SOCIAL MEDIA. TIME ESTIMATED VIA RADAR. (CLE)
0223,UNK,4 NW DOWNTOWN CINCINNAT,HAMILTON,OH,39.14,-84.56,ROOFS BLOWN OFF OF 2 BUILDINGS AND DAMAGE WITHIN THE BUILDING. SEVERAL TREES ALSO KNOCKED DOWN OR DAMAGED. FORTY APARTMENTS WORTH OF RESIDENTS DISPLACED. TIME ESTIMATED (ILN)
0225,UNK,2 NE RISING SUN,BOONE,KY,38.97,-84.82,TREES AND POWERLINES DOWN ON MCVILLE RD. TIME ESTIMATED BY RADAR. (ILN)
0233,UNK,BAINBRIDGE,GEAUGA,OH,41.39,-81.34,SEVERAL REPORTS OF TREE AND OTHER RELATED WIND DAMAGE FROM BAINBRIDGE 911. (CLE)
0235,UNK,UNIONTOWN,STARK,OH,40.97,-81.4,COUPLE TREES DOWN IN UNIONTOWN. ONE TREE FELL ON A CAR ON ROUTE 619...REPORTS VIA SOCIAL MEDIA. TIME ESTIMATED VIA RADAR. (CLE)
0240,UNK,5 SW INDEPENDENCE,BOONE,KY,38.9,-84.61,TREES AND POWERLINES DOWN ALONG OLD LEXINGTON PIKE. TIME ESTIMATED BY RADAR. (ILN)
0245,UNK,5 NNE COVINGTON,HAMILTON,OH,39.14,-84.47,LARGE DIAMETER TREE KNOCKED DOWN. TIME ESTIMATED FROM RADAR. (ILN)
0245,UNK,PARKMAN,GEAUGA,OH,41.37,-81.06,TREE DOWN ONTO A CAR ON REYNOLDS ROAD IN PARKMAN. REPORT FROM GEAUGA COUNTY SHERIFF TWITTER PAGE. (CLE)
0253,UNK,3 SSE SHELBYVILLE,SHELBY,KY,38.18,-85.21,TREES DOWN ALONG MT. EDEN ROAD IN THE AREA OF HOOPER STATION AND MCMAKIN-MCMULLEN. (LMK)
0255,UNK,5 NNE WET GLAIZE,CAMDEN,MO,37.99,-92.49,REPORTS OF LARGE TREES AND BRANCHES DOWN. SIZE UNKNOWN AT THIS TIME. TIME ESTIMATED BASED ON RADAR. (SGF)
0300,UNK,NORTH BLOOMFIELD,TRUMBULL,OH,41.44,-80.89,TREES DOWN ALL OVER TRUMBULL COUNTY. STARTED AT ABOUT 9PM. (CLE)
0305,UNK,GOSHEN,CLERMONT,OH,39.23,-84.16,SEVERAL REPORTS OF TREES AND POWER LINES DOWN NEAR GOSHEN AND THROUGH PORTIONS OF MIAMI TOWNSHIP. (ILN)
0305,UNK,ORWELL,ASHTABULA,OH,41.54,-80.86,TREES DOWN IN THE SOUTHERN PART OF THE COUNTY. (CLE)
0315,UNK,CANFIELD,MAHONING,OH,41.03,-80.77,SEVERAL TREES DOWN IN THE CANFIELD AREA. SOME TREES ARE BLOCKING SECONDARY ROADS. (CLE)
0340,UNK,1 N ROGERS,COLUMBIANA,OH,40.81,-80.63,ONE TREE DOWN NEAR ROGERS. (PBZ)
0348,UNK,CYNTHIANA,HARRISON,KY,38.39,-84.3,POWER LINE DOWN ON WEST PLEASANT STREET. (LMK)
0400,60,4 NW COCHRANTON,CRAWFORD,PA,41.57,-80.1,A MEMBER OF THE PUBLIC BETWEEN MEADVILLE AND COCHRANTON MEASURED A 60 MPH WIND GUST FROM HIS ANEMOMETER...REPORT RELAYED THROUGH BROADCAST MEDIA. (CLE)
0410,63,3 SE BRECKENRIDGE,GARFIELD,OK,36.41,-97.69,(OUN)
0414,UNK,4 WSW LEXINGTON,FAYETTE,KY,38.02,-84.52,POWER LINES AND TRESS DOWN ON ELAM PARK. (LMK)
0415,UNK,ERIE,ERIE,PA,42.13,-80.09,TREES DOWN IN THE CITY OF ERIE. ONE TREE WAS ON A HOUSE AND ONE TREE WAS ON A CAR. (CLE)
0425,UNK,KREMLIN,GARFIELD,OK,36.55,-97.83,EMERGENCY MANAGER REPORTED SIGNIFICANT DAMAGE TO TREES AND SEVERAL BUILDINGS ON NORTH SIDE OF TOWN. INCLUDING SIGNIFICANT DAMAGE TO THE ROOF OF THE POST OFFICE... WHICH (OUN)
0425,UNK,3 NE ELIZAVILLE,FLEMING,KY,38.45,-83.79,TREE BLOWN DOWN ON JUNCTION ROAD. (JKL)
0440,UNK,CAMARGO,MONTGOMERY,KY,38,-83.89,LARGE LIMB DOWN ON CAMARGO LEVEE ROAD. HIGHWAY DEPARTMENT CALLED OUT TO CLEAR IT. (JKL)
0441,UNK,10 WSW MARIENVILLE,CLARION,PA,41.4,-79.26,TREE DOWN. (PBZ)
0445,UNK,6 W MARIENVILLE,FOREST,PA,41.46,-79.19,SEVERAL TREES AND WIRES DOWN. (PBZ)
0510,75,3 N STILLWATER,PAYNE,OK,36.16,-97.06,(OUN)
0518,UNK,STILLWATER,PAYNE,OK,36.12,-97.06,SIGNIFICANT TREE DAMAGE IN STILLWATER. KOCO METEOROLOGIST RELAYED VIEWER REPORT VIA TWITTER OF SUBSTANTIAL TREE DOWN ON FENCE. TIME ESTIMATED VIA RADAR. (OUN)
0528,62,BUFFALO AIRPORT,ERIE,NY,42.94,-78.74,(BUF)
0535,UNK,N PERKINS,PAYNE,OK,35.97,-97.03,POWER LINE DOWNED AND A SEMI TURNED OVER AT HIGHWAYS 33 AND 177. (OUN)
0548,UNK,2 E GASPORT,NIAGARA,NY,43.2,-78.53,LARGE TREE AND WIRES DOWN ON MOUNTAIN RD (BUF)
0551,UNK,ALABAMA,GENESEE,NY,43.09,-78.38,TREE DOWN ON TESNOW RD. (BUF)
0617,UNK,BATAVIA,GENESEE,NY,43,-78.19,TREE DOWN ON LEWISTON RD. (BUF)
0646,UNK,TULSA,TULSA,OK,36.13,-95.92,FEW TREES SNAPPED AND LIMBS DOWN NEAR 71ST AND MINGO (TSA)
0650,58,HECTORVILLE,OKMULGEE,OK,35.84,-95.93,(TSA)
0650,66,1 W BIXBY,TULSA,OK,35.94,-95.9,(TSA)
0735,59,2 W CHECOTAH,MCINTOSH,OK,35.47,-95.56,(TSA)
0755,UNK,CANADIAN,PITTSBURG,OK,35.18,-95.65,AWNING DESTROYED AND A FEW SHINGLES REMOVED. (TSA)
0830,58,WILBURTON,LATIMER,OK,34.92,-95.31,(TSA)
0845,UNK,GAINESVILLE,OZARK,MO,36.6,-92.43,OUTFLOW AHEAD OF THUNDERSTORMS DOWNED POWER LINES IN THE GAINSEVILLE AREA. (SGF)
0928,UNK,CLAY,JEFFERSON,AL,33.7,-86.6,A VERY LARGE OAK TREE CRASHED INTO AND DESTROYED A HOME. (BMX)
1030,UNK,SYLVIA,RENO,KS,37.96,-98.41,DELAYED REPORT. SNAPPED POWER POLE AND BRANCHES 1 INCH DIAMETER DOWN. (ICT)
1051,UNK,6 NW ASHLAND,CLAY,AL,33.34,-85.91,SEVERAL TREES REPORTED DOWN ALONG NEWBURY ROAD. (BMX)
Time,Size,Location,County,State,Lat,Lon,Comments
1200,100,2 NE ASHTON,OSCEOLA,IA,43.34,-95.76,. (FSD)
1257,100,6 NNW MOUNTAIN LAKE,COTTONWOOD,MN,44.02,-94.96,. (FSD)
1300,100,SIOUX CENTER,SIOUX,IA,43.08,-96.17,. (FSD)
1310,100,BUTTERFIELD,WATONWAN,MN,43.96,-94.79,. (MPX)
1326,100,4 ENE KINGSLEY,PLYMOUTH,IA,42.62,-95.9,. (FSD)
1342,150,2 N LEWISVILLE,WATONWAN,MN,43.95,-94.44,. (MPX)
1344,150,2 NE CUSHING,IDA,IA,42.49,-95.65,. (FSD)
1441,100,2 E BERRYTON,SHAWNEE,KS,38.94,-95.59,(TOP)
1530,100,6 SE RIDGELAND,DUNN,WI,45.15,-91.81,. (MPX)
1600,100,1 NNE HAMMOND,ST. CROIX,WI,44.98,-92.43,. (MPX)
1845,100,CAMDENTON,CAMDEN,MO,38.01,-92.74,DIME TO QUARTER SIZE HAIL ON BEAR PAW ROAD. (SGF)
1928,100,2 ENE PELKIE,BARAGA,MI,46.82,-88.61,AT BARAGA 7 NW COOP LOCATION. (MQT)
1941,125,3 NE GOLDEN GATE,COLLIER,FL,26.21,-81.67,DELAYED PUBLIC REPORT OF HAIL LARGER THAN QUARTERS BUT SMALLER THAN GOLFBALLS JUST NORTH OF HIDEOUT GOLF CLUB. (MFL)
1955,100,O'FALLON,ST. CHARLES,MO,38.78,-90.71,QUARTER-SIZED HAIL AND LIMBS DOWN AT HIGHWAY K AND I-70 IN OFALLON MISSOURI. (LSX)
2001,175,TERRE HAUTE,VIGO,IN,39.47,-87.38,LOCATED AT 12TH STREET AND WABASH (IND)
2025,100,1 NW PLYMOUTH,SHEBOYGAN,WI,43.76,-87.99,REPORT RELAYED VIA MPING. (MKX)
2037,100,2 WSW DON HOLT BRIDGE,CHARLESTON,SC,32.88,-79.99,SOCIAL MEDIA REPORT OF QUARTER SIZE HAIL AT PARK CIRCLE (CHS)
2049,100,4 SSE CLYDE,HAYWOOD,NC,35.47,-82.9,HAIL RANGED FROM PEA TO QUARTER-SIZED ACROSS THE LOCALLY KNOWN AREA OF BETHEL...WITHIN WOODROW...NC. THIS SITE RECEIVED 1.1 INCHES OF RAIN FROM THE STORM. (GSP)
2256,100,INDIANAPOLIS,MARION,IN,39.78,-86.15,(IND)
2257,175,3 SE PANORA,GUTHRIE,IA,41.66,-94.32,. (DMX)
2300,100,OTTAWA,LA SALLE,IL,41.35,-88.84,INTERSECTION OF BOYCE MEMEORIAL DRIVE AND OTTAWA AVENUE. (LOT)
2319,100,1 NNW EATON,PREBLE,OH,39.76,-84.64,QUARTER SIZED HAIL REPORTED AT PREBLE COUNTY DISPATCH. TIME ESTIMATED FROM RADAR. (ILN)
0017,100,1 N RUSSELLVILLE,FRANKLIN,AL,34.52,-87.73,(HUN)
0024,175,3 W GEUDA SPRINGS,SUMNER,KS,37.11,-97.2,REPORTED BY KAKE NEWS. (ICT)
0032,100,5 NNE RUSSELLVILLE,FRANKLIN,AL,34.57,-87.68,(HUN)
0045,150,RICHLAND,PULASKI,MO,37.86,-92.4,PICTURE FROM SOCIAL MEDIA. TIME WAS ESTIMATED BY RADAR. (SGF)
0109,100,5 W ARKANSAS CITY,COWLEY,KS,37.07,-97.13,(ICT)
0110,175,CAMDENTON,CAMDEN,MO,38.01,-92.74,(SGF)
0124,150,5 S GEUDA SPRINGS,SUMNER,KS,37.04,-97.15,(ICT)
0126,100,1 NW ARKANSAS CITY,COWLEY,KS,37.08,-97.05,(ICT)
0139,100,1 N CAMDENTON,CAMDEN,MO,38.02,-92.74,QUARTER SIZE HAIL REPORTED JUST NORTH OF CAMDENTON (SGF)
0147,150,6 SW GEUDA SPRINGS,SUMNER,KS,37.05,-97.23,(ICT)
0348,100,1 S GOODLAND,SHERMAN,KS,39.33,-101.71,LASTED A MINUTE. MOSTLY PEA SIZE HAIL WITH SOME NICKEL SIZE AND A FEW QUARTER SIZE HAIL. (GLD)
0442,217,1 SW HILLSDALE,GARFIELD,OK,36.55,-98.01,(OUN)
0445,100,6 ESE GARBER,GARFIELD,OK,36.4,-97.48,(OUN)
0510,100,ENID,GARFIELD,OK,36.4,-97.88,(OUN)
