Time,F_Scale,Location,County,State,Lat,Lon,Comments
1014,UNK,2 W VERONA,LEE,MS,34.19,-88.75,A COUPLE LARGE TREES DOWN AND DAMAGE FROM FALLING TREE AND BRANCHES TO A PICKUP TRUCK AND CAR IN COMMUNITY OF PALMETTO. ROOF BLOWN OFF A BUILDING. MOBILE HOME DAMAGE ON (MEG)
1015,UNK,5 NE NEW ORLEANS,ORLEANS,LA,30.02,-90.02,REPORTS BY WWL TV OF A TREE DOWN ON A HOUSE IN NEW ORLEANNS EAST. (LIX)
1015,UNK,1 E LOUIN,JASPER,MS,32.07,-89.24,TREES AND POWERLINES DOWN ON COUNTY ROAD 16 EAST OF LOUIN. (JAN)
1018,UNK,3 N WEST HATTIESBURG,FORREST,MS,31.36,-89.38,TREE DOWNED AT LAKE ESTATES DRIVE AND PINE TREE DRIVE. (JAN)
1022,UNK,5 NNW KILN,HANCOCK,MS,30.48,-89.47,TREE DOWN ON CUEVAS TOWN RD NEAR SAVANNAH CURVE. (LIX)
1022,UNK,11 ENE NOXAPATER,WINSTON,MS,33.05,-88.89,ROOF DAMAGE TO A HOUSE AND OUTBUILDING. WOOD SUPPORT COLUMNS FOR A PORCH ALSO BLOWN OUT. MULTIPLE LARGE LIMBS DOWN AS WELL. PICTURES RELAYED VIA SOCIAL MEDIA. LOCATION (JAN)
1022,UNK,1 NE BALDWYN,PRENTISS,MS,34.51,-88.62,A FEW TREES DOWN. AWNINGS BLOWN OFF NEAR WHEELER SCHOOL IN THE COMMUNITY OF WHEELER. (MEG)
1025,UNK,2 S DECATUR,NEWTON,MS,32.41,-89.12,SEVERAL TREES DOWN AROUND THE COUNTY. (JAN)
1030,UNK,2 W VERONA,LEE,MS,34.19,-88.75,A LARGE TREE DOWN AND DAMAGE FROM FALLING TREE AND BRANCHES TO A PICKUP TRUCK IN COMMUNITY OF PALMETTO. (MEG)
1035,60,PERKINSTON,STONE,MS,30.78,-89.14,WEATHER STATION AT MISSISSIPPI GULF COAST COMMUNITY COLLEGE PERKINSTON RECORDED WIND GUST OF 60 MPH. (MOB)
1036,UNK,6 NNE SNELL,LAUDERDALE,MS,32.28,-88.47,SEVERAL TREES DOWN IN THE WHYNOT AREA. REPORT RELAYED VIA SOCIAL MEDIA. (JAN)
1038,UNK,9 W ENTERPRISE,JASPER,MS,32.16,-88.97,TREE DOWN ACROSS COUNTY ROAD 5133 NORTHEAST OF ROSE HILL. (JAN)
1040,UNK,13 E PURVIS,FORREST,MS,31.13,-89.2,A FEW TREES DOWN BETWEEN MCLAURIN AND BROOKLYN. REPORT RELAYED VIA SOCIAL MEDIA. (JAN)
1040,UNK,1 ENE LAUREL,JONES,MS,31.7,-89.14,TREES DOWN THROUGHOUT THE COUNTY. (JAN)
1045,UNK,7 W LYMAN,HARRISON,MS,30.5,-89.25,HARRISON COUNTY SHERIFFS OFFICE REPORTS A TREE DOWN NEAR THE INTERSECTION OF LIZANA SCHOOL RD AND CABLE BRIDGE RD NEAR LYMAN... MS. (LIX)
1045,UNK,WIGGINS,STONE,MS,30.86,-89.13,AT LEAST 20 ROADS HAVE TREES DOWN ACROSS THEM (COUNTY WIDE IN STONE COUNTY). (MOB)
1045,UNK,RUNNELSTOWN,PERRY,MS,31.38,-89.11,SEVERAL TREES DOWN IN THE RUNNELSTOWN AND RICHTON AREAS OF PERRY COUNTY. (MOB)
1045,UNK,RED BAY,FRANKLIN,AL,34.44,-88.14,TREES DOWN AROUND RED BAY. (HUN)
1046,UNK,2 N JANICE,PERRY,MS,31.05,-89.04,TREES DOWN ON BRYANT ROAD NEAR DAVIS ROAD. (MOB)
1052,UNK,6 E LYMAN,HARRISON,MS,30.5,-89.03,A HARRISON COUNTY EMPLOYEE REPORTS TREES DOWN ON FELLER DRIVE AND GARCIA DRIVE... WHICH IS ABOUT A MILE SOUTH OF THE INTERSECTION OF MS-605 AND MS-67... NEAR LYMAN... M (LIX)
1100,UNK,1 E GOLDEN,TISHOMINGO,MS,34.49,-88.17,POWER LINES DOWN ON GOLDEN ROAD JUST WEST OF RED BAY ALABAMA NEAR THE STATE LINE. (MEG)
1103,UNK,6 S MERIDIAN,LAUDERDALE,MS,32.29,-88.69,POWER LINES DOWN ALONG HWY 45 NEAR THE CLARKDALE WATER DEPARTMENT. REPORT RELAYED VIA SOCIAL MEDIA. (JAN)
1109,UNK,1 N COLUMBUS,LOWNDES,MS,33.52,-88.4,TREE DOWN AT THE INTERSECTION OF RIDGE RD AND MILITARY RD. REPORT RELAYED VIA SOCIAL MEDIA. (JAN)
1112,UNK,5 NE HODGES,FRANKLIN,AL,34.38,-87.87,TREE DOWN ON AL 187. (HUN)
1113,UNK,BILOXI,HARRISON,MS,30.42,-88.93,BILOXI FIRE DEPARTMENT REPORTS POWER LINE DOWN NEAR 128 LAMEUSE ST IN BILOXI... MS. (LIX)
1119,UNK,QUITMAN,CLARKE,MS,32.04,-88.72,SEVERAL TREES DOWN AROUND THE QUITMAN AREA. REPORT RELAYED VIA SOCIAL MEDIA. (JAN)
1123,UNK,LEAKESVILLE,GREENE,MS,31.15,-88.55,EMERGENCY MANAGER REPORTS NUMEROUS TREES DOWN THROUGHOUT GREENE COUNTY MS. TIME ESTIMATED BY RADAR. (MOB)
1124,UNK,OCEAN SPRINGS,JACKSON,MS,30.41,-88.8,POWERLINES DOWN ALONG HWY 90... TREES DOWN IN PARKTOWN EASTNEIGHBORHOOD... AND DAMAGE AT WAL-MART IN OCEAN SPRINGS. RELAYED VIA SOCIAL MEDIA (LIX)
1126,UNK,W ESCATAWPA,JACKSON,MS,30.49,-88.55,REPORTS OF A ROOF OFF ON KENSHAW... PRESCOTT... AND RIVERLODGE ROADS IN ESCATAWPA... MS. (LIX)
1135,UNK,WAYNESBORO,WAYNE,MS,31.68,-88.64,SEVERAL TREES DOWN COUNTY WIDE ACROSS WAYNE COUNTY. (MOB)
1136,UNK,6 NNE SNELL,LAUDERDALE,MS,32.28,-88.47,CORRECTS TIME OF PREVIOUS TSTM WND DMG REPORT FROM 6 NNE SNELL. SEVERAL TREES DOWN IN THE WHYNOT AREA. REPORT RELAYED VIA SOCIAL MEDIA. (JAN)
1136,UNK,1 S FLORENCE,LAUDERDALE,AL,34.81,-87.67,POWER LINE IN TREES. (HUN)
Time,Size,Location,County,State,Lat,Lon,Comments
