Time,F_Scale,Location,County,State,Lat,Lon,Comments
Time,Speed,Location,County,State,Lat,Lon,Comments
1200,65,2 NE DIMMITT,CASTRO,TX,34.57,-102.29,WEST TEXAS MESONET REPORT (LUB)
1200,UNK,CARAWAY,CRAIGHEAD,AR,35.76,-90.33,TREES DOWN...LARGE LIMBS...SHED CRUSHED BY TREE. (MEG)
1233,UNK,JONESBORO,CRAIGHEAD,AR,35.82,-90.69,FRAME-ONLY CONSTRUCTION PROJECT COLLAPSED ON POST ROAD. (MEG)
1302,61,1 E CANYON,RANDALL,TX,34.98,-101.9,61 MPH GUST ON EAST SIDE OF CANYON NEAR WTAMU EVENTS CENTER (AMA)
1305,UNK,CANYON,RANDALL,TX,34.98,-101.92,TWO SEMI TRUCKS OVERTURNED ALONG I27 (AMA)
1639,UNK,MANCHESTER CENTER,ONTARIO,NY,42.98,-77.18,3-4 INCH DIAMETER TREE BRANCH DOWN IN ROAD...REPORTED BY POSTAL CARRIER. (BUF)
1735,UNK,NASHVILLE,DAVIDSON,TN,36.17,-86.78,OVER 25 REPORTS OF TREES AND POWERLINES DOWN CITYWIDE REPORTED FROM OEM (OHX)
1738,UNK,FRANKLIN,WILLIAMSON,TN,35.93,-86.84,TREES AND POWERLINES DOWN ALONG A FEW ROADS IN FRANKLIN FROM GUST FRONT WINDS. (OHX)
1747,UNK,MOUNT JULIET,WILSON,TN,36.21,-86.52,TREES AND POWER LINES DOWN ALONG SADDLEWOOD DRIVE WITH THE GUST FRONT (OHX)
1809,77,2 NNE SMYRNA,RUTHERFORD,TN,36.01,-86.5,66 KNOTS REPORTED AT KMQY. (OHX)
1814,63,1 NE DECATUR,WISE,TX,33.24,-97.59,KLUD (FWD)
1833,UNK,CARTHAGE,SMITH,TN,36.26,-85.94,MULTIPLE TREES DOWN AROUND TOWN (OHX)
1838,73,3 W DENTON,DENTON,TX,33.22,-97.2,KDTO (FWD)
1845,62,PILOT POINT,DENTON,TX,33.4,-96.97,MEASURED AT THE INTERSECTION OF 377 AND 455 (FWD)
1852,UNK,CARTHAGE,SMITH,TN,36.26,-85.94,TREES DOWN ACROSS THE COUNTY. (OHX)
1855,UNK,HASLET,TARRANT,TX,32.97,-97.35,SHINGLES BLOWN OFF ROOF IN HASLET (FWD)
1900,60,GRAPEVINE,TARRANT,TX,32.93,-97.08,REPORT FROM FORMER NWS MET (FWD)
1902,UNK,4 SW GAINESBORO,JACKSON,TN,36.32,-85.7,TREES AND POWERLINES DOWN. (OHX)
1916,UNK,4 NNW COOKEVILLE,PUTNAM,TN,36.21,-85.53,TREES DOWN NEAR THE INTERSECTION OF KNIGHTS CHAPEL ROAD AND SHIPLEY ROAD. (OHX)
1916,UNK,CELINA,CLAY,TN,36.55,-85.5,SEVERAL TREES BLOWN DOWN ACROSS CLAY COUNTY WITH POWER OUTAGES (OHX)
1916,UNK,BYRDSTOWN,PICKETT,TN,36.57,-85.13,TREE DOWN ON HOUSE IN BYRDSTOWN ON MAIN STREET...ALSO POWER OUTAGES REPORTED. (OHX)
1920,UNK,7 WNW LIVINGSTON,OVERTON,TN,36.41,-85.44,WINDS ESTIMATED AT OVER 50 MPH. TREE FELL ON HOME. (OHX)
1922,60,3 NW SPARTA,WHITE,TN,35.97,-85.51,WIND IN EXCESS OF 60 MPH 3.2 MILES NW OF SPARTA AIRPORT WITH TREE LIMBS DOWN IN ROADWAY. (OHX)
1925,UNK,GUNTER,GRAYSON,TX,33.45,-96.75,14 INCH DIAMETER TREE WAS KNOCKED DOWN IN GUNTER (FWD)
1926,UNK,GAINESBORO,JACKSON,TN,36.36,-85.65,TREES DOWN ACROSS JACKSON COUNTY...WITH POWER OUT IN HALF THE COUNTY. (OHX)
1927,UNK,PROSPERITY,NEWBERRY,SC,34.21,-81.53,NUMEROUS TREES AND POWERLINES DOWN IN PROSPERITY. (CAE)
1931,UNK,MCKINNEY,COLLIN,TX,33.2,-96.62,POWER POLES WERE BLOWN DOWN AT THE INTERSECTION OF VIRGINA AND GRAVES (FWD)
1931,UNK,5 N MAUD,BOWIE,TX,33.4,-94.35,LARGE OAK TREE SPLIT IN HALF AND DOWNED ON A CARPORT ROOF AND PICKUP TRUCK...SIGNIFICANT DAMAGE (SHV)
1933,68,4 ESE MCKINNEY,COLLIN,TX,33.18,-96.56,KTKI (FWD)
1936,UNK,4 SSE CHARLOTTE,MECKLENBURG,NC,35.14,-80.82,TWO TREES DOWN ON COLONY ROAD IN THE MYERS PARK AREA. REPORT RECEIVED FROM SOCIAL MEDIA. (GSP)
1942,UNK,8 W LIVINGSTON,OVERTON,TN,36.39,-85.47,TREE FELL ON HOUSE ON OLD UNION ROAD IN HILHAM. (OHX)
1943,69,GARLAND,DALLAS,TX,32.92,-96.63,69 MPH WIND GUST IN GARLAND (FWD)
1949,65,PRINCETON,COLLIN,TX,33.18,-96.5,(FWD)
1950,UNK,PILOT GROVE,GRAYSON,TX,33.43,-96.43,A LARGE TREEN WAS KNOCKED OVER DUE TO HIGH WINDS (FWD)
1952,UNK,1 SE GLOVERVILLE,AIKEN,SC,33.52,-81.8,TREES AND POWERLINES DOWN NEAR LANGLEY (CAE)
1959,UNK,ALLARDT,FENTRESS,TN,36.38,-84.88,LARGE TREE BLOCKING TRAFFIC ON MOUNT HELEN ROAD IN ALLARDT. CAUSED A TRAFFIC ACCIDENT WITH NO INJURIES. (OHX)
2000,UNK,MONTICELLO,WAYNE,KY,36.84,-84.85,TREES DOWN. (JKL)
2010,UNK,2 W MOUNT VICTORY,PULASKI,KY,37.03,-84.42,TWO TREES DOWN IN POPLARVILLE ON 3269. (JKL)
2014,UNK,5 S STALLINGS,UNION,NC,35.01,-80.68,A FEW TREES DOWN IN THIS AREA. MONROE REGIONAL AIRPORT HAD A 40 KNOT GUST AT 414 PM WHICH IS LESS THAN FIVE MILES FROM THIS AREA. OTHER REPORTS OF PEA TO MARBLE SIZED H (GSP)
2018,UNK,6 N POMARIA,NEWBERRY,SC,34.35,-81.42,NEWBERRY ELECTRIC REPORTED TREE DOWN ON POWER LINE IN THE RAWL ROAD AREA. (CAE)
2024,UNK,PARIS,LAMAR,TX,33.65,-95.53,TREES AND POWERLINES DOWN IN THE CITY OF PARIS (FWD)
2025,UNK,3 WSW APPLETON,ALLENDALE,SC,33.03,-81.42,SC HIGHWAY PATROL REPORTS A TREE DOWN ON ROAD AT INTERSECTION OF REVOLUTIONARY ROAD AND HIGHWAY 3. (CHS)
2030,UNK,BIG SOUTH FORK NATIONAL,SCOTT,TN,36.52,-84.67,FEW TREES DOWN (MRX)
2030,UNK,NANCY,PULASKI,KY,37.07,-84.75,LARGE TREE ACROSS MOBILE HOME. (JKL)
2032,UNK,PINE KNOT,MCCREARY,KY,36.66,-84.44,LIMBS AS BIG AS FOREARM IN YARD. POWER IS OUT. PEA SIZED HAIL. (JKL)
2035,UNK,6 SW HUNTSVILLE,SCOTT,TN,36.35,-84.56,FEW TREES DOWN IN ROBBINS (MRX)
2040,UNK,1 SSW STEARNS,LEE,KY,37.57,-83.65,SMALL TREES WERE BLOWN DOWN ON HWY 742 A MILE AND A HALF SOUTHWEST OF REVELO. (JKL)
2043,UNK,SHOPVILLE,PULASKI,KY,37.16,-84.48,TREE LIMBS COMING DOWN AROUND THE SCHOOL AT SHOPVILLE. (JKL)
2043,UNK,HARRODSBURG,MERCER,KY,37.77,-84.85,ONE TREE REPORTED DOWN. (LMK)
2047,UNK,GHENT,COLUMBIA,NY,42.33,-73.62,MULTIPLE TREES DOWN. (ALY)
2048,UNK,WHITLEY CITY,MCCREARY,KY,36.72,-84.48,TREES WERE BLOWN DOWN IN DOWNTOWN WHITLEY CITY. (JKL)
2050,UNK,ALFORD,BERKSHIRE,MA,42.24,-73.41,TREES AND WIRES DOWN. ROUTE 71 CLOSED. 10-15 TREES SHEARED OFF. (ALY)
2100,UNK,5 S ROCKY BOTTOM,PICKENS,SC,34.98,-82.8,2 TREES DOWN 2 MILES SE OF VINEYARDS FIRE DISTRICT (GSP)
2100,UNK,WILLIAMSBURG,WHITLEY,KY,36.74,-84.17,A FEW TREES DOWN IN OAK GROVE AREA OF WILLIAMSBURG. (JKL)
2100,UNK,WOODBINE,WHITLEY,KY,36.9,-84.09,TREES REPORTED DOWN IN WOODBINE COMMUNITY. (JKL)
2100,UNK,MOUNT VERNON,ROCKCASTLE,KY,37.36,-84.34,TREES DOWN IN MOUNT VERNON ON RICHMOND STREET AND ALSO AT THE JUNCTION OF 150 AND 25. (JKL)
2100,UNK,LEXINGTON,FAYETTE,KY,38.04,-84.46,SEVERAL TREES DOWN. (LMK)
2100,UNK,4 NW LEXINGTON,SCOTT,IN,38.69,-85.67,SEVERAL TREES DOWN. (LMK)
2110,UNK,MALDEN,DUNKLIN,MO,36.58,-89.98,WINDS MEASURED AT 60 MPH. SCATTERD TREE LIMBS DOWN ON HOMES AND POWER LINES AND SOME CARS. (MEG)
2115,UNK,CORBIN,WHITLEY,KY,36.94,-84.11,TREES DOWN. REPORT VIA SOCIAL MEDIA. (JKL)
2115,UNK,KEAVY,LAUREL,KY,37,-84.17,LARGE TREE DOWN. (JKL)
2115,UNK,GEORGETOWN,SCOTT,KY,38.2,-84.55,TREES REPORTED DOWN. (LMK)
2120,UNK,SANDGAP,JACKSON,KY,37.48,-84.09,TREE DOWN ON A HOUSE. (JKL)
2120,UNK,RICHMOND,MADISON,KY,37.74,-84.29,HOTEL SIGN DOWN ON TRUCK. (LMK)
2124,UNK,2 SW BOONEVILLE,OWSLEY,KY,37.46,-83.71,TREE DOWN ON HIGHWAY 1938. (JKL)
2125,UNK,ANNVILLE,JACKSON,KY,37.32,-83.96,TREE DOWN ON HWY 3630 NEAR ANNVILLE. (JKL)
2130,UNK,1 E INDIANTOWN,MARTIN,FL,27.02,-80.46,MARTIN COUNTY FIRE RESCUE REPORTED 12 INCH DIAMETER 15-20 FT PALM TREE FELL ONTO VEHICLE ON SW SEMINOLE DRIVE. TIME ESTIMATED FROM RADAR. (MLB)
2130,UNK,DE QUEEN,SEVIER,AR,34.04,-94.34,NUMEROUS TREES DOWN (SHV)
2130,UNK,FOURMILE,BELL,KY,36.79,-83.74,TREES DOWN ON POWERLINES NEAR LONE JACK SCHOOL. (JKL)
2130,UNK,BUSH,CLAY,KY,37.09,-83.87,POWERLINE DOWN ON HWY 80 EAST (JKL)
2140,UNK,ARNETT,OWSLEY,KY,37.41,-83.57,LARGE TREE DOWN ON HWY 28. (JKL)
2145,UNK,6 N BELTON,BELL,TX,31.16,-97.47,LARGE TREE FELL ON A CAR NEAR MORGANS POINT (FWD)
2145,UNK,5 NW PITTSBURG,CAMP,TX,33.05,-95.03,A TREE ON A HOME (SHV)
2145,UNK,TRAVELLERS REST,OWSLEY,KY,37.45,-83.79,TREE DOWN ON HWY 30. (JKL)
2145,UNK,1 S BILSBORO,ONTARIO,NY,42.78,-76.98,REPORT OF A LARGE TREE AND POWER POLE DOWN. (BUF)
2148,UNK,WATERLOO,SENECA,NY,42.9,-76.86,TREES REPORTED DOWN AT THE INTERSECTION STATE ROUTE 96 AND BURGESS ROAD IN THE VILLAGE OF WATERLOO. (BGM)
2152,UNK,COPAKE,COLUMBIA,NY,42.1,-73.55,WIRES DOWN. ROUTE 7A NEAR MOUNTAIN VIEW RD (ALY)
2155,62,5 E QUITMAN,WOOD,TX,32.8,-95.36,MEASURED ON HIGHWAY 154 EAST OF QUITMAN (SHV)
2158,UNK,SALISBURY,LITCHFIELD,CT,41.98,-73.42,MULTIPLE TREES ON POWERLINES. (ALY)
2200,UNK,2 NNW LONG CREEK,OCONEE,SC,34.8,-83.27,SEVERAL BRANCHES DOWN,PEA-SIZED HAIL (GSP)
2200,UNK,HAPPY VALLEY,BLOUNT,TN,35.61,-83.96,TREES AND POWERLINES DOWNED IN HAPPY VALLEY. REPORTED BY DISPATCH. (MRX)
2200,UNK,GREENEVILLE,GREENE,TN,36.17,-82.82,TREES DOWN COUNTYWIDE (MRX)
2205,UNK,MINEOLA,WOOD,TX,32.67,-95.49,LARGE TREE DOWN ON HWY 69 IN MINEOLA (SHV)
2205,UNK,HARLAN,HARLAN,KY,36.84,-83.32,TREE DOWN ON US 421. (JKL)
2205,UNK,FRENCHBURG,MENIFEE,KY,37.95,-83.62,NUMEROUS TREES DOWN IN FRENCHBURG AND AROUND THE COUNTY. (JKL)
2207,UNK,DE KALB,BOWIE,TX,33.51,-94.62,NUMEROUS TREES DOWN (SHV)
2208,UNK,3 NE JACKSON,BREATHITT,KY,37.59,-83.34,TREE DOWN 1 MILE NORTH OF HIGHWAY 30 ON AIRPORT ROAD. (JKL)
2209,UNK,4 WSW AKRON,TUSCOLA,MI,43.55,-83.58,POWER POLES DOWN. RADAR ESTIMATED TIME. (DTX)
2210,UNK,2 NW KENDAIA,SENECA,NY,42.77,-76.91,TREE LIMBS WERE GOING HORIZONTAL WITH WIND SPEED ESTIMATED AT 50 TO 55 MPH (BGM)
2210,UNK,SACKETS HARBOR,JEFFERSON,NY,43.94,-76.12,TREE DOWN (BUF)
2215,UNK,PRIDGEN,COFFEE,GA,31.7,-82.92,THE EMERGENCY MANAGEMENT RECEIVED A REPORT OF AN OAK TREE DOWN AND SEVERAL SMALLER TREES DOWN JUST NORTH OF PRIDGEN. THE TREES WERE NOT BLOCKING ROADWAYS. THE TIME GIVE (JAX)
2215,UNK,2 NW DICE,PERRY,KY,37.38,-83.25,ROOF DAMAGE TO HOMES NEAR THE AIRPORT. (JKL)
2215,UNK,LAKEVILLE,LITCHFIELD,CT,41.96,-73.44,TREES AND WIRES DOWN. (ALY)
2218,UNK,NEW BOSTON,BOWIE,TX,33.46,-94.42,TREE DOWN ON A HOUSE ON FM1849 (SHV)
2218,UNK,3 N CORNETTSVILLE,PERRY,KY,37.17,-83.08,TREES DOWN INCLUDING ONE ON A HOUSE ON BIG BRANCH IN THE FUSONIA/KODAK AREA. (JKL)
2220,UNK,3 WNW BEN LOMOND,SEVIER,AR,33.86,-94.16,TREES DOWN ON HWY 71 NEAR FALLS CHAPEL (SHV)
2222,UNK,ADELE,MORGAN,KY,37.76,-83.3,TWO TREES DOWN NEAR INTERSECTION OF HWY 119 AND 134. (JKL)
2222,UNK,SKANEATELES,ONONDAGA,NY,42.95,-76.43,POWER POLE DOWN WITH WIRES (BGM)
2222,UNK,1 E HUBBARD CROSSING,JEFFERSON,NY,44.06,-75.63,TREE REPORTED DOWN (BUF)
2228,UNK,1 N CAMP LEWIS,BREATHITT,KY,37.6,-83.19,LARGE TREE LIMBS WERE DOWNED. (JKL)
2230,UNK,MARYVILLE,BLOUNT,TN,35.75,-83.97,COUPLE TREES DOWN. (MRX)
2230,UNK,SEVIERVILLE,SEVIER,TN,35.89,-83.58,FEW TREES DOWN ACROSS THE COUNTY. (MRX)
2230,UNK,DANDRIDGE,JEFFERSON,TN,36.02,-83.42,MANY TREES DOWNED COUNTY-WIDE MAINLY NEAR DANDRIDGE. (MRX)
2230,UNK,LYNCH,HARLAN,KY,36.96,-82.91,TWO TREES DOWN ON HWY 160. (JKL)
2230,UNK,MAYSVILLE,MASON,KY,38.63,-83.78,SMALL OUT-BUILDING BLOWN. 2 TREES DOWN,ONE ACROSS HWY 8. (ILN)
2230,UNK,CANTON,ST. LAWRENCE,NY,44.6,-75.17,TELEPHONE POLE DOWN ACROSS PINK SCHOOLHOUSE RD AND TREES AND WIRES DOWN ALONG COUNTY RTE 21 (BTV)
2233,UNK,LONGVIEW,GREGG,TX,32.52,-94.76,LARGE TREE DOWN ON DUNDEE ROAD (SHV)
2233,UNK,FORAKER,MAGOFFIN,KY,37.66,-83.14,A TREE WAS BLOWN DOWN. (JKL)
2240,UNK,NILES,CAYUGA,NY,42.83,-76.4,REPORT OF BARN BLOWN DOWN AND A LARGE AREA OF TREES DOWN IN AND AROUND NILES. (BGM)
2245,UNK,NESBITT,HARRISON,TX,32.59,-94.45,MULTIPLE TREES DOWN ON HWY 154 NEAR NESBITT (SHV)
2245,UNK,N LONG CREEK,OCONEE,SC,34.77,-83.26,MULTIPLE TREES DOWN IN VICINITY (GSP)
2245,UNK,SSE CASS CITY,TUSCOLA,MI,43.6,-83.17,6 TO 8 INCH DIAMETER TREE LIMBS DOWN. (DTX)
2246,UNK,1 SE BRAINARD,FLOYD,KY,37.65,-82.88,TWO TREES WERE BLOWN DOWN BETWEEN MILEMARKERS 2 AND 4 ALONG KY HIGHWAY 114. (JKL)
2249,UNK,NEDROW,ONONDAGA,NY,42.98,-76.13,TREE DOWN ON A HOUSE (BGM)
2255,UNK,1 NW LITTLE SANDY,ELLIOTT,KY,38.07,-83.2,TREE DOWN ON HWY 173. (JKL)
2300,UNK,2 NW PRIDGEN,COFFEE,GA,31.72,-82.94,A COCORAHS OBSERVER REPORTED TREE LIMBS DOWN WHICH WERE UP TO 4 INCHES IN DIAMETER. (JAX)
2300,UNK,LONGVIEW,GREGG,TX,32.52,-94.76,MULTIPLE TREES DOWN ACROSS THE COUNTY (SHV)
2300,UNK,HAGERHILL,JOHNSON,KY,37.79,-82.79,MULTIPLE TREES DOWN IN HAGERHILL AND VAN LEAR COMMUNITIES. (JKL)
2300,UNK,PREBLE,CORTLAND,NY,42.73,-76.13,TREE DOWN BLOCKING ROUTE 11 (BGM)
2300,60,TULLY,ONONDAGA,NY,42.8,-76.11,SMALL HAIL AND HEAVY RAIN ALSO REPORTED. (BGM)
2310,UNK,TYLER,SMITH,TX,32.33,-95.3,TREES DOWN THROUGHOUT THE COUNTY (SHV)
2310,UNK,SCIPIO CENTER,CAYUGA,NY,42.78,-76.53,TREES DOWN (BGM)
2311,UNK,GILSUM,CHESHIRE,NH,43.05,-72.27,TREE DOWN ON WIRES NEAR THE SURRY LINE (BOX)
2314,UNK,3 NW SIDNEY,PIKE,KY,37.65,-82.39,TREE DOWN ON ROCKHOUSE FORK. (JKL)
2315,UNK,DOUGLAS,COFFEE,GA,31.51,-82.85,THE 911 CALL CENTER RECEIVED REPORTS OF TREES AND POWERLINES DOWN IN DOUGLAS. THE TIME GIVEN WAS BASED ON RADAR. (JAX)
2315,UNK,LEWISVILLE,LAFAYETTE,AR,33.36,-93.58,TREES DOWN IN LEWISVILLE (SHV)
2315,UNK,ALMOND,SWAIN,NC,35.37,-83.57,MULTIPPLE TREES DOWN IN VICINITY,ALMOND POST OFFICE LOST POWER (GSP)
2315,UNK,MORRISTOWN,HAMBLEN,TN,36.21,-83.3,12 TREES DOWN ACROSS THE COUNTY. (MRX)
2320,UNK,REIDLAND,MCCRACKEN,KY,37.01,-88.53,LARGE TREE DOWN (PAH)
2320,UNK,INEZ,MARTIN,KY,37.87,-82.54,TREE AND POWERLINE DOWN ON TURKEY CREEK. (JKL)
2330,UNK,HALLSVILLE,HARRISON,TX,32.5,-94.58,TREES DOWN IN HALLSVILLE (SHV)
2330,UNK,JEFFERSON CITY,JEFFERSON,TN,36.12,-83.49,FEW TREES DOWN NEAR EAST DUMPLIN VALLEY RD. (MRX)
2330,UNK,2 ESE ULYSSES,LAWRENCE,KY,37.94,-82.66,TREE DOWN ALONG 1690 IN THE CHERRYVILLE AREA...TIME ESTIMATED FROM RADAR (RLX)
2332,UNK,LAKE PLACID,ESSEX,NY,44.28,-73.98,FRANKLIN COUNTY EM DISPATCHER ALSO REPORTED TREES DOWN ON POWERLINES IN LAKE PLACID. (BTV)
2332,UNK,PAUL SMITHS,FRANKLIN,NY,44.44,-74.25,FRANKLIN CTY EM DISPATCHER REPORTED TREES DOWN ON POWERLINE WIRES IN PAUL SMITHS (BTV)
2333,58,VERNON CENTER,ONEIDA,NY,43.05,-75.52,ESTIMATE 50 TO 60 MPH WINDS AND SMALL HAIL (BGM)
2335,UNK,1 W DELBARTON,MINGO,WV,37.7,-82.2,TREE DOWN ON 52 JUST WEST OF DELBARTON...TIME ESTIMATED FROM RADAR (RLX)
2340,UNK,BREEDEN,MINGO,WV,37.92,-82.27,TREE DOWN ON ROUTE 3 5...TIME ESTIMATED FROM RADAR (RLX)
2345,UNK,WILLACOOCHEE,ATKINSON,GA,31.34,-83.05,THE LAW ENFORCEMENT IN WILLACOOCHEE REPORTED TREES DOWN. THE TIME GIVEN WAS BASED ON RADAR. (JAX)
2345,UNK,JACKSONVILLE,CHEROKEE,TX,31.97,-95.26,POWER LINES DOWN ALONG HWY 79 (SHV)
2348,UNK,PLAIN DEALING,BOSSIER,LA,32.91,-93.7,TREES DOWN IN PLAIN DEALING (SHV)
2350,UNK,2 NW GREENVILLE,WASHINGTON,MS,33.41,-91.08,A LARGE TREE IS DOWN IN THE ROAD ALONG WITH SNAPPED POWER POLES AT INTERSECTION OF WASHINGTON AVE AND STALLINGS ST (JAN)
2355,UNK,HARTS,LINCOLN,WV,38.03,-82.13,MULTIPLE TREES DOWN IN THE TOWN OF HARTS...TIME ESTIMATED FROM RADAR (RLX)
2359,UNK,TROUP,SMITH,TX,32.14,-95.12,ROOF PEELED BACK ON A BARN (SHV)
0000,UNK,CARTHAGE,PANOLA,TX,32.15,-94.34,TREES DOWN IN CARTHAGE (SHV)
0000,UNK,MAUD,BOWIE,TX,33.33,-94.34,LARGE OAK TREE SPLIT IN HALF AND DOWNED ON A CARPORT ROOF AND PICKUP TRUCK...SIGNIFICANT DAMAGE (SHV)
0000,UNK,CLINTON,ONEIDA,NY,43.05,-75.38,MULTIPLE TREES DOWN ACROSS CENTRAL PART OF THE COUNTY FROM 745 PM TO 800 PM (BGM)
0006,UNK,4 SSE ALAPAHA,BERRIEN,GA,31.33,-83.21,3 TREES DOWN (TAE)
0009,60,MARION,CRITTENDEN,KY,37.33,-88.08,ONE TREE DOWN (PAH)
0015,UNK,6 S SHREVEPORT,CADDO,LA,32.39,-93.79,TREES DOWN ON CRABAPPLE DRIVE IN SOUTHERN HILLS SUBDIVISION (SHV)
0015,UNK,FRANKFORT HILL,HERKIMER,NY,43.04,-75.19,MULTIPLE TREES DOWN. (ALY)
0020,UNK,JACKSONVILLE,CHEROKEE,TX,31.97,-95.26,TREES DOWN IN JACKSONVILLE (SHV)
0020,UNK,GRAND CANE,DE SOTO,LA,32.08,-93.81,TREES DOWN IN GRAND CANE (SHV)
0020,UNK,COTTON VALLEY,WEBSTER,LA,32.81,-93.42,TREES DOWN ALL ACROSS THE PARISH (SHV)
0020,UNK,1 SW CLAYTON,RABUN,GA,34.87,-83.41,911 COMMS CENTER REPORTED ONE TREE DOWN ON MARSENGILL STREET AND POST OFFICE REPORTED LARGE LIMBS DOWN IN TIGER AREA. (GSP)
0024,UNK,GREENEVILLE,GREENE,TN,36.17,-82.82,TREES DOWN COUNTYWIDE (MRX)
0025,UNK,7 SSE BOSSIER CITY,BOSSIER,LA,32.42,-93.62,TREES DOWN IN TAYLORTOWN ALONG HWY 71 (SHV)
0027,UNK,ALKOL,LINCOLN,WV,38.16,-81.92,MULTIPLE TREES DOWN IN AND AROUND THE CITY OF ALKOL...TIME ESTIMATED FROM RADAR (RLX)
0030,UNK,11 E CARTHAGE,PANOLA,TX,32.14,-94.14,TREES DOWN IN DEADWOOD (SHV)
0030,UNK,MINDEN,WEBSTER,LA,32.62,-93.28,UTILITY POLE SNAPPED IN HALF IN BEAVER CREEK SUBDIVISION (SHV)
0030,UNK,HAMLIN,LINCOLN,WV,38.28,-82.1,MULTIPLE TREES DOWN IN AND AROUND THE TOWN OF HAMLIN...TIME ESTIMATED FROM RADAR (RLX)
0030,UNK,FRANKFORT,HERKIMER,NY,43.04,-75.07,TREES AND WIRES DOWN (ALY)
0030,UNK,DOLGEVILLE,HERKIMER,NY,43.1,-74.77,NUMEROUS TREES AND WIRES DOWN (ALY)
0034,UNK,SHREVEPORT,CADDO,LA,32.47,-93.8,TREE ON A HOUSE ON GREEN TERRACE (SHV)
0035,UNK,OPPENHEIM,FULTON,NY,43.07,-74.69,TREES AND WIRES DOWN ACROSS WESTERN PART OF COUNTY (ALY)
0042,UNK,JERICHO,CHITTENDEN,VT,44.5,-73,MULTIPLE BROADCAST MEDIA REPORTS OF A POWER LINE DOWN ON SKUNK HOLLOW ROAD IN JERICHO RESULTING IN ROAD CLOSURE. TIME ESTIMATED FROM RADAR. (BTV)
0045,UNK,HENDERSON,RUSK,TX,32.16,-94.8,TREES DOWN IN HENDERSON AND OTHER PARTS OF THE COUNTY (SHV)
0045,UNK,JONESBOROUGH,WASHINGTON,TN,36.29,-82.48,MANY TREES DOWNED COUNTY-WIDE (MRX)
0045,UNK,BLOUNTVILLE,SULLIVAN,TN,36.53,-82.33,TREES DOWN COUNTYWIDE (MRX)
0049,60,1 WNW SHANNON,OHIO,WV,40.17,-80.65,(PBZ)
0055,UNK,4 SSW NACOGDOCHES,NACOGDOCHES,TX,31.56,-94.68,TREES DOWN ON HWY 59 (SHV)
0055,UNK,TYLER,SMITH,TX,32.33,-95.3,LARGE TREE DOWN ON BROADWAY (SHV)
0055,UNK,SHREVEPORT,CADDO,LA,32.47,-93.8,TREE DOWN NEAR CRABAPPLE IN SOUTHERN HILLS (SHV)
0055,UNK,EL DORADO,UNION,AR,33.22,-92.66,LARGE TREE FELL ONTO A HOUSE...STRUCTURAL DAMAGE...NO INJURIES (SHV)
0055,60,ST. ALBANS,KANAWHA,WV,38.38,-81.82,60 FOOT TREE FELL AT A RESIDENCE ON PENNSYLVANIA AVENUE (RLX)
0056,UNK,FRANKFORT CENTER,HERKIMER,NY,43.05,-75.14,TWO TREES ACROSS FRANKFORT CENTER ROAD. (ALY)
0101,UNK,SSW CHARLESTON,KANAWHA,WV,38.35,-81.63,LARGE TREE DOWN ON RUFFNER AVENUE BLOCKING THE ROADWAY (RLX)
0107,UNK,ALTO,CHEROKEE,TX,31.65,-95.07,TREES DOWN IN ALTO (SHV)
0110,UNK,GALWAY,SARATOGA,NY,43.02,-74.03,TREE DOWN ON WIRES PARKIS HILL RD AT GRAVES RD (ALY)
0111,UNK,CONVERSE,SABINE,LA,31.78,-93.7,TREES DOWN IN CONVERSE (SHV)
0115,UNK,COUSHATTA,RED RIVER,LA,32.02,-93.34,TREES DOWN THROUGHOUT THE PARISH (SHV)
0115,UNK,13 NE CAMPTI,NATCHITOCHES,LA,32.03,-92.96,TREES DOWN (SHV)
0115,UNK,GIBSLAND,BIENVILLE,LA,32.54,-93.05,TREES DOWN IN GIBSLAND (SHV)
0115,UNK,AMSTERDAM,MONTGOMERY,NY,42.94,-74.19,ONE TREE DOWN ON RESIDENCE. (ALY)
0117,UNK,GLOVERSVILLE,FULTON,NY,43.05,-74.35,TREE ON HOUSE. (ALY)
0125,UNK,2 SW BUFFALO,WASHINGTON,PA,40.21,-80.38,COUPLE OF TREES DOWN IN HOPEWELL TOWNSHIP (PBZ)
0130,UNK,SIMSBORO,LINCOLN,LA,32.53,-92.78,TREES DOWN THROUGHOUT THE PARISH (SHV)
0130,UNK,ATHENS,CLAIBORNE,LA,32.65,-93.03,TREES DOWN IN ATHENS (SHV)
0130,UNK,CHARLESTON,TALLAHATCHIE,MS,34.01,-90.06,ONE MILE NORTH OF HIGHWAY 32...MEASURED 67 MPH WIND FROM THE NORTH...SEVERAL TREES DOWN (MEG)
0130,UNK,DERBY CENTER,ORLEANS,VT,44.96,-72.13,5 TREES DOWN WITH DAMAGE TO A FEW CARS. WINDS ESTIMATED 55-72 MPH. (BTV)
0145,UNK,DODSON,WINN,LA,32.08,-92.66,TREES DOWN ON A HOUSE IN DODSON (SHV)
0152,UNK,LINDEN,PERRY,TN,35.61,-87.84,SHERIFFS DEPT REPORTED A TREE DOWN ON OLD LINDEN HWY NEAR LINDEN. (OHX)
0155,UNK,HOOSICK FALLS,RENSSELAER,NY,42.9,-73.35,TREE DOWN ON ROUTE 7 NEAR MANN OF KENT TAVERN (ALY)
0157,UNK,HAMBURG,ASHLEY,AR,33.23,-91.8,REPORTS OF 4 TREES DOWN IN AND AROUND HAMBURG. (JAN)
0200,UNK,JONESBORO,JACKSON,LA,32.24,-92.71,NUMEROUS TREES DOWN THROUGHOUT THE PARISH (SHV)
0205,UNK,LOVELADY,HOUSTON,TX,31.13,-95.45,TREES AND POWERLINES REPORTED DOWN IN AND AROUND LOVELADY. (HGX)
0205,UNK,WINNFIELD,WINN,LA,31.92,-92.64,NUMEROUS TREES DOWN ACROSS THE PARISH (SHV)
0210,UNK,BASTROP,MOREHOUSE,LA,32.77,-91.91,MULTIPLE REPORTS OF TREES AND POWER LINES DOWN ACROSS THE SOUTHERN PART OF THE PARISH...GENERALLY BASTROP SOUTH. DMG OCCURRED BETWEEN 910-930PM. (JAN)
0210,UNK,3 W LAKE VILLAGE,CHICOT,AR,33.32,-91.34,SEVERAL TREES AND POWER LINES DOWN IN CENTRAL CHICOT CO (JAN)
0214,UNK,DORSET,BENNINGTON,VT,43.26,-73.1,TREE DOWN ON WIRES AT 8 CHURCH ST (ALY)
0215,UNK,MONROE,OUACHITA,LA,32.51,-92.08,TREES AND POWERLINES DOWN THROUGHOUT THE PARISH (SHV)
0243,UNK,COLUMBIA,CALDWELL,LA,32.1,-92.08,TREES DOWN THROUGHOUT THE PARISH (SHV)
0245,UNK,1 SE EUDORA,CHICOT,AR,33.11,-91.25,TREES AND POWER LINES DOWN JUST SOUTHEAST OF EUDORA (JAN)
0256,UNK,INDIANOLA,SUNFLOWER,MS,33.45,-90.64,REPORT OF A POWERLINE DOWN IN INDIANOLA. (JAN)
0303,UNK,3 N BELLEVUE,DAVIDSON,TN,36.13,-86.93,POWER LINES DOWN ON GOWEN ROAD IN WEST NASHVILLE (OHX)
0310,UNK,POLLOCK,GRANT,LA,31.52,-92.41,LARGE TREE DOWN IN POLLOCK (SHV)
0310,UNK,WINNSBORO,FRANKLIN,LA,32.16,-91.72,4 RDS WITH TREES BLOCKING THEM IN AND AROUND WINNSBORO (JAN)
0310,UNK,7 SSW LAKE PROVIDENCE,EAST CARROLL,LA,32.72,-91.23,REPORTS OF 4 POWERLINES DOWN AT 6289 HIGHWAY 580 AND A TREE DOWN ON HIGHWAY 134. (JAN)
0323,UNK,RINDGE,CHESHIRE,NH,42.75,-72.02,TREE AND WIRES DOWN ON ROUTE 119 (BOX)
0325,UNK,TALLULAH,MADISON,LA,32.41,-91.19,REPORTS OF A TREE AND POWERLINE DOWN IN THE CITY OF TALLULAH. (JAN)
0330,UNK,2 N CLAYTON,CATAHOULA,LA,31.75,-91.54,TREES DOWNED ACROSS A COUPLE OF ROADS (JAN)
0340,UNK,GRENADA,GRENADA,MS,33.78,-89.81,REPORTS OF TREES AND POWERLINES DOWN IN THE CITY OF GRENADA AND THROUGHOUT THE COUNTY. (JAN)
0343,UNK,JEFFERSON,CARROLL,MS,33.63,-89.89,SEVERAL TREES DOWN (JAN)
0348,UNK,1 S COILA,CARROLL,MS,33.38,-89.97,SEVERAL TREES DOWN (JAN)
0355,UNK,VICKSBURG,WARREN,MS,32.33,-90.87,REPORTS OF TREES DOWN AND POWER OUTAGES IN VICKSBURG. (JAN)
0400,UNK,OXFORD,LAFAYETTE,MS,34.36,-89.53,SIX STREETS BLOCKED BY TREES...NUMEROUS POWER LINES DOWN...TREE LIMBS AND DEBRIS CITY-WIDE. (MEG)
0410,UNK,5 ESE SATARTIA,YAZOO,MS,32.64,-90.47,REPORTS OF TREES DOWN ON ANDING OIL CITY ROAD AND HIGHWAY 433. ALSO A TREE FELL ON A FENCE OF A RESIDENCE ON HIGHWAY 433. (JAN)
0410,UNK,LEXINGTON,HOLMES,MS,33.12,-90.05,BIG LIMB DOWN ON POWER LINES. REPORT RELAYED THROUGH SOCIAL MEDIA. (JAN)
0415,UNK,1 SE WINONA,MONTGOMERY,MS,33.48,-89.71,A FEW TREES DOWN ALONG HWY 407 (JAN)
0420,UNK,EDWARDS,HINDS,MS,32.33,-90.6,POWER LINES DOWN (JAN)
0425,UNK,3 NW UTICA,HINDS,MS,32.13,-90.66,COUPLE TREES DOWN NW OF UTICA...ONE WAS DOWN ALONG HWY 27 NEAR THE TRACE. (JAN)
0425,UNK,FLORA,MADISON,MS,32.55,-90.31,REPORTS OF A TREE DOWN ON COX FERRY ROAD JUST WEST OF HIGHWAY 49. (JAN)
0429,60,TULA,LAFAYETTE,MS,34.23,-89.37,SPOTTER ESTIMATES WINDS NEAR 60 MPH AT INTERSECTION OF 436 AND 445. (MEG)
0430,UNK,2 S KILMICHAEL,MONTGOMERY,MS,33.41,-89.57,A FEW TREES DOWN ALONG HWY 413 (JAN)
0445,UNK,4 SSW RIDGELAND,HINDS,MS,32.37,-90.16,TREE DOWN ON W CO LINE RD (JAN)
0450,UNK,6 ENE CANTON,MADISON,MS,32.63,-89.94,REPORTS OF A TREE DOWN ON HIGHWAY 16 AND ALSO ON SHARON ROAD NEAR BROOKS ROAD. (JAN)
0457,UNK,4 NW EUPORA,WEBSTER,MS,33.58,-89.33,A FEW TREES DOWN ACROSS MT VERON RD (JAN)
0520,UNK,CARTHAGE,LEAKE,MS,32.74,-89.53,REPORTS OF TREES AND POWERLINES DOWN IN CARTHAGE ALONG HIGHWAY 35. (JAN)
0520,UNK,ACKERMAN,CHOCTAW,MS,33.31,-89.17,A FEW TREES DOWN ALONG WITH A POWER LINE. (JAN)
0525,UNK,4 NW STAR,RANKIN,MS,32.15,-90.09,REPORTS OF A TREE DOWN ON A HOUSE AT 520 SUNNY CIRCLE. (JAN)
0525,UNK,1 ENE PELAHATCHIE,RANKIN,MS,32.32,-89.79,REPORTS OF A TREE DOWN ON A POWERLINE ON 225 NORTH AVENUE. (JAN)
0935,UNK,DAISETTA,LIBERTY,TX,30.11,-94.64,TREES DOWN (HGX)
1030,UNK,ANAHUAC,CHAMBERS,TX,29.76,-94.68,TREES AND POWERLINES DOWN IN ANAHUAC. (HGX)
1030,UNK,WINNIE,CHAMBERS,TX,29.82,-94.38,TREES AND POWERLINES DOWN IN WINNIE. (HGX)
1044,78,1 N STOWELL,CHAMBERS,TX,29.8,-94.38,WIND GUST WAS MEASURED AT EAST CHAMBERS ELEMENTARY SCHOOL. (HGX)
Time,Size,Location,County,State,Lat,Lon,Comments
1235,175,4 N LITTLEFIELD,LAMB,TX,33.98,-102.32,FELL AT GOLF COURSE. TIME ESTIMATED. (LUB)
1310,175,COTTON CENTER,HALE,TX,33.99,-101.99,TIME ESTIMATED. (LUB)
1453,100,REED,GREER,OK,34.9,-99.68,(OUN)
1500,175,6 N MANGUM,GREER,OK,34.97,-99.5,(OUN)
1516,175,1 S LONE WOLF,KIOWA,OK,34.98,-99.25,(OUN)
1517,125,GRANITE,GREER,OK,34.96,-99.38,(OUN)
1614,175,EAKLY,CADDO,OK,35.31,-98.56,(OUN)
1620,175,BINGER,CADDO,OK,35.31,-98.34,(OUN)
1640,150,2 E NILES,CANADIAN,OK,35.43,-98.21,(OUN)
1645,100,ROMULUS,SENECA,NY,42.75,-76.83,(BGM)
1645,200,SENECA CASTLE,ONTARIO,NY,42.89,-77.1,(BUF)
1700,175,GENEVA,ONTARIO,NY,42.87,-76.98,(BUF)
1715,100,6 W BRECKENRIDGE,STEPHENS,TX,32.75,-99,QUARTER SIZED HAIL REPORTED 6 MILES W OF BRECKENRIDIGE (FWD)
1724,175,2 NW FAYETTE,SENECA,NY,42.84,-76.83,(BGM)
1818,100,3 N LEBANON,WILSON,TN,36.25,-86.32,QUARTER SIZE HAIL AND STRONG WINDS. (OHX)
1858,100,HARRISBURG,CABARRUS,NC,35.32,-80.67,HAIL REPORTED UP TO QUARTER SIZED. SOME MINOR WIND GUSTS. (GSP)
1900,250,GHENT,COLUMBIA,NY,42.33,-73.62,PUBLIC REPORT (ALY)
1915,100,SOUTH ALBANY,ALBANY,NY,42.55,-73.85,(ALY)
1917,100,3 N NEWARK,WAYNE,NY,43.09,-77.09,(BUF)
1919,100,STUYVESANT FALLS,COLUMBIA,NY,42.36,-73.73,HAIL COVERING GROUND (ALY)
1922,100,7 N AIKEN,AIKEN,SC,33.64,-81.74,PUBLIC REPORTED QUARTER SIZE HAIL AT EXIT 18 ON I-26. (CAE)
1923,100,EAST GREENBUSH,RENSSELAER,NY,42.59,-73.7,SKYWARN SPOTTER (ALY)
1924,100,COHOES,ALBANY,NY,42.77,-73.71,FACEBOOK (ALY)
1932,100,4 SSE CHARLOTTE,MECKLENBURG,NC,35.15,-80.81,QUARTER SIZED HAIL NEAR SOUTHPARK MALL. ALSO HAD GUSTY WIND AND TORRENTIAL RAIN CAUSING RAPID RUNOFF NEAR MALL. (GSP)
1934,200,KINDERHOOK,COLUMBIA,NY,42.39,-73.7,WEATHERNET6 (ALY)
1936,100,WALWORTH,WAYNE,NY,43.14,-77.27,(BUF)
1955,100,3 NE TRUMANN,CRAIGHEAD,AR,35.71,-90.48,(MEG)
1958,175,3 N BROCKPORT,MONROE,NY,43.26,-77.94,(BUF)
2000,125,NORTH BROOKFIELD,MADISON,NY,42.85,-75.37,MOST OF THE HAIL WAS 1 INCH IN DIAMETER. (BGM)
2030,100,4 N TAMPA,HILLSBOROUGH,FL,28.02,-82.48,BROADCAST SOCIAL MEDIA PAGE RECEIVED SEVERAL PICTURES OF HAIL NICKEL TO QUARTER SIZE NEAR SITKA ST AND ROME AVE. TIME ESTIMATED BY RADAR. (TBW)
2043,100,3 NE TRUMANN,CRAIGHEAD,AR,35.71,-90.48,(MEG)
2045,100,TAGHKANIC,COLUMBIA,NY,42.14,-73.68,TRAINED SPOTTER. (ALY)
2048,100,WHITLEY CITY,MCCREARY,KY,36.72,-84.48,QUARTER SIZE HAIL WAS REPORTED IN WHITLEY CITY. (JKL)
2055,175,CLUNY POINT,LIVINGSTON,NY,42.82,-77.71,MIX OF DIME AND GOLF BALL SIZED HAIL (BUF)
2056,100,HERKIMER,HERKIMER,NY,43.03,-74.99,TIME ESTIMATED BY RADAR (ALY)
2110,100,2 N FAIRVIEW,UNION,NC,35.17,-80.54,QUARTER SIZE HAIL ON WRIGHTS COVE RD. (GSP)
2110,100,2 N FAIRVIEW,BUNCOMBE,NC,35.55,-82.4,QUARTER SIZE HAIL ON WRIGHTS COVE RD. (GSP)
2124,100,HARKER HEIGHTS,BELL,TX,31.06,-97.65,(FWD)
2125,100,2 N ALANDER,BERKSHIRE,MA,42.09,-73.46,HAIL FIVE INCHES DEEP. SEVERAL TENTS DESTROYED. NO INJURIES. AT YMCA CAMP GROUND. (ALY)
2127,100,12 N MOUNT PLEASANT,TITUS,TX,33.34,-94.98,(SHV)
