Time,F_Scale,Location,County,State,Lat,Lon,Comments
2131,UNK,HOLLANDALE,FREEBORN,MN,43.76,-93.21,DAMAGE PHOTOS FROM KAAL-TV BROADCAST METEOROLOGIST CLEARLY SHOW TORNADIC DAMAGE TO A CORN FIELD AND TREES ON THE NORTHWEST CORNER OF HWY 251 AND ZUYDER ZEE AVE. TORNADO (MPX)
Time,Speed,Location,County,State,Lat,Lon,Comments
1203,77,2 NNE JAMESTOWN,STUTSMAN,ND,46.94,-98.69,(BIS)
1220,UNK,3 SW SANBORN,BARNES,ND,46.91,-98.27,SEMI TRUCK AND TRAILER BLOWN OFF OF INTERSTATE 94 NEAR MP178. (FGF)
1230,80,4 SSW SANBORN,BARNES,ND,46.89,-98.26,A WIDE SWATH OF DAMAGING WINDS AND HAIL RAKED ACROSS NORTHERN HEMEN TOWNSHIP. WIND DRIVEN HAIL STRIPPED MATURING BEAN AND CORN FIELDS DOWN TO STUMPS. TREES WERE BROKEN (FGF)
1250,59,VALLEY CITY,BARNES,ND,46.92,-98.01,THE WIND GUST WAS MEASURED AT THE VALLEY CITY AIRPORT. (FGF)
1300,UNK,1 S ORISKA,BARNES,ND,46.92,-97.79,SEMI CARRYING ANHYDROUS AMMONIA ROLLED ON ITS SIDE IN THE EASTBOUND LANE OF INTERSTATE 94. TIME ESTIMATED BASED ON RADAR. LOCATION ESTIMATED AWAITING FURTHER REPORTS. (FGF)
1318,60,1 N VERONA,LAMOURE,ND,46.38,-98.07,PEA SIZE HAIL (BIS)
1358,UNK,6 ESE CHESTERTON,PORTER,IN,41.56,-86.95,40FT WILLOW TREE UPROOTED... 10-12 FOOT PEAR TREE SNAPPED AND SOME CORN FLATTENED. TIME ESTIMATED BASED ON RADAR. (LOT)
1402,63,8 W HAVANA,SARGENT,ND,45.95,-97.78,PEAK WIND MEASURED AT A PERSONAL WEATHER STATION NEAR THE SD BORDER. (FGF)
1420,UNK,5 SE RUTLAND,SARGENT,ND,46,-97.43,SEVERAL LARGE 4 TO 6 INCH DIAMETER TREE BRANCHES BROKEN DOWN AROUND FARMSTEADS AND IN SHELTER BELTS ACROSS TEWAUKON TOWNSHIP. ALSO BRIEF PERIOD OF DIME TO NICKEL SIZED (FGF)
1845,UNK,GILBERT,LEXINGTON,SC,33.92,-81.39,SOCIAL MEDIA REPORT AND IMAGES OF TREES DOWN NEAR GILBERT. TIME ESTIMATED FROM PUBLIC AND FROM RADAR. (CAE)
1850,UNK,FORESTDALE,JEFFERSON,AL,33.58,-86.9,FORESTDALE FIRE AND RESCUE RESPONDING TO LARGE TREE THAT FELL AND DOWNED POWER LINES ALONG MALINDA DRIVE. ESTIMATED 40 TO 50 MPH WINDS. LOCATION APPROXIMATE. TIME ESTIM (BMX)
1920,UNK,DARWIN SUBDIVISION,GREENE,GA,33.55,-83.17,A TREE WAS BLOWN DOWN NEAR MILE MARKER 132 ON I-20 BLOCKING PART OF THE ROADWAY. (FFC)
1925,UNK,1 S POLLOCKSVILLE,JONES,NC,34.99,-77.22,REPORTS OF SEVERAL TREES DOWN ON HIGHWAY 17 NEAR POLLOCKSVILLE. (MHX)
1925,UNK,5 SSE CLEMENTS,REDWOOD,MN,44.32,-95.01,BIG EVERGREENS SNAPPED OFF OR PUSHED OVER. GARAGE WALL PEELED OFF. KLGR RADIO RELAYED. (MPX)
1930,UNK,1 NE SPRINGFIELD,BROWN,MN,44.24,-94.96,TWO BOX CARS BLOWN OFF TRACK AT THE CO-OP. (MPX)
1932,UNK,1 NW MARTINEZ,COLUMBIA,GA,33.53,-82.1,TREES DOWN AND TRAFFIC LIGHTS DOWN NEAR THE PASS AND CLARKE POINTE NEAR EVANS. (CAE)
1939,UNK,3 WSW REMBERT,SUMTER,SC,34.08,-80.58,TREES AND POWER LINE DOWN REPORTED AT STATE FARM RD REMBERT... SC. (CAE)
1955,UNK,1 S PLANT YATES,COWETA,GA,33.44,-84.9,A TREE WAS BLOWN DOWN ONTO POWER LINES ON WAGERS MILL RD. (FFC)
2005,69,5 SSE SEARLES,BROWN,MN,44.17,-94.38,HOME WEATHER SENSOR MEASURED WIND GUST. ALSO HAD TREE DAMAGE IN THE AREA... WITH POWER OUT AS WELL. SPOTTER ALSO REPORTED SOME SOYBEANS HAD BEEN FLATTENED IN NEARBY FIE (MPX)
2020,64,3 NE MADELIA,BLUE EARTH,MN,44.08,-94.37,MESONET STATION MADELIA 3 ENE /MN045/ ROAD SIDE EQUIPMENT...STILL AWAITING COLLATERAL DAMAGE REPORTS FOR CONFORMATION OF THIS EVENT. (MPX)
2020,UNK,LAKE CRYSTAL,BLUE EARTH,MN,44.1,-94.22,BRANCHES DOWN AND POWER OUT. (MPX)
2028,72,2 SSE OREGON INLET,MAINLAND DARE,NC,35.77,-75.53,(MHX)
2030,UNK,1 S MANKATO,BLUE EARTH,MN,44.15,-93.99,LARGE TREE DOWN IN FRONT YARD. VIA SOCIAL MEDIA. (MPX)
2100,UNK,6 E EHRHARDT,BAMBERG,SC,33.09,-80.91,TREES REPORTED ON ROADWAY HICKS RD. AND HUNTER'S CHAPEL RD. TIME EST BY RADAR. (CAE)
2104,UNK,4 NNW SMOAKS,COLLETON,SC,33.14,-80.84,SOUTH CAROLINA HIGHWAY PATROL REPORTED A TREE DOWN AND IN THE ROADWAY ON BUCKHEAD ROAD NEAR BEREA ROAD. DAMAGE ASSOCIATED WITH THUNDERSTORM OUTFLOW. (CHS)
2114,59,2 WSW WASECA,WASECA,MN,44.07,-93.55,REPORTED AT ACQ AIRPORT. (MPX)
2120,UNK,EADYTOWN,BERKELEY,SC,33.41,-80.14,TREE DOWN AT 1080 THOMAS WALTERS RD. TIME ESTIMATED BY RADAR. (CHS)
2120,UNK,1 N EUTAWVILLE,ORANGEBURG,SC,33.41,-80.34,PUBLIC REPORTED TREES DOWN ON MONCKS CORNER RD NEAR SC HWY 6. TIME ESTIMATED. . (CAE)
2140,UNK,3 ENE EADYTOWN,BERKELEY,SC,33.43,-80.09,TREE DOWN ON PINEVILLE CIRCLE. TIME ESTIMATED BY RADAR. (CHS)
2140,UNK,1 S BARNHILL,GEORGETOWN,SC,33.69,-79.37,TREE DOWN AT BARNHILL AND MENTION ROAD. (ILM)
2143,UNK,9 W HAYFIELD,DODGE,MN,43.89,-93.03,TREES REPORTED DOWN ALONG COUNTY LINE NEAR BLOOMING PRAIRIE (ARX)
2144,UNK,3 ENE REEVESVILLE,DORCHESTER,SC,33.23,-80.61,WARNING POINT AND HIGHWAY PATROL REPORTED THREE TREES DOWN AROUND REEVESVILLE. WINNINGHAM ROAD AT REEVES FARM ROAD... INDEPENDENT SCHOOL ROAD AT WHITE STONE DRIVE... LE (CHS)
2146,UNK,3 ENE MILEY,COLLETON,SC,32.96,-80.98,HIGHWAY PATROL REPORTED TREE DOWN AT THE INTERSECTION OF CROSS SWAMP ROAD AND CONNLEY ROAD. (CHS)
2158,UNK,1 NW AUSTIN,MOWER,MN,43.68,-92.98,LARGE BRANCHES DOWN (ARX)
2200,UNK,HAYFIELD,DODGE,MN,43.89,-92.85,GAZEBO MOVED AND LARGE TREE DOWN. TIME ESTIMATED FROM RADAR. (ARX)
2223,60,HAYFIELD,DODGE,MN,43.89,-92.85,(ARX)
2224,UNK,3 WNW SPRING VALLEY,MOWER,MN,43.7,-92.45,LOTS OF TREES BLOWN DOWN. (ARX)
2232,65,ROCK DELL,OLMSTED,MN,43.91,-92.65,(ARX)
2240,UNK,3 WSW GRAY COURT,LAURENS,SC,34.59,-82.17,DEPT OF HIGHWAYS REPORTED A TREE DOWN IN THE ROADWAY ON SC-101 & SWEETBRIAR RD IN GRAY COURT (GSP)
2241,UNK,1 SSE LAURENS,LAURENS,SC,34.48,-82.02,LAW ENFORCEMENT REPORTED A TREE DOWN ON FAIRVIEW RD IN LAURENS (GSP)
2245,UNK,1 W RACINE,MOWER,MN,43.78,-92.5,BARN BLOWN DOWN. ANOTHER OUT BUILDING ALSO SUSTAINED DAMAGE. TIME ESTIMATED FROM RADAR. (ARX)
2248,UNK,2 SSE SUMMERVILLE,DORCHESTER,SC,32.99,-80.16,SC STATE HIGHWAY PATROL REPORTED A TREE DOWN AT THE INTERSECTION OF MILES JAMISON ROAD AND GREENHURST AVENUE. TIME WAS ESTIMATED FROM RADAR DATA. (CHS)
2248,60,STEWARTVILLE,OLMSTED,MN,43.86,-92.49,(ARX)
2308,UNK,3 W PRESTON,FILLMORE,MN,43.67,-92.14,LOTS OF TREE DAMAGE ON SECONDARY ROADS WEST OF PRESTON. (ARX)
2309,73,1 NW CARIMONA,FILLMORE,MN,43.68,-92.18,MEASURED AT THE FILLMORE COUNTY AIRPORT. (ARX)
2313,65,RUSHFORD,FILLMORE,MN,43.81,-91.75,TREES AND POWER LINES DOWN. LOSS POWER AND PEA SIZE HAIL. (ARX)
2325,UNK,3 W ARCADE,JACKSON,GA,34.08,-83.61,DAMAGE TO MULTIPLE BARNS AND OUTBUILDINGS ALONG WITH AN UPROOTED TREE ON A VEHICLE NEAR THE INTERSECTION OF W.H. HAYES AND GALILEE CHURCH ROAD. TIME ESTIMATED FROM RADA (FFC)
2348,UNK,5 S CHATSWORTH,LIVINGSTON,IL,40.68,-88.29,LARGE BRANCHES DOWNED (LOT)
2353,UNK,3 WNW FERRYVILLE,CRAWFORD,WI,43.37,-91.14,REPORTS OF NUMEROUS TREES AND POWER LINES DOWN IN THE DE SOTO AREA... ESPECIALLY ALONG HIGHWAY 35 NEAR RUSH CREEK. TIME ESTIMATED FROM RADAR. (ARX)
0010,UNK,1 SSW MISSOULA,MISSOULA,MT,46.86,-114.01,MAPLE TREE (TRUNK ESTIMATED TO BE 18 INCHES IN DIAMETER) SNAPPED IN HALF AND BLOCKED TRAFFIC FOR A SHORT TIME. (MSO)
0030,UNK,BOSCOBEL,GRANT,WI,43.14,-90.7,LARGE TREE DOWN... BLOCKING ROAD. (ARX)
0035,UNK,BAGLEY,GRANT,WI,42.9,-91.1,SMALL TREES DOWN. TIME ESTIMATED FROM RADAR. (ARX)
0055,UNK,4 SSE FARMER,HANSON,SD,43.67,-97.66,TRUCK AND TRAILER BLOWN OVER NEAR EXIT 355 ON I-90. (FSD)
0100,UNK,2 NW CASSVILLE,GRANT,WI,42.73,-91.01,LARGE TREE DOWN IN NELSON DEWEY STATE PARK. TIME ESTIMATED FROM RADAR. (ARX)
0108,UNK,SPRING GREEN,SAUK,WI,43.18,-90.07,REPORT OF SEVERAL PINE TREES DOWN AND A DOOR DAMAGED ON A BARN. RELAYED THROUGH LOCAL MEDIA. TIME ESTIMATED. (MKX)
0113,UNK,KIELER,GRANT,WI,42.58,-90.6,SMALL TREES DOWN. (ARX)
0215,UNK,ODUM,WAYNE,GA,31.67,-82.03,THE EMA REPORTED THREE TREES DOWN IN ODUM. THERE WERE ALSO REPORTS OF PWERLINES DOWN BETWEEN HIGHWAY 27 AND STATE ROAD 38. (JAX)
0255,60,5 SSE SPENCER,BOYD,NE,42.81,-98.66,(LBF)
0305,UNK,JANESVILLE,ROCK,WI,42.68,-89.02,ABOUT A DOZEN TREES DOWN IN THE CITY... SOME WIRES DOWN (MKX)
0655,UNK,GLENCOE,MCLEOD,MN,44.77,-94.15,LARGE TREES DOWN AND POWER LINES DOWN IN GLENCOE. (MPX)
0710,60,2 WSW WACONIA,CARVER,MN,44.84,-93.82,. (MPX)
0735,UNK,DELANO,WRIGHT,MN,45.04,-93.79,HOME WINDOW BLOWN IN. TIME ESTIMATED BY RADAR AND NWS EMPLOYEE. (MPX)
0743,UNK,LONG LAKE,HENNEPIN,MN,44.99,-93.57,FOUR INCH DIAMETER TREE LIMB SEVERED. TIME ESTIMATED FROM RADAR. (MPX)
0748,UNK,ROGERS,HENNEPIN,MN,45.19,-93.55,TREE LIMBS GREATER THEN OR EQUAL TO 2 INCHES IN DIAMETER SEVERED. TIME ESTIMATED BY RADAR. (MPX)
0754,UNK,ST. MICHAEL,WRIGHT,MN,45.21,-93.66,TREES (APPROXIMATELY 20 FEET TALL)... TOPPLED. TIME ESTIMATED FROM RADAR. (MPX)
0908,UNK,CALEDONIA,HOUSTON,MN,43.64,-91.5,TREE BLOWN DOWN. TIME ESTIMATED FROM RADAR. (ARX)
Time,Size,Location,County,State,Lat,Lon,Comments
1250,175,1 SSW HOWARD,MINER,SD,43.99,-97.53,LARGEST HAIL GOLF BALL SIZED AT ABOUT 750 PM... BUT INTERMITTENT NICKLE TO QUARTER SIZED HAIL 730 PM TO 8 PM. (FSD)
1340,100,2 S LISBON,RANSOM,ND,46.41,-97.68,(FGF)
1805,100,4 SSE WANDA,REDWOOD,MN,44.26,-95.19,. (MPX)
1905,100,4 SSE WANDA,REDWOOD,MN,44.26,-95.19,. (MPX)
2244,100,CHERRY GROVE,FILLMORE,MN,43.58,-92.28,(ARX)
2337,125,3 SE ROCK FALLS,CERRO GORDO,IA,43.17,-93.05,MOSTLY QUARTER SIZE WITH A FEW LARGER STONES. (DMX)
0000,175,BRIDGEPORT,MORRILL,NE,41.67,-103.1,PING PONG TO GOLF BALL SIZE HAIL OCCURRED FOR 5-10 MIN IN BRIDGEPORT. (CYS)
0000,100,2 WSW MISSOULA,MISSOULA,MT,46.86,-114.04,. (MSO)
0024,100,3 NE WOODBINE,JO DAVIESS,IL,42.38,-90.11,STRONG WINDS AND TORRENTIAL RAIN ALSO REPORTED. (DVN)
0057,100,4 N VILAS,MINER,SD,44.06,-97.59,. (FSD)
0131,150,1 NNW SPENCER,MCCOOK,SD,43.74,-97.61,6 INCH DIAMETER TREE BRANCH DOWN...TIME ESTIMATED FROM RADAR. (FSD)
0131,100,1 N ORLAND,LAKE,SD,43.91,-97.19,TIME ESTIMATED FROM RADAR. (FSD)
0139,175,1 E MILLS,KEYA PAHA,NE,42.94,-99.38,ONLY A FEW HAILSTONES WERE TO THE SIZE OF GOLF BALLS...WINDS WERE ESTIMATED AT BETWEEN 30 AND 40 MPH. (LBF)
0145,100,3 NW OLDHAM,KINGSBURY,SD,44.25,-97.35,TIME ESTIMATED FROM RADAR. (FSD)
0215,100,13 SE NAPER,HOLT,NE,42.83,-98.92,RESIDENTS HOME WEATHER STATION WAS READING 32 MPH WINDS AT TIME OF THE CALL...WHICH WAS 925PM CDT. RESIDENTS WAS NOT COMFORTABLE ESTIMATING WINDS...BUT DID SAY A COUPLE (LBF)
0329,100,HAYTI,HAMLIN,SD,44.66,-97.2,RELAYED BY KDLT VIEWER REPORT AND PICTURE (ABR)
