Time,F_Scale,Location,County,State,Lat,Lon,Comments
Time,Speed,Location,County,State,Lat,Lon,Comments
1638,UNK,1 S TUCKER HEIGHTS,SCHENECTADY,NY,42.9,-73.94,LARGE TREE LIMBS DOWN ON WYNDON ROAD AND WHEELER DRIVE (ALY)
1815,UNK,WEST SPRINGFIELD,HAMPDEN,MA,42.12,-72.65,TREE DOWN ON MAIN STREET AND BURFORD STREET (BOX)
1850,UNK,HAMPDEN,HAMPDEN,MA,42.07,-72.42,WIRES DOWN ON MAIN STREET (BOX)
1853,UNK,1 S PORT BAY,WAYNE,NY,43.28,-76.83,MULTIPLE TREES AND WIRES DOWN. (BUF)
1902,UNK,2 S SIDNEY,SHELBY,OH,40.26,-84.16,ONE TREE DOWN IN ORANGE TOWNSHIP. TIME ESTIMATED VIA RADAR. (ILN)
1912,UNK,4 NW WEST SWANZEY,CHESHIRE,NH,42.91,-72.38,TREES DOWN ON LINCLON RD IN CHESTERFIELD (GYX)
1921,UNK,GRANBY CENTER,OSWEGO,NY,43.33,-76.47,TREES AND WIRES DOWN. (BUF)
1933,UNK,CALEDONIA,LIVINGSTON,NY,42.98,-77.86,TREES AND WIRES DOWN. (BUF)
1940,UNK,MEXICO,OSWEGO,NY,43.46,-76.23,TREES AND WIRES DOWN. (BUF)
1945,UNK,BETHANY CENTER,GENESEE,NY,42.9,-78.13,TREE DOWN. (BUF)
1950,UNK,1 N YORK,LIVINGSTON,NY,42.89,-77.87,TREES AND WIRES DOWN. (BUF)
2010,UNK,BARBOURS,LYCOMING,PA,41.4,-76.78,TREES DOWN NEAR BARBOURS (CTP)
2012,UNK,PHELPS,ONTARIO,NY,42.96,-77.06,TREE AND WIRE DOWN. (BUF)
2013,UNK,1 ENE SOUTH CAMBRIDGE,WASHINGTON,NY,42.97,-73.47,TREES DOWN ALONG ROUTE 59A (ALY)
2015,UNK,HILLSGROVE,SULLIVAN,PA,41.44,-76.71,NUMEROUS TREES DOWN IN HILLSGROVE (CTP)
2019,UNK,BRIGHTON,MONROE,NY,43.12,-77.58,WIRES DOWN. (BUF)
2024,UNK,VICTOR,ONTARIO,NY,42.98,-77.41,SEVERAL TREES AND WIRES DOWN. (BUF)
2027,UNK,PITTSTOWN,RENSSELAER,NY,42.84,-73.48,2 TREES DOWN. (ALY)
2028,UNK,MOUNT MORRIS,LIVINGSTON,NY,42.72,-77.88,TREE DOWN. (BUF)
2032,UNK,1 E PLATEA,ERIE,PA,41.95,-80.31,TREE DOWN ON WIRES BLOCKING PEACH STREET. (CLE)
2035,61,SRQ SARASOTA BRADENTON,MANATEE,FL,27.4,-82.55,THE ASOS AT SARASOTA/BRADENTON INTL AIRPORT RECORDED A WIND GUST OF 61 MPH. (TBW)
2035,UNK,1 NW WILLSEYVILLE,TIOGA,NY,42.29,-76.4,TREES AND WIRES DOWN ON CODDINGTON RD. (BGM)
2035,UNK,MACEDON,WAYNE,NY,43.07,-77.3,TREES DOWN. (BUF)
2037,UNK,LYONSDALE,LEWIS,NY,43.62,-75.31,TREES DOWN. (BUF)
2051,UNK,PHELPS,ONTARIO,NY,42.96,-77.06,TREE AND WIRE DOWN. (BUF)
2051,UNK,CLYDE,WAYNE,NY,43.08,-76.87,TREE DOWN. (BUF)
2057,UNK,2 ENE LAWRENCE PARK,ERIE,PA,42.16,-79.99,TREE DOWN ACROSS ROAD AT FAIR AVE AND LEE AVE. (CLE)
2100,UNK,1 SSW HOOSICK FALLS,RENSSELAER,NY,42.89,-73.36,TREE DOWN ACROSS BOVEE HILL ROAD AND LESTER LANE (ALY)
2102,UNK,EAST BERKSHIRE,TIOGA,NY,42.3,-76.13,MULTIPLE TREES DOWN ON WILSON CREEK RD. (BGM)
2124,59,ORLANDO INTERNATIONAL A,ORANGE,FL,28.42,-81.32,ASOS AT ORLANDO INTERNATIONAL MEASURED A WIND GUST OF 51KT/59MPH FROM THE SSE (MLB)
2125,UNK,MAYVILLE,CHAUTAUQUA,NY,42.25,-79.5,TREE LIMBS DOWN WITH POWER OUTAGES. (BUF)
2132,UNK,ORISKANY FALLS,MADISON,NY,42.94,-75.46,ROOF DAMAGED AND SILO BLOWN DOWN. (BGM)
2135,UNK,3 WNW SARDINIA,ERIE,NY,42.55,-78.55,VOLUNTEER FIRE DEPT REPORTS MULTIPLE POWER POLES AND WIRES DOWN AT INTERSECTION OF GENESEE AND WARNERS GULF ROADS. POWER COMPANY ON SCENE FOR REPAIRS. (BUF)
2140,UNK,WHITESBORO,ONEIDA,NY,43.12,-75.3,TREE DOWN ON JUDD ROAD. (BGM)
2143,UNK,3 WSW CONWAY,ORANGE,FL,28.48,-81.38,BROADCAST MEDIA REPORTS THAT A VIEWER HAD A TREE FALL ON HER HOUSE. TIME ESTIMATED BY RADAR. (MLB)
2145,UNK,1 WNW FRANKFORT CENTER,HERKIMER,NY,43.06,-75.16,TREE ON WIRES...RADAR ESTIMATED. (ALY)
2146,UNK,NEW BERLIN,CHENANGO,NY,42.62,-75.34,NUMEROUS TREES DOWN ACROSS COUNTY. (BGM)
2156,UNK,2 SE EDMESTON,OTSEGO,NY,42.68,-75.21,MULTIPLE REPORTS OF TREES DOWN... TREES ON WIRE... THROUGHOUT THE COUNTY. (BGM)
2200,UNK,3 WSW VIDOR,ORANGE,TX,30.11,-94.04,MEDIA REPORTS ONE TRAILER WAS FLIPPED AND ANOTHER TRAILER HAD A TREE FALL ON IT. TIME ESTIMATED FROM RADAR. (LCH)
2200,UNK,HERKIMER,HERKIMER,NY,43.03,-74.99,MULTIPLE TREES DOWN (ALY)
2224,UNK,RICHFIELD SPRINGS,OTSEGO,NY,42.85,-74.99,LARGE LIMBS AND WIRES DOWN. (BGM)
2225,UNK,1 NNW CANADA LAKE,FULTON,NY,43.19,-74.52,*** 8 INJ *** NUMEROUS TREES AND WIRES AT CAMPGROUND. (ALY)
2230,UNK,LEVELS,HAMPSHIRE,WV,39.48,-78.55,TREE DOWN NEAR THE INTERSECTION OF JERSEY MOUNTAIN ROAD AND LITTLE CACAPON-LEVELS ROAD. (LWX)
2230,UNK,5 WSW SLATE RUN,LYCOMING,PA,41.44,-77.58,TREES AND WIRES DOWN (CTP)
2241,UNK,SHARON SPRINGS,SCHOHARIE,NY,42.8,-74.62,WIRES DOWN ON SOUTH STREET (ALY)
2245,UNK,EDINBURG,SARATOGA,NY,43.23,-74.09,TREES AND WIRES DOWN (ALY)
2250,UNK,1 N WEST CHARLTON,SARATOGA,NY,42.97,-74.03,MULTIPLE LARGE BRANCHES AND LIMBS DOWN AT THE INTERSECTION OF ROUTES 67 AND 147. (ALY)
2258,UNK,2 NE FORT JOHNSON,MONTGOMERY,NY,42.97,-74.21,TREE DOWN BLOCKING ROAD... MCKAY RD SOUTH OF MCDONALD DR. (ALY)
2259,UNK,4 NW CACAPON STATE PARK,MORGAN,WV,39.55,-78.35,TREE DOWN IN THE 20000 BLOCK OF CACAPON ROAD. (LWX)
2301,UNK,1 NNE SUMMIT,SCHOHARIE,NY,42.6,-74.58,TREE ON WIRES ON BEARDS HOLLOW ROAD AT ROUTE 10 (ALY)
2307,UNK,1 NW FOURTH LAKE,WARREN,NY,43.37,-73.84,TREES AND TREE LIMBS DOWN. RADAR ESTIMATED (ALY)
2310,UNK,CHARLTON,SARATOGA,NY,42.93,-73.97,TREES AND WIRES DOWN. (ALY)
2315,UNK,SARATOGA SPRINGS,SARATOGA,NY,43.07,-73.78,TREE AND POWER LINES DOWN AT INTERSECTION OF CRESCENT ST AND JEFFERSON ST. (ALY)
2315,UNK,BOLTON,WARREN,NY,43.53,-73.67,TREES AND BRANCHES DOWN ON ROUTE 9N. RADAR ESTIMATED. (ALY)
2322,UNK,2 W WEST GLENS FALLS,WARREN,NY,43.3,-73.72,LARGE TREE LIMBS DOWN (ALY)
2325,UNK,4 SSW SYLVESTER,WORTH,GA,31.48,-83.86,TREE DOWN ON EVERGREEN ROAD (TAE)
2326,UNK,3 NE FORT MYERS,LEE,FL,26.66,-81.81,DAMAGE TO METAL ROOFING ON FOUR BUSINESSES IN AN INDUSTRIAL COMPLEX ON CORPORATION CIRCLE AND ZIP DRIVE. A FUNNEL CLOUD WAS SIGHTED IN THE VICINITY. (TBW)
2330,UNK,2 ENE TIFTON,TIFT,GA,31.46,-83.47,TREE DOWN ON POWERLINE FERRY LAKE RD (TAE)
2330,UNK,TEMPLE,BERKS,PA,40.41,-75.92,A FEW TREES BLOWN DOWN AND SMALL ROW BOAT THROWN APPROXIMATELY 30 FEET (PHI)
2335,UNK,5 W MARIENVILLE,FOREST,PA,41.44,-79.18,MULTIPLE 1+ FOOT DIAMETER LIMBS DOWN NEAR ROSES... PA. (PBZ)
2335,UNK,2 SE SHEFFIELD,WARREN,PA,41.68,-79,WIRES DOWN EAST OF SHEFFIELD (CTP)
2339,UNK,3 NE PUMPKIN HOOK,BENNINGTON,VT,43.05,-73.27,TREE DOWN ON BLACK HOLLOW RD...ARLINGTON...RADAR EST. (ALY)
2340,UNK,3 NE NEW MANCHESTER,HANCOCK,WV,40.56,-80.54,TREES DOWN (PBZ)
2342,UNK,1 S EAST HARTFORD,WASHINGTON,NY,43.32,-73.38,LARGE TREE LIMBS DOWN...RADAR TIME EST. (ALY)
2343,UNK,CONOCOCHEAGUE,WASHINGTON,MD,39.66,-77.85,TREE DOWN ON HWY 40 AT CONOCOCHEAGUE CREEK (LWX)
2345,UNK,ANTRIM,HILLSBOROUGH,NH,43.03,-71.95,TREES DOWN (GYX)
2350,UNK,1 NW MANCHESTER CENTER,BENNINGTON,VT,43.19,-73.06,TREES DOWN ON BONNET ST/ROUTE 30...RADAR EST.. (ALY)
2352,UNK,1 N ASHOKAN,ULSTER,NY,41.99,-74.2,TREE AND WIRES DOWN...RADAR ESTIMATED (ALY)
2352,UNK,W PAWLET,RUTLAND,VT,43.35,-73.18,TREE DOWN ON POWERLINES IN WEST PAWLET. (BTV)
0000,UNK,MOMBACCUS,ULSTER,NY,41.81,-74.31,WIRES DOWN...RADAR ESTIMATED. (ALY)
0002,UNK,4 W BENNINGTON,HILLSBOROUGH,NH,42.99,-72.02,TREES BLOCKING RT 123 (GYX)
0006,UNK,HAGERSTOWN,WASHINGTON,MD,39.64,-77.72,TREE ON VEHICLE ON EAST ANTIETAM ST (LWX)
0012,UNK,SUMMERVILLE,JEFFERSON,PA,41.12,-79.19,TREE DOWN (PBZ)
0012,UNK,WEST COXSACKIE,GREENE,NY,42.37,-73.82,TREES AND TREE LIMBS DOWN. TIME RADAR ESTIMATED. (ALY)
0013,UNK,SAUGERTIES,ULSTER,NY,42.08,-73.95,TREES DOWN ON WIRES ON WASHINGTON AVE BETWEEN RUSSEL AND DIVIISION (ALY)
0015,UNK,2 NE ROCKINGHAM,WINDHAM,VT,43.21,-72.45,WIRES DOWN ON MISSING LINK ROAD IN ROCKINGHAM. TIME ESTIMATED FROM RADAR. (ALY)
0016,UNK,UPPER SAUCON TWP,LEHIGH,PA,40.54,-75.42,WIRES BLOWN DOWN...TIME ESTIMATED FROM RADAR (PHI)
0017,UNK,1 NW UNION CENTER,ULSTER,NY,41.86,-74.01,TREE DOWN ON VEHICLE...RADAR ESTIMATED. (ALY)
0020,UNK,RICHARDSVILLE,JEFFERSON,PA,41.24,-79.01,TREE DOWN (PBZ)
0020,UNK,1 S OWASCO,CAYUGA,NY,42.84,-76.47,TREE DOWN ON VALENTINE ROAD. (BGM)
0021,UNK,1 WSW ELIZAVILLE,COLUMBIA,NY,42.05,-73.82,TREE DOWN ACROSS EAST KERLEY CORNER ROAD (ALY)
0023,UNK,1 S MUITZES KILL,COLUMBIA,NY,42.46,-73.73,POWER LINES DOWN (ALY)
0025,UNK,LANGDON,SULLIVAN,NH,43.17,-72.38,TREES AND WIRES DOWN (GYX)
0028,UNK,1 W MARCELLUS,ONONDAGA,NY,42.98,-76.36,TREES DOWN (BGM)
0030,UNK,W FARGO,CLINCH,GA,30.68,-82.57,POWER LIENS AND TREES WERE BLOWN DOWN ALONG ALFRED GRIFFIS ROAD AND MLK DRIVE IN FARGO. (JAX)
0030,UNK,WASHINGTON,WARREN,NJ,40.76,-74.98,WIRES BLOWN DOWN...TIME ESTIMATED FROM RADAR. (PHI)
0030,UNK,1 SE PUMPKIN HOLLOW,COLUMBIA,NY,42.11,-73.6,TREES AND WIRES DOWN (ALY)
0035,UNK,SCHODACK CENTER,RENSSELAER,NY,42.55,-73.68,TWO TREES DOWN IN THE VILLAGE (ALY)
0038,UNK,LAFAYETTE,ONONDAGA,NY,42.89,-76.11,TREES DOWN (BGM)
0039,UNK,NORWALK,FAIRFIELD,CT,41.09,-73.42,DOWN UTILITY POLE ON GRANITE DR. (OKX)
0043,UNK,1 ENE AQUETUCK,ALBANY,NY,42.46,-73.82,TREE AND POWER POLE DOWN ON MARTINS HILL ROAD (ALY)
0045,UNK,MILLERTON,DUTCHESS,NY,41.95,-73.51,LARGE MAPLE TREE DOWN (ALY)
0050,UNK,GORDON,WILKINSON,GA,32.89,-83.34,A TREE WAS BLOWN DOWN AT THE INTERSECTION OF BROOKS STREET AND COLLEGE STREET. (FFC)
0050,UNK,1 SSW SOUTH EGREMONT,BERKSHIRE,MA,42.15,-73.42,MULTIPLE TREES AND WIRES DOWN (ALY)
0054,UNK,GREENWICH,FAIRFIELD,CT,41.03,-73.63,NUMEROUS TREES DOWN AROUND TOWN. (OKX)
0055,UNK,1 SW SPOFFORD,CHESHIRE,NH,42.9,-72.43,TREES DOWN RT 9A (GYX)
0105,UNK,MONTPELIER,BALDWIN,GA,33.08,-83.17,A TREE WAS BLOWN DOWN AT THE INTERSECTION OF SPARTA HIGHWAY AND STEMBRIDGE RD. (FFC)
0109,UNK,DANBURY,FAIRFIELD,CT,41.4,-73.47,NUMEROUS TREES AND WIRES DOWN AROUND TOWN. (OKX)
0115,UNK,FAIRFIELD,FAIRFIELD,CT,41.13,-73.28,LARGE LIMB DOWN ON LONGVIEW AVE. (OKX)
0123,UNK,BLANDFORD,HAMPDEN,MA,42.18,-72.93,6 TO 8 INCH DIMETER BRANCHES DOWN ON CHESTER ROAD (BOX)
0125,UNK,1 ENE MERIWETHER,BALDWIN,GA,33.16,-83.3,A TREE WAS BLOWN DOWN ON STEWART DRIVE. (FFC)
0132,60,CUMMINGTON,HAMPSHIRE,MA,42.47,-72.9,(BOX)
0150,UNK,MONTAGUE,FRANKLIN,MA,42.53,-72.53,TREE DOWN ON SUTH AND FEDERAL STREET (BOX)
0200,UNK,SOUTH WINDSOR,HARTFORD,CT,41.82,-72.62,LARGE LIMBS DOWN INCLUDING ONE ON TROY ROAD (BOX)
0209,UNK,WESTPORT,FAIRFIELD,CT,41.12,-73.35,LARGE TREE LIMB DOWN ON HOUSE ON WITCH LANE. (OKX)
0211,UNK,AMHERST,HAMPSHIRE,MA,42.38,-72.52,TREE AND WIRES DOWN ON MONTAGUE ROAD (BOX)
0214,UNK,MONSON,HAMPDEN,MA,42.1,-72.31,WALES ROAD TREE DOWN ACROSS ROAD (BOX)
0222,UNK,2 N EFFORT,MONROE,PA,40.97,-75.43,SEVERAL LARGE TREE BRANCHES BLOWN DOWN. WINDS ESTIMATED ABOVE 60 MPH. (PHI)
0225,UNK,STURBRIDGE,WORCESTER,MA,42.1,-72.06,TREE DOWN ON LANE 7 OF SOUTH POND CAUSING POWER OUTAGE (BOX)
0244,UNK,VERNON,TOLLAND,CT,41.82,-72.48,TREE ON WIRES ON TANNER ROAD (BOX)
0300,UNK,POMFRET,WINDHAM,CT,41.9,-71.97,TREE AND WIRES DOWN ON DAY ROAD AND WRIGHTS CROSSING ROAD (BOX)
0315,UNK,CANTERBURY,WINDHAM,CT,41.7,-71.97,TREES DOWN INCLUDING TREE DOWN ON WIRES ALONG CANTERBURY ROAD (BOX)
0322,UNK,CLINTON,WORCESTER,MA,42.42,-71.69,MULTIPLE TREES AND POWER LINES DOWN ON PRESCOTT STREET (BOX)
0336,UNK,SPENCER,WORCESTER,MA,42.24,-71.99,TREE DOWN ON WIRES ON CHICKERING ROAD CAUSING POWER OUTAGE TO 500 CUSTOMERS (BOX)
0349,UNK,1 NE MOUNT AIRY,WESTCHESTER,NY,41.23,-73.86,TREE DOWN AT CROTON DAM ROAD AND ROUTE 129. (OKX)
0355,UNK,WEBSTER,WORCESTER,MA,42.05,-71.87,WIRES DOWN ON PERRYVILLE ROAD (BOX)
0400,UNK,WASHINGTON,LITCHFIELD,CT,41.63,-73.31,TREE DOWN ON HOUSE (ALY)
0440,UNK,BRISTOL,HARTFORD,CT,41.68,-72.94,WIRES DOWN ON JAMES P CASEY ROAD AT LAWRENCE LANE (BOX)
0441,UNK,1 NW FOX MEADOWS,MIDDLESEX,CT,41.61,-72.7,TREE DOWN NEAR THE INTERSECTION OF NORTH ROAD AND THE NORTH ROAD EXTENSION. (OKX)
0521,UNK,1 SSW OCCUM,NEW LONDON,CT,41.58,-72.06,SEVERAL REPORTS OF TREES DOWN IN THE AREA OF OLD CANTERBURY TURNPIKE AND I-395. (OKX)
0555,UNK,SCITUATE,PROVIDENCE,RI,41.8,-71.62,TREE DOWN ON EAST ROAD (BOX)
0610,UNK,WESTBOROUGH,WORCESTER,MA,42.27,-71.62,WIRES DOWN ON MAYBERRY AVENUE AT THE HIGH STREET EXTENSION (BOX)
0635,UNK,QUINCY,NORFOLK,MA,42.26,-71.01,LARGE TREE LIMB AND WIRES DOWN ON CAR ON RICE ROAD (BOX)
Time,Size,Location,County,State,Lat,Lon,Comments
1930,175,KEENE,CHESHIRE,NH,42.95,-72.3,(GYX)
2230,175,2 N SEDGWICK,SEDGWICK,CO,40.96,-102.53,(BOU)
2335,100,5 ESE CHAPPELL,DEUEL,NE,41.07,-102.38,(LBF)
