Time,F_Scale,Location,County,State,Lat,Lon,Comments
1804,UNK,5 WSW RICHMOND,MACOMB,MI,42.78,-82.83,A BRIEF EF0 TORNADO TOUCHED DOWN AROUND 204 PM ON PLACE ROAD BETWEEN 29 MILE AND 30 MILE ROAD IN LENOX TOWNSHIP. PATH LENGTH WAS ESTIMATED TO BE 0.25 MILES WITH A PATH (DTX)
1945,UNK,2 SE MACKAY,CUSTER,ID,43.89,-113.58,MULTIPLE PHOTOS OF FUNNEL WITH BRIEF TOUCH DOWN (PIH)
Time,Speed,Location,County,State,Lat,Lon,Comments
1704,UNK,SHARPS CHAPEL,UNION,TN,36.34,-83.81,DISPATCH REPORTED A FEW TREES DOWNED IN THE COUNTY. (MRX)
1705,UNK,2 ESE MARION,MCDOWELL,NC,35.67,-81.97,TREES DOWN ALONG TUNNEL ROAD AND JACKTOWN ROAD. (GSP)
1730,UNK,CASSVILLE,BARTOW,GA,34.24,-84.85,IN THE VICINITY OF CASSVILLE ROAD...MULTIPLE TREES WERE REPORTED DOWN. (FFC)
1754,UNK,1 WSW LAKE SHORE,DAWSON,GA,34.41,-83.99,SEVERAL TREES DOWN ALONG HICKORY NUT TRAIL (FFC)
1815,UNK,OAKWOOD,HALL,GA,34.23,-83.88,911 CALL CENTER RECEIVED REPORTS OF NUMEROUS TREES DOWN... 3 RESIDENCES DAMAGED... AND TRAFFIC LIGHTS OUT IN THE OAKWOOD AREA. (FFC)
1831,UNK,5 NNE FINGERVILLE,POLK,NC,35.21,-81.98,SEVERAL TREES DOWN NEAR INTERSECTION OF SANDY SPRINGS ROAD AND CHESNEE ROAD. (GSP)
1835,UNK,2 NNW SNOW SPRINGS,BARTOW,GA,34.37,-85,A TREE FELL ON A MOBILE HOME IN THE RIDGEWOOD MOBILE HOME PARK. REPORTS OF TRAFFIC ACCIDENTS AND 1 TREE BLOCKING THE ROAD NEAR THE FLOYD AND BARTOW COUNTY LINE. (FFC)
1835,UNK,PLAINVILLE,GORDON,GA,34.4,-85.04,TREES AND POWER LINES DOWN. (FFC)
1845,UNK,HERMITAGE,DAVIDSON,TN,36.2,-86.62,SEVERAL TREES WERE BLOWN DOWN AND SOME SIGNS WERE DAMAGED NEAR THE INTERSECTION OF OLD HICKORY BLVD AND LEBANON RD. (OHX)
1849,UNK,6 E LEBANON,WILSON,TN,36.21,-86.21,MULTIPLE TREES AND POWER LINES REPORTED DOWN ALONG TROUSDALE FERRY RD BETWEEN LEBANON AND TUCKERS CROSSROADS. (OHX)
1850,UNK,MOUNT JULIET,WILSON,TN,36.21,-86.52,A FEW TREES AND POWERLINES DOWN (OHX)
1852,UNK,3 SW CHESNEE,SPARTANBURG,SC,35.12,-81.9,2 TREES DOWN OFF BUCK CREEK RD AND CROW RD... SW OF CHESNEE... SC. (GSP)
1854,UNK,1 WSW LAKE SHORE,DAWSON,GA,34.41,-83.99,SEVERAL TREES DOWN ALONG HICKORY NUT TRAIL (FFC)
1857,UNK,3 SE OXFORD,CALHOUN,AL,33.57,-85.78,TREES AND POWERLINES DOWN ALONG MCINTOSH ROAD...NEAR MELLON BRIDGE. ESTIMATED WINDS APPROXIMATELY 50 MPH. (BMX)
1859,UNK,THOMASTON,UPSON,GA,32.89,-84.33,6 TREES... SOME ON POWERLINES REPORTED DOWN IN THE VICINITY OF THOMASTON. (FFC)
1900,UNK,PHILADELPHIA,LOUDON,TN,35.68,-84.4,MULTIPLE TREES DOWN. AT LEAST ONE BARN DAMAGED OR DESTROYED. (MRX)
1902,UNK,5 NW CARTERSVILLE,BARTOW,GA,34.22,-84.86,SEVERAL TREES DOWN BLOCKING MACJOHNSON AND CASSVILLE ROADS (FFC)
1914,UNK,5 E CHERRYVILLE,GASTON,NC,35.37,-81.28,TREE IN ROADWAY (GSP)
1915,UNK,SWEETWATER,MONROE,TN,35.6,-84.47,NUMEROUS TREES DOWN ESPECIALLY IN THE SWEETWATER AND MADISONVILLE AREAS. (MRX)
1919,60,ALEXANDRIA,DE KALB,TN,36.08,-86.03,(OHX)
1920,UNK,5 E SPARTANBURG,SPARTANBURG,SC,34.94,-81.84,SCHP REPORTED TREE DOWN ALONG CLIFTON-GLENDALE ROAD (GSP)
1920,UNK,ALEXANDRIA,DE KALB,TN,36.08,-86.03,EXTENSIVE DAMAGE IN THE ALEXANDRIA AREA AND ACROSS DE KALB COUNTY. ROOF DAMAGE TO STRUCTURES ON E. MAIN ST. IN ALEXANDRIA AND AT THE DE KALB COUNTY FAIRGROUNDS...AND NU (OHX)
1921,UNK,3 NNW WINCHESTER,FRANKLIN,TN,35.22,-86.13,A TREE WAS REPORTED DOWN AT THIS LOCATION. (HUN)
1925,UNK,1 N LIDA,LAUREL,KY,37.1,-83.93,TREE DOWN ON TOM CAT TRAIL OR HWY 1305. (JKL)
1935,UNK,4 W GASTONIA,GASTON,NC,35.26,-81.24,TREE DOWN ACROSS ROADWAY (GSP)
1935,UNK,SMITHVILLE,DE KALB,TN,35.96,-85.82,TREES AND POWER LINES BLOWN DOWN ALL ACROSS DEKALB COUNTY (OHX)
1936,UNK,FOREST PARK,CLAYTON,GA,33.62,-84.37,911 CALL CENTER REPORTS SEVERAL TREES DOWN IN THE NOTHERN PORTION OF CLAYTON COUNTY. (FFC)
1936,UNK,1 NNW BURNT HICKORY FAR,PAULDING,GA,34.07,-84.83,TREES DOWN AT THE INTERSECTION OF HIGHWAY 61 AND DOUTHIT BRIDGE ROAD. (FFC)
1945,UNK,WOODBURY,CANNON,TN,35.82,-86.07,MINOR SIDING AND ROOF DAMAGE TO HOMES AND SEVERAL TREES BLOWN DOWN AROUND WOODBURY (OHX)
1947,60,10 W SPARTA,WHITE,TN,35.93,-85.65,EMERGENCY MANAGEMENT REPORTED WINDS IN EXCESS OF 60 MPH ON BLUE SPRINGS RD. (OHX)
1950,UNK,GOOD HOPE,WALTON,GA,33.78,-83.61,SEVERAL TREES DOWN IN GOOD HOPE (FFC)
1954,UNK,6 E ROBERTA,CRAWFORD,GA,32.72,-83.91,TREE DOWN ON HWY 80E (FFC)
1957,UNK,SPARTA,WHITE,TN,35.93,-85.47,EMERGENCY MANAGEMENT REPORTS MULITIPLE TREES DOWN COUNTYWIDE. (OHX)
2000,UNK,1 NNW HUBER,TWIGGS,GA,32.73,-83.55,FEW TREES DOWN NEAR ALFRED BOND DR (FFC)
2010,UNK,4 S TELLICO PLAINS,MONROE,TN,35.31,-84.3,TREES DOWN ON TELLICO MOUNTAIN. (MRX)
2012,58,6 SW LEBANON,WILSON,TN,36.15,-86.4,WEMA REPORTED ESTIMATED WINDS AT OR GREATER THAN 58 MPH AT 840 BETWEEN CENTRAL PIKE AND STEWARTS FERRY PIKE. (OHX)
2015,UNK,MADISON,MORGAN,GA,33.6,-83.47,NUMEROUS TREES AND POWER LINES DOWN ESPECIALLY IN AND WEST OF MADISON (FFC)
2015,UNK,2 NNE ALCOVY,WALTON,GA,33.67,-83.77,A COUPLE OF TREES DOWN ALONG HD ATHA ROAD. (FFC)
2015,UNK,5 WNW WALLAND,BLOUNT,TN,35.75,-83.9,TWO TREES DOWN. (MRX)
2015,UNK,6 E DOYLE,WHITE,TN,35.85,-85.41,TREE DOWN ON BLACKBURN MOUNTAIN ROAD (OHX)
2018,UNK,FAIRINGTON,DEKALB,GA,33.7,-84.16,TREE KNOCKED DOWN ACROSS I20 WESTBOUND NEAR PANOLA ROAD. INTERSTATE CLOSED FOR ABOUT AN HOUR. (FFC)
2028,UNK,9 WNW GREENEVILLE,GREENE,TN,36.22,-82.97,TWO TREES DOWN. (MRX)
2029,UNK,RURAL HILL,WILSON,TN,36.11,-86.51,STRUCTURAL DAMAGE TO A HOUSE AT 688 POPLAR DRIVE DUE TO A FALLEN TREE. (OHX)
2030,UNK,GODFREY,MORGAN,GA,33.45,-83.5,NUMEROUS TREES AND POWER LINES DOWN (FFC)
2030,UNK,SWEETWATER,MONROE,TN,35.6,-84.47,TREES DOWN IN SWEETWATER. (MRX)
2030,UNK,2 N NEWPORT,COCKE,TN,35.99,-83.19,TREES DOWN. (MRX)
2036,UNK,1 E PINEVILLE,BELL,KY,36.76,-83.68,TREE DOWN ON TOP OF TRAILER AT BROWNING TRAILER PARK LOOP ON HWY 119 (JKL)
2045,UNK,4 SSE RURAL HILL,RUTHERFORD,TN,36.05,-86.48,A MOBILE HOME ROOF WAS BLOWN OFF AT WEAKLEY LN ALONG WITH MULTIPLE TREES AND POWER LINES DOWN IN THE AREA. (OHX)
2049,UNK,2 SE ANTIOCH,DAVIDSON,TN,36.04,-86.64,PORCH BLOWN OFF AND 3 HOMES DAMAGED ALONG COUCHVILLE PIKE. (OHX)
2050,UNK,DALLAS,PAULDING,GA,33.92,-84.84,911 CALL CENTER REPORTS FIVE TREES DOWN NEAR HW 61 NORTH AND BABBS RIDGE ROAD. (FFC)
2057,UNK,1 ENE COLES CROSSING,FANNIN,GA,34.96,-84.23,A COUPLE OF TREES DOWN ON HIGHWAY SPUR 60 NORTHEAST OF MINERAL BLUFF NOT FAR FROM THE NC STATE LINE. (FFC)
2100,UNK,COCHRAN,BLECKLEY,GA,32.39,-83.35,4 POWER LINES AND AT LEAST ONE TREE DOWN (FFC)
2100,UNK,3 ENE GREENSBORO,GREENE,GA,33.59,-83.13,TREES DOWN AT AIRPORT ROAD AND UNION POINT HIGHWAY AND AT OLD UNION POINT ROAD AND PENFIELD ROAD. (FFC)
2100,UNK,MURFREESBORO,RUTHERFORD,TN,35.85,-86.39,MULTIPLE TREES REPORTED DOWN ACROSS RUTHERFORD COUNTY. (OHX)
2100,UNK,2 NE SMYRNA,RUTHERFORD,TN,36,-86.49,A MOBILE HOME ROOF WAS BLOWN OFF AT WEAKLY LN ALONG WITH MULTIPLE TREES AND POWER LINES DOWN IN THE AREA. (OHX)
2100,UNK,SNEEDVILLE,HANCOCK,TN,36.54,-83.21,TREES DOWN ACROSS COUNTY. (MRX)
2105,UNK,2 N HOT SPRINGS,MADISON,NC,35.92,-82.83,1 SMALL TREE KNOCKED DOWN. (GSP)
2108,UNK,2 N LANCASTER,GARRARD,KY,37.65,-84.58,ROOF BLOWN PARTIALLY OFF BARN...LARGE TREE LIMBS DOWN. (LMK)
2110,UNK,2 S MADISONVILLE,MONROE,TN,35.49,-84.36,TREES DOWN SOUTH OF MADISONVILLE. (MRX)
2110,UNK,DAYTON,RHEA,TN,35.49,-85.01,NUMEROUS TREES DOWN. (MRX)
2110,UNK,2 S GREENEVILLE,GREENE,TN,36.14,-82.82,A FEW TREES DOWN. (MRX)
2110,UNK,4 ENE CEDAR HILL,ROBERTSON,TN,36.58,-86.93,TREES FELL AND CRUSHED A CAR AND PORCH ON MINNIS ROAD (OHX)
2112,UNK,2 SW TAZEWELL,CLAIBORNE,TN,36.44,-83.6,SEVERAL TREES DOWN. (MRX)
2115,UNK,SUGAR VALLEY,GORDON,GA,34.56,-85.01,911 CALL CENTER REPORTS NUMEROUS TREES DOWN ON HYDE ROAD AND TREES AND POWER LINES DOWN A THE RUSSELL HILL ESTATES. (FFC)
2115,UNK,DANVILLE,BOYLE,KY,37.64,-84.77,FEW TREES DOWN (LMK)
2115,UNK,4 SSE LEXINGTON,FAYETTE,KY,37.99,-84.57,DAMAGE TO BRICK HOME AND TREES DOWN AT CROMWELL WAY. (LMK)
2122,UNK,N COCHRAN,BLECKLEY,GA,32.39,-83.35,SEVERAL POWERLINES AND TREES DOWN ACROSS BLECKLEY COUNTY (FFC)
2124,59,LEXINGTON,FAYETTE,KY,38.04,-84.46,AT AIRPORT (LMK)
2125,UNK,1 S MOUNT VERNON,ROCKCASTLE,KY,37.35,-84.34,TREE DOWN ON SOUTH WILDERNESS ROAD (JKL)
2125,UNK,PALMER,ESTILL,KY,37.81,-84.07,7 TO 8 TREES DOWN ON HARRIS FERRY ROAD. (JKL)
2126,UNK,4 N GREENBRIER,ROBERTSON,TN,36.48,-86.79,A TREE WAS REPORTED DOWN ON POSSUM TROT RD AND HIGHWAY 76. MULTIPLE OTHER TREE DOWN REPORTS WERE LOCATED ALONG HIGHWAY 76 ACROSS THE COUNTY VIA EMERGENCY MANAGER AND SH (OHX)
2126,UNK,2 N GOLDVEIN,FAUQUIER,VA,38.48,-77.65,LARGE TREE DOWN NEAR INTERSECTION OF BLACKWELLS MILL RD AND DEEP RUN MILL RD (LWX)
2127,UNK,2 NE ARNCO-SARGENT,COWETA,GA,33.45,-84.84,SIX TREES DOWNED ACROSS COWETA COUNTY...INCLUDING ONE ACROSS REX HYDE ROAD. (FFC)
2129,UNK,3 ESE KEENE,JESSAMINE,KY,37.92,-84.59,TREES DOWN IN AREA OF HWY 169 BETWEEN HWY 68 AND 27. (LMK)
2130,UNK,DUNLAP,SEQUATCHIE,TN,35.37,-85.39,SEVERAL TREES DOWN. (MRX)
2132,75,CLARKSVILLE,MONTGOMERY,TN,36.56,-87.35,CLARKSVILLE ASOS MEASURED 75 MPH WIND GUST. (OHX)
2132,70,1 E LEFOR,STARK,ND,46.68,-102.54,LATE REPORT FROM 8-20-14. WIND DAMAGE ON A FARMSTEAD 1 E OF LEFOR. SHED WAS DESTROYED ALONG WITH TREE DAMAGE. (BIS)
2135,UNK,MITCHELL,GLASCOCK,GA,33.22,-82.7,A COUPLE OF TREES DOWN. (FFC)
2140,UNK,RENTZ,LAURENS,GA,32.38,-82.99,REPORT OF SEVERAL TREES DOWN ON HOLIDAY SOUTH DRIVE AND SPRINGHAVEN ROAD. (FFC)
2140,UNK,5 S MADISONVILLE,MONROE,TN,35.45,-84.36,TREES DOWN NEAR THE MONROE-POLK COUNTY LINE. (MRX)
2140,UNK,CLARKSVILLE,MONTGOMERY,TN,36.56,-87.35,TREES AND POWER LINES BLOWN DOWN ACROSS THE NORTHERN PORTIONS OF THE COUNTY. (OHX)
2150,UNK,MORELAND,COWETA,GA,33.29,-84.77,SIX TREES WERE BLOWN DOWN ACROSS COWETA COUNTY. (FFC)
2150,UNK,RICEVILLE,MCMINN,TN,35.38,-84.7,TREES DOWN NEAR RICEVILLE. (MRX)
2155,UNK,1 N COWAN,FRANKLIN,TN,35.18,-86.02,TREES AND POWERLINES DOWN ON GEORGIA CROSSING RD. (HUN)
2155,58,RDU INTERNATIONAL AIRPO,WAKE,NC,35.88,-78.79,50 KT WIND GUST AT KRDU. (RAH)
2155,UNK,RDU INTERNATIONAL AIRPO,WAKE,NC,35.88,-78.79,STRONG WINDS FLIPPED OVER A SUPER CARIVAN AIRCRAFT AND BLEW A LARGE CARGO CONTAINER OVER AN 8 FOOT FENCE INTO A CAR. BOTH EVENTS WERE NEAR THE NORTH CARGO RAMP. (RAH)
2155,UNK,MONTICELLO,WAYNE,KY,36.84,-84.85,PART OF A BOAT STORAGE BUILDING WAS BLOWN AWAY WEST OF HWY 82 (JKL)
2155,UNK,SCALF,KNOX,KY,36.92,-83.7,TWO TREES DOWN ON STINKING CREEK ROAD. (JKL)
2155,UNK,2 SSW MCWHORTER,LAUREL,KY,37.21,-84.02,TREES DOWN ALONG HWY 638 BETWEEN MILE MARKERS 4-12. (JKL)
2157,UNK,BUCKHORN LAKE S.P.,PERRY,KY,37.3,-83.44,THREE TREES DOWN ON LODGE ROAD. (JKL)
2203,63,FORT CAMPBELL NORTH,CHRISTIAN,KY,36.65,-87.46,DELAYED REPORT. WIND GUST REPORTED BETWEEN 503 PM AND 512 PM CDT AT OBSERVATION SITE. INITIAL GUST OF 43 MPH REPORTED AT 457 PM CDT...WITH HIGHER GUST OF 54 MPH AT 459 (PAH)
2204,UNK,1 NW BAKERSVILLE,MITCHELL,NC,36.03,-82.17,2 TREES REPORTED DOWN JUST NW OF BAKERSVILLE... NC. (GSP)
2206,UNK,PARKSVILLE,POLK,TN,35.1,-84.65,SEVERAL TREES DOWN IN AND NEAR PARKSVILLE. (MRX)
2210,UNK,7 SSW ADAMS,ROBERTSON,TN,36.48,-87.11,TWO LARGE OAK TREES WERE REPORTED DOWN ON STROUDSVILLE ROAD NEAR THE MONTGOMERY AND ROBERTSON COUNTY LINE. (OHX)
2210,UNK,1 E BOONEVILLE,OWSLEY,KY,37.48,-83.66,2 TREES DOWN ON HWY 3346. (JKL)
2213,UNK,1 NNW GREENBRIER,ROBERTSON,TN,36.43,-86.8,A TREE WAS REPORTED DOWN ON CHURCH STREET DOING MINOR DAMAGE TO A CAR ON CHURCH STREET IN GREENBRIER. (OHX)
2220,UNK,1 E VIPER,PERRY,KY,37.18,-83.13,TREE DOWN ON MACES CREEK ROAD. (JKL)
2225,UNK,CHATSWORTH,MURRAY,GA,34.77,-84.77,911 CALL CENTER REPORTS NUMEROUS TREES AND POWERLINES DOWN ACROSS THE COUNTY. (FFC)
2225,UNK,CLEVELAND,GREENVILLE,SC,35.07,-82.53,LOTS OF TREES DOWN COUNTY-WIDE. (MRX)
2228,UNK,2 N PRATER MILL,WHITFIELD,GA,34.92,-84.92,TREES DOWN ON MCGAUGHY CHAPEL AND STRAIN ROADS (FFC)
2230,UNK,MOUNTAINTOWN,GILMER,GA,34.76,-84.56,NUMEROUS TREES REPORTED DOWN ACROSS THE COUNTY. (FFC)
2230,UNK,TRENTON,DADE,GA,34.87,-85.51,911 CALL CENTER REPORTS NUMEROUS TREES DOWN ACROSS THE COUNTY. (FFC)
2234,UNK,1 SE CLEMSON,PICKENS,SC,34.67,-82.8,TREE FELL ON HOUSE CAUSING SIGNIFICANT DAMAGE. NO INJURIES REPORTED. (GSP)
2238,UNK,MARSHES SIDING,MCCREARY,KY,36.74,-84.48,A TRAINED SPOTTER REPORTED THAT MULTIPLE TREES HAD BEEN BLOWN DOWN ALL OVER THE COUNTY. THERE WERE ALSO SOME POWER OUTAGES REPORTED THAT COULD HAVE BEEN CAUSED BY EITHE (JKL)
2242,UNK,4 ESE KRYPTON,PERRY,KY,37.29,-83.27,A COUPLE OF TREES WERE REPORTED TO HAVE BEEN BLOWN DOWN. (JKL)
2245,UNK,2 NNW WILLIAMSBURG,WHITLEY,KY,36.76,-84.18,TREES DOWN ON AIRPORT ROAD. (JKL)
2246,UNK,3 SE ORANGE,ORANGE,VA,38.23,-78.07,TREE DOWN NEAR INTERSECTION OF MONROVIA RD AND BRICK CHURCH RD (LWX)
2247,UNK,1 W NORTON,WHITFIELD,GA,34.86,-84.87,TREES DOWN ALONG BOYLES MILL ROAD AND OAKDALE ROAD. (FFC)
2250,UNK,4 WNW ASHBURN,TURNER,GA,31.73,-83.71,COUPLE OF TREES DOWN ON WARWICK HIGHWAY (TAE)
2255,UNK,ELLIJAY,GILMER,GA,34.7,-84.48,TREES DOWN COUNTY WIDE. ROADS BLOCKED AND SOME TREES ON HOUSES. MULTIPLE POWER OUTAGES. (FFC)
2257,UNK,GARNER,WAKE,NC,35.69,-78.63,TREE ON POWER LINE CAUSED 10000 RESIDENTIAL AND COMMERCIAL OUTAGES WHICH LASTED THROUGH MIDNIGHT. (RAH)
2300,UNK,2 NE ABBA,BEN HILL,GA,31.77,-83.35,TREE DOWN ON PEAR ROAD (TAE)
2300,UNK,5 SE LAGRANGE,TROUP,GA,32.99,-84.97,ONE TREE WAS BLOWN DOWN ONTO A POWERLINE NEAR ROSEMONT ELEMENTARY SCHOOL. (FFC)
2300,UNK,CALLAWAY,BELL,KY,36.78,-83.56,TREE ON HWY 119 AT THE 2 MILE MARKER. (JKL)
2300,60,5 S GLEN ULLIN,MORTON,ND,46.74,-101.83,NEAR ZERO VISIBILITY FOR A BRIEF PERIOD IN VERY HEAVY RAIN. HARD TIME KEEPING CAR ON THE ROAD AS TRAVELER DROVE NORTH ON ND HIGHWAY 49. NO HAIL. REPORT RELAYED FROM PUB (BIS)
2310,UNK,3 SW ARP,IRWIN,GA,31.72,-83.44,TREE DOWN ON HIGHWAY 107 IN RURAL IRWIN COUNTY (TAE)
2310,UNK,JELLICO,CAMPBELL,TN,36.58,-84.13,A FEW TREES DOWN. (MRX)
2314,UNK,JASPER,PICKENS,GA,34.47,-84.43,911 CALL CENTER REPORTS NUMEROUS TREES AND POWERLINES DOWN ACROSS THE ENTIRE COUNTY. (FFC)
2315,UNK,PINE MOUNTAIN,HARRIS,GA,32.86,-84.85,911 CALL CENTER REPORTS 1 TREE DOWN IN PINE MOUNTAIN. (FFC)
2315,UNK,1 SSE VAWTER CORNER,LOUISA,VA,38.12,-78.01,TREE DOWN ON ELLISVILLE DRIVE (AKQ)
2317,UNK,SUGAR VALLEY,GORDON,GA,34.56,-85.01,911 CALL CENTER REPORTS SEVERAL TREES AND SEVERAL POWERLINES DOWN ON OWEN GIN ROAD...TATE BEND ROAD...GOAT ROAD...AND VICTORY ROAD. (FFC)
2325,UNK,WAVERLY HALL,HARRIS,GA,32.68,-84.74,911 CALL CENTER REPORTS 1 POWERLINE DOWN IN WAVERLY HALL. (FFC)
2325,UNK,LA FOLLETTE,CAMPBELL,TN,36.37,-84.13,A FEW TREES DOWN. (MRX)
2330,UNK,SHARPS CHAPEL,UNION,TN,36.34,-83.81,DISPATCH REPORTED A FEW TREES DOWNED IN THE COUNTY. (MRX)
2330,UNK,2 NW LOUISA,LOUISA,VA,38.04,-78.03,TREES DOWN. RESULTED IN TRANFORMER FIRE. (AKQ)
2333,UNK,1 NNW HOLLYMEAD,ALBEMARLE,VA,38.14,-78.44,TREE DOWN AT 100 BLOCK OF DEERWOOD RD (LWX)
2355,UNK,CLINTON,ANDERSON,TN,36.09,-84.13,TREES DOWN COUNTY-WIDE. (MRX)
0004,UNK,6 NW LEEFIELD,BULLOCH,GA,32.47,-81.69,WARNING POINT REPORTED TREE DOWN AT THE INTERSECTION OF FIVE CHOP ROAD AND HIGHWAY 24. (CHS)
0028,62,LAKE ST. LOUIS,ST. CHARLES,MO,38.79,-90.78,(LSX)
0030,UNK,KNOXVILLE,KNOX,TN,35.97,-83.95,A FEW TREES DOWN NEAR UT CAMPUS. (MRX)
0045,UNK,1 S MAYOS WOODS,GOOCHLAND,VA,37.72,-77.89,SEVERAL TREES DOWN ACROSS CENTRAL GOOCHLAND COUNTY. (AKQ)
0045,UNK,CHESTERFIELD,ST. LOUIS,MO,38.65,-90.58,MEDIUM SIZED TREE DOWN BLOCKING OLD CHESTERFIELD ROAD. (LSX)
0054,60,4 NW MAYWOOD,FRONTIER,NE,40.7,-100.68,(LBF)
0118,70,13 NNE MAYWOOD,LINCOLN,NE,40.83,-100.53,WINDS BENT METAL POLES ON TRAMPOLINE. (LBF)
0118,UNK,8 SW BRADY,LINCOLN,NE,40.94,-100.48,BLEW OVER GAZEBO... AND KNOCKED DOWN A COUPLE TREES. ALONG WITH WINDS... SOME NICKLE SIZE HAIL. (LBF)
0135,UNK,BRADY,LINCOLN,NE,41.02,-100.37,LARGE BRANCHES DOWN IN TOWN (LBF)
0140,60,BRADY,LINCOLN,NE,41.02,-100.37,(LBF)
0141,UNK,FINE CREEK MILLS,POWHATAN,VA,37.6,-77.82,TREES DOWN. (AKQ)
0157,UNK,1 ENE LAKE POWHATAN,POWHATAN,VA,37.58,-77.98,TREE ON A HOUSE (AKQ)
0205,UNK,11 NE BRADY,CUSTER,NE,41.14,-100.22,MEASURED 80 MPH FROM HOME WEATHER STATION. HAIL ALSO REPORTED TO BE WALNUT SIZE AND PUNCHED HOLES INTO SIDING. TIME ESTIMATED BY RADAR. DELAYED REPORT. (LBF)
0210,71,4 W TRAIL CITY,CORSON,SD,45.47,-100.81,PEAK WIND GUST FROM THE TRAIL CITY RWIS STATION. (ABR)
0215,UNK,2 SSE GILES MILL,AMELIA,VA,37.46,-77.96,SEVERAL TREES DOWN IN NORTHERN AMELIA. (AKQ)
0215,60,2 S TRAIL CITY,DEWEY,SD,45.44,-100.73,NO MAJOR DAMAGE. (ABR)
0230,59,MOBRIDGE,WALWORTH,SD,45.54,-100.44,(ABR)
0245,60,8 E LINTON,EMMONS,ND,46.27,-100.06,LATE REPORT FROM AUGUST 20 2014. TIME ESTIMATED. SMALL TREE BRANCHES BROKEN AND YARD FURNITURE DAMAGED. WIND LASTED 5 TO 10 MINUTES. (BIS)
0300,60,LAPLANT,DEWEY,SD,45.14,-100.65,(ABR)
0300,60,8 E LINTON,EMMONS,ND,46.27,-100.06,LATE REPORT FROM AUGUST 20 2014. TIME ESTIMATED. SMALL TREE BRANCHES BROKEN AND YARD FURNITURE DAMAGED. WIND LASTED 5 TO 10 MINUTES. CORRECTED TIME OF EVENT. (BIS)
0400,60,10 SW LEOLA,MCPHERSON,SD,45.62,-99.08,WINDS ESTIMATED AT 50 TO 60 MPH (ABR)
0534,UNK,5 S KEARNEY,KEARNEY,NE,40.63,-99.08,DELAYED REPORT...RELAYED VIA MEDIA. MULTIPLE TREE BRANCHES DOWN...SOME AS BIG AS SIX INCHES IN DIAMETER. SMALL FRUIT TREE ALSO UPROOTED. TIME ESTIMATED FROM RADAR. (GID)
0655,UNK,2 NE PROSSER,HALL,NE,40.71,-98.55,DELAYED REPORT. RELAYED VIA SOCIAL MEDIA. IRRIGATION PIVOT OVERTURNED. TIME ESTIMATED FROM RADAR. (GID)
0905,UNK,SPIRIT LAKE,DICKINSON,IA,43.42,-95.11,POWER OUT OVER MOST OF THE TOWN (FSD)
0938,63,2 WNW GRUVER,EMMET,IA,43.41,-94.75,MEASURED AT ESTHERVILLE AIRPORT (DMX)
Time,Size,Location,County,State,Lat,Lon,Comments
1215,100,3 SE SUN CITY,RIVERSIDE,CA,33.68,-117.17,PUBLIC REPORTS 1 INCH HAIL IN MENIFEE. (SGX)
1531,100,NUEVO,RIVERSIDE,CA,33.81,-117.14,SPOTTER REPORTED HAIL UP TO 1 INCH IN SIZE IN NUEVO. (SGX)
1658,100,MARION,MCDOWELL,NC,35.68,-82.01,QUARTER SIZE HAIL NEAR POST OFFICE IN DOWNTOWN MARION. (GSP)
1806,175,KINGSTON,ROANE,TN,35.87,-84.51,(MRX)
1854,100,4 SW HARTSVILLE,TROUSDALE,TN,36.35,-86.21,(OHX)
1900,100,3 N LEBANON,WILSON,TN,36.25,-86.32,SPOTTER ALSO REPORTED A FEW TREES AND SIGNS BLOWN DOWN IN THE AREA. (OHX)
1929,100,5 SW TAZEWELL,CLAIBORNE,TN,36.41,-83.64,(MRX)
2008,100,ANNVILLE,JACKSON,KY,37.32,-83.96,(JKL)
2010,100,LA GRANGE,OLDHAM,KY,38.4,-85.38,(LMK)
2019,100,1 SW SHELL VALLEY,ROLETTE,ND,48.78,-99.89,(BIS)
2058,100,ATHENS,MCMINN,TN,35.45,-84.6,(MRX)
2132,100,3 NW PICKENS,PICKENS,SC,34.91,-82.75,1 INCH HAIL NW OF PICKENS. (GSP)
2138,175,6 SW WHITE BUTTE,PERKINS,SD,45.88,-102.45,(UNR)
2148,100,NE PICKENS,PICKENS,SC,34.89,-82.7,(GSP)
2220,150,2 W CENTRAL,PICKENS,SC,34.72,-82.82,MIXED WITH QUARTER SIZED HAIL...SOCIAL MEDIA REPORT (GSP)
2230,100,TOOELE,TOOELE,UT,40.54,-112.3,TIME ESTIMATED. (SLC)
2230,100,1 SW LEMMON,PERKINS,SD,45.93,-102.17,(UNR)
2248,100,6 NNE COLBY,THOMAS,KS,39.47,-101.01,(GLD)
2255,175,SHADEHILL,PERKINS,SD,45.77,-102.18,(UNR)
2255,100,5 S HEBRON,MORTON,ND,46.83,-102.05,40 MPH WIND. 2.50 INCHES OF RAIN WITH STANDING WATER IN THE FARM YARD. (BIS)
2330,100,11 NNW SHAMBO RANCH,CORSON,SD,45.68,-101.92,(ABR)
2354,100,6 WNW CULBERTSON,HITCHCOCK,NE,40.27,-100.93,(GLD)
0000,125,10 N BISMARCK,BURLEIGH,ND,46.95,-100.78,(BIS)
0054,175,4 NW MAYWOOD,FRONTIER,NE,40.7,-100.68,BROKE WINDOWS ON CARS (LBF)
0054,175,4 N MAYWOOD,LINCOLN,NE,40.72,-100.62,(LBF)
0118,150,13 NNE MAYWOOD,LINCOLN,NE,40.83,-100.53,(LBF)
0205,100,7 E LITTLE EAGLE,CORSON,SD,45.68,-100.65,(ABR)
0315,100,7 SW AMELIA,HOLT,NE,42.16,-99.06,(LBF)
0500,100,ROSCOE,EDMUNDS,SD,45.45,-99.33,REPORT VIA FACEBOOK (ABR)
0515,100,3 W LAGOONA BEACH,ROBERTS,SD,45.37,-96.55,NICKEL TO QUARTER SIZE HAIL (ABR)
0851,100,LAKE PARK,DICKINSON,IA,43.45,-95.32,(FSD)
