Time,F_Scale,Location,County,State,Lat,Lon,Comments
0210,UNK,MOYOCK,CURRITUCK,NC,36.49,-76.14,MULTIPLE REPORTS OF TREES DOWN AND DAMAGE TO THE AWNING AT A BANK DRIVE IN. (AKQ)
0210,70,3 NE BAKER,TEXAS,OK,36.9,-100.98,(AMA)
0215,67,CORNING,CLAY,AR,36.41,-90.59,67 MPH GUST RECORDED BY AWOS. (MEG)
0217,UNK,BRYANS CORNER,BEAVER,OK,36.62,-100.82,POWERLINES DOWN WITH POWER OUT IN THE AREA. SOME DAMAGE TO PROPERTY DUE TO WINDS. (AMA)
0220,UNK,KINGSTON,ROANE,TN,35.87,-84.51,TREES DOWN ACROSS THE COUNTY. (MRX)
0225,UNK,7 SSW SHELBYVILLE,BEDFORD,TN,35.4,-86.49,TREE DOWN ON SHELBYVILLE HIGHWAY JUST NORTH OF THE LINCOLN COUNTY LINE. (OHX)
0225,UNK,CLINTON,ANDERSON,TN,36.09,-84.13,SEVERAL TREES DOWN ACROSS THE COUNTY. (MRX)
0225,UNK,LA FOLLETTE,CAMPBELL,TN,36.37,-84.13,A FEW TREES DOWN ACROSS THE COUNTY. (MRX)
0227,UNK,2 WNW PEA RIDGE,BENTON,AR,36.47,-94.15,POWER LINES DOWN. (TSA)
0228,UNK,WALNUT RIDGE,LAWRENCE,AR,36.07,-90.96,TREE FELL ON HOUSE ON GUM STREET IN WALNUT RIDGE. (MEG)
0229,UNK,DUNLAP,SEQUATCHIE,TN,35.37,-85.39,TWO TREES DOWN ACROSS SEQUATCHIE COUNTY. (MRX)
0230,UNK,LAWRENCEBURG,LAWRENCE,TN,35.25,-87.34,POWER LINES DOWNED NEAR ROTARY PARK. A POWER LINE WAS DOWNED RESULTING IN A FIRE STARTING IN A TREE AT ADMIRAL CIRCLE. (OHX)
0233,UNK,ELMWOOD,BEAVER,OK,36.62,-100.52,TREES AND POWERLINES DOWNED DUE TO THUNDERSTORM WIND GUST. (AMA)
0235,UNK,3 SSW WALCOTT,GREENE,AR,35.99,-90.69,TREES BLOCKING THE ROAD AT HIGHWAYS 141 AND 358. (MEG)
0240,UNK,2 W KNOXVILLE,KNOX,TN,35.97,-83.98,EXTENSIVE DAMAGE ACROSS WEST KNOX COUNTY. CARS CRUSHED BY TREES... WINDOWS BLOWN OUT CHIMNEY OFF HOME. (MRX)
0243,UNK,LOUDON,LOUDON,TN,35.74,-84.36,WIDESPREAD TREES AND POWER LINES DOWN ACROSS THE COUNTY. (MRX)
0245,UNK,OKEMAH,OKFUSKEE,OK,35.43,-96.3,TREES DOWN IN OKEMAH (TSA)
0245,UNK,1 S JONESBORO,CRAIGHEAD,AR,35.81,-90.69,LARGE METAL SHOP ROOF BLOWN OFF ALONG HIGHWAY 1 JUST SOUTH OF JONESBORO. (MEG)
0248,UNK,1 N FAYETTEVILLE,LINCOLN,TN,35.17,-86.56,TREE DOWN AT 159 SHELBYVILLE HWY. (HUN)
0248,69,DUCK,DARE,NC,36.16,-75.75,DUKN7 NOS C-MAN STATION ON DUCK PIER REPORTED A 69 MPH WIND GUSTS AT 1048 PM (MHX)
0250,59,1 SSW BEAVER,BEAVER,OK,36.8,-100.53,(AMA)
0255,UNK,SILOAM SPRINGS,BENTON,AR,36.19,-94.54,TREES DOWN. VIA BROADCAST MEDIA SOCIAL MEDIA ACCOUNT. (TSA)
0255,68,8 W SLAPOUT,BEAVER,OK,36.6,-100.26,(AMA)
0256,UNK,1 E SLAPOUT,BEAVER,OK,36.62,-100.1,LATE REPORT...18-WHEELER BLOWN OVER DUE TO THUNDERSTORM WINDS. (AMA)
0258,UNK,ATHENS,MCMINN,TN,35.45,-84.6,NUMEROUS TREES DOWN ACROSS THE COUNTY. A TREE FELL ONTO A HOUSE. NO INJURIES. (MRX)
0300,UNK,MARYVILLE,BLOUNT,TN,35.75,-83.97,MASSIVE TREES AND POWER LINES DOWN. SEVERAL TREES ON HOMES. (MRX)
0300,UNK,CARAWAY,CRAIGHEAD,AR,35.76,-90.33,TREES DOWN IN CARAWAY. (MEG)
0305,62,1 SSW BEAVER,BEAVER,OK,36.8,-100.53,(AMA)
0309,60,DAVIS,MURRAY,OK,34.5,-97.12,(OUN)
0309,60,3 SW MORRIS,OKMULGEE,OK,35.58,-95.9,(TSA)
0310,UNK,8 NNW SKYLINE,JACKSON,AL,34.92,-86.16,SEVERAL TREES WERE BLOWN DOWN AT THIS LOCATION NEAR HURRICANE CREEK. (HUN)
0310,UNK,RUTLEDGE,GRAINGER,TN,36.27,-83.52,WIDESPREAD TREES DOWN ACROSS THE COUNTY. (MRX)
0312,UNK,UNDERWOOD-PETERSVILLE,LAUDERDALE,AL,34.87,-87.69,A TREE WAS KNOCKED DOWN IN THE ROAD NEAR THE LAND FILL AT 5896 HIGHWAY 157 IN PETERSVILLE. (HUN)
0315,UNK,LEPANTO,POINSETT,AR,35.61,-90.33,TREES DOWN ON ROADS AND HOUSES IN LEPANTO. (MEG)
0315,UNK,NEWPORT,COCKE,TN,35.96,-83.19,NUMEROUS TREES DOWN ACROSS THE COUNTY. (MRX)
0316,UNK,1 SSE BOYNTON,CATOOSA,GA,34.91,-85.18,REPORT OF 1 TREE DOWN NEAR THE INTERSECTION OF THREE NOTCH RD AND BUSTER RIDGE LANE (FFC)
0316,76,COOTER,PEMISCOT,MO,36.05,-89.81,NUMEROUS TREES DOWN. (MEG)
0317,60,1 N SPRINGER,CARTER,OK,34.33,-97.14,VIA KFOR. (OUN)
0320,65,8 W SLAPOUT,BEAVER,OK,36.6,-100.26,(AMA)
0325,UNK,MORRIS,OKMULGEE,OK,35.61,-95.86,TREE DOWN BLOCKING SIDE STREET IN MORRIS (TSA)
0328,UNK,4 NNW NEW MARKET,MADISON,AL,34.96,-86.45,TREE DOWN ON JB WALKER ROAD... NEAR NEW MARKET... AL. (HUN)
0330,UNK,5 WNW ROGERSVILLE,LAUDERDALE,AL,34.86,-87.37,A TREE WAS KNOCKED DOWN IN THE ROADWAY ON CR 113 JUST NORTH OF CR 586. (HUN)
0330,UNK,2 WNW COHUTTA SPRINGS,MURRAY,GA,34.9,-84.76,REPORT OF A TREE BLOWN DOWN ON MANTOOTH RD SOUTH OF HALLS CHAPEL RD (FFC)
0330,UNK,BRYSON CITY,SWAIN,NC,35.43,-83.45,SWAIN COUNTY 911 REPORTS NUMEROUS CALLS OF MULTIPLE TREES DOWN AROUND THE COUNTY WITH A CONCENTRATION IN AND AROUND BRYSON CITY. (GSP)
0330,UNK,WHITTON,MISSISSIPPI,AR,35.51,-90.27,LARGE TREE FELL ON HOUSE IN WHITTON. (MEG)
0335,70,5 SW FITTSTOWN,PONTOTOC,OK,34.56,-96.7,(OUN)
0340,UNK,CRAWFORDSVILLE,CRITTENDEN,AR,35.23,-90.33,*** 1 INJ *** A LARGE TREE FELL ON TWO MOBILE HOMES IN CRAWFORDSVILLE. ONE MINOR INJURY OCCURRED. A FARM BUILDING WAS PUSHED OFF ITS SLAB ON HIGHWAY 50. (MEG)
0340,UNK,SYLVA,JACKSON,NC,35.37,-83.22,COUNTY 911 REPORTS DOWNED TREES ALL AROUND THE COUNTY. (GSP)
0342,UNK,5 ENE PISGAH,JACKSON,AL,34.7,-85.77,LARGE TREE DOWN IN ROSALIE ON COUNTY ROAD 78. (HUN)
0343,UNK,5 WSW PAINT ROCK,MADISON,AL,34.63,-86.4,TREE DOWN NEAR THE INTERSECTION OF CHERRY TREE ROAD AND BERKLEY. (HUN)
0344,UNK,MURPHY,CHEROKEE,NC,35.09,-84.03,SEVERAL TREES DOWN ACROSS THE COUNTY. (MRX)
0344,UNK,DENMARK,MADISON,TN,35.53,-89,SEVERAL TREES DOWN AND UPROOTED. (MEG)
0345,UNK,DEL RIO,COCKE,TN,35.92,-83.03,SEVERAL TREES DOWN ACROSS THE EASTERN PART OF THE COUNTY. (MRX)
0347,60,4 N RAVIA,JOHNSTON,OK,34.3,-96.76,(OUN)
0347,UNK,MILLINGTON,SHELBY,TN,35.33,-89.89,*** 1 INJ *** TREE DOWN ON TRAILER WHERE ONE PERSON WAS TRAPPED FOR SHORT PERIOD AND SUFFERED MINOR INJURIES. TIME ESTIMATED BASED ON RADAR. (MEG)
0350,UNK,2 W HENAGAR,DEKALB,AL,34.64,-85.77,LARGE TREE DOWN ON A POWER LINE ON GREENBRIAR DRIVE. (HUN)
0350,UNK,DOWNTOWN MEMPHIS,SHELBY,TN,35.13,-90.05,TRACTOR TRAILER OVERTURNED ON THE HERNANDO DESOTO I-40 BRIDGE. (MEG)
0353,UNK,3 SW GREENEVILLE,GREENE,TN,36.13,-82.86,SEVERAL TREES DOWN ACROSS THE WESTERN PART OF THE COUNTY. (MRX)
0355,UNK,FRANKLIN,MACON,NC,35.18,-83.38,COUNTY REPORTS WIDESPREAD TREES DOWN THROUGHOUT THE COUNTY. (GSP)
0355,UNK,SYLVA,JACKSON,NC,35.37,-83.22,COUNTY 911 REPORTS DOWNED TREES ALL AROUND THE COUNTY. (GSP)
0355,70,2 WSW WOODWARD,WOODWARD,OK,36.42,-99.42,(OUN)
0356,UNK,BARGERTON,HENDERSON,TN,35.73,-88.5,TREES AND POWER LINES DOWN ACROSS CENTRAL AND NORTHERN SECTIONS OF HENDERSON COUNTY. (MEG)
0400,UNK,1 S COALGATE,COAL,OK,34.53,-96.22,MULTIPLE TREES AND POWER LONES DOWN ON SOUTH SIDE OF COALGATE. (OUN)
0400,UNK,MUTUAL,WOODWARD,OK,36.23,-99.17,NUMEROUS WINDOWS BLOWN OUT. (OUN)
0405,UNK,2 N DOWNTOWN MEMPHIS,SHELBY,TN,35.16,-90.06,PARTIAL BUILDING COLLAPSE AND GAS LEAK AT THE 100 BLOCK OF HARBOR TOWN CIRCLE ON MUD ISLAND JUST NORTH OF DOWNTOWN MEMPHIS. (MEG)
0410,69,DOWNTOWN MEMPHIS,SHELBY,TN,35.13,-90.05,69 MPH GUST REPORTED IN DOWNTOWN MEMPHIS. (MEG)
0415,UNK,SOUTHAVEN,DESOTO,MS,34.97,-90,POWERLINES DOWN IN SOUTHAVEN. (MEG)
0415,UNK,3 E LAKE TOXAWAY,TRANSYLVANIA,NC,35.14,-82.88,COUNTY REPORTS TREES...BRANCHES...AND LEAF LITTER COVERING WILDWOOD DRIVE. (GSP)
0415,UNK,WEBBERS FALLS,MUSKOGEE,OK,35.51,-95.13,ROOF DAMAGE TO A HOME. PUBLIC POSTED ON BROADCAST MEDIA FACEBOOK PAGE. TIME ESTIMATED VIA RADAR. (TSA)
0415,UNK,5 NNW WAYNESVILLE,HAYWOOD,NC,35.56,-83.02,COUNTY REPORTS TREES AND POWERLINES DOWN COUNTYWIDE BUT WITH A HEAVY CONCENTRATION IN THE HIGHWAY 276 JONATHAN CREEK AREA. (GSP)
0415,UNK,MARSHALL,MADISON,NC,35.8,-82.68,COUNTY REPORTS TREES AND POWER LINES DOWN THROUGHOUT THE COUNTY WITH WIDESPREAD POWER OUTAGES. HARDEST HIT AREAS INCLUDE HOT SPRINGS...MARSHALL...LAUREL...MARS HILL. (GSP)
0415,62,4 NE CESTOS,WOODWARD,OK,36.19,-99.04,(OUN)
0420,UNK,CANDLER,BUNCOMBE,NC,35.54,-82.69,SEVERAL TREES DOWN ACROSS MAINLY THE WESTERN HALF OF BUNCOMBE COUNTY. (GSP)
0422,UNK,ROCKY FORK,UNICOI,TN,36.03,-82.55,A FEW TREES DOWN ACROSS THE SAM GAP AREA. (MRX)
0425,UNK,1 N RINGLING,JEFFERSON,OK,34.19,-97.59,LATE REPORT. THREE POWER POLES SNAPPED ON HIGHWAY 89 ONE HALF MILE NORTH OF RINGLING. TIME ESTIMATED BY RADAR. (OUN)
0425,UNK,TIGER,RABUN,GA,34.85,-83.43,TREE AND POWER LINE DOWN WITH A TRANSFORMER FIRE ON MURRAY COVE ROAD. (GSP)
0425,UNK,WNW BURNSVILLE,YANCEY,NC,35.92,-82.3,YANCEY COUNTY 911 CALL CENTER REPORTS WIDESPREAD TREE DAMAGE ACROSS THE COUNTY... ESPECIALLY ALONG U.S. 19. (GSP)
0427,UNK,CHESTER,MAJOR,OK,36.22,-98.92,SEVERAL POWER POLES DOWN. REPORT RELAYED FROM EMERGENCY MANAGER THROUGH WEBEOC. (OUN)
0430,71,1 N RINGLING,JEFFERSON,OK,34.19,-97.59,(OUN)
0430,UNK,SALLISAW,SEQUOYAH,OK,35.46,-94.79,TREE ON HOME IN SALLISAW. TIME ESTIMATED BY RADAR. (TSA)
0440,UNK,HENDERSONVILLE,HENDERSON,NC,35.32,-82.46,COUNTY REPORTS SCATTERED TREES DOWN COUNTYWIDE WITH A FEW IN HENDERSONVILLE. (GSP)
0440,UNK,1 NNE WOODLAWN,MCDOWELL,NC,35.79,-82.03,ONE TREE BLOWN DOWN ALONG HIGHWAY 221 NORTH. (GSP)
0450,UNK,CEDARVILLE,CRAWFORD,AR,35.57,-94.37,WIDESPREAD TREE DAMAGE ON ARKANSAS 220 NORTH OF CEDARVILLE. (TSA)
0452,UNK,FORT SMITH,SEBASTIAN,AR,35.39,-94.4,TWO LARGE TREES UPROOTED NEAR PHOENIX AVENUE AND MASSARD ROAD (TSA)
0455,UNK,RUTHERFORDTON,RUTHERFORD,NC,35.36,-81.96,SCATTERED TREES DOWN ON POWERLINES AROUND COUNTY BUT WITH A GREATER CONCENTRATION IN THE WEST END ESPECIALLY LAKE LURE AREA. (GSP)
0500,UNK,POTTS CAMP,MARSHALL,MS,34.65,-89.31,POWER LINES DOWN IN POTTS CAMP. (MEG)
0500,UNK,HODGEN,LE FLORE,OK,34.84,-94.63,MEDIUM SIZE TREES SNAPPED (TSA)
0505,UNK,PINE GROVE,BENTON,MS,34.71,-89.18,DOWNED TREES ON HIGHWAY 2 IN PINE GROVE. (MEG)
0505,UNK,MICHIE,MCNAIRY,TN,35.06,-88.43,TREE DOWN ON HOUSE ON HIGHWAY 22 IN MICHIE. (MEG)
0515,UNK,RIPLEY,TIPPAH,MS,34.73,-88.94,TREES DOWN IN RIPLEY. (MEG)
0515,UNK,MORGANTON,BURKE,NC,35.74,-81.7,COUNTY REPORTS SCATTERED TREES AND POWER LINES DOWN AROUND COUNTY. (GSP)
0520,59,2 NNE LONE GROVE,CARTER,OK,34.21,-97.25,(OUN)
0520,UNK,MYRTLE,UNION,MS,34.56,-89.12,HOME DAMAGED IN WESTERN UNION COUNTY WITH DEBRIS ROAD. (MEG)
0525,70,CLAYTON,PUSHMATAHA,OK,34.59,-95.35,(TSA)
0525,UNK,10 ESE BOONEVILLE,PRENTISS,MS,34.61,-88.41,TREES DOWN ON HIGHWAY 4 IN PINEY GROVE AREA. (MEG)
0525,UNK,6 W BOONEVILLE,PRENTISS,MS,34.66,-88.67,TREES DOWN IN THE DRY CREEK COMMUNITY. (MEG)
0531,UNK,CLAYTON,PUSHMATAHA,OK,34.59,-95.35,LARGE TREES DOWN IN CLAYTON. (TSA)
0532,UNK,POLKVILLE,CLEVELAND,NC,35.42,-81.64,COUNTY REPORTS A FEW TREES DOWN AROUND POLKVILLE. (GSP)
0535,UNK,BALDWYN,LEE,MS,34.5,-88.63,TREES DOWN IN BALDWYN. (MEG)
0535,UNK,9 WNW UNDERWOOD-PETERSV,LAUDERDALE,AL,34.92,-87.85,A TREE WAS KNOCKED DOWN ACROSS ROAD AT 3673 CR 158. (HUN)
0537,UNK,3 SSW CHEROKEE,COLBERT,AL,34.71,-87.99,TREES DOWN IN THE RIVERTON ROSE PARK AREA. TIME ESTIMATED FROM RADAR. (HUN)
0540,UNK,ECRU,PONTOTOC,MS,34.36,-89.03,TREES AND POWERLINES DOWN ACROSS THE COMMUNITY (MEG)
0540,UNK,LUTHERVILLE,JOHNSON,AR,35.48,-93.28,A FEW BARNS AND METAL OUTBUILDINGS DESTROYED. (LZK)
0545,75,8 N RED BAY,FRANKLIN,AL,34.56,-88.11,MEASURED 75 MPH GUST IN POGO COMMUNITY BEFORE POWER WAS LOST. RELAYED BY BROADCAST MEDIA. TIME ADJUSTED FROM RADAR. (HUN)
0545,78,WHITESBORO,LE FLORE,OK,34.69,-94.89,TREES AND POWERLINES DOWN (TSA)
0550,UNK,GOLDEN,TISHOMINGO,MS,34.49,-88.19,A FEW TREES DOWN IN GOLDEN. (MEG)
0550,UNK,7 W SHEFFIELD,LAUDERDALE,AL,34.76,-87.82,A LARGE TREE WAS KNOCKED DOWN ON WOODLAND ROAD SOUTH OF CR 204. (HUN)
0550,UNK,4 NNW SAINT FLORIAN,LAUDERDALE,AL,34.93,-87.64,A TREE WAS KNOCKED DOWN ON CR 224 BETWEEN THE RR TRACKS AND CR 309. (HUN)
0555,UNK,4 S KIRKVILLE,ITAWAMBA,MS,34.39,-88.49,POWER LINES DOWN IN THE RATCLIFF COMMUNITY. (MEG)
0557,60,VANCE AIR FORCE BASE,GARFIELD,OK,36.34,-97.9,(OUN)
0602,UNK,2 WSW VINA,FRANKLIN,AL,34.36,-88.09,WIDESPREAD TREES DOWN ALONG CR 23 SOUTH OF VINA. DELAYED REPORT FROM 5/28. (HUN)
0605,UNK,4 SW HOCHATOWN,MCCURTAIN,OK,34.16,-94.71,LARGE TREE DOWN ON MARINA LANE NEAR BEAVERS BEND MARINA. (SHV)
0605,UNK,POTTSVILLE,POPE,AR,35.25,-93.05,METAL ROOFING REMOVED FROM A ROW OF BUSINESSES. NUMEROUS TREES DOWN OR SNAPPED. (LZK)
0605,62,RUSSELLVILLE,POPE,AR,35.27,-93.14,(LZK)
0608,UNK,LITTLEVILLE,COLBERT,AL,34.6,-87.67,TREE DOWN ON JACKSON HIGHWAY IN LITTLEVILLE. TIME ESTIMATED FROM RADAR. (HUN)
0609,UNK,5 NE KILLEN,LAUDERDALE,AL,34.9,-87.46,A TREE WAS KNOCKED DOWN AT CR 73 AND CR 71. (HUN)
0610,UNK,PLANTERSVILLE,LEE,MS,34.21,-88.67,TREES DOWN IN PLANTERSVILLE. (MEG)
0610,UNK,6 N TOWN CREEK,LAWRENCE,AL,34.75,-87.42,TREES WERE REPORTED DOWN IN THE EASTERN PORTIONS OF THE HATTON COMMUNITY. (HUN)
0610,60,3 SE HEAVENER,LE FLORE,OK,34.86,-94.56,IN HONTUNBY. TIME ESTIMATED BY RADAR. (TSA)
0610,UNK,DENVER,LINCOLN,NC,35.53,-81.03,SEVERAL LARGE TREES DOWN. LOCATION AND TIME ESTIMATED. (GSP)
0610,UNK,3 N DENVER,CATAWBA,NC,35.57,-81.02,MULTIPLE TREES AND POWER LINES DOWN. RELAYED BY AMATEUR RADIO. TIME ESTIMATED. (GSP)
0611,UNK,1 S RUSSELLVILLE,FRANKLIN,AL,34.5,-87.73,TREES DOWN BEHIND THE RUSSELLVILLE WALMART. TIME ESTIMATED FROM RADAR. (HUN)
0615,UNK,STATESVILLE,IREDELL,NC,35.79,-80.89,WIDESPREAD TREES DOWN AROUND THE COUNTY. (GSP)
0619,UNK,4 E RAINSVILLE,DEKALB,AL,34.5,-85.78,A TREE WAS REPORTED DOWN AT THIS LOCATION. (HUN)
0620,69,HAMILTON,MARION,AL,34.14,-87.98,MEASURED WIND GUST OF 69 MPH ASSOCIATED WITH SIGNIFICANT DAMAGE IN AND AROUND HAMILTON. (BMX)
0620,UNK,HAMILTON,MARION,AL,34.14,-87.98,TREE ON HOME WITH ENTRAPMENT. CHILD SAFELY REMOVED FROM HOME. NO INJURIES. (BMX)
0620,UNK,1 W HACKLEBURG,MARION,AL,34.27,-87.85,METAL OUTBUILDING BLOW DOWN AND ACROSS CR 345. SAME AREA AS MOBILE HOME DAMAGE PREVIOUSLY REPORTED. (BMX)
0620,UNK,10 SE HEAVENER,LE FLORE,OK,34.79,-94.48,DAMAGE TO BARN... TIN BLOWN OFF ROOF IN HAW CREEK. (TSA)
0620,UNK,5 N MORRILTON,CONWAY,AR,35.22,-92.74,A TREE FELL ON A HOUSE. THE OCCUPANTS WERE UNINJURED. (LZK)
0622,60,3 NNW PHIL CAMPBELL,FRANKLIN,AL,34.39,-87.73,SPOTTER ESTIMATED WINDS OF AT LEAST 60 MPH... POSSIBLY HIGHER... IN SPRUCE PINE. TIME ADJUSTED BASED ON RADAR. (HUN)
0622,UNK,2 S ROGERSVILLE,LAUDERDALE,AL,34.8,-87.28,A TREE WAS KNOCKED DOWN AT CR 70 AND TIPTON ROAD. (HUN)
0627,UNK,2 ESE FLORENCE,LAUDERDALE,AL,34.82,-87.63,A TREE AND POWER POLE WERE KNOCKED DOWN AT 126 SOUTH ORLEANS STREET. (HUN)
0630,UNK,AMORY,MONROE,MS,33.99,-88.48,SOME TREES DOWN ON HIGHWAY 278 IN THE AMORY AREA AND ACROSS NORTHERN MONROE COUNTY. A TREE FELL ON HOUSE IN AMORY. (MEG)
0633,UNK,1 WSW HALEYVILLE,MARION,AL,34.23,-87.64,TREES AND POWER LINES DOWN IN AND AROUND THE CITY OF HALEYVILLE. TIME BASED ON RADAR. (BMX)
0633,UNK,1 SW MOULTON,LAWRENCE,AL,34.47,-87.29,TREE DOWN NEAR MARKET STREET AND BYLER ROAD. (HUN)
0640,UNK,CREWS,LAMAR,AL,33.91,-88.08,LARGE TREES DOWN IN THE CREWS COMMUNITY. ONE VEHICLE WAS HEAVILY DAMAGED. VIA SOCIAL MEDIA... TIME BASED ON RADAR. (BMX)
0640,UNK,WILLIAMS JUNCTION,PERRY,AR,34.88,-92.77,LARGE TREE UPROOTED. (LZK)
0644,UNK,1 E WATERLOO,LAUDERDALE,AL,34.92,-88.05,POWER LINES WERE KNOCKED DOWN AND DEBRIS WAS IN THE ROAD ALONG CR 14 IN FRONT OF THE ROCK WALL. (HUN)
0645,UNK,ABERDEEN,MONROE,MS,33.83,-88.55,A FEW TREES DOWN AROUND ABERDEEN. (MEG)
0645,UNK,4 E DE QUEEN,SEVIER,AR,34.05,-94.27,SHERIFF OFFICE REPORTS SEVERAL LARGE TREES DOWN AT WEYERHAEUSER OFFICE JUST EAST OF DE QUEEN. (SHV)
0648,UNK,LYNN,WINSTON,AL,34.04,-87.55,TREES DOWN AND DAMAGE TO OUTBUILDINGS IN THE LYNN COMMUNITY. VIA SOCIAL MEDIA... TIME BASED ON RADAR. (BMX)
0653,UNK,10 WSW FALKVILLE,MORGAN,AL,34.34,-87.09,A TREE WAS KNOCKED DOWN AT 1100 ANDREWS ROAD. (HUN)
0655,UNK,MT IDA,MONTGOMERY,AR,34.55,-93.63,TREES AND POWER LINES DOWN ALL THROUGH THE COUNTY. (LZK)
0655,UNK,4 WSW LINWOOD,DAVIDSON,NC,35.73,-80.38,ONE TREE WAS REPORTED DOWN ON A RESIDENCE ALONG SEVEN OAKS DRIVE. (RAH)
0700,UNK,6 NE LOCKESBURG,SEVIER,AR,34.04,-94.11,SHERIFF REPORTS TREES DOWN IN THE PROVO COMMUNITY. (SHV)
0704,UNK,2 SSE PRICEVILLE,MORGAN,AL,34.49,-86.87,A TREE WAS KNOCKED DOWN AT 1100 NATURAL BRIDGE ROAD. (HUN)
0707,UNK,FAYETTE,FAYETTE,AL,33.69,-87.83,LARGE TREE DOWN ON A HOUSE IN FAYETTE. (BMX)
0707,UNK,BEN LOMOND,SEVIER,AR,33.84,-94.12,SHERIFF OFFICE REPORTS SEVERAL TREES DOWN IN THE BEN LOMOND AREA. (SHV)
0709,UNK,EAST TRION,CHATTOOGA,GA,34.55,-85.29,TREES AND POWERLINES WERE REPORTED DOWN IN TRION... NEAR THE INTERSECTIONS OF HIGHWAY 27 AND MOUNTAIN VIEW ROAD AND SCENIC HILL ROAD. (FFC)
0710,UNK,5 NNW SHERMAN,GRAYSON,TX,33.7,-96.6,LARGE SIGN BLOWN DOWN AT HWY 82/FM 1417. DEBRIS ON ROAD AT HWY 82/TRAVIS ST. (FWD)
0715,UNK,MINERAL SPRINGS,HOWARD,AR,33.88,-93.92,WIDESPREAD TREES DOWN ACROSS TOWN... ALONG WITH SOME TREES CAUSING DAMAGE TO HOMES. (SHV)
0715,UNK,NAUVOO,WALKER,AL,33.99,-87.49,MULTIPLE TREES DOWN. (BMX)
0715,UNK,2 N SOUTH VINEMONT,CULLMAN,AL,34.26,-86.86,TREE DOWN ACROSS COUNTY ROAD 1371. TIME ESTIMATED FROM RADAR. (HUN)
0716,UNK,7 SE TRIANA,MORGAN,AL,34.52,-86.67,A TREE WAS KNOCKED DOWN AT 187 MACK BROWN ROAD. (HUN)
0718,UNK,1 SSE EVA,MORGAN,AL,34.31,-86.75,A TREE WAS KNOCKED DOWN AT 485 OZ DAVIS ROAD. (HUN)
0718,60,1 SE EVA,MORGAN,AL,34.32,-86.74,SPOTTER ESTIMATED 60-65 MPH GUSTS IN EVA. TIME ESTIMATED FROM RADAR. (HUN)
0719,78,1 NNW SOUTH VINEMONT,CULLMAN,AL,34.25,-86.87,SPOTTER REPORTED DIME HAIL AND MEASURED 78 MPH GUST NEAR VINEMONT. (HUN)
0732,UNK,LONO,HOT SPRING,AR,34.2,-92.7,TREES REPORTED TO BE BLOWN DOWN. (LZK)
0736,UNK,KIRBY,PIKE,AR,34.25,-93.63,TREE BRANCH FELL THROUGH THE ROOF OF A HOME (LZK)
0740,UNK,1 SW HOT SPRINGS,GARLAND,AR,34.49,-93.07,ROOF DAMAGE TO A DOZEN STORAGE UNITS AND A HOME HAD A UTILITY POLE FALL ONTO IT. (LZK)
0742,UNK,2 SSW MANCHESTER,WALKER,AL,33.87,-87.27,LARGE TREE DOWN ON AIRPORT RD IN JASPER BLOCKING THE ROADWAY. TIME BASED ON RADAR. VIA SOCIAL MEDIA. (BMX)
0747,UNK,ONEONTA,BLOUNT,AL,33.95,-86.47,TREES DOWN THROUGHOUT THE COUNTY... INCLUDING HAYDEN... ONEONTA... CLEVELAND... LOCUST FORK... AND BLOUNTSVILLE. (BMX)
0808,UNK,LONO,HOT SPRING,AR,34.2,-92.7,TREES REPORTED TO BE BLOWN DOWN. (LZK)
0818,UNK,2 E ST. CLAIR SPRINGS,ST. CLAIR,AL,33.76,-86.37,ALABAMA HWY 23 BLOCKED BY DOWNED TREES AT THE INTERSECTION OF HWY 23 AND COUNTY RD 222. LOTS OF TREES REPORTED DOWN ON COUNTY ROAD 222. VIA SOCIAL MEDIA. (BMX)
0834,UNK,1 NE MOUNTAIN BROOK,JEFFERSON,AL,33.51,-86.74,LARGE TREE DOWN CRUSHING A VEHICLE IN CRESTLINE PARK IN EAST BIRMINGHAM. VIA SOCIAL MEDIA... TIME BASED ON RADAR. (BMX)
0838,UNK,WEAVER,CALHOUN,AL,33.75,-85.81,TREES DOWN IN WEAVER. (BMX)
0842,UNK,1 SW HERMITAGE,FLOYD,GA,34.31,-85.08,A TREE WAS REPORTED DOWN NEAR THE INTERSECTION OF BARRON ROAD NORTHEAST AND WARD MOUNTAIN ROAD NORTHEAST (FFC)
0903,UNK,CAVE SPRING,FLOYD,GA,34.11,-85.33,A TREE WAS REPORTED DOWN NEAR THE INTERSECTION OF REHAB DRIVE AND PADLOCK MOUNTAIN ROAD SOUTHWEST. (FFC)
0910,UNK,1 WNW LAVENDER,FLOYD,GA,34.3,-85.36,TREE BLOWN OVER ONTO POWERLINES ON THE 1100 BLOCK OF FRIDAY RD (FFC)
0914,UNK,1 ENE JOHN GRAHAM HOMES,FLOYD,GA,34.24,-85.16,TREE BLOWN OVER ONTO POWERLINES ON E 2ND AVE (FFC)
0919,UNK,2 SE BUCHANAN,HARALSON,GA,33.78,-85.16,A TREE WAS REPORTED DOWN NEAR THE INTERSECTION OF MORGAN ROAD AND MCBRAYER ROAD. (FFC)
0935,UNK,1 ESE UNION,PAULDING,GA,33.84,-84.96,LARGE TREE LIMBS WERE REPORTED IN THE STREET NEAR THE INTERSECTION OF HARMONY ROAD AND MULBERRY ROCK ROAD. (FFC)
0935,UNK,LOGAN TRACE,COBB,GA,34.07,-84.68,A TREE WAS REPORTED DOWN NEAR THE INTERSECTION OF LOGAN ROAD AND CHEROKEE STREET. (FFC)
0940,UNK,DUE WEST ESTATES,PAULDING,GA,33.98,-84.74,POWER LINES WERE REPORTED DOWN NEAR THE INTERSECTION OF HIGHWAY 92 AND DUE WEST ROAD. (FFC)
0947,UNK,SWEETWATER BLUFF,DOUGLAS,GA,33.63,-84.83,POWER LINES WERE REPORTED DOWN NEAR THE INTERSECTION OF HIGHWAY 5 AND SWEETWATER DRIVE. (FFC)
0947,UNK,1 ENE HICKORY GLEN,COBB,GA,33.82,-84.72,A TREE WAS REPORTED DOWN NEAR THE INTERSECTION OF COBALD DRIVE AND STOUT PARKWAY SOUTHWEST... (FFC)
0955,UNK,SOUTH RIDGE,DOUGLAS,GA,33.74,-84.67,A TREE WAS REPORTED DOWN NEAR THE INTERSECTION OF LEE ROAD AND OLD LEE ROAD. (FFC)
0955,UNK,RIVERHILL,COBB,GA,33.96,-84.41,A TREE WAS REPORTED DOWN NEAR THE INTERSECTION OF JOHNSON FERRY ROAD AND HAMPTON FARMS DRIVE (FFC)
1003,UNK,MIDTOWN,FULTON,GA,33.78,-84.39,A TREE WAS BLOWN OVER ONTO A BUILDING AT THE 12TH STREET WEST APARTMENTS (FFC)
1020,UNK,1 NNE PANTHERSVILLE,DEKALB,GA,33.73,-84.26,A LARGE TREE WAS SNAPPED AND POWER LINES WERE DOWNED ALONG BARBARA LANE. (FFC)
1150,UNK,5 SSE SHREVEPORT,CADDO,LA,32.4,-93.78,MAIL BOX BLOWN DOWN THE STREET... TREES ON HOME ON FRANCIS STREET CAUSING ROOF DAMAGE... NUMEROUS LARGE TREE LIMBS DOWN AND PINE TREES BLOWN OVER. TREE CRUSHED A METAL (SHV)
Time,Size,Location,County,State,Lat,Lon,Comments
1634,100,3 WNW BETO JUNCTION,COFFEY,KS,38.42,-95.74,SUBWAY RESTAURANT REPORTED SEVERAL QUARTER SIZE HAIL STONES. (TOP)
1645,175,3 S MELVERN,OSAGE,KS,38.46,-95.63,LOTS OF GOLF BALL SIZE HAIL STONES. (TOP)
1700,175,2 E GALESBURG,NEOSHO,KS,37.47,-95.32,DELAYED REPORT (ICT)
1705,100,RANTOUL,FRANKLIN,KS,38.55,-95.1,A FEW QUARTER SIZE STONES. (TOP)
1712,100,1 W STILLWELL,JOHNSON,KS,38.77,-94.68,QUARTER SIZE HAIL REPORTED NEAR 199TH ST. AND HWY 69 (EAX)
1718,125,FORT LEONARD WOOD,PULASKI,MO,37.71,-92.16,HALF DOLLAR SIZE HAIL. TIME BASED ON RADAR. REPORT VIA INTERNET. (SGF)
1730,100,5 S ERIE,NEOSHO,KS,37.5,-95.24,PER SOCIAL MEDIA. (ICT)
1736,250,ARCHIE,CASS,MO,38.48,-94.35,DELAYED REPORT...PHOTO OF TENNIS BALL SIZED HAIL IN ARCHIE (EAX)
1752,100,5 WNW LECOMA,PHELPS,MO,37.81,-91.8,DIME TO ALMOST QUARTER SIZE HAIL BETWEEN 63 AND O HIGHWAY AT THE PHELPS/DENT COUNTY LINE. (SGF)
1752,100,ELLINWOOD,BARTON,KS,38.36,-98.58,PER SOCIAL MEDIA (ICT)
1802,425,4 NNW BALLARD,BATES,MO,38.41,-94.17,BATES COUNTY SHERIFF CALLED TO REPORT SEVERAL REPORTS OF SOFTBALL SIZE HAIL EAST OF ADRIAN (EAX)
1803,100,CHASE,RICE,KS,38.36,-98.35,(ICT)
1805,100,4 N KENOMA,BARTON,MO,37.49,-94.19,BARTON COUNTY QUATER SIZE HAIL REPORTED AT A HWY AND 160 HWY. (SGF)
1808,125,NNE CREIGHTON,CASS,MO,38.5,-94.07,ABOUT QUARTER TO HALF DOLLAR SIZE HAIL REPORTED AT CONOCO (EAX)
1810,100,3 ENE GREENFIELD,DADE,MO,37.43,-93.79,1.00 INCH HAIL. TIME BASED ON RADAR. VIA INTERNET SUBMISSION. (SGF)
1825,150,2 W LITTLE RIVER,RICE,KS,38.4,-98.05,(ICT)
1833,175,2 S CLINTON,HENRY,MO,38.34,-93.78,(EAX)
1838,200,3 ESE SALEM,DENT,MO,37.63,-91.49,PUBLIC SUBMITTED PHOTOS OF 2 INCH HAIL EAST OF SALEM VIA SOCIAL MEDIA. (SGF)
1840,100,WARDSVILLE,COLE,MO,38.49,-92.17,(LSX)
1848,200,4 S COAL,HENRY,MO,38.26,-93.6,REPORT FROM EM OF SEVERAL VEHICHLES WITH WINDSHIELDS BROKEN OUT DUE TO HAIL AT THE BUCKSAW MARINA. HAIL SIZE UNKNOWN. (EAX)
1848,100,NNE GREEN RIDGE,PETTIS,MO,38.62,-93.41,REPORTED AT CASEYS GENERAL STORE (EAX)
1900,175,2 N GREENFIELD,DADE,MO,37.44,-93.84,GOLF BALL SIZE HAIL. VIA SOCIAL MEDIA. (SGF)
1910,150,5 SE GALVA,MCPHERSON,KS,38.33,-97.47,TRAINED SPOTTER REPORTS QUARTER TO PING PONG BALL SIZED HAIL WHICH COVERED THE GROUND. THE HAIL LASTED FOR FIVE MINUTES. TIME IS ESTIMATED FROM RADAR. (ICT)
1910,100,OTTERVILLE,COOPER,MO,38.7,-93,(EAX)
1915,175,3 SSE BOLIVAR,POLK,MO,37.57,-93.39,GOLF BALL SIZE HAIL VIA LE. (SGF)
1919,300,9 NW REYNOLDS,REYNOLDS,MO,37.48,-91.19,TIME ESTIMATED FROM RADAR.. (LSX)
1935,150,HALLTOWN,LAWRENCE,MO,37.2,-93.63,REPORTS OF PING PONG SIZED HAIL AND N HWY AND I-44 IN HALLTOWN AREA. (SGF)
1940,100,3 W DANVILLE,BOYLE,KY,37.65,-84.83,(LMK)
1950,175,3 NNE SPRINGFIELD,GREENE,MO,37.24,-93.27,REPORTED AT KEARNEY AND PICKWICK... SPRINGFIELD... MO. GOLF BALL SIZED HAIL. (SGF)
1950,175,3 E TASWELL,CRAWFORD,IN,38.34,-86.52,(LMK)
1953,175,1 N MCLEANSBORO,HAMILTON,IL,38.11,-88.53,(PAH)
1956,200,2 N CENTERVILLE,REYNOLDS,MO,37.47,-90.96,(LSX)
2000,175,3 NE LOOSE CREEK,OSAGE,MO,38.54,-91.92,(LSX)
2005,100,1 W STRAFFORD,GREENE,MO,37.27,-93.13,305PM ..QUARTER SIZED HAIL...1 MI W OF STRAFFORD... GREENE COUNTY. (SGF)
2015,175,GROVESPRING,WRIGHT,MO,37.4,-92.61,GOLF BALL SIZE HAIL WITH SNAPPED TREES. (SGF)
2015,175,LESTERVILLE,REYNOLDS,MO,37.46,-90.83,TIME ESTIMATED FROM RADAR. (LSX)
2020,100,WICKLIFFE,BALLARD,KY,36.97,-89.08,(PAH)
2020,175,2 N STANTON,POWELL,KY,37.88,-83.86,THE EVENT TIME IS ESTIMATED FROM RADAR DATA FOR REPORT VIA SOCIAL MEDIA. (JKL)
2033,200,SABULA,IRON,MO,37.41,-90.69,(LSX)
2035,175,1 S ECKERTY,CRAWFORD,IN,38.3,-86.62,(LMK)
2038,100,2 SSE LINN,OSAGE,MO,38.46,-91.83,(LSX)
2040,125,2 NW ANDERSONVILLE,BUCKINGHAM,VA,37.48,-78.59,PHOTO SUBMITTED OF HALF-DOLLAR SIZE HAIL IN ANDERSONVILLE. (RNK)
2042,175,9 SW OLPE,LYON,KS,38.19,-96.3,(TOP)
2044,100,1 ESE SAINT CROIX,PERRY,IN,38.23,-86.57,I-64 NEAR THE PERRY/CRAWFORD COUNTY LINE. REPORTED BY STATE POLICE. (LMK)
2045,150,3 S SAINT ROBERT,PULASKI,MO,37.79,-92.18,PICTURE FROM SOCIAL MEDIA OF PING PONG SIZE HAIL AT FORT LEONARD WOOD. (SGF)
2050,100,IRVINE,ESTILL,KY,37.7,-83.97,(JKL)
2055,175,KEVIL,BALLARD,KY,37.08,-88.89,HAIL RANGING FROM NICKEL SIZED TO A FEW GOLFBALLS (PAH)
2055,100,2 SE DILLWYN,BUCKINGHAM,VA,37.52,-78.44,HAIL RANGED FROM PEA SIZE THEN INCREASED TO QUARTER SIZE. (RNK)
2100,100,WEST PADUCAH,MCCRACKEN,KY,37.08,-88.74,UP TO 1.25 INCH HAIL (PAH)
2107,100,VONTAY,HANOVER,VA,37.76,-77.75,(AKQ)
2108,175,3 NNE SACO,MADISON,MO,37.41,-90.43,(LSX)
2111,100,2 S KINGSTON SPRINGS,CHEATHAM,TN,36.07,-87.1,(OHX)
2114,175,PETERSVILLE,LEWIS,KY,38.44,-83.49,TIME ESTIMATED BY RADAR. PHOTO POSTED ON SOCIAL MEDIA. (ILN)
2115,100,BERTRAND,MISSISSIPPI,MO,36.91,-89.45,NICKEL TO QUARTER SIZED HAIL (PAH)
2120,100,7 E CADIZ,TRIGG,KY,36.87,-87.7,NEAR EXIT 65 ON I-24. (PAH)
2122,100,RAINES TAVERN,CUMBERLAND,VA,37.37,-78.37,(AKQ)
2125,150,5 WSW WALSENBURG,HUERFANO,CO,37.59,-104.87,(PUB)
2125,175,6 E NEW STRAWN,COFFEY,KS,38.26,-95.63,DELAYED REPORT. (TOP)
2127,100,2 SSE JACKSON,BREATHITT,KY,37.53,-83.36,REPORT VIA SOCIAL MEDIA AND TIME OF THE EVENT ESTIMATED FROM RADAR DATA. (JKL)
2135,175,CERULEAN,TRIGG,KY,36.96,-87.71,(PAH)
2135,125,4 SSW DEATONVILLE,NOTTOWAY,VA,37.28,-78.2,(AKQ)
2135,175,3 SW ELMONT,HENRICO,VA,37.68,-77.54,(AKQ)
2138,250,2 SW JETERSVILLE,AMELIA,VA,37.27,-78.13,HAIL SMASHED WINDSHIELD AND SEVERELY DENTED VEHICLE. (AKQ)
2139,100,ADAMS GROVE,SOUTHAMPTON,VA,36.69,-77.38,(AKQ)
2147,275,4 SSE PIEDMONT,WAYNE,MO,37.09,-90.67,PICTURES VERIFIED SIZE - LATE REPORT. (PAH)
2148,100,4 NNW HAZARD,PERRY,KY,37.31,-83.22,REPORT VIA SOCIAL MEDIA WITH EVENT TIME ESTIMATED FROM RADAR DATA. (JKL)
2150,200,3 WSW LAUREL,HENRICO,VA,37.62,-77.55,(AKQ)
2200,100,DES MOINES,UNION,NM,36.76,-103.83,(ABQ)
2200,125,MOUNT VICTORY,PULASKI,KY,37.03,-84.39,(JKL)
2200,100,1 NE BLACKSTONE,NOTTOWAY,VA,37.09,-78,(AKQ)
