Time,F_Scale,Location,County,State,Lat,Lon,Comments
0902,UNK,2 ENE DAWSONVILLE,DAWSON,GA,34.43,-84.09,NUMEROUS TREES WERE REPORTED DOWN ON STRUCTURES... ROADWAYS... AND POWERLINES ON NORTH SEED TICK ROAD. NO INJURIES HAVE BEEN REPORTED. (FFC)
0905,UNK,WABBASEKA,JEFFERSON,AR,34.36,-91.79,POWER OUTAGES OCCURRED DUE TO THUNDERSTORM WIND DAMAGE. (LZK)
0908,UNK,3 ENE TAILS CREEK,GILMER,GA,34.7,-84.56,NUMEROUS TREES AND POWERLINES WERE REPORTED DOWN ALONG GUN STOCK CREEK ROAD. (FFC)
0930,UNK,MOUND BAYOU,BOLIVAR,MS,33.88,-90.73,NUMEROUS TREES AND POWER LINES DOWN ACROSS BOLIVAR COUNTY. (JAN)
0930,85,8 N DREW,SUNFLOWER,MS,33.93,-90.55,SEVERAL STRUCTURES AT THE CORRECTIONAL FACILITY HAD PORTIONS OF THE ROOF TORN OFF. OTHER METAL BUILDS HAD ROLL UP DOORS BLOWN IN AND SOME ROOF DAMAGE. SEVERAL POWER POL (JAN)
0935,58,2 NW CLEVELAND,BOLIVAR,MS,33.76,-90.76,MEASURED AT CLEVELAND ASOS KRNV. (JAN)
0936,UNK,ATKINS,POPE,AR,35.24,-92.95,A POWER POLE WAS BLOWN DOWN. (LZK)
0937,UNK,DREW,SUNFLOWER,MS,33.81,-90.53,MANY TREES DOWN AROUND DREW ALONG WITH POWER LINES DOWN AND A FEW POLES SNAPPED. (JAN)
0938,UNK,2 NE WALESKA,CHEROKEE,GA,34.33,-84.53,A PORTION OF A HOUSE ROOF WAS DAMAGED IN THE 1000 BLOCK OF AMMONS ROAD. (FFC)
0944,UNK,1 ENE GAINESVILLE,HALL,GA,34.3,-83.81,TREES AND POWER LINES WERE REPORTED DOWN IN THE ROADWAY ON HIGHWAY 129 AT SOUTH ENOTA DRIVE. (FFC)
0946,UNK,3 S DODDSVILLE,SUNFLOWER,MS,33.61,-90.52,ROOF PEELED OFF OF A CHURCH IN BLAINE. (JAN)
0948,UNK,1 NE SHANNON,FLOYD,GA,34.35,-85.06,TWO POWER POLES WERE REPORTED SNAPPED WITH TREES DOWN IN THE 5000 BLOCK OF CALHOUN ROAD. (FFC)
0954,UNK,3 NNE LATHEMTOWN,CHEROKEE,GA,34.29,-84.27,MULTIPLE TREES WERE REPORTED DOWN ON POWER LINES NEAR THE INTERSECTION OF HIGHTOWER ROAD AND YELLOW CREEK ROAD. MULTIPLE TREES WERE ALSO REPORTED DOWN JUST OVER THE COU (FFC)
0955,UNK,1 SE MCKEE,DAWSON,GA,34.45,-84.13,INITIAL EM REPORT OF MULTIPLE TREES DOWN AND SOME STRUCTURAL DAMAGE NEAR THE INTERSECTION OF GA HWY 9 AND HWY 136. TIME ESTIMATED FROM RADAR. (FFC)
0956,UNK,HICKORY FLAT,CHEROKEE,GA,34.18,-84.42,A TREE WAS REPORTED DOWN NEAR THE INTERSECTION OF TOWNSHIP WAY AND EAST CHEROKEE DRIVE. (FFC)
0957,UNK,7 W AVALON,LEFLORE,MS,33.65,-90.21,TREES DOWN IN MONEY. (JAN)
1000,UNK,2 SSE GAYLESVILLE,CHEROKEE,AL,34.24,-85.54,SOME ROOF TIN PULLED UP FROM A ROOF ALONG COUNTY ROAD 751 IN CHEROKEE COUNTY. ESTIMATED 45-55 MPH WINDS. TIME APPROXIMATE. (BMX)
1005,UNK,2 NE DREW,FORSYTH,GA,34.23,-84.19,THIRTY TREES WERE REPORTED DOWN IN THE SAWNEE VIEW FARMS NEIGHBORHOOD WITH DAMAGE TO MULTIPLE HOMES. (FFC)
1009,UNK,ISOLA,HUMPHREYS,MS,33.26,-90.59,TREES DOWN... INCLUDING ONE ON POWER LINES. (JAN)
1011,UNK,1 E O'REILLY,BOLIVAR,MS,33.67,-90.71,TREE DOWNED ACROSS JONES BAYOU ROAD. (JAN)
1012,UNK,3 W VALLEY HILL,LEFLORE,MS,33.5,-90.12,TREE DOWN ALONG SUNSET CIRCLE. (JAN)
1015,UNK,3 NW NORTH CARROLLTON,CARROLL,MS,33.55,-89.95,NUMEROUS TREES AND POWER LINES DOWN ACROSS THE NORTHERN PORTION OF CARROLL COUNTY... ESPECIALLY JUST NORTH OF CARROLLTON. (JAN)
1016,UNK,1 SSW JOHNS CREEK,FULTON,GA,34.03,-84.18,A TREE WAS REPORTED DOWN... BLOCKING WILSON ROAD... IN FRONT OF WILSON CREEK ELEMENTARY. (FFC)
1018,UNK,2 N SUWANEE,GWINNETT,GA,34.08,-84.06,MULTIPLE TREES AND POWER LINES WERE REPORTED DOWN WITH ONE TREE ON A TRUCK AND A TREE ON A HOUSE NEAR THE INTERSECTION OF PRICE HILLS TRAIL AND WEST PRICE ROAD. PEA SIZ (FFC)
1020,UNK,1 W INDIANOLA,SUNFLOWER,MS,33.45,-90.66,TREE DOWNED ON POWER LINES AT 400 MIMOSA DRIVE IN DOWNTOWN INDIANOLA. (JAN)
1022,UNK,4 ENE TCHULA,HOLMES,MS,33.2,-90.16,TREE DOWN ALONG ROSEBANK-MT OLIVE RD. (JAN)
1025,UNK,BLACK HAWK,CARROLL,MS,33.33,-90.01,NUMEROUS TREES DOWN ACROSS THE SOUTHERN PORTION OF CARROLL COUNTY. (JAN)
1033,UNK,4 NW LAWRENCEVILLE,GWINNETT,GA,33.99,-84.04,REPORT OF TREE DOWN ON BACK DECK AND ROOF OF HOME ALONG SUWANEE VALLEY ROAD. TIME ESTIMATED FROM RADAR. (FFC)
1035,UNK,YAZOO CITY,YAZOO,MS,32.86,-90.4,TREE DOWN ALONG GRAND AVE. (JAN)
1043,UNK,7 W WEST,HOLMES,MS,33.19,-89.9,TREE DOWN ALONG ELLIS RD. (JAN)
1048,UNK,11 SE PICKENS,MADISON,MS,32.78,-89.84,TREES DOWN... INCLUDING ONE ON A POWER LINE IN CAMDEN. (JAN)
1050,UNK,SALLIS,ATTALA,MS,33.02,-89.77,MULTIPLE TREES AND POWER LINES DOWN IN THE SOUTHWEST PORTION OF ATTALA COUNTY. (JAN)
1050,UNK,2 NNE PANTHERSVILLE,DEKALB,GA,33.74,-84.25,EM REPORTED A TREE DOWN ON POWERLINESS NEAR THE INTERSECTION OF GLENWOOD RD AND COLUMBIA DR. PDK AUTOMATED WEATHER STATION HAD A PEAK GUST TO 42 MPH JUST BEFORE THIS IN (FFC)
1052,UNK,9 W REDWATER,LEAKE,MS,32.77,-89.71,TREE DOWN ALONG RED DOG RD. (JAN)
1100,UNK,3 WNW LENA,LEAKE,MS,32.62,-89.64,TREE DOWN ALONG WELCH RD. (JAN)
1100,UNK,2 SSE GAYLESVILLE,CHEROKEE,AL,34.24,-85.54,TREE DOWN IN ROADWAY AT AL HWY 35 & CR 710. (BMX)
1106,UNK,MONROE,WALTON,GA,33.79,-83.71,FIVE POWER LINES WERE REPORTED DOWN IN MONROE. NUMEROUS OTHER TREES AND POWERLINES WERE REPORTED DOWN ACROSS THE COUNTY. (FFC)
1108,UNK,PIKEVILLE,BLEDSOE,TN,35.61,-85.2,MULTIPLE TREES DOWN. (MRX)
1118,UNK,2 WSW JACKSON,HINDS,MS,32.31,-90.24,TREE DOWN BLOCKING THE ENTRANCE TO AN APARTMENT BUILDING. (JAN)
1121,UNK,7 N BRANDON,RANKIN,MS,32.37,-90.01,TREE FELL ON MULTIPLE POWER LINES NEAR THE INTERSECTION OF CAMELIA DR AND SPILLWAY RD. (JAN)
1124,UNK,3 NE REESE,MORGAN,GA,33.58,-83.58,A TREE WAS REPORTED DOWN ALONG INTERSTATE 20 NEAR MILE MARKER 108. (FFC)
1155,61,17 SW GILA BEND,MARICOPA,AZ,32.79,-112.94,DESERT RESEARCH INSTITUTE RANGE 4 STATION RECORDED GUST OF 61 MPH. (PSR)
1155,UNK,1 NNW NEWNAN,COWETA,GA,33.38,-84.8,EM REPORT OF A TREE DOWN ON A HOUSE OFF MANSOUR CIRCLE... IN THE TOWN OF NEWNAN. ADDITIONAL TREE DOWN JUST NORTH OF THIS LOCATION. TIME ESTIMATED FROM RADAR. (FFC)
Time,Size,Location,County,State,Lat,Lon,Comments
1205,100,1 W FAIR GROVE,GREENE,MO,37.38,-93.17,QUARTER-SIZED HAIL JUST WEST AND SOUTHWEST OF FAIR GROVE. TIME ESTIMATED BY RADAR. (SGF)
1309,175,MOUNTAIN HOME,BAXTER,AR,36.34,-92.38,HEAVY HAIL WAS FALLING IN MOUNTAIN HOME... RANGING FROM NICKEL TO GOLFBALL SIZE. (LZK)
1721,200,FREDONIA,CRAWFORD,IN,38.18,-86.4,(LMK)
1801,175,CORYDON,HARRISON,IN,38.21,-86.13,HAIL FELL FOR 30 MIN IN DOWNTOWN CORYDON. LARGEST WAS GOLFBALL SIZE. (LMK)
1802,100,2 E SEYMOUR,JACKSON,IN,38.96,-85.84,TIME ESTIMATED BY RADAR. (IND)
1820,175,6 N CROTHERSVILLE,JACKSON,IN,38.87,-85.82,(IND)
1827,275,MILTON,TRIMBLE,KY,38.71,-85.37,(LMK)
1828,125,PLEASURE RIDGE PAR,JEFFERSON,KY,38.15,-85.85,(LMK)
1828,175,1 S MADISON,JEFFERSON,IN,38.74,-85.38,JEFFERSON COUNTY DISPATCH REPORTS GOLF BALL SIZE HAIL AT THEIR LOCATION. (LMK)
1838,150,1 NE BRIDGEPORT,HARRISON,IN,38.18,-85.91,AT HORSESHOE SOUTHERN INDIANA CASINO. (LMK)
1840,100,REXVILLE,RIPLEY,IN,38.95,-85.34,SEVERAL TREES HAVE ALSO BEEN REPORTED DOWNED THROUGHOUT RIPLEY COUNTY. (ILN)
1843,100,LITTLE YORK,WASHINGTON,IN,38.7,-85.9,SIGNIFICANT CROP DAMAGE CAUSED BY QUARTER SIZED HAIL...REPORTED AT LITTLE YORK WASHINGTON COUNTY IN. (LMK)
1845,200,3 SE SHIVELY,JEFFERSON,KY,38.17,-85.78,(LMK)
1902,100,4 NNW OKOLONA,JEFFERSON,KY,38.2,-85.71,4200 BLOCK OF POPLAR LEVEL ROAD. (LMK)
1922,100,LINCOLNVILLE,WABASH,IN,40.75,-85.68,LASTED FOR 30 SECONDS. (IWX)
1929,100,3 E SHEPHERDSVILLE,BULLITT,KY,37.99,-85.66,(LMK)
1952,250,2 WNW COXS CREEK,NELSON,KY,37.92,-85.51,(LMK)
2100,100,21 SSE TUCSON,PIMA,AZ,31.92,-110.75,(TWC)
2117,100,2 WNW BALL STATE UNIVER,DELAWARE,IN,40.21,-85.44,(IND)
2132,125,HOLTON,RIPLEY,IN,39.08,-85.38,HOLTON FIRE DEPARTMENT REPORTED HALF DOLLAR SIZED HAIL. TIME ESTIMATED VIA RADAR. (ILN)
2203,175,3 SW WINONA,SHANNON,MO,36.98,-91.36,OBSERVED QUARTER TO SOME GOLFBALL SIZE HAIL. DELAYED REPORT. (SGF)
2215,125,LORETTO,MARION,KY,37.64,-85.4,(LMK)
2222,100,JACKTOWN,CASEY,KY,37.44,-85.02,(LMK)
2229,175,1 W SULPHUR WELL,METCALFE,KY,37.1,-85.64,VIEWER REPORTS GOLF BALL SIZE HAIL NEAR SULPHUR WELL. (LMK)
2230,175,1 SW SAINT CATHERINE,WASHINGTON,KY,37.69,-85.26,GOLF BALL SIZE HAIL ALONG HIGHWAY 152. (LMK)
2243,150,5 W SALOMA,TAYLOR,KY,37.41,-85.5,IN THE MAC COMMUNITY. (LMK)
2246,100,LEBANON,MARION,KY,37.57,-85.25,REPORTED AT BEDROCK LANE LEBANON MARION COUNTY KY. (LMK)
2254,250,2 SE MIDDLEBURG,CASEY,KY,37.32,-84.79,(LMK)
2259,100,1 WNW ROCKBRIDGE,MONROE,KY,36.79,-85.69,(LMK)
2300,175,5 E HOBSON,TAYLOR,KY,37.42,-85.28,(LMK)
2301,150,GRADYVILLE,ADAIR,KY,37.08,-85.42,(LMK)
2305,100,2 S ESSEX,STODDARD,MO,36.78,-89.86,QUARTER SIZE HAIL REPORTED VIA MEDIA. (PAH)
2315,100,5 N QULIN,BUTLER,MO,36.67,-90.25,QUARTER SIZE HAIL. RELAYED THROUGH EM. (PAH)
2319,175,4 SE GRADYVILLE,ADAIR,KY,37.05,-85.37,VIEWER REPORT OF HAIL A LITTLE LARGER THAN GOLF BALL SIZE NEAR COLUMBIA. (LMK)
2319,100,3 S CAMPBELLSVILLE,TAYLOR,KY,37.31,-85.34,(LMK)
2320,100,16 SSW WILLCOX,COCHISE,AZ,32.04,-109.94,SPOTTER 3096 REPORTED QUARTER SIZE HAIL. (TWC)
2330,175,2 ESE MARROWBONE,CUMBERLAND,KY,36.81,-85.47,(LMK)
2340,100,16 SSE SIERRA VISTA,COCHISE,AZ,31.35,-110.21,SPOTTER 903 REPORTED ROUGHLY QUARTER SIZE HAIL. (TWC)
2342,100,2 W BUCKNER,OLDHAM,KY,38.38,-85.47,(LMK)
2354,400,TOMPKINSVILLE,MONROE,KY,36.7,-85.69,VERIFIED PHOTO ON TWITTER. TIME ESTIMATED FROM RADAR. (LMK)
2355,100,13 SSE SIERRA VISTA,COCHISE,AZ,31.39,-110.23,SPOTTER 926 REPORTED HEAVY RAIN AND UP TO 1" HAIL. (TWC)
0010,100,1 ENE COLUMBIA,ADAIR,KY,37.1,-85.29,(LMK)
0010,100,CURBY,CRAWFORD,IN,38.24,-86.38,(LMK)
0016,100,2 E CAYCE,FULTON,KY,36.55,-89,(PAH)
0028,100,CLARKSVILLE,CLARK,IN,38.32,-85.77,(LMK)
0029,100,6 SE SIERRA VISTA,COCHISE,AZ,31.49,-110.26,SPOTTER #911 IN SIERRA VISTA REPORTS HAIL NOW UP TO 1" IN DIAMETER. (TWC)
0030,100,4 NE CELINA,CLAY,TN,36.59,-85.45,ESTIMATED 1 INCH HAIL REPORTED IN PEA RIDGE (OHX)
0030,200,9 N HICKOK,GRANT,KS,37.68,-101.23,PICTURE OF HAIL WAS FORWARDED VIA SOCIAL MEDIA FROM KSN NEWS. (DDC)
0032,100,BYRDSTOWN,PICKETT,TN,36.57,-85.13,FACEBOOK PHOTOS SHOWED DIME TO QUARTER SIZE HAIL IN BYRDSTOWN (OHX)
0050,100,4 ESE BYRDSTOWN,PICKETT,TN,36.56,-85.06,FACEBOOK PHOTOS SHOWED QUARTER SIZE HAIL IN THE CEDAR GROVE AREA (OHX)
0055,100,1 N VALLEY STATION,JEFFERSON,KY,38.12,-85.85,HAIL WAS MEASURED AT STONESTREET ROAD. TIME FROM RADAR. (LMK)
0107,100,CELINA,CLAY,TN,36.55,-85.5,QUARTER SIZE HAIL REPORTED IN CELINA. (OHX)
0110,100,5 ENE KENDALL,KEARNY,KS,37.96,-101.45,(DDC)
0119,175,1 W CENTRAL BARREN,HARRISON,IN,38.37,-86.11,GOLF BALL SIZE HAIL ALONG HANCOCK CHAPEL ROAD. (LMK)
0124,175,1 SSW ALGOOD,PUTNAM,TN,36.18,-85.45,DELAYED REPORT FROM FRIDAY JULY 20. GOLFBALL SIZE HAIL REPORTED NEAR ALGOOD ELEMENTARY SCHOOL. (OHX)
0128,150,PLYMELL,FINNEY,KS,37.81,-100.87,(DDC)
0134,100,LIVINGSTON,OVERTON,TN,36.39,-85.33,(OHX)
0135,100,3 ESE LAKIN,KEARNY,KS,37.93,-101.21,(DDC)
0141,100,2 NNE HILLVIEW,JEFFERSON,KY,38.1,-85.67,(LMK)
0145,100,MCDANIELS,BRECKINRIDGE,KY,37.6,-86.43,(LMK)
0145,100,2 NE ANCHORAGE,JEFFERSON,KY,38.29,-85.51,ALSO SAW TREE BRANCHES AND LEAVES DOWN. (LMK)
0222,100,3 S COOKEVILLE,PUTNAM,TN,36.11,-85.51,REPORT OF QUARTER SIZE HAIL SOUTH OF COOKEVILLE IN PUTNAM COUNTY. (OHX)
0240,125,1 SE GIBSON,PULASKI,AR,34.89,-92.22,(LZK)
0326,100,W NORTH LITTLE ROCK,PULASKI,AR,34.79,-92.26,QUARTER SIZED HAIL FELL AT THE NWS OFFICE AT THE NORTH LITTLE ROCK AIRPORT. (LZK)
0337,175,7 SE BEELER,NESS,KS,38.38,-100.09,(DDC)
0342,100,2 SW GREENSBURG,GREEN,KY,37.23,-85.53,QUARTER SIZE HAIL IN THE THURLOW AREA. (LMK)
0417,125,3 SW NEOSHO,NEWTON,MO,36.84,-94.4,(SGF)
0418,100,1 NNE EXIE,GREEN,KY,37.18,-85.53,(LMK)
0434,125,RIVERTON,CHEROKEE,KS,37.07,-94.7,SOCIAL MEDIA REPORT OF QUARTER TO HALF DOLLAR SIZE HAIL. TIME ESTIMATED BY RADAR. (SGF)
0452,125,5 SW IRON GATES,NEWTON,MO,37.01,-94.61,(SGF)
0457,175,PEA RIDGE,BENTON,AR,36.45,-94.11,(TSA)
0457,100,5 NE MIAMI,OTTAWA,OK,36.93,-94.81,(TSA)
0515,175,4 E MOUNT HOPE,SEDGWICK,KS,37.87,-97.59,CORRECTED FOR DATE. (ICT)
0519,125,LOWELL,BENTON,AR,36.26,-94.13,(TSA)
0525,100,2 NE BROWNSVILLE,LONOKE,AR,34.84,-91.86,(LZK)
0527,175,4 S SPRINGDALE,WASHINGTON,AR,36.13,-94.13,GOLF BALL HAIL REPORTED NEAR LAKE FAYETTEVILLE (TSA)
0527,100,PINEVILLE,MCDONALD,MO,36.59,-94.38,QUARTER-SIZED HAIL REPORTED AT THE MCDONALD COUNTY SHERIFF'S OFFICE IN PINEVILLE. DELAYED REPORT. TIME ESTIMATED BY RADAR. (SGF)
0536,100,6 WSW CHARLESTON,BRADLEY,TN,35.27,-84.86,(MRX)
0545,100,3 ESE MAIZE,SEDGWICK,KS,37.75,-97.42,DELAYED REPORT VIA TWITTER OF QUARTER SIZE HAIL ON THE NW SIDE OF WICHITA. LOCATION ESTIMATED BASED ON RADAR. (ICT)
0547,275,ELKINS,WASHINGTON,AR,36,-94.01,BASEBALL HAIL EAST SIDE OF ELKINS. REPORTS OF BROKEN CAR WINDSHIELDS. (TSA)
0552,125,3 E BENTONVILLE,BENTON,AR,36.37,-94.15,HAIL UP TO HALF DOLLAR SIZE REPORTED IN LITTLE FLOCK. (TSA)
0604,275,CROSSES,MADISON,AR,35.87,-93.91,(TSA)
0606,100,2 NNE GROVE,DELAWARE,OK,36.62,-94.76,(TSA)
0629,100,2 NNE SOUTH WEST CITY,MCDONALD,MO,36.54,-94.6,NICKEL AND QUARTER-SIZED HAIL REPORTED JUST NORTH OF SOUTH WEST CITY OFF OF MO-43 NEAR MILLER RD. DELAYED REPORT. TIME ESTIMATED BY RADAR. (SGF)
0645,100,SEARCY,WHITE,AR,35.24,-91.73,(LZK)
0648,125,GRAVETTE,BENTON,AR,36.42,-94.45,(TSA)
0718,175,HICKORY PLAINS,PRAIRIE,AR,34.99,-91.74,(LZK)
0930,100,2 NNW JASPER,PICKENS,GA,34.5,-84.44,QUARTER SIZE HAIL WAS REPORTED IN THE HUNTERS RIDGE SUBDIVISION. (FFC)
0949,100,1 N BALL GROUND,CHEROKEE,GA,34.35,-84.38,HAIL QUARTER SIZED AND SLIGHTLY LARGER WAS REPORTED IN THE 1500 BLOCK OF OLD CANTON ROAD. (FFC)
1005,100,2 NE DREW,FORSYTH,GA,34.23,-84.19,QUARTER INCH HAIL WAS REPORTED IN THE SAWNEE VIEW FARMS NEIGHBORHOOD OFF OD BETHELVIEW ROADAND SAWNEE VIEW DRIVE. (FFC)
1015,100,BUFORD DAM-LAKE LANIER,GWINNETT,GA,34.15,-84.06,QUARTER SIZED HAIL WAS REPORTED BY THE BUFORD DAM PARK. (FFC)
1015,175,8 ESE SMITHVILLE,DE KALB,TN,35.92,-85.68,TWITTER REPORT OF HAIL UP TO GOLF BALL SIZE IN EASTERN DE KALB COUNTY (OHX)
1016,175,9 SW BAKERS CROSSROADS,WHITE,TN,35.92,-85.65,TWITTER REPORT OF PEA TO GOLFBALL SIZE HAIL ON THE DE KALB/WHITE COUNTY LINE (OHX)
1043,100,8 SE SPENCER,VAN BUREN,TN,35.65,-85.36,QUARTER SIZE HAIL REPORTED AT FALL CREEK FALLS CAMPGROUND (OHX)
